ec895c40 2888934479 S Co:2:003:0 s 40 c0 0000 0000 0000 0
ec895c40 2888935165 C Co:2:003:0 0 0
ec895c40 2888942353 S Co:2:003:0 s 40 c2 0001 0000 0000 0
ec895c40 2888943553 C Co:2:003:0 0 0
ec895c40 2891205806 S Co:2:003:0 s 40 b5 0008 0000 0000 0
ec895c40 2891206908 C Co:2:003:0 0 0
ec895c40 2891211533 S Ii:2:003:6 -115:1 544 <
eb0bb1c0 2891212521 S Co:2:003:0 s 40 f7 0000 0000 0000 0
eb0bb1c0 2891213787 C Co:2:003:0 0 0
ec895c40 2891281357 C Ii:2:003:6 0:1 544 = 4f9327c7 42c323c7 461a30c7 c49c20c7 391e1fc7 7a6f2ac7 267f27c7 109f3ec7
ec895c40 2891305677 S Ii:2:003:6 -115:1 544 <
ec895c40 2891343791 C Ii:2:003:6 0:1 544 = 531287c7 a70587c7 321187c7 921787c7 851181c7 780b81c7 0c0981c7 1b0d81c7
ec895c40 2891354178 S Ii:2:003:6 -115:1 544 <
ec895c40 2891406356 C Ii:2:003:6 0:1 544 = 692686c7 f91986c7 b42586c7 dd2b86c7 910680c7 d60080c7 adfc7fc7 760280c7
ec895c40 2891415396 S Ii:2:003:6 -115:1 544 <
ec895c40 2891468781 C Ii:2:003:6 0:1 544 = ce0585c7 5cf984c7 e50485c7 470b85c7 c7be7dc7 4fb37dc7 c3ae7dc7 88b67dc7
ec895c40 2891485679 S Ii:2:003:6 -115:1 544 <
ec895c40 2891531292 C Ii:2:003:6 0:1 544 = 2be883c7 fedb83c7 42e783c7 6eed83c7 4baa7bc7 489f7bc7 1e9a7bc7 84a27bc7
ec895c40 2891535861 S Ii:2:003:6 -115:1 544 <
ec895c40 2891593854 C Ii:2:003:6 0:1 544 = 362783c7 1b1b83c7 ae2683c7 a12c83c7 87c379c7 39b879c7 ceb379c7 99bb79c7
ec895c40 2891606738 S Ii:2:003:6 -115:1 544 <
ec895c40 2891656285 C Ii:2:003:6 0:1 544 = fb7e82c7 037382c7 2d7e82c7 658482c7 441c78c7 421178c7 fd0c78c7 a01478c7
ec895c40 2891658817 S Ii:2:003:6 -115:1 544 <
ec895c40 2891718857 C Ii:2:003:6 0:1 544 = 010282c7 d6f581c7 900182c7 920782c7 fcb376c7 0aa976c7 98a476c7 3eac76c7
ec895c40 2891727539 S Ii:2:003:6 -115:1 544 <
ec895c40 2891781367 C Ii:2:003:6 0:1 544 = b76081c7 e25481c7 3a6081c7 4b6681c7 92f474c7 a6e974c7 5be574c7 34ed74c7
ec895c40 2891796802 S Ii:2:003:6 -115:1 544 <
ec895c40 2891843785 C Ii:2:003:6 0:1 544 = 3aa380c7 399780c7 57a280c7 93a880c7 fe5373c7 424973c7 464473c7 764c73c7
ec895c40 2891858679 S Ii:2:003:6 -115:1 544 <
ec895c40 2891906301 C Ii:2:003:6 0:1 544 = 192e7fc7 a7167fc7 362d7fc7 1b397fc7 c22671c7 7a1b71c7 3b1771c7 0c1f71c7
ec895c40 2891916669 S Ii:2:003:6 -115:1 544 <
ec895c40 2891968811 C Ii:2:003:6 0:1 544 = 5af07cc7 4ed97cc7 81ef7cc7 cafb7cc7 53cd6ec7 d7c16ec7 4cbd6ec7 a0c56ec7
ec895c40 2891985829 S Ii:2:003:6 -115:1 544 <
ec895c40 2892031313 C Ii:2:003:6 0:1 544 = 03fe7ac7 5ce77ac7 55fd7ac7 7d097bc7 87a66cc7 729b6cc7 44976cc7 029f6cc7
ec895c40 2892042549 S Ii:2:003:6 -115:1 544 <
ec895c40 2892093788 C Ii:2:003:6 0:1 544 = 5e2979c7 d31279c7 4e2879c7 933479c7 45a06ac7 c3946ac7 85906ac7 a8986ac7
ec895c40 2892109337 S Ii:2:003:6 -115:1 544 <
ec895c40 2892156290 C Ii:2:003:6 0:1 544 = b9bb77c7 efa477c7 90ba77c7 e8c677c7 87bd68c7 53b268c7 83ae68c7 55b668c7
f6f052c0 2892182674 S Ii:2:003:6 -115:1 544 <
f6f052c0 2892218782 C Ii:2:003:6 0:1 544 = 510477c7 1eee76c7 ff0377c7 b20f77c7 f88367c7 d57867c7 5b7467c7 ad7c67c7
f6f052c0 2892225654 S Ii:2:003:6 -115:1 544 <
f6f052c0 2892281287 C Ii:2:003:6 0:1 544 = e3c875c7 98b275c7 f8c775c7 0ad475c7 0fd965c7 cccd65c7 ccc965c7 7fd165c7
f6f052c0 2892290972 S Ii:2:003:6 -115:1 544 <
f6f052c0 2892343872 C Ii:2:003:6 0:1 544 = 375b74c7 084574c7 905a74c7 336674c7 ebfb63c7 00f163c7 4fec63c7 01f563c7
f6f052c0 2892355669 S Ii:2:003:6 -115:1 544 <
f6f052c0 2892406300 C Ii:2:003:6 0:1 544 = 585572c7 503f72c7 075572c7 dc6072c7 41ca61c7 54bf61c7 50bb61c7 c7c361c7
f6f052c0 2892417691 S Ii:2:003:6 -115:1 544 <
f6f052c0 2892468791 C Ii:2:003:6 0:1 544 = 821070c7 46fb6fc7 0e1070c7 441c70c7 2e6c5fc7 aa605fc7 315d5fc7 1a655fc7
f6f052c0 2892478731 S Ii:2:003:6 -115:1 544 <
f6f052c0 2892531304 C Ii:2:003:6 0:1 544 = 44fd6dc7 f4e76dc7 23fd6dc7 9e086ec7 f9615dc7 fd565dc7 e9525dc7 8a5b5dc7
f6f052c0 2892541090 S Ii:2:003:6 -115:1 544 <
f6f052c0 2892593857 C Ii:2:003:6 0:1 544 = 594a6cc7 5b356cc7 1d4a6cc7 49566cc7 1d6c5bc7 12615bc7 045d5bc7 5b655bc7
f6f052c0 2892602706 S Ii:2:003:6 -115:1 544 <
f6f052c0 2892656306 C Ii:2:003:6 0:1 544 = 81046bc7 60ef6ac7 47046bc7 4b106bc7 d2cc59c7 51c159c7 8ebd59c7 02c659c7
f6f052c0 2892665696 S Ii:2:003:6 -115:1 544 <
f6f052c0 2892718787 C Ii:2:003:6 0:1 544 = 1df069c7 c6db69c7 0bf069c7 b6fb69c7 9d4d58c7 6e4258c7 1a3f58c7 534758c7
f6f052c0 2892738745 S Ii:2:003:6 -115:1 544 <
f6f052c0 2892781288 C Ii:2:003:6 0:1 544 = 98c968c7 00b568c7 50c968c7 09d568c7 f3a356c7 d59856c7 799556c7 f39c56c7
f6f052c0 2892802196 S Ii:2:003:6 -115:1 544 <
f6f052c0 2892843801 C Ii:2:003:6 0:1 544 = ac1f67c7 270b67c7 c81f67c7 402b67c7 1eab54c7 e39f54c7 899c54c7 e4a454c7
f6f052c0 2892855817 S Ii:2:003:6 -115:1 544 <
f6f052c0 2892906300 C Ii:2:003:6 0:1 544 = e51d65c7 700965c7 c01d65c7 b82965c7 0b6b52c7 af5f52c7 765c52c7 d56452c7
f6f052c0 2892915696 S Ii:2:003:6 -115:1 544 <
f6f052c0 2892968802 C Ii:2:003:6 0:1 544 = a5dd62c7 cac962c7 87dd62c7 4ae962c7 9e2150c7 ad1650c7 a51350c7 971b50c7
f6f052c0 2892985722 S Ii:2:003:6 -115:1 544 <
f6f052c0 2893031320 C Ii:2:003:6 0:1 544 = 66a960c7 339660c7 ada960c7 8eb560c7 f0ec4dc7 92e14dc7 d7de4dc7 07e74dc7
f6f052c0 2893050753 S Ii:2:003:6 -115:1 544 <
f6f052c0 2893093858 C Ii:2:003:6 0:1 544 = 6e225fc7 280f5fc7 a9225fc7 812e5fc7 6b094cc7 defd4bc7 d7fa4bc7 2f034cc7
f6f052c0 2893105681 S Ii:2:003:6 -115:1 544 <
f6f052c0 2893156321 C Ii:2:003:6 0:1 544 = eaf45dc7 4fe15dc7 14f55dc7 af005ec7 2c694ac7 9b5d4ac7 775b4ac7 ca634ac7
f6f052c0 2893164394 S Ii:2:003:6 -115:1 544 <
f6f052c0 2893218793 C Ii:2:003:6 0:1 544 = fecb5cc7 eeb85cc7 44cc5cc7 16d85cc7 feb048c7 8ea548c7 34a248c7 8daa48c7
f6f052c0 2893225648 S Ii:2:003:6 -115:1 544 <
f6f052c0 2893281368 C Ii:2:003:6 0:1 544 = 18bc5bc7 44a95bc7 dfbc5bc7 55c85bc7 c53c47c7 843147c7 872e47c7 123747c7
ec895c40 2893299814 S Ii:2:003:6 -115:1 544 <
ec895c40 2893343857 C Ii:2:003:6 0:1 544 = a0115ac7 d3fe59c7 77125ac7 2c1e5ac7 096245c7 6b5645c7 da5345c7 375c45c7
ec895c40 2893355691 S Ii:2:003:6 -115:1 544 <
ec895c40 2893406288 C Ii:2:003:6 0:1 544 = dcf757c7 51e557c7 65f857c7 0e0458c7 121c43c7 071043c7 1e0e43c7 8b1643c7
f6f052c0 2893417497 S Ii:2:003:6 -115:1 544 <
f6f052c0 2893468785 C Ii:2:003:6 0:1 544 = fbbf55c7 e4ad55c7 90c055c7 56cc55c7 67bd40c7 22b140c7 61af40c7 a8b740c7
f6f052c0 2893485653 S Ii:2:003:6 -115:1 544 <
f6f052c0 2893531292 C Ii:2:003:6 0:1 544 = 338153c7 e46e53c7 168153c7 108d53c7 1a973ec7 918b3ec7 6e893ec7 31913ec7
f6f052c0 2893541563 S Ii:2:003:6 -115:1 544 <
f6f052c0 2893593801 C Ii:2:003:6 0:1 544 = 270552c7 93f351c7 e70552c7 9f1152c7 b9d73cc7 decb3cc7 adc93cc7 21d23cc7
f6f052c0 2893609233 S Ii:2:003:6 -115:1 544 <
f6f052c0 2893656358 C Ii:2:003:6 0:1 544 = bfcf50c7 e1bd50c7 86d050c7 dadb50c7 40333bc7 ec273bc7 9b253bc7 312e3bc7
f6f052c0 2893664076 S Ii:2:003:6 -115:1 544 <
f6f052c0 2893718859 C Ii:2:003:6 0:1 544 = d1ba4fc7 52a94fc7 b5bb4fc7 39c74fc7 a79739c7 248c39c7 2d8a39c7 9f9239c7
f6f052c0 2893729426 S Co:2:003:0 s 40 b8 0000 0000 0000 0
f6f052c0 2893730668 C Co:2:003:0 0 0
