f6c62640 2202380062 C Ii:1:009:1 0:8 8 = 00000000 00000000
f6c62640 2202380103 S Ii:1:009:1 -115:8 8 <
f73766c0 2202420866 S Bo:1:008:2 -115 31 = 55534243 d3540200 00000000 00010600 00000000 00000000 00000000 000000
f73766c0 2202420910 C Bo:1:008:2 0 31 >
f73766c0 2202420921 S Bi:1:008:2 -115 13 <
f73766c0 2202422034 C Bi:1:008:2 0 13 = 55534253 d3540200 00000000 01
f73766c0 2202422044 S Bo:1:008:2 -115 31 = 55534243 d4540200 12000000 80010603 00000012 00000000 00000000 000000
f73766c0 2202422159 C Bo:1:008:2 0 31 >
d8a10340 2202422170 S Bi:1:008:2 -115 18 <
d8a10340 2202423410 C Bi:1:008:2 0 18 = 70000200 0000000a 00000000 3a000000 0000
f73766c0 2202423436 S Bi:1:008:2 -115 13 <
f73766c0 2202424306 C Bi:1:008:2 0 13 = 55534253 d4540200 00000000 00
f73766c0 2202424337 S Bo:1:008:2 -115 31 = 55534243 d5540200 00000000 00010600 00000000 00000000 00000000 000000
f73766c0 2202424409 C Bo:1:008:2 0 31 >
f73766c0 2202424430 S Bi:1:008:2 -115 13 <
f73766c0 2202425556 C Bi:1:008:2 0 13 = 55534253 d5540200 00000000 01
f73766c0 2202425563 S Bo:1:008:2 -115 31 = 55534243 d6540200 12000000 80010603 00000012 00000000 00000000 000000
f73766c0 2202425660 C Bo:1:008:2 0 31 >
dbec5640 2202425681 S Bi:1:008:2 -115 18 <
dbec5640 2202427056 C Bi:1:008:2 0 18 = 70000200 0000000a 00000000 3a000000 0000
f73766c0 2202427064 S Bi:1:008:2 -115 13 <
f73766c0 2202427910 C Bi:1:008:2 0 13 = 55534253 d6540200 00000000 00
f73766c0 2202427948 S Bo:1:008:2 -115 31 = 55534243 d7540200 00000000 0001061e 00000001 00000000 00000000 000000
f73766c0 2202428051 C Bo:1:008:2 0 31 >
f73766c0 2202428058 S Bi:1:008:2 -115 13 <
f73766c0 2202429051 C Bi:1:008:2 0 13 = 55534253 d7540200 00000000 01
f73766c0 2202429065 S Bo:1:008:2 -115 31 = 55534243 d8540200 12000000 80010603 00000012 00000000 00000000 000000
f73766c0 2202429159 C Bo:1:008:2 0 31 >
dbec5640 2202429183 S Bi:1:008:2 -115 18 <
dbec5640 2202430535 C Bi:1:008:2 0 18 = 70000200 0000000a 00000000 3a000000 0000
f73766c0 2202430554 S Bi:1:008:2 -115 13 <
f73766c0 2202431306 C Bi:1:008:2 0 13 = 55534253 d8540200 00000000 00
f73766c0 2202431330 S Bo:1:008:2 -115 31 = 55534243 d9540200 00000000 0001061e 00000000 00000000 00000000 000000
f73766c0 2202431410 C Bo:1:008:2 0 31 >
f73766c0 2202431740 S Bi:1:008:2 -115 13 <
f73766c0 2202432534 C Bi:1:008:2 0 13 = 55534253 d9540200 00000000 01
f73766c0 2202432561 S Bo:1:008:2 -115 31 = 55534243 da540200 12000000 80010603 00000012 00000000 00000000 000000
f73766c0 2202432676 C Bo:1:008:2 0 31 >
d8a10340 2202432684 S Bi:1:008:2 -115 18 <
d8a10340 2202434035 C Bi:1:008:2 0 18 = 70000200 0000000a 00000000 3a000000 0000
f73766c0 2202434184 S Bi:1:008:2 -115 13 <
f73766c0 2202434785 C Bi:1:008:2 0 13 = 55534253 da540200 00000000 00
f73766c0 2202434868 S Bo:1:008:2 -115 31 = 55534243 db540200 00000000 00010600 00000000 00000000 00000000 000000
f73766c0 2202434910 C Bo:1:008:2 0 31 >
f73766c0 2202434958 S Bi:1:008:2 -115 13 <
f73766c0 2202436035 C Bi:1:008:2 0 13 = 55534253 db540200 00000000 01
f73766c0 2202436056 S Bo:1:008:2 -115 31 = 55534243 dc540200 12000000 80010603 00000012 00000000 00000000 000000
f73766c0 2202436164 C Bo:1:008:2 0 31 >
d8a10340 2202436177 S Bi:1:008:2 -115 18 <
d8a10340 2202437663 C Bi:1:008:2 0 18 = 70000200 0000000a 00000000 3a000000 0000
f73766c0 2202437678 S Bi:1:008:2 -115 13 <
f73766c0 2202438409 C Bi:1:008:2 0 13 = 55534253 dc540200 00000000 00
f73766c0 2202438435 S Bo:1:008:2 -115 31 = 55534243 dd540200 00000000 00000600 00000000 00000000 00000000 000000
f73766c0 2202438551 C Bo:1:008:2 0 31 >
f73766c0 2202438566 S Bi:1:008:2 -115 13 <
f73766c0 2202440056 C Bi:1:008:2 0 13 = 55534253 dd540200 00000000 01
f73766c0 2202440072 S Bo:1:008:2 -115 31 = 55534243 de540200 12000000 80000603 00000012 00000000 00000000 000000
f73766c0 2202440160 C Bo:1:008:2 0 31 >
dbec5640 2202440188 S Bi:1:008:2 -115 18 <
dbec5640 2202441536 C Bi:1:008:2 0 18 = 70000200 0000000a 00000000 3a000000 0000
f73766c0 2202441563 S Bi:1:008:2 -115 13 <
f73766c0 2202442306 C Bi:1:008:2 0 13 = 55534253 de540200 00000000 00
f73766c0 2202442343 S Bo:1:008:2 -115 31 = 55534243 df540200 00000000 00000600 00000000 00000000 00000000 000000
f73766c0 2202442410 C Bo:1:008:2 0 31 >
f73766c0 2202442425 S Bi:1:008:2 -115 13 <
f73766c0 2202443542 C Bi:1:008:2 0 13 = 55534253 df540200 00000000 01
f73766c0 2202443571 S Bo:1:008:2 -115 31 = 55534243 e0540200 12000000 80000603 00000012 00000000 00000000 000000
f73766c0 2202443676 C Bo:1:008:2 0 31 >
dbec5640 2202443684 S Bi:1:008:2 -115 18 <
dbec5640 2202444923 C Bi:1:008:2 0 18 = 70000200 0000000a 00000000 3a000000 0000
f73766c0 2202444931 S Bi:1:008:2 -115 13 <
f73766c0 2202445785 C Bi:1:008:2 0 13 = 55534253 e0540200 00000000 00
f73766c0 2202445823 S Bo:1:008:2 -115 31 = 55534243 e1540200 00000000 0000061e 00000001 00000000 00000000 000000
f73766c0 2202445926 C Bo:1:008:2 0 31 >
f73766c0 2202445933 S Bi:1:008:2 -115 13 <
f73766c0 2202447181 C Bi:1:008:2 0 13 = 55534253 e1540200 00000000 01
f73766c0 2202447188 S Bo:1:008:2 -115 31 = 55534243 e2540200 12000000 80000603 00000012 00000000 00000000 000000
f73766c0 2202447285 C Bo:1:008:2 0 31 >
dbec5640 2202447306 S Bi:1:008:2 -115 18 <
dbec5640 2202448556 C Bi:1:008:2 0 18 = 70000200 0000000a 00000000 3a000000 0000
f73766c0 2202448563 S Bi:1:008:2 -115 13 <
f73766c0 2202449426 C Bi:1:008:2 0 13 = 55534253 e2540200 00000000 00
f73766c0 2202449458 S Bo:1:008:2 -115 31 = 55534243 e3540200 00000000 0000061e 00000000 00000000 00000000 000000
f73766c0 2202449535 C Bo:1:008:2 0 31 >
f73766c0 2202449555 S Bi:1:008:2 -115 13 <
f73766c0 2202450536 C Bi:1:008:2 0 13 = 55534253 e3540200 00000000 01
f73766c0 2202450544 S Bo:1:008:2 -115 31 = 55534243 e4540200 12000000 80000603 00000012 00000000 00000000 000000
f73766c0 2202450660 C Bo:1:008:2 0 31 >
d8a10340 2202450693 S Bi:1:008:2 -115 18 <
d8a10340 2202452285 C Bi:1:008:2 0 18 = 70000200 0000000a 00000000 3a000000 0000
f73766c0 2202454735 S Bi:1:008:2 -115 13 <
f73766c0 2202454911 C Bi:1:008:2 0 13 = 55534253 e4540200 00000000 00
f73766c0 2202454954 S Bo:1:008:2 -115 31 = 55534243 e5540200 00000000 00000600 00000000 00000000 00000000 000000
f73766c0 2202455035 C Bo:1:008:2 0 31 >
f73766c0 2202455047 S Bi:1:008:2 -115 13 <
f73766c0 2202456159 C Bi:1:008:2 0 13 = 55534253 e5540200 00000000 01
f73766c0 2202458094 S Bo:1:008:2 -115 31 = 55534243 e6540200 12000000 80000603 00000012 00000000 00000000 000000
f73766c0 2202458160 C Bo:1:008:2 0 31 >
f223ea40 2202458169 S Bi:1:008:2 -115 18 <
f223ea40 2202459535 C Bi:1:008:2 0 18 = 70000200 0000000a 00000000 3a000000 0000
f73766c0 2202459563 S Bi:1:008:2 -115 13 <
f73766c0 2202460289 C Bi:1:008:2 0 13 = 55534253 e6540200 00000000 00
f6c62740 2202910074 C Ii:1:007:1 0:8 4 = 00000100
f6c62740 2202910138 S Ii:1:007:1 -115:8 4 <
f6c62740 2202918041 C Ii:1:007:1 0:8 4 = 0004ff00
f6c62740 2202918093 S Ii:1:007:1 -115:8 4 <
f6c62740 2202926063 C Ii:1:007:1 0:8 4 = 000afb00
f6c62740 2202926114 S Ii:1:007:1 -115:8 4 <
f6c62740 2202934046 C Ii:1:007:1 0:8 4 = 000af800
f6c62740 2202934095 S Ii:1:007:1 -115:8 4 <
f6c62740 2202942047 C Ii:1:007:1 0:8 4 = 000bf700
f6c62740 2202942101 S Ii:1:007:1 -115:8 4 <
f6c62740 2202950065 C Ii:1:007:1 0:8 4 = 000af600
f6c62740 2202950114 S Ii:1:007:1 -115:8 4 <
f6c62740 2202958040 C Ii:1:007:1 0:8 4 = 0009f500
f6c62740 2202958090 S Ii:1:007:1 -115:8 4 <
f6c62740 2202966064 C Ii:1:007:1 0:8 4 = 0006f700
f6c62740 2202966116 S Ii:1:007:1 -115:8 4 <
f6c62740 2202974064 C Ii:1:007:1 0:8 4 = 0007f700
f6c62740 2202974116 S Ii:1:007:1 -115:8 4 <
f6c62740 2202982066 C Ii:1:007:1 0:8 4 = 0005f700
f6c62740 2202982114 S Ii:1:007:1 -115:8 4 <
f6c62740 2202990069 C Ii:1:007:1 0:8 4 = 0005f900
f6c62740 2202990120 S Ii:1:007:1 -115:8 4 <
f6c62740 2202998040 C Ii:1:007:1 0:8 4 = 0005f700
f6c62740 2202998093 S Ii:1:007:1 -115:8 4 <
f6c62740 2203006065 C Ii:1:007:1 0:8 4 = 0006f600
f6c62740 2203006115 S Ii:1:007:1 -115:8 4 <
f6c62740 2203014046 C Ii:1:007:1 0:8 4 = 0005f700
f6c62740 2203014095 S Ii:1:007:1 -115:8 4 <
f6c62740 2203022063 C Ii:1:007:1 0:8 4 = 0006f800
f6c62740 2203022115 S Ii:1:007:1 -115:8 4 <
f6c62740 2203030065 C Ii:1:007:1 0:8 4 = 0004f700
f6c62740 2203030113 S Ii:1:007:1 -115:8 4 <
f6c62740 2203038063 C Ii:1:007:1 0:8 4 = 0004f700
f6c62740 2203038112 S Ii:1:007:1 -115:8 4 <
f6c62740 2203046064 C Ii:1:007:1 0:8 4 = 0004f800
f6c62740 2203046113 S Ii:1:007:1 -115:8 4 <
f6c62740 2203054044 C Ii:1:007:1 0:8 4 = 0004f900
f6c62740 2203054102 S Ii:1:007:1 -115:8 4 <
f6c62740 2203062048 C Ii:1:007:1 0:8 4 = 0004f900
f6c62740 2203062122 S Ii:1:007:1 -115:8 4 <
f6c62740 2203070042 C Ii:1:007:1 0:8 4 = 0006fa00
f6c62740 2203070067 S Ii:1:007:1 -115:8 4 <
f6c62740 2203078040 C Ii:1:007:1 0:8 4 = 0005fd00
f6c62740 2203078068 S Ii:1:007:1 -115:8 4 <
f6c62740 2203086043 C Ii:1:007:1 0:8 4 = 0006fc00
f6c62740 2203086073 S Ii:1:007:1 -115:8 4 <
f6c62740 2203094057 C Ii:1:007:1 0:8 4 = 0006fe00
f6c62740 2203094083 S Ii:1:007:1 -115:8 4 <
f6c62740 2203102062 C Ii:1:007:1 0:8 4 = 0005ff00
f6c62740 2203102111 S Ii:1:007:1 -115:8 4 <
f6c62740 2203110062 C Ii:1:007:1 0:8 4 = 00040000
f6c62740 2203110111 S Ii:1:007:1 -115:8 4 <
f6c62740 2203118040 C Ii:1:007:1 0:8 4 = 0003ff00
f6c62740 2203118091 S Ii:1:007:1 -115:8 4 <
f6c62740 2203126045 C Ii:1:007:1 0:8 4 = 0002ff00
f6c62740 2203126093 S Ii:1:007:1 -115:8 4 <
f6c62740 2203134043 C Ii:1:007:1 0:8 4 = 00040000
f6c62740 2203134091 S Ii:1:007:1 -115:8 4 <
f6c62740 2203142045 C Ii:1:007:1 0:8 4 = 0004fe00
f6c62740 2203142096 S Ii:1:007:1 -115:8 4 <
f6c62740 2203150046 C Ii:1:007:1 0:8 4 = 0004fe00
f6c62740 2203150095 S Ii:1:007:1 -115:8 4 <
f6c62740 2203158040 C Ii:1:007:1 0:8 4 = 0004fe00
f6c62740 2203158091 S Ii:1:007:1 -115:8 4 <
f6c62740 2203166063 C Ii:1:007:1 0:8 4 = 0003fd00
f6c62740 2203166115 S Ii:1:007:1 -115:8 4 <
f6c62740 2203174043 C Ii:1:007:1 0:8 4 = 0001fd00
f6c62740 2203174106 S Ii:1:007:1 -115:8 4 <
f6c62740 2203182046 C Ii:1:007:1 0:8 4 = 0000fe00
f6c62740 2203182085 S Ii:1:007:1 -115:8 4 <
f6c62740 2203190058 C Ii:1:007:1 0:8 4 = 0000fd00
f6c62740 2203190077 S Ii:1:007:1 -115:8 4 <
f6c62740 2203198058 C Ii:1:007:1 0:8 4 = 00ffff00
f6c62740 2203198084 S Ii:1:007:1 -115:8 4 <
f6c62740 2203206057 C Ii:1:007:1 0:8 4 = 00fffe00
f6c62740 2203206084 S Ii:1:007:1 -115:8 4 <
f6c62740 2203214041 C Ii:1:007:1 0:8 4 = 00ffff00
f6c62740 2203214094 S Ii:1:007:1 -115:8 4 <
f6c62740 2203222041 C Ii:1:007:1 0:8 4 = 00ffff00
f6c62740 2203222095 S Ii:1:007:1 -115:8 4 <
f6c62740 2203230058 C Ii:1:007:1 0:8 4 = 00ff0000
f6c62740 2203230084 S Ii:1:007:1 -115:8 4 <
f6c62740 2203238044 C Ii:1:007:1 0:8 4 = 0000ff00
f6c62740 2203238071 S Ii:1:007:1 -115:8 4 <
f6c62740 2203270064 C Ii:1:007:1 0:8 4 = 00ff0000
f6c62740 2203270115 S Ii:1:007:1 -115:8 4 <
f6c62740 2203278040 C Ii:1:007:1 0:8 4 = 0000ff00
f6c62740 2203278089 S Ii:1:007:1 -115:8 4 <
f6c62740 2203286047 C Ii:1:007:1 0:8 4 = 00ff0000
f6c62740 2203286096 S Ii:1:007:1 -115:8 4 <
f6c62740 2203294047 C Ii:1:007:1 0:8 4 = 00fffe00
f6c62740 2203294098 S Ii:1:007:1 -115:8 4 <
f6c62740 2203302062 C Ii:1:007:1 0:8 4 = 00ffff00
f6c62740 2203302113 S Ii:1:007:1 -115:8 4 <
f6c62740 2203310040 C Ii:1:007:1 0:8 4 = 00ff0000
f6c62740 2203310089 S Ii:1:007:1 -115:8 4 <
f6c62740 2203326759 C Ii:1:007:1 0:8 4 = 00ff0000
f6c62740 2203326809 S Ii:1:007:1 -115:8 4 <
f6c62740 2203342068 C Ii:1:007:1 0:8 4 = 00ff0000
f6c62740 2203342114 S Ii:1:007:1 -115:8 4 <
f6c62740 2203350065 C Ii:1:007:1 0:8 4 = 00ff0000
f6c62740 2203350113 S Ii:1:007:1 -115:8 4 <
f6c62740 2203358063 C Ii:1:007:1 0:8 4 = 00ff0000
f6c62740 2203358110 S Ii:1:007:1 -115:8 4 <
f6c62740 2203366050 C Ii:1:007:1 0:8 4 = 00fe0100
f6c62740 2203366102 S Ii:1:007:1 -115:8 4 <
f6c62740 2203374048 C Ii:1:007:1 0:8 4 = 00fe0200
f6c62740 2203374101 S Ii:1:007:1 -115:8 4 <
f6c62740 2203382047 C Ii:1:007:1 0:8 4 = 00ff0200
f6c62740 2203382098 S Ii:1:007:1 -115:8 4 <
f6c62740 2203390065 C Ii:1:007:1 0:8 4 = 00fe0200
f6c62740 2203390113 S Ii:1:007:1 -115:8 4 <
f6c62740 2203398063 C Ii:1:007:1 0:8 4 = 00fd0300
f6c62740 2203398113 S Ii:1:007:1 -115:8 4 <
f6c62740 2203406047 C Ii:1:007:1 0:8 4 = 00fd0400
f6c62740 2203406096 S Ii:1:007:1 -115:8 4 <
f6c62740 2203414046 C Ii:1:007:1 0:8 4 = 00fc0300
f6c62740 2203414096 S Ii:1:007:1 -115:8 4 <
f6c62740 2203422046 C Ii:1:007:1 0:8 4 = 00fb0400
f6c62740 2203422094 S Ii:1:007:1 -115:8 4 <
f6c62740 2203430048 C Ii:1:007:1 0:8 4 = 00fb0400
f6c62740 2203430099 S Ii:1:007:1 -115:8 4 <
f6c62740 2203438044 C Ii:1:007:1 0:8 4 = 00fb0300
f6c62740 2203438072 S Ii:1:007:1 -115:8 4 <
f6c62740 2203446042 C Ii:1:007:1 0:8 4 = 00fc0200
f6c62740 2203446070 S Ii:1:007:1 -115:8 4 <
f6c62740 2203454042 C Ii:1:007:1 0:8 4 = 00fb0200
f6c62740 2203454069 S Ii:1:007:1 -115:8 4 <
f6c62740 2203462043 C Ii:1:007:1 0:8 4 = 00fc0100
f6c62740 2203462070 S Ii:1:007:1 -115:8 4 <
f6c62740 2203470045 C Ii:1:007:1 0:8 4 = 00fe0100
f6c62740 2203470073 S Ii:1:007:1 -115:8 4 <
f6c62740 2203478055 C Ii:1:007:1 0:8 4 = 00fe0000
f6c62740 2203478080 S Ii:1:007:1 -115:8 4 <
f6c62740 2203510041 C Ii:1:007:1 0:8 4 = 0000ff00
f6c62740 2203510061 S Ii:1:007:1 -115:8 4 <
f6c62740 2203518055 C Ii:1:007:1 0:8 4 = 0000ff00
f6c62740 2203518081 S Ii:1:007:1 -115:8 4 <
f6c62740 2203534056 C Ii:1:007:1 0:8 4 = 0000ff00
f6c62740 2203534080 S Ii:1:007:1 -115:8 4 <
f6c62740 2203542057 C Ii:1:007:1 0:8 4 = 00ff0000
f6c62740 2203542083 S Ii:1:007:1 -115:8 4 <
f6c62740 2203550057 C Ii:1:007:1 0:8 4 = 0000ff00
f6c62740 2203550081 S Ii:1:007:1 -115:8 4 <
f6c62740 2203558057 C Ii:1:007:1 0:8 4 = 0001ff00
f6c62740 2203558083 S Ii:1:007:1 -115:8 4 <
f6c62740 2203566044 C Ii:1:007:1 0:8 4 = 0000ff00
f6c62740 2203566070 S Ii:1:007:1 -115:8 4 <
f6c62740 2203574065 C Ii:1:007:1 0:8 4 = 0000ff00
f6c62740 2203574118 S Ii:1:007:1 -115:8 4 <
f6c62740 2203582065 C Ii:1:007:1 0:8 4 = 0000ff00
f6c62740 2203582111 S Ii:1:007:1 -115:8 4 <
f6c62740 2203590047 C Ii:1:007:1 0:8 4 = 0001ff00
f6c62740 2203590099 S Ii:1:007:1 -115:8 4 <
f6c62740 2203598041 C Ii:1:007:1 0:8 4 = 0000ff00
f6c62740 2203598091 S Ii:1:007:1 -115:8 4 <
f6c62740 2203606063 C Ii:1:007:1 0:8 4 = 0001ff00
f6c62740 2203606114 S Ii:1:007:1 -115:8 4 <
f6c62740 2203614065 C Ii:1:007:1 0:8 4 = 0000ff00
f6c62740 2203614114 S Ii:1:007:1 -115:8 4 <
f6c62740 2203622066 C Ii:1:007:1 0:8 4 = 00010000
f6c62740 2203622112 S Ii:1:007:1 -115:8 4 <
f6c62740 2203630065 C Ii:1:007:1 0:8 4 = 0000ff00
f6c62740 2203630113 S Ii:1:007:1 -115:8 4 <
f6c62740 2203638063 C Ii:1:007:1 0:8 4 = 0001ff00
f6c62740 2203638111 S Ii:1:007:1 -115:8 4 <
f6c62740 2203654066 C Ii:1:007:1 0:8 4 = 0000ff00
f6c62740 2203654114 S Ii:1:007:1 -115:8 4 <
f6c62740 2203662047 C Ii:1:007:1 0:8 4 = 00010000
f6c62740 2203662095 S Ii:1:007:1 -115:8 4 <
f6c62740 2203670047 C Ii:1:007:1 0:8 4 = 00010000
f6c62740 2203670093 S Ii:1:007:1 -115:8 4 <
f6c62740 2203678040 C Ii:1:007:1 0:8 4 = 0000ff00
f6c62740 2203678088 S Ii:1:007:1 -115:8 4 <
f6c62740 2203686047 C Ii:1:007:1 0:8 4 = 00020000
f6c62740 2203686092 S Ii:1:007:1 -115:8 4 <
f6c62740 2203694063 C Ii:1:007:1 0:8 4 = 0000ff00
f6c62740 2203694108 S Ii:1:007:1 -115:8 4 <
f6c62740 2203702066 C Ii:1:007:1 0:8 4 = 00010000
f6c62740 2203702113 S Ii:1:007:1 -115:8 4 <
f6c62740 2203710042 C Ii:1:007:1 0:8 4 = 00010000
f6c62740 2203710097 S Ii:1:007:1 -115:8 4 <
f6c62740 2203718060 C Ii:1:007:1 0:8 4 = 00010000
f6c62740 2203718086 S Ii:1:007:1 -115:8 4 <
f6c62740 2203726059 C Ii:1:007:1 0:8 4 = 00010000
f6c62740 2203726081 S Ii:1:007:1 -115:8 4 <
f6c62740 2203734041 C Ii:1:007:1 0:8 4 = 00010000
f6c62740 2203734077 S Ii:1:007:1 -115:8 4 <
f6c62740 2203742057 C Ii:1:007:1 0:8 4 = 00010000
f6c62740 2203742084 S Ii:1:007:1 -115:8 4 <
f6c62740 2203750058 C Ii:1:007:1 0:8 4 = 00010000
f6c62740 2203750082 S Ii:1:007:1 -115:8 4 <
f6c62740 2203758057 C Ii:1:007:1 0:8 4 = 00020000
f6c62740 2203758082 S Ii:1:007:1 -115:8 4 <
f6c62740 2203766046 C Ii:1:007:1 0:8 4 = 00020100
f6c62740 2203766093 S Ii:1:007:1 -115:8 4 <
f6c62740 2203774048 C Ii:1:007:1 0:8 4 = 00010000
f6c62740 2203774102 S Ii:1:007:1 -115:8 4 <
f6c62740 2204006071 C Ii:1:007:1 0:8 4 = 01000000
f6c62740 2204006137 S Ii:1:007:1 -115:8 4 <
f6c62740 2204118043 C Ii:1:007:1 0:8 4 = 00000000
f6c62740 2204118084 S Ii:1:007:1 -115:8 4 <
f73766c0 2204419167 S Bo:1:008:2 -115 31 = 55534243 e7540200 00000000 00010600 00000000 00000000 00000000 000000
f73766c0 2204419318 C Bo:1:008:2 0 31 >
f73766c0 2204419441 S Bi:1:008:2 -115 13 <
f73766c0 2204420313 C Bi:1:008:2 0 13 = 55534253 e7540200 00000000 01
f73766c0 2204420355 S Bo:1:008:2 -115 31 = 55534243 e8540200 12000000 80010603 00000012 00000000 00000000 000000
f73766c0 2204420436 C Bo:1:008:2 0 31 >
d8a10140 2204420456 S Bi:1:008:2 -115 18 <
d8a10140 2204421795 C Bi:1:008:2 0 18 = 70000200 0000000a 00000000 3a000000 0000
f73766c0 2204421820 S Bi:1:008:2 -115 13 <
f6c62740 2204422046 C Ii:1:007:1 0:8 4 = 00000100
f6c62740 2204422103 S Ii:1:007:1 -115:8 4 <
f73766c0 2204422565 C Bi:1:008:2 0 13 = 55534253 e8540200 00000000 00
f73766c0 2204422654 S Bo:1:008:2 -115 31 = 55534243 e9540200 00000000 00010600 00000000 00000000 00000000 000000
f73766c0 2204422788 C Bo:1:008:2 0 31 >
f73766c0 2204422824 S Bi:1:008:2 -115 13 <
f73766c0 2204423920 C Bi:1:008:2 0 13 = 55534253 e9540200 00000000 01
f73766c0 2204423943 S Bo:1:008:2 -115 31 = 55534243 ea540200 12000000 80010603 00000012 00000000 00000000 000000
f73766c0 2204424039 C Bo:1:008:2 0 31 >
f712a840 2204424064 S Bi:1:008:2 -115 18 <
f712a840 2204425312 C Bi:1:008:2 0 18 = 70000200 0000000a 00000000 3a000000 0000
f73766c0 2204425339 S Bi:1:008:2 -115 13 <
f73766c0 2204426169 C Bi:1:008:2 0 13 = 55534253 ea540200 00000000 00
f73766c0 2204426310 S Bo:1:008:2 -115 31 = 55534243 eb540200 00000000 0001061e 00000001 00000000 00000000 000000
f73766c0 2204426435 C Bo:1:008:2 0 31 >
f73766c0 2204426454 S Bi:1:008:2 -115 13 <
f73766c0 2204427420 C Bi:1:008:2 0 13 = 55534253 eb540200 00000000 01
f73766c0 2204427442 S Bo:1:008:2 -115 31 = 55534243 ec540200 12000000 80010603 00000012 00000000 00000000 000000
f73766c0 2204427545 C Bo:1:008:2 0 31 >
e2da9ac0 2204427560 S Bi:1:008:2 -115 18 <
e2da9ac0 2204428918 C Bi:1:008:2 0 18 = 70000200 0000000a 00000000 3a000000 0000
f73766c0 2204428936 S Bi:1:008:2 -115 13 <
f73766c0 2204429679 C Bi:1:008:2 0 13 = 55534253 ec540200 00000000 00
f73766c0 2204429776 S Bo:1:008:2 -115 31 = 55534243 ed540200 00000000 0001061e 00000000 00000000 00000000 000000
f73766c0 2204429918 C Bo:1:008:2 0 31 >
f6c62740 2204429927 C Ii:1:007:1 0:8 4 = 00000100
f73766c0 2204429942 S Bi:1:008:2 -115 13 <
f6c62740 2204429972 S Ii:1:007:1 -115:8 4 <
f73766c0 2204430921 C Bi:1:008:2 0 13 = 55534253 ed540200 00000000 01
f73766c0 2204430945 S Bo:1:008:2 -115 31 = 55534243 ee540200 12000000 80010603 00000012 00000000 00000000 000000
f73766c0 2204431045 C Bo:1:008:2 0 31 >
f224fac0 2204431102 S Bi:1:008:2 -115 18 <
f224fac0 2204432421 C Bi:1:008:2 0 18 = 70000200 0000000a 00000000 3a000000 0000
f73766c0 2204432449 S Bi:1:008:2 -115 13 <
f73766c0 2204433171 C Bi:1:008:2 0 13 = 55534253 ee540200 00000000 00
f73766c0 2204433275 S Bo:1:008:2 -115 31 = 55534243 ef540200 00000000 00010600 00000000 00000000 00000000 000000
f73766c0 2204433421 C Bo:1:008:2 0 31 >
f73766c0 2204433435 S Bi:1:008:2 -115 13 <
f73766c0 2204434545 C Bi:1:008:2 0 13 = 55534253 ef540200 00000000 01
f73766c0 2204434577 S Bo:1:008:2 -115 31 = 55534243 f0540200 12000000 80010603 00000012 00000000 00000000 000000
f73766c0 2204434685 C Bo:1:008:2 0 31 >
d8a10140 2204434702 S Bi:1:008:2 -115 18 <
d8a10140 2204436043 C Bi:1:008:2 0 18 = 70000200 0000000a 00000000 3a000000 0000
f73766c0 2204436064 S Bi:1:008:2 -115 13 <
f73766c0 2204436796 C Bi:1:008:2 0 13 = 55534253 f0540200 00000000 00
f73766c0 2204436869 S Bo:1:008:2 -115 31 = 55534243 f1540200 00000000 00000600 00000000 00000000 00000000 000000
f73766c0 2204436912 C Bo:1:008:2 0 31 >
f73766c0 2204436933 S Bi:1:008:2 -115 13 <
f6c62740 2204438046 C Ii:1:007:1 0:8 4 = 00000100
f6c62740 2204438092 S Ii:1:007:1 -115:8 4 <
f73766c0 2204438540 C Bi:1:008:2 0 13 = 55534253 f1540200 00000000 01
f73766c0 2204438557 S Bo:1:008:2 -115 31 = 55534243 f2540200 12000000 80000603 00000012 00000000 00000000 000000
f73766c0 2204438691 C Bo:1:008:2 0 31 >
e2da9ac0 2204438710 S Bi:1:008:2 -115 18 <
e2da9ac0 2204439920 C Bi:1:008:2 0 18 = 70000200 0000000a 00000000 3a000000 0000
f73766c0 2204439942 S Bi:1:008:2 -115 13 <
f73766c0 2204440795 C Bi:1:008:2 0 13 = 55534253 f2540200 00000000 00
f73766c0 2204440903 S Bo:1:008:2 -115 31 = 55534243 f3540200 00000000 00000600 00000000 00000000 00000000 000000
f73766c0 2204441047 C Bo:1:008:2 0 31 >
f73766c0 2204441068 S Bi:1:008:2 -115 13 <
f73766c0 2204442046 C Bi:1:008:2 0 13 = 55534253 f3540200 00000000 01
f73766c0 2204442064 S Bo:1:008:2 -115 31 = 55534243 f4540200 12000000 80000603 00000012 00000000 00000000 000000
f73766c0 2204442171 C Bo:1:008:2 0 31 >
e2da9ac0 2204442310 S Bi:1:008:2 -115 18 <
e2da9ac0 2204443419 C Bi:1:008:2 0 18 = 70000200 0000000a 00000000 3a000000 0000
f73766c0 2204443440 S Bi:1:008:2 -115 13 <
f73766c0 2204444419 C Bi:1:008:2 0 13 = 55534253 f4540200 00000000 00
f73766c0 2204444546 S Bo:1:008:2 -115 31 = 55534243 f5540200 00000000 0000061e 00000001 00000000 00000000 000000
f73766c0 2204444685 C Bo:1:008:2 0 31 >
f73766c0 2204444704 S Bi:1:008:2 -115 13 <
f73766c0 2204445666 C Bi:1:008:2 0 13 = 55534253 f5540200 00000000 01
f73766c0 2204445685 S Bo:1:008:2 -115 31 = 55534243 f6540200 12000000 80000603 00000012 00000000 00000000 000000
f73766c0 2204445810 C Bo:1:008:2 0 31 >
f712a840 2204445830 S Bi:1:008:2 -115 18 <
f6c62740 2204446063 C Ii:1:007:1 0:8 4 = 00ff0000
f6c62740 2204446109 S Ii:1:007:1 -115:8 4 <
f712a840 2204447170 C Bi:1:008:2 0 18 = 70000200 0000000a 00000000 3a000000 0000
f73766c0 2204447198 S Bi:1:008:2 -115 13 <
f73766c0 2204447920 C Bi:1:008:2 0 13 = 55534253 f6540200 00000000 00
f73766c0 2204448019 S Bo:1:008:2 -115 31 = 55534243 f7540200 00000000 0000061e 00000000 00000000 00000000 000000
f73766c0 2204448165 C Bo:1:008:2 0 31 >
f73766c0 2204448188 S Bi:1:008:2 -115 13 <
f73766c0 2204449171 C Bi:1:008:2 0 13 = 55534253 f7540200 00000000 01
f73766c0 2204449190 S Bo:1:008:2 -115 31 = 55534243 f8540200 12000000 80000603 00000012 00000000 00000000 000000
f73766c0 2204449296 C Bo:1:008:2 0 31 >
d8a10140 2204449323 S Bi:1:008:2 -115 18 <
d8a10140 2204450673 C Bi:1:008:2 0 18 = 70000200 0000000a 00000000 3a000000 0000
f73766c0 2204450693 S Bi:1:008:2 -115 13 <
f73766c0 2204451421 C Bi:1:008:2 0 13 = 55534253 f8540200 00000000 00
f73766c0 2204451462 S Bo:1:008:2 -115 31 = 55534243 f9540200 00000000 00000600 00000000 00000000 00000000 000000
f73766c0 2204451544 C Bo:1:008:2 0 31 >
f73766c0 2204451558 S Bi:1:008:2 -115 13 <
f73766c0 2204452545 C Bi:1:008:2 0 13 = 55534253 f9540200 00000000 01
f73766c0 2204452561 S Bo:1:008:2 -115 31 = 55534243 fa540200 12000000 80000603 00000012 00000000 00000000 000000
f73766c0 2204452672 C Bo:1:008:2 0 31 >
d8a10140 2204452694 S Bi:1:008:2 -115 18 <
f6c62740 2204454047 C Ii:1:007:1 0:8 4 = 00000100
f6c62740 2204454091 S Ii:1:007:1 -115:8 4 <
d8a10140 2204454169 C Bi:1:008:2 0 18 = 70000200 0000000a 00000000 3a000000 0000
f73766c0 2204454193 S Bi:1:008:2 -115 13 <
f73766c0 2204455039 C Bi:1:008:2 0 13 = 55534253 fa540200 00000000 00
f6c62740 2204462067 C Ii:1:007:1 0:8 4 = 00000100
f6c62740 2204462114 S Ii:1:007:1 -115:8 4 <
f6c62740 2204470071 C Ii:1:007:1 0:8 4 = 00ff0000
f6c62740 2204470116 S Ii:1:007:1 -115:8 4 <
f6c62740 2204478050 C Ii:1:007:1 0:8 4 = 00000200
f6c62740 2204478100 S Ii:1:007:1 -115:8 4 <
f6c62740 2204486065 C Ii:1:007:1 0:8 4 = 00ff0100
f6c62740 2204486115 S Ii:1:007:1 -115:8 4 <
f6c62740 2204494067 C Ii:1:007:1 0:8 4 = 00ff0200
f6c62740 2204494117 S Ii:1:007:1 -115:8 4 <
f6c62740 2204502048 C Ii:1:007:1 0:8 4 = 00ff0100
f6c62740 2204502097 S Ii:1:007:1 -115:8 4 <
f6c62740 2204510062 C Ii:1:007:1 0:8 4 = 00ff0200
f6c62740 2204510112 S Ii:1:007:1 -115:8 4 <
f6c62740 2204518042 C Ii:1:007:1 0:8 4 = 00ff0200
f6c62740 2204518101 S Ii:1:007:1 -115:8 4 <
f6c62740 2204526048 C Ii:1:007:1 0:8 4 = 00000100
f6c62740 2204526086 S Ii:1:007:1 -115:8 4 <
f6c62740 2204534043 C Ii:1:007:1 0:8 4 = 00ff0200
f6c62740 2204534072 S Ii:1:007:1 -115:8 4 <
f6c62740 2204542057 C Ii:1:007:1 0:8 4 = 00000100
f6c62740 2204542081 S Ii:1:007:1 -115:8 4 <
f6c62740 2204550057 C Ii:1:007:1 0:8 4 = 00ff0100
f6c62740 2204550084 S Ii:1:007:1 -115:8 4 <
f6c62740 2204558057 C Ii:1:007:1 0:8 4 = 00000100
f6c62740 2204558082 S Ii:1:007:1 -115:8 4 <
f6c62740 2204566056 C Ii:1:007:1 0:8 4 = 00000100
f6c62740 2204566081 S Ii:1:007:1 -115:8 4 <
f6c62740 2204574054 C Ii:1:007:1 0:8 4 = 00ff0100
f6c62740 2204574074 S Ii:1:007:1 -115:8 4 <
f6c62740 2204582057 C Ii:1:007:1 0:8 4 = 00000100
f6c62740 2204582084 S Ii:1:007:1 -115:8 4 <
f6c62740 2204590041 C Ii:1:007:1 0:8 4 = 00000100
f6c62740 2204590066 S Ii:1:007:1 -115:8 4 <
f6c62740 2204598057 C Ii:1:007:1 0:8 4 = 00ff0100
f6c62740 2204598083 S Ii:1:007:1 -115:8 4 <
f6c62740 2204606043 C Ii:1:007:1 0:8 4 = 00000100
f6c62740 2204606068 S Ii:1:007:1 -115:8 4 <
f6c62740 2204614058 C Ii:1:007:1 0:8 4 = 00000100
f6c62740 2204614083 S Ii:1:007:1 -115:8 4 <
f6c62740 2204622038 C Ii:1:007:1 0:8 4 = 00ff0100
f6c62740 2204622057 S Ii:1:007:1 -115:8 4 <
f6c62740 2204630048 C Ii:1:007:1 0:8 4 = 00000100
f6c62740 2204630099 S Ii:1:007:1 -115:8 4 <
f6c62740 2204902072 C Ii:1:007:1 0:8 4 = 01000000
f6c62740 2204902138 S Ii:1:007:1 -115:8 4 <
f6c62740 2205022068 C Ii:1:007:1 0:8 4 = 00000000
f6c62740 2205022130 S Ii:1:007:1 -115:8 4 <
f712ac40 2205061047 S Co:1:010:0 s 40 c1 0000 0000 0000 0
f712ac40 2205061794 C Co:1:010:0 0 0
f712ac40 2205065853 S Co:1:010:0 s 40 c2 0002 0000 0000 0
f712ac40 2205067041 C Co:1:010:0 0 0
f6c62740 2205558072 C Ii:1:007:1 0:8 4 = 00010000
f6c62740 2205558133 S Ii:1:007:1 -115:8 4 <
f6c62740 2205566046 C Ii:1:007:1 0:8 4 = 00010000
f6c62740 2205566097 S Ii:1:007:1 -115:8 4 <
f6c62740 2205574041 C Ii:1:007:1 0:8 4 = 00020000
f6c62740 2205574091 S Ii:1:007:1 -115:8 4 <
f6c62740 2205582064 C Ii:1:007:1 0:8 4 = 00030000
f6c62740 2205582114 S Ii:1:007:1 -115:8 4 <
f6c62740 2205590059 C Ii:1:007:1 0:8 4 = 0003ff00
f6c62740 2205590077 S Ii:1:007:1 -115:8 4 <
f6c62740 2205598057 C Ii:1:007:1 0:8 4 = 0004fe00
f6c62740 2205598085 S Ii:1:007:1 -115:8 4 <
f6c62740 2205606043 C Ii:1:007:1 0:8 4 = 0004ff00
f6c62740 2205606063 S Ii:1:007:1 -115:8 4 <
f6c62740 2205614058 C Ii:1:007:1 0:8 4 = 0004ff00
f6c62740 2205614085 S Ii:1:007:1 -115:8 4 <
f6c62740 2205622038 C Ii:1:007:1 0:8 4 = 00050000
f6c62740 2205622063 S Ii:1:007:1 -115:8 4 <
f6c62740 2205630047 C Ii:1:007:1 0:8 4 = 0004ff00
f6c62740 2205630097 S Ii:1:007:1 -115:8 4 <
f6c62740 2205638066 C Ii:1:007:1 0:8 4 = 0005ff00
f6c62740 2205638116 S Ii:1:007:1 -115:8 4 <
f6c62740 2205646063 C Ii:1:007:1 0:8 4 = 00040000
f6c62740 2205646110 S Ii:1:007:1 -115:8 4 <
f6c62740 2205654063 C Ii:1:007:1 0:8 4 = 0004ff00
f6c62740 2205654114 S Ii:1:007:1 -115:8 4 <
f6c62740 2205662063 C Ii:1:007:1 0:8 4 = 00040000
f6c62740 2205662109 S Ii:1:007:1 -115:8 4 <
f6c62740 2205670064 C Ii:1:007:1 0:8 4 = 00030000
f6c62740 2205670111 S Ii:1:007:1 -115:8 4 <
f6c62740 2205678067 C Ii:1:007:1 0:8 4 = 00030000
f6c62740 2205678113 S Ii:1:007:1 -115:8 4 <
f6c62740 2205686064 C Ii:1:007:1 0:8 4 = 0003ff00
f6c62740 2205686113 S Ii:1:007:1 -115:8 4 <
f6c62740 2205694046 C Ii:1:007:1 0:8 4 = 00030000
f6c62740 2205694093 S Ii:1:007:1 -115:8 4 <
f6c62740 2205702066 C Ii:1:007:1 0:8 4 = 00020000
f6c62740 2205702114 S Ii:1:007:1 -115:8 4 <
f6c62740 2205710064 C Ii:1:007:1 0:8 4 = 00030000
f6c62740 2205710111 S Ii:1:007:1 -115:8 4 <
f6c62740 2205718066 C Ii:1:007:1 0:8 4 = 0002ff00
f6c62740 2205718117 S Ii:1:007:1 -115:8 4 <
f6c62740 2205726046 C Ii:1:007:1 0:8 4 = 00010000
f6c62740 2205726094 S Ii:1:007:1 -115:8 4 <
f6c62740 2205734063 C Ii:1:007:1 0:8 4 = 00020000
f6c62740 2205734109 S Ii:1:007:1 -115:8 4 <
f6c62740 2205742066 C Ii:1:007:1 0:8 4 = 00010000
f6c62740 2205742113 S Ii:1:007:1 -115:8 4 <
f6c62740 2205766040 C Ii:1:007:1 0:8 4 = 00010000
f6c62740 2205766090 S Ii:1:007:1 -115:8 4 <
f6c62740 2205814067 C Ii:1:007:1 0:8 4 = 00010000
f6c62740 2205814122 S Ii:1:007:1 -115:8 4 <
f6c62740 2205830066 C Ii:1:007:1 0:8 4 = 00010000
f6c62740 2205830115 S Ii:1:007:1 -115:8 4 <
f6c62740 2205838046 C Ii:1:007:1 0:8 4 = 00010000
f6c62740 2205838095 S Ii:1:007:1 -115:8 4 <
f6c62740 2205846041 C Ii:1:007:1 0:8 4 = 0001ff00
f6c62740 2205846095 S Ii:1:007:1 -115:8 4 <
f6c62740 2205854063 C Ii:1:007:1 0:8 4 = 00010000
f6c62740 2205854110 S Ii:1:007:1 -115:8 4 <
f6c62740 2205862066 C Ii:1:007:1 0:8 4 = 00010000
f6c62740 2205862113 S Ii:1:007:1 -115:8 4 <
f6c62740 2205870067 C Ii:1:007:1 0:8 4 = 00020000
f6c62740 2205870114 S Ii:1:007:1 -115:8 4 <
f6c62740 2205878065 C Ii:1:007:1 0:8 4 = 00020000
f6c62740 2205878113 S Ii:1:007:1 -115:8 4 <
f6c62740 2205886047 C Ii:1:007:1 0:8 4 = 00030000
f6c62740 2205886094 S Ii:1:007:1 -115:8 4 <
f6c62740 2205894046 C Ii:1:007:1 0:8 4 = 00030000
f6c62740 2205894093 S Ii:1:007:1 -115:8 4 <
f6c62740 2205902063 C Ii:1:007:1 0:8 4 = 00030000
f6c62740 2205902108 S Ii:1:007:1 -115:8 4 <
f6c62740 2205910066 C Ii:1:007:1 0:8 4 = 00010000
f6c62740 2205910113 S Ii:1:007:1 -115:8 4 <
f6c62740 2205918041 C Ii:1:007:1 0:8 4 = 00010000
f6c62740 2205918089 S Ii:1:007:1 -115:8 4 <
f6c62740 2205926048 C Ii:1:007:1 0:8 4 = 00010000
f6c62740 2205926095 S Ii:1:007:1 -115:8 4 <
f6c62740 2205950066 C Ii:1:007:1 0:8 4 = 00010000
f6c62740 2205950114 S Ii:1:007:1 -115:8 4 <
f6c62740 2206006066 C Ii:1:007:1 0:8 4 = 00000100
f6c62740 2206006122 S Ii:1:007:1 -115:8 4 <
f6c62740 2206014048 C Ii:1:007:1 0:8 4 = 00010000
f6c62740 2206014094 S Ii:1:007:1 -115:8 4 <
f6c62740 2206022065 C Ii:1:007:1 0:8 4 = 00000100
f6c62740 2206022112 S Ii:1:007:1 -115:8 4 <
f6c62740 2206030067 C Ii:1:007:1 0:8 4 = 00000100
f6c62740 2206030116 S Ii:1:007:1 -115:8 4 <
f6c62740 2206038065 C Ii:1:007:1 0:8 4 = 00000100
f6c62740 2206038113 S Ii:1:007:1 -115:8 4 <
f6c62740 2206046047 C Ii:1:007:1 0:8 4 = 00010000
f6c62740 2206046093 S Ii:1:007:1 -115:8 4 <
f6c62740 2206054067 C Ii:1:007:1 0:8 4 = 00000100
f6c62740 2206054121 S Ii:1:007:1 -115:8 4 <
f6c62740 2206062048 C Ii:1:007:1 0:8 4 = 00010100
f6c62740 2206062119 S Ii:1:007:1 -115:8 4 <
f6c62740 2206070043 C Ii:1:007:1 0:8 4 = 00000100
f6c62740 2206070094 S Ii:1:007:1 -115:8 4 <
f73766c0 2206420972 S Bo:1:008:2 -115 31 = 55534243 fb540200 00000000 00010600 00000000 00000000 00000000 000000
f73766c0 2206421064 C Bo:1:008:2 0 31 >
f73766c0 2206421202 S Bi:1:008:2 -115 13 <
f73766c0 2206422170 C Bi:1:008:2 0 13 = 55534253 fb540200 00000000 01
f73766c0 2206422189 S Bo:1:008:2 -115 31 = 55534243 fc540200 12000000 80010603 00000012 00000000 00000000 000000
f73766c0 2206422311 C Bo:1:008:2 0 31 >
d8a0cf40 2206422352 S Bi:1:008:2 -115 18 <
d8a0cf40 2206423685 C Bi:1:008:2 0 18 = 70000200 0000000a 00000000 3a000000 0000
f73766c0 2206423708 S Bi:1:008:2 -115 13 <
f73766c0 2206424438 C Bi:1:008:2 0 13 = 55534253 fc540200 00000000 00
f73766c0 2206424606 S Bo:1:008:2 -115 31 = 55534243 fd540200 00000000 00010600 00000000 00000000 00000000 000000
f73766c0 2206424663 C Bo:1:008:2 0 31 >
f73766c0 2206424700 S Bi:1:008:2 -115 13 <
f73766c0 2206425812 C Bi:1:008:2 0 13 = 55534253 fd540200 00000000 01
f73766c0 2206425846 S Bo:1:008:2 -115 31 = 55534243 fe540200 12000000 80010603 00000012 00000000 00000000 000000
f73766c0 2206425938 C Bo:1:008:2 0 31 >
d8a103c0 2206425958 S Bi:1:008:2 -115 18 <
d8a103c0 2206427312 C Bi:1:008:2 0 18 = 70000200 0000000a 00000000 3a000000 0000
f73766c0 2206427334 S Bi:1:008:2 -115 13 <
f73766c0 2206428065 C Bi:1:008:2 0 13 = 55534253 fe540200 00000000 00
f73766c0 2206428199 S Bo:1:008:2 -115 31 = 55534243 ff540200 00000000 0001061e 00000001 00000000 00000000 000000
f73766c0 2206428310 C Bo:1:008:2 0 31 >
f73766c0 2206428329 S Bi:1:008:2 -115 13 <
f73766c0 2206429437 C Bi:1:008:2 0 13 = 55534253 ff540200 00000000 01
f73766c0 2206429458 S Bo:1:008:2 -115 31 = 55534243 00550200 12000000 80010603 00000012 00000000 00000000 000000
f73766c0 2206429565 C Bo:1:008:2 0 31 >
d8a0cf40 2206429600 S Bi:1:008:2 -115 18 <
d8a0cf40 2206430941 C Bi:1:008:2 0 18 = 70000200 0000000a 00000000 3a000000 0000
f73766c0 2206430961 S Bi:1:008:2 -115 13 <
f73766c0 2206431813 C Bi:1:008:2 0 13 = 55534253 00550200 00000000 00
f73766c0 2206431914 S Bo:1:008:2 -115 31 = 55534243 01550200 00000000 0001061e 00000000 00000000 00000000 000000
f73766c0 2206432062 C Bo:1:008:2 0 31 >
f73766c0 2206432094 S Bi:1:008:2 -115 13 <
f73766c0 2206433063 C Bi:1:008:2 0 13 = 55534253 01550200 00000000 01
f73766c0 2206433082 S Bo:1:008:2 -115 31 = 55534243 02550200 12000000 80010603 00000012 00000000 00000000 000000
f73766c0 2206433190 C Bo:1:008:2 0 31 >
f00aba40 2206433224 S Bi:1:008:2 -115 18 <
f00aba40 2206434576 C Bi:1:008:2 0 18 = 70000200 0000000a 00000000 3a000000 0000
f73766c0 2206434614 S Bi:1:008:2 -115 13 <
f73766c0 2206435312 C Bi:1:008:2 0 13 = 55534253 02550200 00000000 00
f73766c0 2206435364 S Bo:1:008:2 -115 31 = 55534243 03550200 00000000 00010600 00000000 00000000 00000000 000000
f73766c0 2206435420 C Bo:1:008:2 0 31 >
f73766c0 2206435435 S Bi:1:008:2 -115 13 <
f73766c0 2206436573 C Bi:1:008:2 0 13 = 55534253 03550200 00000000 01
f73766c0 2206436591 S Bo:1:008:2 -115 31 = 55534243 04550200 12000000 80010603 00000012 00000000 00000000 000000
f73766c0 2206436664 C Bo:1:008:2 0 31 >
f712ac40 2206436702 S Bi:1:008:2 -115 18 <
f712ac40 2206438039 C Bi:1:008:2 0 18 = 70000200 0000000a 00000000 3a000000 0000
f73766c0 2206438092 S Bi:1:008:2 -115 13 <
f73766c0 2206438788 C Bi:1:008:2 0 13 = 55534253 04550200 00000000 00
f73766c0 2206438861 S Bo:1:008:2 -115 31 = 55534243 05550200 00000000 00000600 00000000 00000000 00000000 000000
f73766c0 2206438914 C Bo:1:008:2 0 31 >
f73766c0 2206438996 S Bi:1:008:2 -115 13 <
f73766c0 2206440415 C Bi:1:008:2 0 13 = 55534253 05550200 00000000 01
f73766c0 2206440437 S Bo:1:008:2 -115 31 = 55534243 06550200 12000000 80000603 00000012 00000000 00000000 000000
f73766c0 2206440546 C Bo:1:008:2 0 31 >
d8a0cf40 2206440561 S Bi:1:008:2 -115 18 <
d8a0cf40 2206442046 C Bi:1:008:2 0 18 = 70000200 0000000a 00000000 3a000000 0000
f73766c0 2206442069 S Bi:1:008:2 -115 13 <
f73766c0 2206442919 C Bi:1:008:2 0 13 = 55534253 06550200 00000000 00
f73766c0 2206443014 S Bo:1:008:2 -115 31 = 55534243 07550200 00000000 00000600 00000000 00000000 00000000 000000
f73766c0 2206443170 C Bo:1:008:2 0 31 >
f73766c0 2206443185 S Bi:1:008:2 -115 13 <
f73766c0 2206444168 C Bi:1:008:2 0 13 = 55534253 07550200 00000000 01
f73766c0 2206444189 S Bo:1:008:2 -115 31 = 55534243 08550200 12000000 80000603 00000012 00000000 00000000 000000
f73766c0 2206444295 C Bo:1:008:2 0 31 >
f00aba40 2206444314 S Bi:1:008:2 -115 18 <
f00aba40 2206445668 C Bi:1:008:2 0 18 = 70000200 0000000a 00000000 3a000000 0000
f73766c0 2206445691 S Bi:1:008:2 -115 13 <
f73766c0 2206446435 C Bi:1:008:2 0 13 = 55534253 08550200 00000000 00
f73766c0 2206446569 S Bo:1:008:2 -115 31 = 55534243 09550200 00000000 0000061e 00000001 00000000 00000000 000000
f73766c0 2206446671 C Bo:1:008:2 0 31 >
f73766c0 2206446689 S Bi:1:008:2 -115 13 <
f73766c0 2206447687 C Bi:1:008:2 0 13 = 55534253 09550200 00000000 01
f73766c0 2206447709 S Bo:1:008:2 -115 31 = 55534243 0a550200 12000000 80000603 00000012 00000000 00000000 000000
f73766c0 2206447795 C Bo:1:008:2 0 31 >
d8a103c0 2206447837 S Bi:1:008:2 -115 18 <
d8a103c0 2206449171 C Bi:1:008:2 0 18 = 70000200 0000000a 00000000 3a000000 0000
f73766c0 2206449190 S Bi:1:008:2 -115 13 <
f73766c0 2206449921 C Bi:1:008:2 0 13 = 55534253 0a550200 00000000 00
f73766c0 2206450012 S Bo:1:008:2 -115 31 = 55534243 0b550200 00000000 0000061e 00000000 00000000 00000000 000000
f73766c0 2206450171 C Bo:1:008:2 0 31 >
f73766c0 2206450195 S Bi:1:008:2 -115 13 <
f73766c0 2206451299 C Bi:1:008:2 0 13 = 55534253 0b550200 00000000 01
f73766c0 2206451319 S Bo:1:008:2 -115 31 = 55534243 0c550200 12000000 80000603 00000012 00000000 00000000 000000
f73766c0 2206451421 C Bo:1:008:2 0 31 >
dbec5bc0 2206451442 S Bi:1:008:2 -115 18 <
dbec5bc0 2206452796 C Bi:1:008:2 0 18 = 70000200 0000000a 00000000 3a000000 0000
f73766c0 2206452817 S Bi:1:008:2 -115 13 <
f73766c0 2206453558 C Bi:1:008:2 0 13 = 55534253 0c550200 00000000 00
f73766c0 2206453625 S Bo:1:008:2 -115 31 = 55534243 0d550200 00000000 00000600 00000000 00000000 00000000 000000
f73766c0 2206453670 C Bo:1:008:2 0 31 >
f73766c0 2206453686 S Bi:1:008:2 -115 13 <
f73766c0 2206454810 C Bi:1:008:2 0 13 = 55534253 0d550200 00000000 01
f73766c0 2206454831 S Bo:1:008:2 -115 31 = 55534243 0e550200 12000000 80000603 00000012 00000000 00000000 000000
f73766c0 2206454919 C Bo:1:008:2 0 31 >
f00aba40 2206454961 S Bi:1:008:2 -115 18 <
f00aba40 2206456311 C Bi:1:008:2 0 18 = 70000200 0000000a 00000000 3a000000 0000
f73766c0 2206456330 S Bi:1:008:2 -115 13 <
f73766c0 2206457044 C Bi:1:008:2 0 13 = 55534253 0e550200 00000000 00
f6c62740 2206806052 C Ii:1:007:1 0:8 4 = 01000000
f6c62740 2206806118 S Ii:1:007:1 -115:8 4 <
f6c62740 2206958062 C Ii:1:007:1 0:8 4 = 00000000
f6c62740 2206958098 S Ii:1:007:1 -115:8 4 <
f223e6c0 2206966193 S Co:1:010:0 s 40 b5 0008 0000 0000 0
f223e6c0 2206967308 C Co:1:010:0 0 0
f223e6c0 2206970580 S Co:1:010:0 s 40 f7 0000 0000 0000 0
f223e6c0 2206971791 C Co:1:010:0 0 0
f223e6c0 2206978593 S Ii:1:010:6 -115:1 544 <
f223e6c0 2207039171 C Ii:1:010:6 0:1 544 = 00000000 433071c4 249d6ec4 5209f0c4 ecbaf0c4 b8a3f1c4 6f09f1c4 ecdef2c4
f223e6c0 2207049662 S Ii:1:010:6 -115:1 544 <
f223e6c0 2207101673 C Ii:1:010:6 0:1 544 = 61dd5347 e7ba5347 e7905347 f7fe5547 a6e05247 bf2e5347 e74f5447 a5745447
f223e6c0 2207113558 S Ii:1:010:6 -115:1 544 <
f223e6c0 2207164198 C Ii:1:010:6 0:1 544 = cc19e247 5ca8e247 05a5e147 cbc8e247 25e6e047 0e67e147 4cf6e147 5fb8e247
f223e6c0 2207178565 S Ii:1:010:6 -115:1 544 <
f6c62740 2207222074 C Ii:1:007:1 0:8 4 = 00010000
f6c62740 2207222139 S Ii:1:007:1 -115:8 4 <
f223e6c0 2207226675 C Ii:1:010:6 0:1 544 = 8ba3d647 b304d747 95e6d547 08bbd647 ace3d447 ef5cd547 88ecd547 969cd647
f6c62740 2207230065 C Ii:1:007:1 0:8 4 = 00020000
f6c62740 2207230112 S Ii:1:007:1 -115:8 4 <
f6c62740 2207238042 C Ii:1:007:1 0:8 4 = 00010100
f6c62740 2207238061 S Ii:1:007:1 -115:8 4 <
f223e6c0 2207238526 S Ii:1:010:6 -115:1 544 <
f6c62740 2207246057 C Ii:1:007:1 0:8 4 = 00030000
f6c62740 2207246086 S Ii:1:007:1 -115:8 4 <
f6c62740 2207254060 C Ii:1:007:1 0:8 4 = 00030000
f6c62740 2207254079 S Ii:1:007:1 -115:8 4 <
f6c62740 2207262043 C Ii:1:007:1 0:8 4 = 00040000
f6c62740 2207262072 S Ii:1:007:1 -115:8 4 <
f6c62740 2207270060 C Ii:1:007:1 0:8 4 = 00040000
f6c62740 2207270095 S Ii:1:007:1 -115:8 4 <
f6c62740 2207278058 C Ii:1:007:1 0:8 4 = 00040000
f6c62740 2207278084 S Ii:1:007:1 -115:8 4 <
f6c62740 2207286055 C Ii:1:007:1 0:8 4 = 00040000
f6c62740 2207286087 S Ii:1:007:1 -115:8 4 <
f223e6c0 2207289184 C Ii:1:010:6 0:1 544 = ba2a1c47 f7fb1a47 83841a47 01841b47 fd8a1847 b5aa1847 ddcd1947 afa81947
f6c62740 2207294066 C Ii:1:007:1 0:8 4 = 00040000
f6c62740 2207294115 S Ii:1:007:1 -115:8 4 <
f223e6c0 2207295885 S Ii:1:010:6 -115:1 544 <
f6c62740 2207302044 C Ii:1:007:1 0:8 4 = 00040000
f6c62740 2207302094 S Ii:1:007:1 -115:8 4 <
f6c62740 2207310058 C Ii:1:007:1 0:8 4 = 00030000
f6c62740 2207310090 S Ii:1:007:1 -115:8 4 <
f6c62740 2207318055 C Ii:1:007:1 0:8 4 = 00020000
f6c62740 2207318081 S Ii:1:007:1 -115:8 4 <
f6c62740 2207326038 C Ii:1:007:1 0:8 4 = 00020000
f6c62740 2207326066 S Ii:1:007:1 -115:8 4 <
f223e6c0 2207351672 C Ii:1:010:6 0:1 544 = 70f94ec7 6fb852c7 43ab4fc7 aea04fc7 ebae51c7 48a152c7 747751c7 589d53c7
f223e6c0 2207363571 S Ii:1:010:6 -115:1 544 <
f223e6c0 2207414196 C Ii:1:010:6 0:1 544 = 2c93dfc7 c04ce2c7 17d9dfc7 987edfc7 ea38e0c7 1313e1c7 ea7be0c7 6537e2c7
f223e6c0 2207423544 S Ii:1:010:6 -115:1 544 <
f223e6c0 2207476698 C Ii:1:010:6 0:1 544 = c50fd4c7 1cb4d6c7 4257d4c7 f567d3c7 152ad4c7 23fcd4c7 c367d4c7 d612d6c7
f223e6c0 2207484326 S Ii:1:010:6 -115:1 544 <
f223e6c0 2207539199 C Ii:1:010:6 0:1 544 = bf4d17c7 38a91ac7 360718c7 ade715c7 e76017c7 4f2f18c7 e91117c7 d2e318c7
f223e6c0 2207544812 S Ii:1:010:6 -115:1 544 <
f223e6c0 2207601685 C Ii:1:010:6 0:1 544 = 7af35347 fc285347 bd005347 1c6f5547 9bf75247 ba435347 415c5447 318a5447
f223e6c0 2207607473 S Ii:1:010:6 -115:1 544 <
f223e6c0 2207664173 C Ii:1:010:6 0:1 544 = e429e247 1bb7e247 2fb3e147 3cd7e247 eff4e047 9b76e147 3606e247 9fc6e247
f223e6c0 2207671103 S Ii:1:010:6 -115:1 544 <
f223e6c0 2207726700 C Ii:1:010:6 0:1 544 = 1d9ed647 e3cdd647 93e1d547 c0b5d647 37dfd447 c257d547 52e7d547 c099d647
f223e6c0 2207733631 S Ii:1:010:6 -115:1 544 <
f223e6c0 2207789170 C Ii:1:010:6 0:1 544 = 9f241c47 063b1a47 a27f1a47 0c7f1b47 ea861847 94a61847 5bc91947 e7a31947
f223e6c0 2207798539 S Ii:1:010:6 -115:1 544 <
f223e6c0 2207851688 C Ii:1:010:6 0:1 544 = 47d64ec7 589552c7 f92850c7 eb784fc7 168751c7 008452c7 d55e51c7 d88453c7
f223e6c0 2207866588 S Ii:1:010:6 -115:1 544 <
f223e6c0 2207914188 C Ii:1:010:6 0:1 544 = 2f93dfc7 8d4ce2c7 32f1dfc7 9c7edfc7 f338e0c7 7714e1c7 e37ce0c7 f438e2c7
f223e6c0 2207924136 S Ii:1:010:6 -115:1 544 <
f223e6c0 2207976697 C Ii:1:010:6 0:1 544 = 1e12d4c7 acb6d6c7 1329d4c7 ef6ad3c7 f92cd4c7 16ffd4c7 4e68d4c7 b612d6c7
f223e6c0 2207986596 S Ii:1:010:6 -115:1 544 <
f223e6c0 2208039189 C Ii:1:010:6 0:1 544 = 9a4c17c7 96a61ac7 500518c7 592c15c7 415f17c7 443818c7 2b1017c7 c2e218c7
f223e6c0 2208048663 S Ii:1:010:6 -115:1 544 <
f223e6c0 2208101688 C Ii:1:010:6 0:1 544 = deec5347 15235347 e9fa5247 9d0d5647 cdf05247 05335347 a0555447 d7835447
f223e6c0 2208118537 S Ii:1:010:6 -115:1 544 <
f223e6c0 2208164188 C Ii:1:010:6 0:1 544 = e124e247 3c9be247 9697e147 09bce247 f6f0e047 c671e147 3effe147 48c2e247
f223e6c0 2208177248 S Ii:1:010:6 -115:1 544 <
f223e6c0 2208226698 C Ii:1:010:6 0:1 544 = 74a4d647 e705d747 0619d647 eeedd647 47e5d447 9b5ed547 bdf0d547 a7a0d647
f223e6c0 2208243061 S Ii:1:010:6 -115:1 544 <
f223e6c0 2208289196 C Ii:1:010:6 0:1 544 = 19221c47 ccf31a47 44371b47 c1371c47 a13a1947 1ea61847 72c81947 3fae1947
d8a103c0 2208303407 S Ii:1:010:6 -115:1 544 <
d8a103c0 2208351680 C Ii:1:010:6 0:1 544 = 51df4ec7 1b4553c7 793650c7 84854fc7 619251c7 f68e52c7 096651c7 d38153c7
d8a103c0 2208363624 S Ii:1:010:6 -115:1 544 <
d8a103c0 2208414173 C Ii:1:010:6 0:1 544 = 0d95dfc7 6566e2c7 bff2dfc7 4b80dfc7 ed39e0c7 f715e1c7 677ee0c7 6538e2c7
f73766c0 2208420045 S Bo:1:008:2 -115 31 = 55534243 0f550200 00000000 00010600 00000000 00000000 00000000 000000
f73766c0 2208420188 C Bo:1:008:2 0 31 >
f73766c0 2208420213 S Bi:1:008:2 -115 13 <
f73766c0 2208421186 C Bi:1:008:2 0 13 = 55534253 0f550200 00000000 01
f73766c0 2208421208 S Bo:1:008:2 -115 31 = 55534243 10550200 12000000 80010603 00000012 00000000 00000000 000000
f73766c0 2208421299 C Bo:1:008:2 0 31 >
f712a8c0 2208421324 S Bi:1:008:2 -115 18 <
f712a8c0 2208422686 C Bi:1:008:2 0 18 = 70000200 0000000a 00000000 3a000000 0000
f73766c0 2208422739 S Bi:1:008:2 -115 13 <
f73766c0 2208423436 C Bi:1:008:2 0 13 = 55534253 10550200 00000000 00
f73766c0 2208423594 S Bo:1:008:2 -115 31 = 55534243 11550200 00000000 00010600 00000000 00000000 00000000 000000
f73766c0 2208423670 C Bo:1:008:2 0 31 >
f73766c0 2208423691 S Bi:1:008:2 -115 13 <
f73766c0 2208424666 C Bi:1:008:2 0 13 = 55534253 11550200 00000000 01
f73766c0 2208424703 S Bo:1:008:2 -115 31 = 55534243 12550200 12000000 80010603 00000012 00000000 00000000 000000
f73766c0 2208424811 C Bo:1:008:2 0 31 >
f712a8c0 2208424826 S Bi:1:008:2 -115 18 <
f712a8c0 2208426185 C Bi:1:008:2 0 18 = 70000200 0000000a 00000000 3a000000 0000
f73766c0 2208426201 S Bi:1:008:2 -115 13 <
f73766c0 2208426936 C Bi:1:008:2 0 13 = 55534253 12550200 00000000 00
f73766c0 2208426988 S Bo:1:008:2 -115 31 = 55534243 13550200 00000000 0001061e 00000001 00000000 00000000 000000
f73766c0 2208427039 C Bo:1:008:2 0 31 >
f73766c0 2208427062 S Bi:1:008:2 -115 13 <
f73766c0 2208428311 C Bi:1:008:2 0 13 = 55534253 13550200 00000000 01
f73766c0 2208428328 S Bo:1:008:2 -115 31 = 55534243 14550200 12000000 80010603 00000012 00000000 00000000 000000
f73766c0 2208428414 C Bo:1:008:2 0 31 >
f712a8c0 2208428449 S Bi:1:008:2 -115 18 <
f712a8c0 2208429810 C Bi:1:008:2 0 18 = 70000200 0000000a 00000000 3a000000 0000
f73766c0 2208429827 S Bi:1:008:2 -115 13 <
f73766c0 2208430560 C Bi:1:008:2 0 13 = 55534253 14550200 00000000 00
f73766c0 2208430642 S Bo:1:008:2 -115 31 = 55534243 15550200 00000000 0001061e 00000000 00000000 00000000 000000
d8a0cf40 2208430763 S Ii:1:010:6 -115:1 544 <
f73766c0 2208430850 C Bo:1:008:2 0 31 >
f73766c0 2208430861 S Bi:1:008:2 -115 13 <
f73766c0 2208431789 C Bi:1:008:2 0 13 = 55534253 15550200 00000000 01
f73766c0 2208431806 S Bo:1:008:2 -115 31 = 55534243 16550200 12000000 80010603 00000012 00000000 00000000 000000
f73766c0 2208431916 C Bo:1:008:2 0 31 >
f23901c0 2208431924 S Bi:1:008:2 -115 18 <
f23901c0 2208433287 C Bi:1:008:2 0 18 = 70000200 0000000a 00000000 3a000000 0000
f73766c0 2208433297 S Bi:1:008:2 -115 13 <
f73766c0 2208434038 C Bi:1:008:2 0 13 = 55534253 16550200 00000000 00
f73766c0 2208434111 S Bo:1:008:2 -115 31 = 55534243 17550200 00000000 00010600 00000000 00000000 00000000 000000
f73766c0 2208434165 C Bo:1:008:2 0 31 >
f73766c0 2208434172 S Bi:1:008:2 -115 13 <
f73766c0 2208435288 C Bi:1:008:2 0 13 = 55534253 17550200 00000000 01
f73766c0 2208435316 S Bo:1:008:2 -115 31 = 55534243 18550200 12000000 80010603 00000012 00000000 00000000 000000
f73766c0 2208435427 C Bo:1:008:2 0 31 >
f23901c0 2208435435 S Bi:1:008:2 -115 18 <
f23901c0 2208436789 C Bi:1:008:2 0 18 = 70000200 0000000a 00000000 3a000000 0000
f73766c0 2208436816 S Bi:1:008:2 -115 13 <
f73766c0 2208437558 C Bi:1:008:2 0 13 = 55534253 18550200 00000000 00
f73766c0 2208437576 S Bo:1:008:2 -115 31 = 55534243 19550200 00000000 00000600 00000000 00000000 00000000 000000
f73766c0 2208437664 C Bo:1:008:2 0 31 >
f73766c0 2208437674 S Bi:1:008:2 -115 13 <
f73766c0 2208439435 C Bi:1:008:2 0 13 = 55534253 19550200 00000000 01
f73766c0 2208439445 S Bo:1:008:2 -115 31 = 55534243 1a550200 12000000 80000603 00000012 00000000 00000000 000000
f73766c0 2208439538 C Bo:1:008:2 0 31 >
f712a8c0 2208439562 S Bi:1:008:2 -115 18 <
f712a8c0 2208440808 C Bi:1:008:2 0 18 = 70000200 0000000a 00000000 3a000000 0000
f73766c0 2208440816 S Bi:1:008:2 -115 13 <
f73766c0 2208441661 C Bi:1:008:2 0 13 = 55534253 1a550200 00000000 00
f73766c0 2208441729 S Bo:1:008:2 -115 31 = 55534243 1b550200 00000000 00000600 00000000 00000000 00000000 000000
f73766c0 2208441803 C Bo:1:008:2 0 31 >
f73766c0 2208441810 S Bi:1:008:2 -115 13 <
f73766c0 2208442917 C Bi:1:008:2 0 13 = 55534253 1b550200 00000000 01
f73766c0 2208442934 S Bo:1:008:2 -115 31 = 55534243 1c550200 12000000 80000603 00000012 00000000 00000000 000000
f73766c0 2208443054 C Bo:1:008:2 0 31 >
f712a8c0 2208443065 S Bi:1:008:2 -115 18 <
f712a8c0 2208444420 C Bi:1:008:2 0 18 = 70000200 0000000a 00000000 3a000000 0000
f73766c0 2208444450 S Bi:1:008:2 -115 13 <
f73766c0 2208445166 C Bi:1:008:2 0 13 = 55534253 1c550200 00000000 00
f73766c0 2208445223 S Bo:1:008:2 -115 31 = 55534243 1d550200 00000000 0000061e 00000001 00000000 00000000 000000
f73766c0 2208445290 C Bo:1:008:2 0 31 >
f73766c0 2208445300 S Bi:1:008:2 -115 13 <
f73766c0 2208446304 C Bi:1:008:2 0 13 = 55534253 1d550200 00000000 01
f73766c0 2208446319 S Bo:1:008:2 -115 31 = 55534243 1e550200 12000000 80000603 00000012 00000000 00000000 000000
f73766c0 2208446415 C Bo:1:008:2 0 31 >
f712ac40 2208446445 S Bi:1:008:2 -115 18 <
f712ac40 2208447786 C Bi:1:008:2 0 18 = 70000200 0000000a 00000000 3a000000 0000
f73766c0 2208447814 S Bi:1:008:2 -115 13 <
f73766c0 2208448804 C Bi:1:008:2 0 13 = 55534253 1e550200 00000000 00
f73766c0 2208448870 S Bo:1:008:2 -115 31 = 55534243 1f550200 00000000 0000061e 00000000 00000000 00000000 000000
f73766c0 2208448916 C Bo:1:008:2 0 31 >
f73766c0 2208448940 S Bi:1:008:2 -115 13 <
f73766c0 2208450054 C Bi:1:008:2 0 13 = 55534253 1f550200 00000000 01
f73766c0 2208450063 S Bo:1:008:2 -115 31 = 55534243 20550200 12000000 80000603 00000012 00000000 00000000 000000
f73766c0 2208450166 C Bo:1:008:2 0 31 >
f712ac40 2208450193 S Bi:1:008:2 -115 18 <
f712ac40 2208451536 C Bi:1:008:2 0 18 = 70000200 0000000a 00000000 3a000000 0000
f73766c0 2208451566 S Bi:1:008:2 -115 13 <
f73766c0 2208452308 C Bi:1:008:2 0 13 = 55534253 20550200 00000000 00
f73766c0 2208452324 S Bo:1:008:2 -115 31 = 55534243 21550200 00000000 00000600 00000000 00000000 00000000 000000
f73766c0 2208452411 C Bo:1:008:2 0 31 >
f73766c0 2208452433 S Bi:1:008:2 -115 13 <
f73766c0 2208453411 C Bi:1:008:2 0 13 = 55534253 21550200 00000000 01
f73766c0 2208453423 S Bo:1:008:2 -115 31 = 55534243 22550200 12000000 80000603 00000012 00000000 00000000 000000
f73766c0 2208453537 C Bo:1:008:2 0 31 >
d8a103c0 2208453544 S Bi:1:008:2 -115 18 <
d8a103c0 2208455163 C Bi:1:008:2 0 18 = 70000200 0000000a 00000000 3a000000 0000
f73766c0 2208455191 S Bi:1:008:2 -115 13 <
f73766c0 2208455912 C Bi:1:008:2 0 13 = 55534253 22550200 00000000 00
d8a0cf40 2208476686 C Ii:1:010:6 0:1 544 = 9f07d4c7 cf7ad6c7 751ed4c7 8960d3c7 5422d4c7 8cf4d4c7 e45dd4c7 7308d6c7
d8a0cf40 2208490559 S Ii:1:010:6 -115:1 544 <
d8a0cf40 2208539193 C Ii:1:010:6 0:1 544 = ca4017c7 0d9b1ac7 a03e17c7 901f15c7 0f5317c7 cd2018c7 adf916c7 0dcc18c7
d8a0cf40 2208553623 S Ii:1:010:6 -115:1 544 <
d8a0cf40 2208601686 C Ii:1:010:6 0:1 544 = 89e75347 281d5347 1b9a5347 38075647 29ea5247 69365347 52585447 6c865447
d8a0cf40 2208613483 S Ii:1:010:6 -115:1 544 <
d8a0cf40 2208664186 C Ii:1:010:6 0:1 544 = 7326e247 529ce247 a298e147 dad3e247 2ef1e047 9c70e147 2700e247 0cc2e247
d8a0cf40 2208674517 S Ii:1:010:6 -115:1 544 <
d8a0cf40 2208726698 C Ii:1:010:6 0:1 544 = 3e9fd647 8400d747 fc13d647 e8b6d647 26dfd447 6a5bd547 7eead547 ad9ad647
d8a0cf40 2208742595 S Ii:1:010:6 -115:1 544 <
d8a0cf40 2208789173 C Ii:1:010:6 0:1 544 = 732c1c47 31fe1a47 25421b47 8b871b47 1c8f1847 10ae1847 49dc1947 abb61947
d8a0cf40 2208803546 S Ii:1:010:6 -115:1 544 <
d8a0cf40 2208851698 C Ii:1:010:6 0:1 544 = e2de4ec7 7e9e52c7 6c914fc7 bade4ec7 899351c7 928e52c7 d95b51c7 798153c7
d8a0cf40 2208863580 S Ii:1:010:6 -115:1 544 <
d8a0cf40 2208914198 C Ii:1:010:6 0:1 544 = da91dfc7 954be2c7 18d8dfc7 8d64dfc7 5736e0c7 2712e1c7 cb78e0c7 1035e2c7
d8a0cf40 2208921836 S Ii:1:010:6 -115:1 544 <
d8a0cf40 2208976697 C Ii:1:010:6 0:1 544 = 2c0ad4c7 ee7dd6c7 6221d4c7 0c63d3c7 c524d4c7 e8f5d4c7 6f5ed4c7 f50bd6c7
d8a0cf40 2208993554 S Ii:1:010:6 -115:1 544 <
d8a0cf40 2209039180 C Ii:1:010:6 0:1 544 = d33c17c7 0bdb19c7 fc3917c7 ca1a15c7 b34c17c7 311b18c7 36f316c7 d0cf18c7
d8a0cf40 2209049462 S Ii:1:010:6 -115:1 544 <
d8a0cf40 2209101685 C Ii:1:010:6 0:1 544 = 5ef25347 b9cf5347 5aa65347 36125647 e1f45247 30425347 80635447 8d925447
f712ac40 2209114914 S Ii:1:010:6 -115:1 544 <
f712ac40 2209164175 C Ii:1:010:6 0:1 544 = f629e247 f99fe247 9bb4e147 f0d7e247 a3f5e047 2776e147 d205e247 f8c7e247
f712ac40 2209174529 S Ii:1:010:6 -115:1 544 <
f6c62740 2209206060 C Ii:1:007:1 0:8 4 = 01000000
f6c62740 2209206092 S Ii:1:007:1 -115:8 4 <
f712ac40 2209226675 C Ii:1:010:6 0:1 544 = 07a2d647 7c03d747 86e5d547 e9b8d647 7de2d447 4c5bd547 07ebd547 9c9ad647
f712ac40 2209238530 S Ii:1:010:6 -115:1 544 <
f712ac40 2209289187 C Ii:1:010:6 0:1 544 = 891a1c47 57ec1a47 35731a47 e4731b47 6a7b1847 8a9b1847 f3bd1947 8c981947
f712ac40 2209303656 S Ii:1:010:6 -115:1 544 <
f712ac40 2209351685 C Ii:1:010:6 0:1 544 = 3bd34ec7 ab9252c7 ed844fc7 117b4fc7 388851c7 5a7a52c7 da5051c7 be7653c7
f712ac40 2209357512 S Ii:1:010:6 -115:1 544 <
f6c62740 2209406064 C Ii:1:007:1 0:8 4 = 00000000
f6c62740 2209406102 S Ii:1:007:1 -115:8 4 <
f712ac40 2209414175 C Ii:1:010:6 0:1 544 = 8392dfc7 ec4be2c7 10d9dfc7 447ddfc7 b937e0c7 0311e1c7 747ae0c7 0a36e2c7
f712ac40 2209424341 S Co:1:010:0 s 40 b8 0000 0000 0000 0
f712ac40 2209425549 C Co:1:010:0 0 0
f6c62740 2209886075 C Ii:1:007:1 0:8 4 = 00010000
f6c62740 2209886140 S Ii:1:007:1 -115:8 4 <
f6c62740 2209894067 C Ii:1:007:1 0:8 4 = 00010000
f6c62740 2209894114 S Ii:1:007:1 -115:8 4 <
f6c62740 2209902067 C Ii:1:007:1 0:8 4 = 0003fe00
f6c62740 2209902115 S Ii:1:007:1 -115:8 4 <
f6c62740 2209910068 C Ii:1:007:1 0:8 4 = 0004fd00
f6c62740 2209910119 S Ii:1:007:1 -115:8 4 <
f6c62740 2209918067 C Ii:1:007:1 0:8 4 = 0005fd00
f6c62740 2209918116 S Ii:1:007:1 -115:8 4 <
f6c62740 2209926050 C Ii:1:007:1 0:8 4 = 0007fc00
f6c62740 2209926100 S Ii:1:007:1 -115:8 4 <
f6c62740 2209934049 C Ii:1:007:1 0:8 4 = 0008fb00
f6c62740 2209934099 S Ii:1:007:1 -115:8 4 <
f6c62740 2209942051 C Ii:1:007:1 0:8 4 = 0008fc00
f6c62740 2209942103 S Ii:1:007:1 -115:8 4 <
f6c62740 2209950064 C Ii:1:007:1 0:8 4 = 0008fb00
f6c62740 2209950112 S Ii:1:007:1 -115:8 4 <
f6c62740 2209958067 C Ii:1:007:1 0:8 4 = 0008fc00
f6c62740 2209958116 S Ii:1:007:1 -115:8 4 <
f6c62740 2209966064 C Ii:1:007:1 0:8 4 = 0009fb00
f6c62740 2209966113 S Ii:1:007:1 -115:8 4 <
f6c62740 2209974067 C Ii:1:007:1 0:8 4 = 0008fb00
f6c62740 2209974115 S Ii:1:007:1 -115:8 4 <
f6c62740 2209982048 C Ii:1:007:1 0:8 4 = 0008fc00
f6c62740 2209982099 S Ii:1:007:1 -115:8 4 <
f6c62740 2209990065 C Ii:1:007:1 0:8 4 = 0008fb00
f6c62740 2209990114 S Ii:1:007:1 -115:8 4 <
f6c62740 2209998043 C Ii:1:007:1 0:8 4 = 0006fc00
f6c62740 2209998098 S Ii:1:007:1 -115:8 4 <
f6c62740 2210006068 C Ii:1:007:1 0:8 4 = 0007fb00
f6c62740 2210006123 S Ii:1:007:1 -115:8 4 <
f6c62740 2210014067 C Ii:1:007:1 0:8 4 = 0006fc00
f6c62740 2210014117 S Ii:1:007:1 -115:8 4 <
f6c62740 2210022050 C Ii:1:007:1 0:8 4 = 0006fb00
f6c62740 2210022098 S Ii:1:007:1 -115:8 4 <
f6c62740 2210030067 C Ii:1:007:1 0:8 4 = 0006fb00
f6c62740 2210030118 S Ii:1:007:1 -115:8 4 <
f6c62740 2210038066 C Ii:1:007:1 0:8 4 = 0005fa00
f6c62740 2210038115 S Ii:1:007:1 -115:8 4 <
f6c62740 2210046048 C Ii:1:007:1 0:8 4 = 0007fa00
f6c62740 2210046097 S Ii:1:007:1 -115:8 4 <
f6c62740 2210054048 C Ii:1:007:1 0:8 4 = 0006fb00
f6c62740 2210054102 S Ii:1:007:1 -115:8 4 <
f6c62740 2210062049 C Ii:1:007:1 0:8 4 = 0007f900
f6c62740 2210062123 S Ii:1:007:1 -115:8 4 <
f6c62740 2210070039 C Ii:1:007:1 0:8 4 = 0006fa00
f6c62740 2210070071 S Ii:1:007:1 -115:8 4 <
f6c62740 2210078048 C Ii:1:007:1 0:8 4 = 0006fb00
f6c62740 2210078087 S Ii:1:007:1 -115:8 4 <
f6c62740 2210086059 C Ii:1:007:1 0:8 4 = 0004fb00
f6c62740 2210086085 S Ii:1:007:1 -115:8 4 <
f6c62740 2210094059 C Ii:1:007:1 0:8 4 = 0005fc00
f6c62740 2210094085 S Ii:1:007:1 -115:8 4 <
f6c62740 2210102067 C Ii:1:007:1 0:8 4 = 0005fb00
f6c62740 2210102119 S Ii:1:007:1 -115:8 4 <
f6c62740 2210110064 C Ii:1:007:1 0:8 4 = 0005fd00
f6c62740 2210110114 S Ii:1:007:1 -115:8 4 <
f6c62740 2210118050 C Ii:1:007:1 0:8 4 = 0004fd00
f6c62740 2210118100 S Ii:1:007:1 -115:8 4 <
f6c62740 2210126043 C Ii:1:007:1 0:8 4 = 0005fc00
f6c62740 2210126098 S Ii:1:007:1 -115:8 4 <
f6c62740 2210134064 C Ii:1:007:1 0:8 4 = 0004fd00
f6c62740 2210134115 S Ii:1:007:1 -115:8 4 <
f6c62740 2210142065 C Ii:1:007:1 0:8 4 = 0004fe00
f6c62740 2210142113 S Ii:1:007:1 -115:8 4 <
f6c62740 2210150047 C Ii:1:007:1 0:8 4 = 0003fd00
f6c62740 2210150097 S Ii:1:007:1 -115:8 4 <
f6c62740 2210158049 C Ii:1:007:1 0:8 4 = 0003fe00
f6c62740 2210158100 S Ii:1:007:1 -115:8 4 <
f6c62740 2210166066 C Ii:1:007:1 0:8 4 = 0002fe00
f6c62740 2210166116 S Ii:1:007:1 -115:8 4 <
f6c62740 2210174068 C Ii:1:007:1 0:8 4 = 0002ff00
f6c62740 2210174117 S Ii:1:007:1 -115:8 4 <
f6c62740 2210182066 C Ii:1:007:1 0:8 4 = 0001ff00
f6c62740 2210182117 S Ii:1:007:1 -115:8 4 <
f6c62740 2210190049 C Ii:1:007:1 0:8 4 = 00010000
f6c62740 2210190096 S Ii:1:007:1 -115:8 4 <
f6c62740 2210206068 C Ii:1:007:1 0:8 4 = 0000ff00
f6c62740 2210206127 S Ii:1:007:1 -115:8 4 <
f6c62740 2210358072 C Ii:1:007:1 0:8 4 = 00ff0100
f6c62740 2210358143 S Ii:1:007:1 -115:8 4 <
f6c62740 2210366050 C Ii:1:007:1 0:8 4 = 00ff0000
f6c62740 2210366102 S Ii:1:007:1 -115:8 4 <
f6c62740 2210374047 C Ii:1:007:1 0:8 4 = 00fd0300
f6c62740 2210374097 S Ii:1:007:1 -115:8 4 <
f6c62740 2210382070 C Ii:1:007:1 0:8 4 = 00fc0200
f6c62740 2210382118 S Ii:1:007:1 -115:8 4 <
f6c62740 2210390067 C Ii:1:007:1 0:8 4 = 00fc0300
f6c62740 2210390116 S Ii:1:007:1 -115:8 4 <
f6c62740 2210398048 C Ii:1:007:1 0:8 4 = 00fc0300
f6c62740 2210398098 S Ii:1:007:1 -115:8 4 <
f6c62740 2210406066 C Ii:1:007:1 0:8 4 = 00fb0400
f6c62740 2210406120 S Ii:1:007:1 -115:8 4 <
f6c62740 2210414065 C Ii:1:007:1 0:8 4 = 00fb0200
f6c62740 2210414115 S Ii:1:007:1 -115:8 4 <
f73766c0 2210421902 S Bo:1:008:2 -115 31 = 55534243 23550200 00000000 00010600 00000000 00000000 00000000 000000
f73766c0 2210422041 C Bo:1:008:2 0 31 >
f6c62740 2210422053 C Ii:1:007:1 0:8 4 = 00fa0300
f6c62740 2210422104 S Ii:1:007:1 -115:8 4 <
f73766c0 2210422124 S Bi:1:008:2 -115 13 <
f73766c0 2210423040 C Bi:1:008:2 0 13 = 55534253 23550200 00000000 01
f73766c0 2210423142 S Bo:1:008:2 -115 31 = 55534243 24550200 12000000 80010603 00000012 00000000 00000000 000000
f73766c0 2210423290 C Bo:1:008:2 0 31 >
d8a103c0 2210424345 S Bi:1:008:2 -115 18 <
d8a103c0 2210424540 C Bi:1:008:2 0 18 = 70000200 0000000a 00000000 3a000000 0000
f73766c0 2210424596 S Bi:1:008:2 -115 13 <
f73766c0 2210425540 C Bi:1:008:2 0 13 = 55534253 24550200 00000000 00
f73766c0 2210425663 S Bo:1:008:2 -115 31 = 55534243 25550200 00000000 00010600 00000000 00000000 00000000 000000
f73766c0 2210425795 C Bo:1:008:2 0 31 >
f73766c0 2210425813 S Bi:1:008:2 -115 13 <
f73766c0 2210426796 C Bi:1:008:2 0 13 = 55534253 25550200 00000000 01
f73766c0 2210426820 S Bo:1:008:2 -115 31 = 55534243 26550200 12000000 80010603 00000012 00000000 00000000 000000
f73766c0 2210426937 C Bo:1:008:2 0 31 >
d8a103c0 2210426958 S Bi:1:008:2 -115 18 <
d8a103c0 2210428311 C Bi:1:008:2 0 18 = 70000200 0000000a 00000000 3a000000 0000
f73766c0 2210428331 S Bi:1:008:2 -115 13 <
f73766c0 2210429045 C Bi:1:008:2 0 13 = 55534253 26550200 00000000 00
f73766c0 2210429118 S Bo:1:008:2 -115 31 = 55534243 27550200 00000000 0001061e 00000001 00000000 00000000 000000
f73766c0 2210429163 C Bo:1:008:2 0 31 >
f73766c0 2210429181 S Bi:1:008:2 -115 13 <
f6c62740 2210430047 C Ii:1:007:1 0:8 4 = 00fb0300
f6c62740 2210430095 S Ii:1:007:1 -115:8 4 <
f73766c0 2210430291 C Bi:1:008:2 0 13 = 55534253 27550200 00000000 01
f73766c0 2210430307 S Bo:1:008:2 -115 31 = 55534243 28550200 12000000 80010603 00000012 00000000 00000000 000000
f73766c0 2210430417 C Bo:1:008:2 0 31 >
d8a0cf40 2210430454 S Bi:1:008:2 -115 18 <
d8a0cf40 2210431665 C Bi:1:008:2 0 18 = 70000200 0000000a 00000000 3a000000 0000
f73766c0 2210431688 S Bi:1:008:2 -115 13 <
f73766c0 2210432547 C Bi:1:008:2 0 13 = 55534253 28550200 00000000 00
f73766c0 2210432636 S Bo:1:008:2 -115 31 = 55534243 29550200 00000000 0001061e 00000000 00000000 00000000 000000
f73766c0 2210432797 C Bo:1:008:2 0 31 >
f73766c0 2210432819 S Bi:1:008:2 -115 13 <
f73766c0 2210433814 C Bi:1:008:2 0 13 = 55534253 29550200 00000000 01
f73766c0 2210433840 S Bo:1:008:2 -115 31 = 55534243 2a550200 12000000 80010603 00000012 00000000 00000000 000000
f73766c0 2210433921 C Bo:1:008:2 0 31 >
d8a0cf40 2210433940 S Bi:1:008:2 -115 18 <
d8a0cf40 2210435424 C Bi:1:008:2 0 18 = 70000200 0000000a 00000000 3a000000 0000
f73766c0 2210435449 S Bi:1:008:2 -115 13 <
f73766c0 2210436172 C Bi:1:008:2 0 13 = 55534253 2a550200 00000000 00
f73766c0 2210436275 S Bo:1:008:2 -115 31 = 55534243 2b550200 00000000 00010600 00000000 00000000 00000000 000000
f73766c0 2210436422 C Bo:1:008:2 0 31 >
f73766c0 2210436442 S Bi:1:008:2 -115 13 <
f73766c0 2210437421 C Bi:1:008:2 0 13 = 55534253 2b550200 00000000 01
f73766c0 2210437438 S Bo:1:008:2 -115 31 = 55534243 2c550200 12000000 80010603 00000012 00000000 00000000 000000
f73766c0 2210437548 C Bo:1:008:2 0 31 >
f23901c0 2210437569 S Bi:1:008:2 -115 18 <
f6c62740 2210438048 C Ii:1:007:1 0:8 4 = 00fa0400
f6c62740 2210438096 S Ii:1:007:1 -115:8 4 <
f23901c0 2210438915 C Bi:1:008:2 0 18 = 70000200 0000000a 00000000 3a000000 0000
f73766c0 2210438942 S Bi:1:008:2 -115 13 <
f73766c0 2210439672 C Bi:1:008:2 0 13 = 55534253 2c550200 00000000 00
f73766c0 2210439769 S Bo:1:008:2 -115 31 = 55534243 2d550200 00000000 00000600 00000000 00000000 00000000 000000
f73766c0 2210439937 C Bo:1:008:2 0 31 >
f73766c0 2210439975 S Bi:1:008:2 -115 13 <
f73766c0 2210441297 C Bi:1:008:2 0 13 = 55534253 2d550200 00000000 01
f73766c0 2210441316 S Bo:1:008:2 -115 31 = 55534243 2e550200 12000000 80000603 00000012 00000000 00000000 000000
f73766c0 2210441436 C Bo:1:008:2 0 31 >
f712a8c0 2210441452 S Bi:1:008:2 -115 18 <
f712a8c0 2210442812 C Bi:1:008:2 0 18 = 70000200 0000000a 00000000 3a000000 0000
f73766c0 2210442837 S Bi:1:008:2 -115 13 <
f73766c0 2210443687 C Bi:1:008:2 0 13 = 55534253 2e550200 00000000 00
f73766c0 2210443834 S Bo:1:008:2 -115 31 = 55534243 2f550200 00000000 00000600 00000000 00000000 00000000 000000
f73766c0 2210443914 C Bo:1:008:2 0 31 >
f73766c0 2210443952 S Bi:1:008:2 -115 13 <
f73766c0 2210445046 C Bi:1:008:2 0 13 = 55534253 2f550200 00000000 01
f73766c0 2210445068 S Bo:1:008:2 -115 31 = 55534243 30550200 12000000 80000603 00000012 00000000 00000000 000000
f73766c0 2210445186 C Bo:1:008:2 0 31 >
d8a0cf40 2210445212 S Bi:1:008:2 -115 18 <
f6c62740 2210446047 C Ii:1:007:1 0:8 4 = 00fc0300
f6c62740 2210446095 S Ii:1:007:1 -115:8 4 <
d8a0cf40 2210446665 C Bi:1:008:2 0 18 = 70000200 0000000a 00000000 3a000000 0000
f73766c0 2210446710 S Bi:1:008:2 -115 13 <
f73766c0 2210447418 C Bi:1:008:2 0 13 = 55534253 30550200 00000000 00
f73766c0 2210447491 S Bo:1:008:2 -115 31 = 55534243 31550200 00000000 0000061e 00000001 00000000 00000000 000000
f73766c0 2210447540 C Bo:1:008:2 0 31 >
f73766c0 2210447581 S Bi:1:008:2 -115 13 <
f73766c0 2210448689 C Bi:1:008:2 0 13 = 55534253 31550200 00000000 01
f73766c0 2210448714 S Bo:1:008:2 -115 31 = 55534243 32550200 12000000 80000603 00000012 00000000 00000000 000000
f73766c0 2210448797 C Bo:1:008:2 0 31 >
d8a103c0 2210448815 S Bi:1:008:2 -115 18 <
d8a103c0 2210450186 C Bi:1:008:2 0 18 = 70000200 0000000a 00000000 3a000000 0000
f73766c0 2210450212 S Bi:1:008:2 -115 13 <
f73766c0 2210450922 C Bi:1:008:2 0 13 = 55534253 32550200 00000000 00
f73766c0 2210451026 S Bo:1:008:2 -115 31 = 55534243 33550200 00000000 0000061e 00000000 00000000 00000000 000000
f73766c0 2210451187 C Bo:1:008:2 0 31 >
f73766c0 2210451208 S Bi:1:008:2 -115 13 <
f73766c0 2210452186 C Bi:1:008:2 0 13 = 55534253 33550200 00000000 01
f73766c0 2210452209 S Bo:1:008:2 -115 31 = 55534243 34550200 12000000 80000603 00000012 00000000 00000000 000000
f73766c0 2210452297 C Bo:1:008:2 0 31 >
d8a103c0 2210452315 S Bi:1:008:2 -115 18 <
d8a103c0 2210453686 C Bi:1:008:2 0 18 = 70000200 0000000a 00000000 3a000000 0000
f73766c0 2210453708 S Bi:1:008:2 -115 13 <
f6c62740 2210454063 C Ii:1:007:1 0:8 4 = 00fb0400
f6c62740 2210454113 S Ii:1:007:1 -115:8 4 <
f73766c0 2210454415 C Bi:1:008:2 0 13 = 55534253 34550200 00000000 00
f73766c0 2210454454 S Bo:1:008:2 -115 31 = 55534243 35550200 00000000 00000600 00000000 00000000 00000000 000000
f73766c0 2210454541 C Bo:1:008:2 0 31 >
f73766c0 2210454553 S Bi:1:008:2 -115 13 <
f73766c0 2210455791 C Bi:1:008:2 0 13 = 55534253 35550200 00000000 01
f73766c0 2210455817 S Bo:1:008:2 -115 31 = 55534243 36550200 12000000 80000603 00000012 00000000 00000000 000000
f73766c0 2210455921 C Bo:1:008:2 0 31 >
f712a8c0 2210455941 S Bi:1:008:2 -115 18 <
f712a8c0 2210457174 C Bi:1:008:2 0 18 = 70000200 0000000a 00000000 3a000000 0000
f73766c0 2210457201 S Bi:1:008:2 -115 13 <
f73766c0 2210458061 C Bi:1:008:2 0 13 = 55534253 36550200 00000000 00
f6c62740 2210462052 C Ii:1:007:1 0:8 4 = 00fc0300
f6c62740 2210462099 S Ii:1:007:1 -115:8 4 <
f6c62740 2210470070 C Ii:1:007:1 0:8 4 = 00fd0400
f6c62740 2210470117 S Ii:1:007:1 -115:8 4 <
f6c62740 2210478068 C Ii:1:007:1 0:8 4 = 00fd0300
f6c62740 2210478118 S Ii:1:007:1 -115:8 4 <
f6c62740 2210486067 C Ii:1:007:1 0:8 4 = 00fd0400
f6c62740 2210486116 S Ii:1:007:1 -115:8 4 <
f6c62740 2210494065 C Ii:1:007:1 0:8 4 = 00fd0200
f6c62740 2210494116 S Ii:1:007:1 -115:8 4 <
f6c62740 2210502065 C Ii:1:007:1 0:8 4 = 00fe0500
f6c62740 2210502115 S Ii:1:007:1 -115:8 4 <
f6c62740 2210510066 C Ii:1:007:1 0:8 4 = 00fd0400
f6c62740 2210510116 S Ii:1:007:1 -115:8 4 <
f6c62740 2210518066 C Ii:1:007:1 0:8 4 = 00fd0500
f6c62740 2210518113 S Ii:1:007:1 -115:8 4 <
f6c62740 2210526069 C Ii:1:007:1 0:8 4 = 00fc0400
f6c62740 2210526118 S Ii:1:007:1 -115:8 4 <
f6c62740 2210534047 C Ii:1:007:1 0:8 4 = 00fc0500
f6c62740 2210534095 S Ii:1:007:1 -115:8 4 <
f6c62740 2210542066 C Ii:1:007:1 0:8 4 = 00fc0500
f6c62740 2210542117 S Ii:1:007:1 -115:8 4 <
f6c62740 2210550068 C Ii:1:007:1 0:8 4 = 00fc0400
f6c62740 2210550117 S Ii:1:007:1 -115:8 4 <
f6c62740 2210558070 C Ii:1:007:1 0:8 4 = 00fb0400
f6c62740 2210558119 S Ii:1:007:1 -115:8 4 <
f6c62740 2210566066 C Ii:1:007:1 0:8 4 = 00fc0400
f6c62740 2210566114 S Ii:1:007:1 -115:8 4 <
f6c62740 2210574049 C Ii:1:007:1 0:8 4 = 00fc0400
f6c62740 2210574100 S Ii:1:007:1 -115:8 4 <
f6c62740 2210582064 C Ii:1:007:1 0:8 4 = 00fc0400
f6c62740 2210582115 S Ii:1:007:1 -115:8 4 <
f6c62740 2210590067 C Ii:1:007:1 0:8 4 = 00fc0300
f6c62740 2210590117 S Ii:1:007:1 -115:8 4 <
f6c62740 2210598064 C Ii:1:007:1 0:8 4 = 00fd0400
f6c62740 2210598113 S Ii:1:007:1 -115:8 4 <
f6c62740 2210606065 C Ii:1:007:1 0:8 4 = 00fe0300
f6c62740 2210606117 S Ii:1:007:1 -115:8 4 <
f6c62740 2210614049 C Ii:1:007:1 0:8 4 = 00fd0300
f6c62740 2210614100 S Ii:1:007:1 -115:8 4 <
f6c62740 2210622064 C Ii:1:007:1 0:8 4 = 00fe0200
f6c62740 2210622115 S Ii:1:007:1 -115:8 4 <
f6c62740 2210630069 C Ii:1:007:1 0:8 4 = 00fd0300
f6c62740 2210630118 S Ii:1:007:1 -115:8 4 <
f6c62740 2210638066 C Ii:1:007:1 0:8 4 = 00fd0300
f6c62740 2210638113 S Ii:1:007:1 -115:8 4 <
f6c62740 2210646065 C Ii:1:007:1 0:8 4 = 00fd0300
f6c62740 2210646116 S Ii:1:007:1 -115:8 4 <
f6c62740 2210654047 C Ii:1:007:1 0:8 4 = 00fe0300
f6c62740 2210654098 S Ii:1:007:1 -115:8 4 <
f6c62740 2210662067 C Ii:1:007:1 0:8 4 = 00fe0300
f6c62740 2210662117 S Ii:1:007:1 -115:8 4 <
f6c62740 2210670065 C Ii:1:007:1 0:8 4 = 00fd0400
f6c62740 2210670114 S Ii:1:007:1 -115:8 4 <
f6c62740 2210678067 C Ii:1:007:1 0:8 4 = 00fe0300
f6c62740 2210678116 S Ii:1:007:1 -115:8 4 <
f6c62740 2210686066 C Ii:1:007:1 0:8 4 = 00fd0400
f6c62740 2210686114 S Ii:1:007:1 -115:8 4 <
f6c62740 2210694067 C Ii:1:007:1 0:8 4 = 00fe0300
f6c62740 2210694116 S Ii:1:007:1 -115:8 4 <
f6c62740 2210702067 C Ii:1:007:1 0:8 4 = 00fd0300
f6c62740 2210702118 S Ii:1:007:1 -115:8 4 <
f6c62740 2210710067 C Ii:1:007:1 0:8 4 = 00fe0400
f6c62740 2210710117 S Ii:1:007:1 -115:8 4 <
f6c62740 2210718042 C Ii:1:007:1 0:8 4 = 00fd0300
f6c62740 2210718094 S Ii:1:007:1 -115:8 4 <
f6c62740 2210726048 C Ii:1:007:1 0:8 4 = 00fd0300
f6c62740 2210726099 S Ii:1:007:1 -115:8 4 <
f6c62740 2210734047 C Ii:1:007:1 0:8 4 = 00fd0300
f6c62740 2210734098 S Ii:1:007:1 -115:8 4 <
f6c62740 2210742069 C Ii:1:007:1 0:8 4 = 00fd0400
f6c62740 2210742118 S Ii:1:007:1 -115:8 4 <
f6c62740 2210750068 C Ii:1:007:1 0:8 4 = 00fd0300
f6c62740 2210750119 S Ii:1:007:1 -115:8 4 <
f6c62740 2210758067 C Ii:1:007:1 0:8 4 = 00fc0300
f6c62740 2210758115 S Ii:1:007:1 -115:8 4 <
f6c62740 2210766068 C Ii:1:007:1 0:8 4 = 00fd0400
f6c62740 2210766117 S Ii:1:007:1 -115:8 4 <
f6c62740 2210774064 C Ii:1:007:1 0:8 4 = 00fd0300
f6c62740 2210774114 S Ii:1:007:1 -115:8 4 <
f6c62740 2210782065 C Ii:1:007:1 0:8 4 = 00fd0300
f6c62740 2210782116 S Ii:1:007:1 -115:8 4 <
f6c62740 2210790071 C Ii:1:007:1 0:8 4 = 00fd0300
f6c62740 2210790121 S Ii:1:007:1 -115:8 4 <
f6c62740 2210798066 C Ii:1:007:1 0:8 4 = 00fd0300
f6c62740 2210798118 S Ii:1:007:1 -115:8 4 <
f6c62740 2210806051 C Ii:1:007:1 0:8 4 = 00fe0300
f6c62740 2210806105 S Ii:1:007:1 -115:8 4 <
f6c62740 2210814049 C Ii:1:007:1 0:8 4 = 00fe0200
f6c62740 2210814097 S Ii:1:007:1 -115:8 4 <
f6c62740 2210822049 C Ii:1:007:1 0:8 4 = 00fe0200
f6c62740 2210822100 S Ii:1:007:1 -115:8 4 <
f6c62740 2210830048 C Ii:1:007:1 0:8 4 = 00ff0100
f6c62740 2210830100 S Ii:1:007:1 -115:8 4 <
f6c62740 2210838050 C Ii:1:007:1 0:8 4 = 00fe0200
f6c62740 2210838101 S Ii:1:007:1 -115:8 4 <
f6c62740 2210846049 C Ii:1:007:1 0:8 4 = 00000100
f6c62740 2210846097 S Ii:1:007:1 -115:8 4 <
f6c62740 2210854053 C Ii:1:007:1 0:8 4 = 00ff0100
f6c62740 2210854102 S Ii:1:007:1 -115:8 4 <
f6c62740 2210862067 C Ii:1:007:1 0:8 4 = 00ff0100
f6c62740 2210862115 S Ii:1:007:1 -115:8 4 <
f6c62740 2210870049 C Ii:1:007:1 0:8 4 = 00000100
f6c62740 2210870100 S Ii:1:007:1 -115:8 4 <
f6c62740 2210878048 C Ii:1:007:1 0:8 4 = 00ff0100
f6c62740 2210878097 S Ii:1:007:1 -115:8 4 <
f6c62740 2210886044 C Ii:1:007:1 0:8 4 = 00ff0200
f6c62740 2210886095 S Ii:1:007:1 -115:8 4 <
f6c62740 2210894048 C Ii:1:007:1 0:8 4 = 00000100
f6c62740 2210894095 S Ii:1:007:1 -115:8 4 <
f6c62740 2210902064 C Ii:1:007:1 0:8 4 = 00ff0100
f6c62740 2210902113 S Ii:1:007:1 -115:8 4 <
f6c62740 2210910064 C Ii:1:007:1 0:8 4 = 00ff0200
f6c62740 2210910114 S Ii:1:007:1 -115:8 4 <
f6c62740 2210918064 C Ii:1:007:1 0:8 4 = 00ff0100
f6c62740 2210918114 S Ii:1:007:1 -115:8 4 <
f6c62740 2210926067 C Ii:1:007:1 0:8 4 = 00ff0100
f6c62740 2210926116 S Ii:1:007:1 -115:8 4 <
f6c62740 2210934066 C Ii:1:007:1 0:8 4 = 00ff0100
f6c62740 2210934114 S Ii:1:007:1 -115:8 4 <
f6c62740 2210942042 C Ii:1:007:1 0:8 4 = 00ff0100
f6c62740 2210942098 S Ii:1:007:1 -115:8 4 <
f6c62740 2210950066 C Ii:1:007:1 0:8 4 = 00ff0000
f6c62740 2210950114 S Ii:1:007:1 -115:8 4 <
f6c62740 2210958066 C Ii:1:007:1 0:8 4 = 00000100
f6c62740 2210958114 S Ii:1:007:1 -115:8 4 <
f6c62740 2210966068 C Ii:1:007:1 0:8 4 = 00ff0000
f6c62740 2210966116 S Ii:1:007:1 -115:8 4 <
f6c62740 2211150063 C Ii:1:007:1 0:8 4 = 0000ff00
f6c62740 2211150099 S Ii:1:007:1 -115:8 4 <
f6c62740 2211158068 C Ii:1:007:1 0:8 4 = 0000ff00
f6c62740 2211158117 S Ii:1:007:1 -115:8 4 <
f6c62740 2211166053 C Ii:1:007:1 0:8 4 = 00fffd00
f6c62740 2211166103 S Ii:1:007:1 -115:8 4 <
f6c62740 2211174043 C Ii:1:007:1 0:8 4 = 00fffd00
f6c62740 2211174098 S Ii:1:007:1 -115:8 4 <
f6c62740 2211182065 C Ii:1:007:1 0:8 4 = 00fffb00
f6c62740 2211182115 S Ii:1:007:1 -115:8 4 <
f6c62740 2211190066 C Ii:1:007:1 0:8 4 = 00fffc00
f6c62740 2211190116 S Ii:1:007:1 -115:8 4 <
f6c62740 2211198065 C Ii:1:007:1 0:8 4 = 00fffb00
f6c62740 2211198115 S Ii:1:007:1 -115:8 4 <
f6c62740 2211206050 C Ii:1:007:1 0:8 4 = 00fefc00
f6c62740 2211206105 S Ii:1:007:1 -115:8 4 <
f6c62740 2211214047 C Ii:1:007:1 0:8 4 = 00fffb00
f6c62740 2211214098 S Ii:1:007:1 -115:8 4 <
f6c62740 2211222049 C Ii:1:007:1 0:8 4 = 00fffc00
f6c62740 2211222101 S Ii:1:007:1 -115:8 4 <
f6c62740 2211230064 C Ii:1:007:1 0:8 4 = 00fffc00
f6c62740 2211230113 S Ii:1:007:1 -115:8 4 <
f6c62740 2211238042 C Ii:1:007:1 0:8 4 = 00fefd00
f6c62740 2211238096 S Ii:1:007:1 -115:8 4 <
f6c62740 2211246046 C Ii:1:007:1 0:8 4 = 00fffc00
f6c62740 2211246077 S Ii:1:007:1 -115:8 4 <
f6c62740 2211254044 C Ii:1:007:1 0:8 4 = 0000fe00
f6c62740 2211254069 S Ii:1:007:1 -115:8 4 <
f6c62740 2211262048 C Ii:1:007:1 0:8 4 = 00fefe00
f6c62740 2211262100 S Ii:1:007:1 -115:8 4 <
f6c62740 2211270050 C Ii:1:007:1 0:8 4 = 0000fe00
f6c62740 2211270097 S Ii:1:007:1 -115:8 4 <
f6c62740 2211278068 C Ii:1:007:1 0:8 4 = 00fffe00
f6c62740 2211278117 S Ii:1:007:1 -115:8 4 <
f6c62740 2211286067 C Ii:1:007:1 0:8 4 = 0000ff00
f6c62740 2211286115 S Ii:1:007:1 -115:8 4 <
f6c62740 2211294064 C Ii:1:007:1 0:8 4 = 0000fe00
f6c62740 2211294110 S Ii:1:007:1 -115:8 4 <
f6c62740 2211302064 C Ii:1:007:1 0:8 4 = 0000fe00
f6c62740 2211302112 S Ii:1:007:1 -115:8 4 <
f6c62740 2211310042 C Ii:1:007:1 0:8 4 = 0000fe00
f6c62740 2211310090 S Ii:1:007:1 -115:8 4 <
f6c62740 2211318047 C Ii:1:007:1 0:8 4 = 0000ff00
f6c62740 2211318096 S Ii:1:007:1 -115:8 4 <
f6c62740 2211326064 C Ii:1:007:1 0:8 4 = 0000fe00
f6c62740 2211326110 S Ii:1:007:1 -115:8 4 <
f6c62740 2211334047 C Ii:1:007:1 0:8 4 = 0000fe00
f6c62740 2211334096 S Ii:1:007:1 -115:8 4 <
f6c62740 2211342047 C Ii:1:007:1 0:8 4 = 0000ff00
f6c62740 2211342094 S Ii:1:007:1 -115:8 4 <
f6c62740 2211422070 C Ii:1:007:1 0:8 4 = 0000ff00
f6c62740 2211422125 S Ii:1:007:1 -115:8 4 <
f6c62740 2211430067 C Ii:1:007:1 0:8 4 = 0000ff00
f6c62740 2211430113 S Ii:1:007:1 -115:8 4 <
f6c62740 2211446067 C Ii:1:007:1 0:8 4 = 0000ff00
f6c62740 2211446116 S Ii:1:007:1 -115:8 4 <
f6c62740 2211542068 C Ii:1:007:1 0:8 4 = 00010000
f6c62740 2211542118 S Ii:1:007:1 -115:8 4 <
f6c62740 2211550066 C Ii:1:007:1 0:8 4 = 0000ff00
f6c62740 2211550115 S Ii:1:007:1 -115:8 4 <
f6c62740 2211558049 C Ii:1:007:1 0:8 4 = 0000ff00
f6c62740 2211558097 S Ii:1:007:1 -115:8 4 <
f6c62740 2211566065 C Ii:1:007:1 0:8 4 = 0000ff00
f6c62740 2211566111 S Ii:1:007:1 -115:8 4 <
f6c62740 2211574064 C Ii:1:007:1 0:8 4 = 0000ff00
f6c62740 2211574110 S Ii:1:007:1 -115:8 4 <
f6c62740 2211582069 C Ii:1:007:1 0:8 4 = 0000ff00
f6c62740 2211582116 S Ii:1:007:1 -115:8 4 <
f6c62740 2211590067 C Ii:1:007:1 0:8 4 = 0000ff00
f6c62740 2211590114 S Ii:1:007:1 -115:8 4 <
f6c62740 2211598066 C Ii:1:007:1 0:8 4 = 0000ff00
f6c62740 2211598114 S Ii:1:007:1 -115:8 4 <
f6c62740 2211606066 C Ii:1:007:1 0:8 4 = 0000ff00
f6c62740 2211606115 S Ii:1:007:1 -115:8 4 <
f6c62740 2211614044 C Ii:1:007:1 0:8 4 = 00010000
f6c62740 2211614071 S Ii:1:007:1 -115:8 4 <
f6c62740 2211622056 C Ii:1:007:1 0:8 4 = 0000ff00
f6c62740 2211622082 S Ii:1:007:1 -115:8 4 <
f6c62740 2211718068 C Ii:1:007:1 0:8 4 = 01000000
f6c62740 2211718121 S Ii:1:007:1 -115:8 4 <
f6c62740 2211846072 C Ii:1:007:1 0:8 4 = 00000000
f6c62740 2211846137 S Ii:1:007:1 -115:8 4 <
f6c62740 2212182073 C Ii:1:007:1 0:8 4 = 00ff0000
f6c62740 2212182139 S Ii:1:007:1 -115:8 4 <
f6c62740 2212190051 C Ii:1:007:1 0:8 4 = 00fe0000
f6c62740 2212190100 S Ii:1:007:1 -115:8 4 <
f6c62740 2212198048 C Ii:1:007:1 0:8 4 = 00fd0200
f6c62740 2212198098 S Ii:1:007:1 -115:8 4 <
f6c62740 2212206058 C Ii:1:007:1 0:8 4 = 00fb0200
f6c62740 2212206085 S Ii:1:007:1 -115:8 4 <
f6c62740 2212214060 C Ii:1:007:1 0:8 4 = 00fb0300
f6c62740 2212214090 S Ii:1:007:1 -115:8 4 <
f6c62740 2212222056 C Ii:1:007:1 0:8 4 = 00fa0300
f6c62740 2212222083 S Ii:1:007:1 -115:8 4 <
f6c62740 2212230046 C Ii:1:007:1 0:8 4 = 00fa0300
f6c62740 2212230076 S Ii:1:007:1 -115:8 4 <
f6c62740 2212238059 C Ii:1:007:1 0:8 4 = 00fa0400
f6c62740 2212238086 S Ii:1:007:1 -115:8 4 <
f6c62740 2212246057 C Ii:1:007:1 0:8 4 = 00f90300
f6c62740 2212246086 S Ii:1:007:1 -115:8 4 <
f6c62740 2212254043 C Ii:1:007:1 0:8 4 = 00fa0400
f6c62740 2212254070 S Ii:1:007:1 -115:8 4 <
f6c62740 2212262060 C Ii:1:007:1 0:8 4 = 00fa0400
f6c62740 2212262087 S Ii:1:007:1 -115:8 4 <
f6c62740 2212270059 C Ii:1:007:1 0:8 4 = 00fb0400
f6c62740 2212270086 S Ii:1:007:1 -115:8 4 <
f6c62740 2212278059 C Ii:1:007:1 0:8 4 = 00fa0300
f6c62740 2212278087 S Ii:1:007:1 -115:8 4 <
f6c62740 2212286062 C Ii:1:007:1 0:8 4 = 00fa0300
f6c62740 2212286080 S Ii:1:007:1 -115:8 4 <
f6c62740 2212294050 C Ii:1:007:1 0:8 4 = 00fb0300
f6c62740 2212294103 S Ii:1:007:1 -115:8 4 <
f6c62740 2212302048 C Ii:1:007:1 0:8 4 = 00fb0300
f6c62740 2212302099 S Ii:1:007:1 -115:8 4 <
f6c62740 2212310064 C Ii:1:007:1 0:8 4 = 00fb0300
f6c62740 2212310115 S Ii:1:007:1 -115:8 4 <
f6c62740 2212318068 C Ii:1:007:1 0:8 4 = 00fb0300
f6c62740 2212318115 S Ii:1:007:1 -115:8 4 <
f6c62740 2212326065 C Ii:1:007:1 0:8 4 = 00fa0400
f6c62740 2212326114 S Ii:1:007:1 -115:8 4 <
f6c62740 2212334047 C Ii:1:007:1 0:8 4 = 00fa0400
f6c62740 2212334098 S Ii:1:007:1 -115:8 4 <
f6c62740 2212342067 C Ii:1:007:1 0:8 4 = 00fb0400
f6c62740 2212342115 S Ii:1:007:1 -115:8 4 <
f6c62740 2212350043 C Ii:1:007:1 0:8 4 = 00fa0400
f6c62740 2212350098 S Ii:1:007:1 -115:8 4 <
f6c62740 2212358064 C Ii:1:007:1 0:8 4 = 00f90300
f6c62740 2212358113 S Ii:1:007:1 -115:8 4 <
f6c62740 2212366066 C Ii:1:007:1 0:8 4 = 00f90300
f6c62740 2212366115 S Ii:1:007:1 -115:8 4 <
f6c62740 2212374064 C Ii:1:007:1 0:8 4 = 00fa0400
f6c62740 2212374111 S Ii:1:007:1 -115:8 4 <
f6c62740 2212382064 C Ii:1:007:1 0:8 4 = 00f90400
f6c62740 2212382114 S Ii:1:007:1 -115:8 4 <
f6c62740 2212390066 C Ii:1:007:1 0:8 4 = 00fa0400
f6c62740 2212390115 S Ii:1:007:1 -115:8 4 <
f6c62740 2212398042 C Ii:1:007:1 0:8 4 = 00fa0400
f6c62740 2212398093 S Ii:1:007:1 -115:8 4 <
f6c62740 2212406068 C Ii:1:007:1 0:8 4 = 00f90400
f6c62740 2212406117 S Ii:1:007:1 -115:8 4 <
f6c62740 2212414067 C Ii:1:007:1 0:8 4 = 00fc0300
f6c62740 2212414118 S Ii:1:007:1 -115:8 4 <
f73766c0 2212420153 S Bo:1:008:2 -115 31 = 55534243 37550200 00000000 00010600 00000000 00000000 00000000 000000
f73766c0 2212420297 C Bo:1:008:2 0 31 >
f73766c0 2212420319 S Bi:1:008:2 -115 13 <
f73766c0 2212421291 C Bi:1:008:2 0 13 = 55534253 37550200 00000000 01
f73766c0 2212421816 S Bo:1:008:2 -115 31 = 55534243 38550200 12000000 80010603 00000012 00000000 00000000 000000
f73766c0 2212421920 C Bo:1:008:2 0 31 >
f6c62740 2212421929 C Ii:1:007:1 0:8 4 = 00fb0400
f6c62740 2212421978 S Ii:1:007:1 -115:8 4 <
f223ecc0 2212422339 S Bi:1:008:2 -115 18 <
f223ecc0 2212423290 C Bi:1:008:2 0 18 = 70000200 0000000a 00000000 3a000000 0000
f73766c0 2212423313 S Bi:1:008:2 -115 13 <
f73766c0 2212424040 C Bi:1:008:2 0 13 = 55534253 38550200 00000000 00
f73766c0 2212424201 S Bo:1:008:2 -115 31 = 55534243 39550200 00000000 00010600 00000000 00000000 00000000 000000
f73766c0 2212424290 C Bo:1:008:2 0 31 >
f73766c0 2212424325 S Bi:1:008:2 -115 13 <
f73766c0 2212425420 C Bi:1:008:2 0 13 = 55534253 39550200 00000000 01
f73766c0 2212425476 S Bo:1:008:2 -115 31 = 55534243 3a550200 12000000 80010603 00000012 00000000 00000000 000000
f73766c0 2212425546 C Bo:1:008:2 0 31 >
d8a0cf40 2212425567 S Bi:1:008:2 -115 18 <
d8a0cf40 2212426801 C Bi:1:008:2 0 18 = 70000200 0000000a 00000000 3a000000 0000
f73766c0 2212426829 S Bi:1:008:2 -115 13 <
f73766c0 2212427671 C Bi:1:008:2 0 13 = 55534253 3a550200 00000000 00
f73766c0 2212427747 S Bo:1:008:2 -115 31 = 55534243 3b550200 00000000 0001061e 00000001 00000000 00000000 000000
f73766c0 2212427790 C Bo:1:008:2 0 31 >
f73766c0 2212427810 S Bi:1:008:2 -115 13 <
f73766c0 2212428922 C Bi:1:008:2 0 13 = 55534253 3b550200 00000000 01
f73766c0 2212428941 S Bo:1:008:2 -115 31 = 55534243 3c550200 12000000 80010603 00000012 00000000 00000000 000000
f73766c0 2212429062 C Bo:1:008:2 0 31 >
f223ecc0 2212429083 S Bi:1:008:2 -115 18 <
f6c62740 2212430048 C Ii:1:007:1 0:8 4 = 00fc0400
f6c62740 2212430097 S Ii:1:007:1 -115:8 4 <
f223ecc0 2212430417 C Bi:1:008:2 0 18 = 70000200 0000000a 00000000 3a000000 0000
f73766c0 2212430443 S Bi:1:008:2 -115 13 <
f73766c0 2212431171 C Bi:1:008:2 0 13 = 55534253 3c550200 00000000 00
f73766c0 2212431249 S Bo:1:008:2 -115 31 = 55534243 3d550200 00000000 0001061e 00000000 00000000 00000000 000000
f73766c0 2212431291 C Bo:1:008:2 0 31 >
f73766c0 2212431324 S Bi:1:008:2 -115 13 <
f73766c0 2212432548 C Bi:1:008:2 0 13 = 55534253 3d550200 00000000 01
f73766c0 2212432602 S Bo:1:008:2 -115 31 = 55534243 3e550200 12000000 80010603 00000012 00000000 00000000 000000
f73766c0 2212432666 C Bo:1:008:2 0 31 >
f223ecc0 2212432690 S Bi:1:008:2 -115 18 <
f223ecc0 2212434048 C Bi:1:008:2 0 18 = 70000200 0000000a 00000000 3a000000 0000
f73766c0 2212434070 S Bi:1:008:2 -115 13 <
f73766c0 2212434796 C Bi:1:008:2 0 13 = 55534253 3e550200 00000000 00
f73766c0 2212434916 S Bo:1:008:2 -115 31 = 55534243 3f550200 00000000 00010600 00000000 00000000 00000000 000000
f73766c0 2212435062 C Bo:1:008:2 0 31 >
f73766c0 2212435078 S Bi:1:008:2 -115 13 <
f73766c0 2212436062 C Bi:1:008:2 0 13 = 55534253 3f550200 00000000 01
f73766c0 2212436078 S Bo:1:008:2 -115 31 = 55534243 40550200 12000000 80010603 00000012 00000000 00000000 000000
f73766c0 2212436171 C Bo:1:008:2 0 31 >
f712ac40 2212436192 S Bi:1:008:2 -115 18 <
f712ac40 2212437564 C Bi:1:008:2 0 18 = 70000200 0000000a 00000000 3a000000 0000
f73766c0 2212437593 S Bi:1:008:2 -115 13 <
f6c62740 2212438065 C Ii:1:007:1 0:8 4 = 00fb0300
f6c62740 2212438112 S Ii:1:007:1 -115:8 4 <
f73766c0 2212438291 C Bi:1:008:2 0 13 = 55534253 40550200 00000000 00
f73766c0 2212438367 S Bo:1:008:2 -115 31 = 55534243 41550200 00000000 00000600 00000000 00000000 00000000 000000
f73766c0 2212438422 C Bo:1:008:2 0 31 >
f73766c0 2212438443 S Bi:1:008:2 -115 13 <
f73766c0 2212439922 C Bi:1:008:2 0 13 = 55534253 41550200 00000000 01
f73766c0 2212439945 S Bo:1:008:2 -115 31 = 55534243 42550200 12000000 80000603 00000012 00000000 00000000 000000
f73766c0 2212440047 C Bo:1:008:2 0 31 >
f223ecc0 2212440089 S Bi:1:008:2 -115 18 <
f223ecc0 2212441437 C Bi:1:008:2 0 18 = 70000200 0000000a 00000000 3a000000 0000
f73766c0 2212441458 S Bi:1:008:2 -115 13 <
f73766c0 2212442421 C Bi:1:008:2 0 13 = 55534253 42550200 00000000 00
f73766c0 2212442593 S Bo:1:008:2 -115 31 = 55534243 43550200 00000000 00000600 00000000 00000000 00000000 000000
f73766c0 2212442666 C Bo:1:008:2 0 31 >
f73766c0 2212442702 S Bi:1:008:2 -115 13 <
f73766c0 2212443794 C Bi:1:008:2 0 13 = 55534253 43550200 00000000 01
f73766c0 2212443811 S Bo:1:008:2 -115 31 = 55534243 44550200 12000000 80000603 00000012 00000000 00000000 000000
f73766c0 2212443939 C Bo:1:008:2 0 31 >
f712a8c0 2212443957 S Bi:1:008:2 -115 18 <
f712a8c0 2212445188 C Bi:1:008:2 0 18 = 70000200 0000000a 00000000 3a000000 0000
f73766c0 2212445205 S Bi:1:008:2 -115 13 <
f73766c0 2212446065 C Bi:1:008:2 0 13 = 55534253 44550200 00000000 00
f6c62740 2212446075 C Ii:1:007:1 0:8 4 = 00fd0400
f6c62740 2212446121 S Ii:1:007:1 -115:8 4 <
f73766c0 2212446214 S Bo:1:008:2 -115 31 = 55534243 45550200 00000000 0000061e 00000001 00000000 00000000 000000
f73766c0 2212446290 C Bo:1:008:2 0 31 >
f73766c0 2212446310 S Bi:1:008:2 -115 13 <
f73766c0 2212447415 C Bi:1:008:2 0 13 = 55534253 45550200 00000000 01
f73766c0 2212447441 S Bo:1:008:2 -115 31 = 55534243 46550200 12000000 80000603 00000012 00000000 00000000 000000
f73766c0 2212447542 C Bo:1:008:2 0 31 >
d8a103c0 2212447568 S Bi:1:008:2 -115 18 <
d8a103c0 2212448812 C Bi:1:008:2 0 18 = 70000200 0000000a 00000000 3a000000 0000
f73766c0 2212448833 S Bi:1:008:2 -115 13 <
f73766c0 2212449670 C Bi:1:008:2 0 13 = 55534253 46550200 00000000 00
f73766c0 2212449746 S Bo:1:008:2 -115 31 = 55534243 47550200 00000000 0000061e 00000000 00000000 00000000 000000
f73766c0 2212449790 C Bo:1:008:2 0 31 >
f73766c0 2212449811 S Bi:1:008:2 -115 13 <
f73766c0 2212450939 C Bi:1:008:2 0 13 = 55534253 47550200 00000000 01
f73766c0 2212450963 S Bo:1:008:2 -115 31 = 55534243 48550200 12000000 80000603 00000012 00000000 00000000 000000
f73766c0 2212451046 C Bo:1:008:2 0 31 >
f712a8c0 2212451065 S Bi:1:008:2 -115 18 <
f712a8c0 2212452562 C Bi:1:008:2 0 18 = 70000200 0000000a 00000000 3a000000 0000
f73766c0 2212452587 S Bi:1:008:2 -115 13 <
f73766c0 2212453296 C Bi:1:008:2 0 13 = 55534253 48550200 00000000 00
f73766c0 2212453390 S Bo:1:008:2 -115 31 = 55534243 49550200 00000000 00000600 00000000 00000000 00000000 000000
f73766c0 2212453547 C Bo:1:008:2 0 31 >
f73766c0 2212453579 S Bi:1:008:2 -115 13 <
f6c62740 2212454064 C Ii:1:007:1 0:8 4 = 00fc0300
f6c62740 2212454111 S Ii:1:007:1 -115:8 4 <
f73766c0 2212454540 C Bi:1:008:2 0 13 = 55534253 49550200 00000000 01
f73766c0 2212454563 S Bo:1:008:2 -115 31 = 55534243 4a550200 12000000 80000603 00000012 00000000 00000000 000000
f73766c0 2212454674 C Bo:1:008:2 0 31 >
f712a8c0 2212454691 S Bi:1:008:2 -115 18 <
f712a8c0 2212456047 C Bi:1:008:2 0 18 = 70000200 0000000a 00000000 3a000000 0000
f73766c0 2212456068 S Bi:1:008:2 -115 13 <
f73766c0 2212456798 C Bi:1:008:2 0 13 = 55534253 4a550200 00000000 00
f6c62740 2212462070 C Ii:1:007:1 0:8 4 = 00fd0300
f6c62740 2212462119 S Ii:1:007:1 -115:8 4 <
f6c62740 2212470069 C Ii:1:007:1 0:8 4 = 00fd0400
f6c62740 2212470118 S Ii:1:007:1 -115:8 4 <
f6c62740 2212478071 C Ii:1:007:1 0:8 4 = 00fe0200
f6c62740 2212478120 S Ii:1:007:1 -115:8 4 <
f6c62740 2212486066 C Ii:1:007:1 0:8 4 = 00fd0300
f6c62740 2212486116 S Ii:1:007:1 -115:8 4 <
f6c62740 2212494048 C Ii:1:007:1 0:8 4 = 00fe0400
f6c62740 2212494096 S Ii:1:007:1 -115:8 4 <
f6c62740 2212502067 C Ii:1:007:1 0:8 4 = 00fd0300
f6c62740 2212502118 S Ii:1:007:1 -115:8 4 <
f6c62740 2212510067 C Ii:1:007:1 0:8 4 = 00fc0300
f6c62740 2212510117 S Ii:1:007:1 -115:8 4 <
f6c62740 2212518067 C Ii:1:007:1 0:8 4 = 00fe0300
f6c62740 2212518116 S Ii:1:007:1 -115:8 4 <
f6c62740 2212526070 C Ii:1:007:1 0:8 4 = 00fd0300
f6c62740 2212526122 S Ii:1:007:1 -115:8 4 <
f6c62740 2212534047 C Ii:1:007:1 0:8 4 = 00fe0200
f6c62740 2212534098 S Ii:1:007:1 -115:8 4 <
f6c62740 2212542067 C Ii:1:007:1 0:8 4 = 00fe0300
f6c62740 2212542117 S Ii:1:007:1 -115:8 4 <
f6c62740 2212550067 C Ii:1:007:1 0:8 4 = 00fd0300
f6c62740 2212550117 S Ii:1:007:1 -115:8 4 <
f6c62740 2212558067 C Ii:1:007:1 0:8 4 = 00fd0200
f6c62740 2212558116 S Ii:1:007:1 -115:8 4 <
f6c62740 2212566067 C Ii:1:007:1 0:8 4 = 00fd0400
f6c62740 2212566116 S Ii:1:007:1 -115:8 4 <
f6c62740 2212574065 C Ii:1:007:1 0:8 4 = 00fd0300
f6c62740 2212574116 S Ii:1:007:1 -115:8 4 <
f6c62740 2212582067 C Ii:1:007:1 0:8 4 = 00fd0400
f6c62740 2212582117 S Ii:1:007:1 -115:8 4 <
f6c62740 2212590067 C Ii:1:007:1 0:8 4 = 00fd0300
f6c62740 2212590115 S Ii:1:007:1 -115:8 4 <
f6c62740 2212598067 C Ii:1:007:1 0:8 4 = 00fe0300
f6c62740 2212598114 S Ii:1:007:1 -115:8 4 <
f6c62740 2212606043 C Ii:1:007:1 0:8 4 = 00fd0400
f6c62740 2212606096 S Ii:1:007:1 -115:8 4 <
f6c62740 2212614050 C Ii:1:007:1 0:8 4 = 00ff0300
f6c62740 2212614107 S Ii:1:007:1 -115:8 4 <
f6c62740 2212622067 C Ii:1:007:1 0:8 4 = 00fd0200
f6c62740 2212622117 S Ii:1:007:1 -115:8 4 <
f6c62740 2212630068 C Ii:1:007:1 0:8 4 = 00fe0300
f6c62740 2212630116 S Ii:1:007:1 -115:8 4 <
f6c62740 2212638068 C Ii:1:007:1 0:8 4 = 00fe0300
f6c62740 2212638114 S Ii:1:007:1 -115:8 4 <
f6c62740 2212646042 C Ii:1:007:1 0:8 4 = 00fe0300
f6c62740 2212646098 S Ii:1:007:1 -115:8 4 <
f6c62740 2212654064 C Ii:1:007:1 0:8 4 = 00ff0300
f6c62740 2212654117 S Ii:1:007:1 -115:8 4 <
f6c62740 2212662065 C Ii:1:007:1 0:8 4 = 00ff0200
f6c62740 2212662114 S Ii:1:007:1 -115:8 4 <
f6c62740 2212670067 C Ii:1:007:1 0:8 4 = 00fe0200
f6c62740 2212670117 S Ii:1:007:1 -115:8 4 <
f6c62740 2212678067 C Ii:1:007:1 0:8 4 = 00ff0200
f6c62740 2212678116 S Ii:1:007:1 -115:8 4 <
f6c62740 2212686042 C Ii:1:007:1 0:8 4 = 00fe0300
f6c62740 2212686094 S Ii:1:007:1 -115:8 4 <
f6c62740 2212694067 C Ii:1:007:1 0:8 4 = 00ff0200
f6c62740 2212694117 S Ii:1:007:1 -115:8 4 <
f6c62740 2212702066 C Ii:1:007:1 0:8 4 = 00ff0200
f6c62740 2212702115 S Ii:1:007:1 -115:8 4 <
f6c62740 2212710068 C Ii:1:007:1 0:8 4 = 00fe0100
f6c62740 2212710118 S Ii:1:007:1 -115:8 4 <
f6c62740 2212718042 C Ii:1:007:1 0:8 4 = 00ff0200
f6c62740 2212718093 S Ii:1:007:1 -115:8 4 <
f6c62740 2212726049 C Ii:1:007:1 0:8 4 = 00ff0200
f6c62740 2212726102 S Ii:1:007:1 -115:8 4 <
f6c62740 2212734047 C Ii:1:007:1 0:8 4 = 00ff0100
f6c62740 2212734095 S Ii:1:007:1 -115:8 4 <
f6c62740 2212742066 C Ii:1:007:1 0:8 4 = 00ff0100
f6c62740 2212742118 S Ii:1:007:1 -115:8 4 <
f6c62740 2212750067 C Ii:1:007:1 0:8 4 = 00ff0100
f6c62740 2212750115 S Ii:1:007:1 -115:8 4 <
f6c62740 2212926072 C Ii:1:007:1 0:8 4 = 0000ff00
f6c62740 2212926132 S Ii:1:007:1 -115:8 4 <
f6c62740 2212950068 C Ii:1:007:1 0:8 4 = 0000ff00
f6c62740 2212950118 S Ii:1:007:1 -115:8 4 <
f6c62740 2213022052 C Ii:1:007:1 0:8 4 = 01000000
f6c62740 2213022110 S Ii:1:007:1 -115:8 4 <
f6c62740 2213150064 C Ii:1:007:1 0:8 4 = 00000000
f6c62740 2213150103 S Ii:1:007:1 -115:8 4 <
f6c62640 2213348076 C Ii:1:009:1 0:8 8 = 01000000 00000000
f6c62640 2213348169 S Ii:1:009:1 -115:8 8 <
f6c62640 2213492073 C Ii:1:009:1 0:8 8 = 01000600 00000000
f6c62640 2213492161 S Ii:1:009:1 -115:8 8 <
