ec262e40 1749875384 S Co:2:003:0 s 40 c9 0000 0000 0000 0
ec262e40 1749876115 C Co:2:003:0 0 0
ec262e40 1749879818 S Co:2:003:0 s 40 c2 0003 0000 0000 0
ec262e40 1749880996 C Co:2:003:0 0 0
f36dbf40 1751778432 S Co:2:003:0 s 40 b5 0008 0000 0000 0
f36dbf40 1751779619 C Co:2:003:0 0 0
f36dbf40 1751790820 S Co:2:003:0 s 40 f7 0000 0000 0000 0
f36dbf40 1751791989 C Co:2:003:0 0 0
f36dbf40 1751792118 S Ii:2:003:6 -115:1 544 <
f36dbf40 1751845117 C Ii:2:003:6 0:1 476 = 6e62cac4 c5d80ac5 380ce5c4 f562b3c4 f29202c5 b5e407c5 5e52ebc4 ab9f03c5
f36dbf40 1751857221 S Ii:2:003:6 -115:1 544 <
f36dbf40 1751907770 C Ii:2:003:6 0:1 544 = c070e3c5 af84f7c5 a904eac5 dec2ddc5 78c5f1c5 ffeef4c5 79d1ebc5 c4c0f3c5
f36dbf40 1751926710 S Ii:2:003:6 -115:1 544 <
f36dbf40 1751970245 C Ii:2:003:6 0:1 544 = 83dd0ec6 f72019c6 002712c6 220d0cc6 06f815c6 b6a317c6 731313c6 e63317c6
f36dbf40 1751984506 S Ii:2:003:6 -115:1 544 <
f36dbf40 1752032768 C Ii:2:003:6 0:1 544 = 8ac8a6c5 8774bac5 0c64adc5 9f18a1c5 933bb5c5 ab3db8c5 111dafc5 acb9b6c5
f36dbf40 1752039899 S Ii:2:003:6 -115:1 544 <
f36dbf40 1752095257 C Ii:2:003:6 0:1 544 = 1ddbfc44 bebfb444 79e4e144 6f090a45 b95cc144 2ff4b744 864edc44 df00c344
f36dbf40 1752101474 S Ii:2:003:6 -115:1 544 <
f36dbf40 1752157743 C Ii:2:003:6 0:1 544 = c7c80646 ef04fd45 d8600346 67ba0946 6a43fe45 7f83fc45 cacc0246 6c310046
f36dbf40 1752173786 S Ii:2:003:6 -115:1 544 <
f36dbf40 1752220251 C Ii:2:003:6 0:1 544 = fd172446 aa041c46 00aa2046 7f092746 085f1c46 27981b46 8c1d2046 4eb01d46
f36dbf40 1752229965 S Ii:2:003:6 -115:1 544 <
f36dbf40 1752282758 C Ii:2:003:6 0:1 544 = ece7d045 b8ebbf45 7221ca45 e2bfd645 46b8c145 aacfbf45 dddec845 d557c345
f36dbf40 1752295723 S Ii:2:003:6 -115:1 544 <
f36dbf40 1752345246 C Ii:2:003:6 0:1 544 = d55429c4 82349fc4 c3d75ec4 28b9f6c3 12988fc4 8fe899c4 0fec6ac4 93a990c4
f36dbf40 1752355666 S Ii:2:003:6 -115:1 544 <
f36dbf40 1752407747 C Ii:2:003:6 0:1 544 = 1024e3c5 2f41f7c5 b5b6e9c5 627fddc5 0f7af1c5 d7a6f4c5 3a87ebc5 4c7af3c5
f36dbf40 1752415504 S Ii:2:003:6 -115:1 544 <
f36dbf40 1752470259 C Ii:2:003:6 0:1 544 = a90f0fc6 a75419c6 715512c6 47420cc6 eb2816c6 70d217c6 f84213c6 966817c6
f36dbf40 1752482736 S Ii:2:003:6 -115:1 544 <
f36dbf40 1752532768 C Ii:2:003:6 0:1 544 = 99a8a6c5 e052bac5 7c3eadc5 8dfba0c5 151cb5c5 741ab8c5 8ef9aec5 1797b6c5
f36dbf40 1752543278 S Ii:2:003:6 -115:1 544 <
f36dbf40 1752595259 C Ii:2:003:6 0:1 544 = 8474fe44 803ab644 3e8ce344 a0c60a45 e3ebc244 bf87b944 37cbdd44 178cc444
f36dbf40 1752607072 S Ii:2:003:6 -115:1 544 <
f36dbf40 1752657746 C Ii:2:003:6 0:1 544 = 27c70646 e1fbfc45 a15e0346 6eb50946 7340fe45 1581fc45 9ac70246 2e310046
f36dbf40 1752666538 S Ii:2:003:6 -115:1 544 <
f36dbf40 1752720270 C Ii:2:003:6 0:1 544 = b0182446 45031c46 abaa2046 5e0d2746 81621c46 95971b46 b7202046 63b21d46
f36dbf40 1752730713 S Ii:2:003:6 -115:1 544 <
f36dbf40 1752782752 C Ii:2:003:6 0:1 544 = 4db5d145 13b6c045 86e8ca45 588ed745 7a82c245 0d9ac045 a0b1c945 8024c445
f36dbf40 1752799913 S Ii:2:003:6 -115:1 544 <
f36dbf40 1752845259 C Ii:2:003:6 0:1 544 = 456d2ac4 d8c99fc4 eaef5fc4 6135f9c3 1e0690c4 526d9ac4 81c96bc4 2a3b91c4
f36dbf40 1752849187 S Ii:2:003:6 -115:1 544 <
f36dbf40 1752907746 C Ii:2:003:6 0:1 544 = 5f32e3c5 0259f7c5 f5c4e9c5 a696ddc5 077df1c5 57acf4c5 8f89ebc5 967cf3c5
f36dbf40 1752926731 S Ii:2:003:6 -115:1 544 <
f36dbf40 1752970259 C Ii:2:003:6 0:1 544 = aac90ec6 180e19c6 230e12c6 dcfc0bc6 62e315c6 008f17c6 a2fe12c6 522217c6
f36dbf40 1752986688 S Ii:2:003:6 -115:1 544 <
f36dbf40 1753032751 C Ii:2:003:6 0:1 544 = c9e2a6c5 c194bac5 d47badc5 6f3ba1c5 3059b5c5 ab58b8c5 a93aafc5 cfdcb6c5
f36dbf40 1753046732 S Ii:2:003:6 -115:1 544 <
f36dbf40 1753095269 C Ii:2:003:6 0:1 544 = c7eefc44 04a7b444 4e13e244 1b010a45 7c52c144 f2e8b744 464bdc44 9ef8c244
f36dbf40 1753105699 S Ii:2:003:6 -115:1 544 <
f36dbf40 1753157759 C Ii:2:003:6 0:1 544 = 71e40646 7b31fd45 0c7d0346 c5d20946 777efe45 fcb8fc45 ebe50246 3d500046
f36dbf40 1753167278 S Ii:2:003:6 -115:1 544 <
f36dbf40 1753220245 C Ii:2:003:6 0:1 544 = 9c412446 d62d1c46 e8d52046 9a332746 298c1c46 24c11b46 8f4b2046 92db1d46
f36dbf40 1753233879 S Ii:2:003:6 -115:1 544 <
f36dbf40 1753282761 C Ii:2:003:6 0:1 544 = 1e58d145 9d51c045 7587ca45 2226d745 1826c245 083fc045 014dc945 d9cfc345
f36dbf40 1753295762 S Ii:2:003:6 -115:1 544 <
f36dbf40 1753345247 C Ii:2:003:6 0:1 544 = 39e225c4 4a919dc4 30605bc4 d63af0c3 a2e58dc4 c12998c4 e7aa67c4 33f48ec4
f36dbf40 1753357602 S Ii:2:003:6 -115:1 544 <
f36dbf40 1753407740 C Ii:2:003:6 0:1 544 = a9c2e2c5 f6e1f6c5 d456e9c5 7b21ddc5 dd13f1c5 a13ef4c5 981febc5 8414f3c5
f36dbf40 1753417214 S Ii:2:003:6 -115:1 544 <
f36dbf40 1753470257 C Ii:2:003:6 0:1 544 = dcfb0ec6 244019c6 974012c6 1d2f0cc6 5f1216c6 cbc017c6 f82d13c6 735317c6
f36dbf40 1753485689 S Ii:2:003:6 -115:1 544 <
f36dbf40 1753532748 C Ii:2:003:6 0:1 544 = 06d0a6c5 bc7ebac5 a167adc5 562ba1c5 b03db5c5 cf42b8c5 9522afc5 d9bbb6c5
f36dbf40 1753542037 S Ii:2:003:6 -115:1 544 <
f36dbf40 1753595245 C Ii:2:003:6 0:1 544 = 6a57fd44 ab39b544 a7a5e244 f4320a45 4fd5c144 bb68b844 6ee3dc44 6a5ac344
f36dbf40 1753605641 S Ii:2:003:6 -115:1 544 <
f36dbf40 1753657768 C Ii:2:003:6 0:1 544 = efaf0646 51cbfc45 f64a0346 d99e0946 3910fe45 4f54fc45 11b40246 071a0046
f36dbf40 1753669462 S Ii:2:003:6 -115:1 544 <
f36dbf40 1753720245 C Ii:2:003:6 0:1 544 = bf262446 00141c46 4cbf2046 74192746 226f1c46 bda61b46 652e2046 8fbf1d46
f36dbf40 1753735656 S Ii:2:003:6 -115:1 544 <
f36dbf40 1753782758 C Ii:2:003:6 0:1 544 = 52e8d145 7ae4c045 d42acb45 5ebad745 35b9c245 f9c5c045 9adec945 8956c445
f36dbf40 1753793994 S Ii:2:003:6 -115:1 544 <
f36dbf40 1753845241 C Ii:2:003:6 0:1 544 = 12f225c4 cf849dc4 702b5bc4 7964f0c3 e0038ec4 785798c4 d7ed67c4 ef258fc4
f36dbf40 1753862408 S Ii:2:003:6 -115:1 544 <
f36dbf40 1753907746 C Ii:2:003:6 0:1 544 = 24bbe2c5 bbd1f6c5 e03de9c5 2c12ddc5 9b0ef1c5 2640f4c5 bd1cebc5 ff04f3c5
f36dbf40 1753925659 S Ii:2:003:6 -115:1 544 <
f36dbf40 1753970258 C Ii:2:003:6 0:1 544 = 63d90ec6 811b19c6 871912c6 a10a0cc6 1df415c6 c7a017c6 971113c6 403317c6
f36dbf40 1753984135 S Ii:2:003:6 -115:1 544 <
f36dbf40 1754032746 C Ii:2:003:6 0:1 544 = 2bf2a6c5 b4a5bac5 4c84adc5 6d4da1c5 a36ab5c5 5467b8c5 7a4eafc5 86ebb6c5
f36dbf40 1754038734 S Ii:2:003:6 -115:1 544 <
f36dbf40 1754095274 C Ii:2:003:6 0:1 544 = 51abfd44 0675b544 5eeae244 cf540a45 e20ec244 89b4b844 8dffdc44 aebdc344
f36dbf40 1754107344 S Ii:2:003:6 -115:1 544 <
f36dbf40 1754157742 C Ii:2:003:6 0:1 544 = 80e20646 4a34fd45 d57f0346 8cd20946 9370fe45 d1b0fc45 e9e10246 6d4c0046
f36dbf40 1754167231 S Ii:2:003:6 -115:1 544 <
f36dbf40 1754220270 C Ii:2:003:6 0:1 544 = 4e192446 96051c46 30b12046 a20a2746 a5641c46 98961b46 c01e2046 67b31d46
ef1984c0 1754230853 S Ii:2:003:6 -115:1 544 <
ef1984c0 1754282772 C Ii:2:003:6 0:1 544 = 8fa2d145 859bc045 86daca45 d779d745 a86dc245 2879c045 8f8ec945 8910c445
ef1984c0 1754294631 S Ii:2:003:6 -115:1 544 <
ef1984c0 1754345261 C Ii:2:003:6 0:1 544 = 965d24c4 6ee29cc4 25d459c4 b793edc3 99378dc4 53b197c4 4b5566c4 405f8ec4
ef1984c0 1754359744 S Ii:2:003:6 -115:1 544 <
ef1984c0 1754407760 C Ii:2:003:6 0:1 544 = 00bfe2c5 3be0f6c5 064de9c5 e01dddc5 6314f1c5 1d4cf4c5 7a29ebc5 b418f3c5
ef1984c0 1754417822 S Co:2:003:0 s 40 b8 0000 0000 0000 0
ef1984c0 1754419012 C Co:2:003:0 0 0
