f72973c0 1411091939 C Ii:1:007:1 0:8 4 = 0000ff00
f72973c0 1411091973 S Ii:1:007:1 -115:8 4 <
f72973c0 1411099956 C Ii:1:007:1 0:8 4 = 0000ff00
f72973c0 1411099985 S Ii:1:007:1 -115:8 4 <
f72973c0 1411107938 C Ii:1:007:1 0:8 4 = 0000ff00
f72973c0 1411107968 S Ii:1:007:1 -115:8 4 <
f72973c0 1411115936 C Ii:1:007:1 0:8 4 = 0000ff00
f72973c0 1411115965 S Ii:1:007:1 -115:8 4 <
f72973c0 1411123938 C Ii:1:007:1 0:8 4 = 00010000
f72973c0 1411123970 S Ii:1:007:1 -115:8 4 <
f72973c0 1411131941 C Ii:1:007:1 0:8 4 = 0000ff00
f72973c0 1411131969 S Ii:1:007:1 -115:8 4 <
f72973c0 1411139943 C Ii:1:007:1 0:8 4 = 0000ff00
f72973c0 1411139971 S Ii:1:007:1 -115:8 4 <
f72973c0 1411147942 C Ii:1:007:1 0:8 4 = 0000ff00
f72973c0 1411147970 S Ii:1:007:1 -115:8 4 <
f72973c0 1411155958 C Ii:1:007:1 0:8 4 = 0001fe00
f72973c0 1411155979 S Ii:1:007:1 -115:8 4 <
f72973c0 1411163954 C Ii:1:007:1 0:8 4 = 0000ff00
f72973c0 1411163982 S Ii:1:007:1 -115:8 4 <
f72305c0 1411169942 C Ii:1:009:1 0:8 8 = 00000000 00000000
f72305c0 1411169987 S Ii:1:009:1 -115:8 8 <
f72973c0 1411171941 C Ii:1:007:1 0:8 4 = 0001fe00
f72973c0 1411171968 S Ii:1:007:1 -115:8 4 <
f72973c0 1411179941 C Ii:1:007:1 0:8 4 = 0000ff00
f72973c0 1411179968 S Ii:1:007:1 -115:8 4 <
f72973c0 1411187938 C Ii:1:007:1 0:8 4 = 0000ff00
f72973c0 1411187969 S Ii:1:007:1 -115:8 4 <
f72973c0 1411195962 C Ii:1:007:1 0:8 4 = 0000ff00
f72973c0 1411196011 S Ii:1:007:1 -115:8 4 <
f72973c0 1411203940 C Ii:1:007:1 0:8 4 = 00010000
f72973c0 1411203992 S Ii:1:007:1 -115:8 4 <
f72973c0 1411211943 C Ii:1:007:1 0:8 4 = 0000ff00
f72973c0 1411211972 S Ii:1:007:1 -115:8 4 <
f72973c0 1411219937 C Ii:1:007:1 0:8 4 = 0000ff00
f72973c0 1411219965 S Ii:1:007:1 -115:8 4 <
f72973c0 1411235938 C Ii:1:007:1 0:8 4 = 00010000
f72973c0 1411235969 S Ii:1:007:1 -115:8 4 <
f72973c0 1411243954 C Ii:1:007:1 0:8 4 = 0000ff00
f72973c0 1411243981 S Ii:1:007:1 -115:8 4 <
f72973c0 1411259955 C Ii:1:007:1 0:8 4 = 00010000
f72973c0 1411259981 S Ii:1:007:1 -115:8 4 <
f72973c0 1411267945 C Ii:1:007:1 0:8 4 = 0000ff00
f72973c0 1411267975 S Ii:1:007:1 -115:8 4 <
f72f3140 1411413476 S Bo:1:008:2 -115 31 = 55534243 cb680000 00000000 00000600 00000000 00000000 00000000 000000
f72f3140 1411413566 C Bo:1:008:2 0 31 >
f72f3140 1411413604 S Bi:1:008:2 -115 13 <
f72f3140 1411415060 C Bi:1:008:2 0 13 = 55534253 cb680000 00000000 01
f72f3140 1411415090 S Bo:1:008:2 -115 31 = 55534243 cc680000 12000000 80000603 00000012 00000000 00000000 000000
f72f3140 1411415202 C Bo:1:008:2 0 31 >
f6e2c240 1411415214 S Bi:1:008:2 -115 18 <
f6e2c240 1411416560 C Bi:1:008:2 0 18 = 70000200 0000000a 00000000 3a000000 0000
f72f3140 1411416588 S Bi:1:008:2 -115 13 <
f72f3140 1411417314 C Bi:1:008:2 0 13 = 55534253 cc680000 00000000 00
f72f3140 1411417379 S Bo:1:008:2 -115 31 = 55534243 cd680000 00000000 00000600 00000000 00000000 00000000 000000
f72f3140 1411417435 C Bo:1:008:2 0 31 >
f72f3140 1411417449 S Bi:1:008:2 -115 13 <
f72f3140 1411418560 C Bi:1:008:2 0 13 = 55534253 cd680000 00000000 01
f72f3140 1411418576 S Bo:1:008:2 -115 31 = 55534243 ce680000 12000000 80000603 00000012 00000000 00000000 000000
f72f3140 1411418688 C Bo:1:008:2 0 31 >
f6e2c240 1411418701 S Bi:1:008:2 -115 18 <
f6e2c240 1411420065 C Bi:1:008:2 0 18 = 70000200 0000000a 00000000 3a000000 0000
f72f3140 1411420079 S Bi:1:008:2 -115 13 <
f72f3140 1411420939 C Bi:1:008:2 0 13 = 55534253 ce680000 00000000 00
f72f3140 1411421011 S Bo:1:008:2 -115 31 = 55534243 cf680000 00000000 0000061e 00000001 00000000 00000000 000000
f72f3140 1411421081 C Bo:1:008:2 0 31 >
f72f3140 1411421095 S Bi:1:008:2 -115 13 <
f72f3140 1411422186 C Bi:1:008:2 0 13 = 55534253 cf680000 00000000 01
f72f3140 1411422198 S Bo:1:008:2 -115 31 = 55534243 d0680000 12000000 80000603 00000012 00000000 00000000 000000
f72f3140 1411422314 C Bo:1:008:2 0 31 >
f6e2c340 1411422328 S Bi:1:008:2 -115 18 <
f6e2c340 1411423685 C Bi:1:008:2 0 18 = 70000200 0000000a 00000000 3a000000 0000
f72f3140 1411423700 S Bi:1:008:2 -115 13 <
f72f3140 1411424438 C Bi:1:008:2 0 13 = 55534253 d0680000 00000000 00
f72f3140 1411424472 S Bo:1:008:2 -115 31 = 55534243 d1680000 00000000 0000061e 00000000 00000000 00000000 000000
f72f3140 1411424560 C Bo:1:008:2 0 31 >
f72f3140 1411424579 S Bi:1:008:2 -115 13 <
f72f3140 1411425560 C Bi:1:008:2 0 13 = 55534253 d1680000 00000000 01
f72f3140 1411425590 S Bo:1:008:2 -115 31 = 55534243 d2680000 12000000 80000603 00000012 00000000 00000000 000000
f72f3140 1411425688 C Bo:1:008:2 0 31 >
ee4d2140 1411425701 S Bi:1:008:2 -115 18 <
ee4d2140 1411427061 C Bi:1:008:2 0 18 = 70000200 0000000a 00000000 3a000000 0000
f72f3140 1411427075 S Bi:1:008:2 -115 13 <
f72f3140 1411427934 C Bi:1:008:2 0 13 = 55534253 d2680000 00000000 00
f72f3140 1411428014 S Bo:1:008:2 -115 31 = 55534243 d3680000 00000000 00000600 00000000 00000000 00000000 000000
f72f3140 1411428065 C Bo:1:008:2 0 31 >
f72f3140 1411428077 S Bi:1:008:2 -115 13 <
f72f3140 1411429190 C Bi:1:008:2 0 13 = 55534253 d3680000 00000000 01
f72f3140 1411429204 S Bo:1:008:2 -115 31 = 55534243 d4680000 12000000 80000603 00000012 00000000 00000000 000000
f72f3140 1411429315 C Bo:1:008:2 0 31 >
ee4d2140 1411429325 S Bi:1:008:2 -115 18 <
ee4d2140 1411430810 C Bi:1:008:2 0 18 = 70000200 0000000a 00000000 3a000000 0000
f72f3140 1411430911 S Bi:1:008:2 -115 13 <
f72f3140 1411431560 C Bi:1:008:2 0 13 = 55534253 d4680000 00000000 00
f72f3140 1411431652 S Bo:1:008:2 -115 31 = 55534243 d5680000 00000000 00010600 00000000 00000000 00000000 000000
f72f3140 1411431689 C Bo:1:008:2 0 31 >
f72f3140 1411431738 S Bi:1:008:2 -115 13 <
f72f3140 1411433315 C Bi:1:008:2 0 13 = 55534253 d5680000 00000000 01
f72f3140 1411433332 S Bo:1:008:2 -115 31 = 55534243 d6680000 12000000 80010603 00000012 00000000 00000000 000000
f72f3140 1411433440 C Bo:1:008:2 0 31 >
f6e2c0c0 1411433452 S Bi:1:008:2 -115 18 <
f6e2c0c0 1411434685 C Bi:1:008:2 0 18 = 70000200 0000000a 00000000 3a000000 0000
f72f3140 1411434700 S Bi:1:008:2 -115 13 <
f72f3140 1411435560 C Bi:1:008:2 0 13 = 55534253 d6680000 00000000 00
f72f3140 1411435607 S Bo:1:008:2 -115 31 = 55534243 d7680000 00000000 00010600 00000000 00000000 00000000 000000
f72f3140 1411435688 C Bo:1:008:2 0 31 >
f72f3140 1411435698 S Bi:1:008:2 -115 13 <
f72f3140 1411436686 C Bi:1:008:2 0 13 = 55534253 d7680000 00000000 01
f72f3140 1411436699 S Bo:1:008:2 -115 31 = 55534243 d8680000 12000000 80010603 00000012 00000000 00000000 000000
f72f3140 1411436813 C Bo:1:008:2 0 31 >
f6e2c0c0 1411436822 S Bi:1:008:2 -115 18 <
f6e2c0c0 1411438188 C Bi:1:008:2 0 18 = 70000200 0000000a 00000000 3a000000 0000
f72f3140 1411438197 S Bi:1:008:2 -115 13 <
f72f3140 1411438935 C Bi:1:008:2 0 13 = 55534253 d8680000 00000000 00
f72f3140 1411438978 S Bo:1:008:2 -115 31 = 55534243 d9680000 00000000 0001061e 00000001 00000000 00000000 000000
f72f3140 1411439064 C Bo:1:008:2 0 31 >
f72f3140 1411439073 S Bi:1:008:2 -115 13 <
f72f3140 1411440327 C Bi:1:008:2 0 13 = 55534253 d9680000 00000000 01
f72f3140 1411440338 S Bo:1:008:2 -115 31 = 55534243 da680000 12000000 80010603 00000012 00000000 00000000 000000
f72f3140 1411440435 C Bo:1:008:2 0 31 >
f6e2c0c0 1411440462 S Bi:1:008:2 -115 18 <
f6e2c0c0 1411441685 C Bi:1:008:2 0 18 = 70000200 0000000a 00000000 3a000000 0000
f72f3140 1411441713 S Bi:1:008:2 -115 13 <
f72f3140 1411442560 C Bi:1:008:2 0 13 = 55534253 da680000 00000000 00
f72f3140 1411442609 S Bo:1:008:2 -115 31 = 55534243 db680000 00000000 0001061e 00000000 00000000 00000000 000000
f72f3140 1411442688 C Bo:1:008:2 0 31 >
f72f3140 1411442698 S Bi:1:008:2 -115 13 <
f72f3140 1411443701 C Bi:1:008:2 0 13 = 55534253 db680000 00000000 01
f72f3140 1411443715 S Bo:1:008:2 -115 31 = 55534243 dc680000 12000000 80010603 00000012 00000000 00000000 000000
f72f3140 1411443810 C Bo:1:008:2 0 31 >
f23e7840 1411443839 S Bi:1:008:2 -115 18 <
f23e7840 1411445205 C Bi:1:008:2 0 18 = 70000200 0000000a 00000000 3a000000 0000
f72f3140 1411445288 S Bi:1:008:2 -115 13 <
f72f3140 1411446060 C Bi:1:008:2 0 13 = 55534253 dc680000 00000000 00
f72f3140 1411446106 S Bo:1:008:2 -115 31 = 55534243 dd680000 00000000 00010600 00000000 00000000 00000000 000000
f72f3140 1411446185 C Bo:1:008:2 0 31 >
f72f3140 1411446213 S Bi:1:008:2 -115 13 <
f72f3140 1411447204 C Bi:1:008:2 0 13 = 55534253 dd680000 00000000 01
f72f3140 1411447213 S Bo:1:008:2 -115 31 = 55534243 de680000 12000000 80010603 00000012 00000000 00000000 000000
f72f3140 1411447310 C Bo:1:008:2 0 31 >
f23e7840 1411447333 S Bi:1:008:2 -115 18 <
f23e7840 1411448954 C Bi:1:008:2 0 18 = 70000200 0000000a 00000000 3a000000 0000
f72f3140 1411448967 S Bi:1:008:2 -115 13 <
f72f3140 1411449704 C Bi:1:008:2 0 13 = 55534253 de680000 00000000 00
f72973c0 1411747943 C Ii:1:007:1 0:8 4 = 01000000
f72973c0 1411747984 S Ii:1:007:1 -115:8 4 <
f72973c0 1411835946 C Ii:1:007:1 0:8 4 = 00000000
f72973c0 1411835986 S Ii:1:007:1 -115:8 4 <
f72973c0 1411947947 C Ii:1:007:1 0:8 4 = 01000000
f72973c0 1411948018 S Ii:1:007:1 -115:8 4 <
f72973c0 1412019945 C Ii:1:007:1 0:8 4 = 00000000
f72973c0 1412019984 S Ii:1:007:1 -115:8 4 <
f6e2c340 1412170178 S Ci:1:010:0 s c0 d2 0000 0000 0100 256 <
f6e2c340 1412178693 C Ci:1:010:0 0 256 = 2d2d2d2d 2d2d2d2d 0d0a2056 332e300d 0a20534e 3a55422d 32303039 2e31302e
f6e2c340 1412182647 S Ci:1:010:0 s c0 d2 0000 0000 0100 256 <
f6e2c340 1412191186 C Ci:1:010:0 0 256 = 2d2d2d2d 2d2d2d2d 0d0a2056 332e300d 0a20534e 3a55422d 32303039 2e31302e
f6e2c340 1412193777 S Ci:1:010:0 s 80 06 0100 0000 0012 18 <
f6e2c340 1412193936 C Ci:1:010:0 0 18 = 12010002 ff000040 3c150100 00000102 0001
f6e2c340 1412196671 S Ci:1:010:0 s c0 d2 0000 0000 0100 256 <
f6e2c340 1412205203 C Ci:1:010:0 0 256 = 2d2d2d2d 2d2d2d2d 0d0a2056 332e300d 0a20534e 3a55422d 32303039 2e31302e
f6e2c340 1412211196 S Ci:1:010:0 s c0 d2 0000 0000 0100 256 <
f6e2c340 1412219687 C Ci:1:010:0 0 256 = 2d2d2d2d 2d2d2d2d 0d0a2056 332e300d 0a20534e 3a55422d 32303039 2e31302e
f23e7940 1412223065 S Ci:1:010:0 s c0 d2 0000 0000 0100 256 <
f23e7940 1412231565 C Ci:1:010:0 0 256 = 2d2d2d2d 2d2d2d2d 0d0a2056 332e300d 0a20534e 3a55422d 32303039 2e31302e
f23e7940 1412235075 S Ci:1:010:0 s 80 06 0100 0000 0012 18 <
f23e7940 1412235203 C Ci:1:010:0 0 18 = 12010002 ff000040 3c150100 00000102 0001
f23e7940 1412275326 S Ci:1:010:0 s c0 d2 0000 0000 0100 256 <
f23e7940 1412283832 C Ci:1:010:0 0 256 = 2d2d2d2d 2d2d2d2d 0d0a2056 332e300d 0a20534e 3a55422d 32303039 2e31302e
f23e7940 1412287347 S Ci:1:010:0 s c0 d2 0000 0000 0100 256 <
f23e7940 1412295828 C Ci:1:010:0 0 256 = 2d2d2d2d 2d2d2d2d 0d0a2056 332e300d 0a20534e 3a55422d 32303039 2e31302e
f23e7940 1412299307 S Ci:1:010:0 s 80 06 0100 0000 0012 18 <
f23e7940 1412299436 C Ci:1:010:0 0 18 = 12010002 ff000040 3c150100 00000102 0001
f23e7940 1412341988 S Ci:1:010:0 s c0 d2 0000 0000 0100 256 <
f23e7940 1412350566 C Ci:1:010:0 0 256 = 2d2d2d2d 2d2d2d2d 0d0a2056 332e300d 0a20534e 3a55422d 32303039 2e31302e
f6e2c5c0 1412353849 S Ci:1:010:0 s c0 d2 0000 0000 0100 256 <
f6e2c5c0 1412362312 C Ci:1:010:0 0 256 = 2d2d2d2d 2d2d2d2d 0d0a2056 332e300d 0a20534e 3a55422d 32303039 2e31302e
f6e2c5c0 1412365844 S Ci:1:010:0 s 80 06 0100 0000 0012 18 <
f6e2c5c0 1412365936 C Ci:1:010:0 0 18 = 12010002 ff000040 3c150100 00000102 0001
f23e7940 1412408792 S Ci:1:010:0 s c0 d2 0000 0000 0100 256 <
f23e7940 1412417312 C Ci:1:010:0 0 256 = 2d2d2d2d 2d2d2d2d 0d0a2056 332e300d 0a20534e 3a55422d 32303039 2e31302e
f23e7940 1412420871 S Ci:1:010:0 s c0 d2 0000 0000 0100 256 <
f23e7940 1412429453 C Ci:1:010:0 0 256 = 2d2d2d2d 2d2d2d2d 0d0a2056 332e300d 0a20534e 3a55422d 32303039 2e31302e
f6e2c5c0 1412434696 S Ci:1:010:0 s 80 06 0100 0000 0012 18 <
f6e2c5c0 1412434824 C Ci:1:010:0 0 18 = 12010002 ff000040 3c150100 00000102 0001
f6e2c5c0 1412475852 S Ci:1:010:0 s c0 d2 0000 0000 0100 256 <
f6e2c5c0 1412484313 C Ci:1:010:0 0 256 = 2d2d2d2d 2d2d2d2d 0d0a2056 332e300d 0a20534e 3a55422d 32303039 2e31302e
f23e7940 1412487755 S Ci:1:010:0 s c0 d2 0000 0000 0100 256 <
f23e7940 1412496313 C Ci:1:010:0 0 256 = 2d2d2d2d 2d2d2d2d 0d0a2056 332e300d 0a20534e 3a55422d 32303039 2e31302e
f6e2c340 1412501589 S Ci:1:010:0 s 80 06 0100 0000 0012 18 <
f6e2c340 1412501689 C Ci:1:010:0 0 18 = 12010002 ff000040 3c150100 00000102 0001
f6e2c340 1412542426 S Ci:1:010:0 s c0 d2 0000 0000 0100 256 <
f6e2c340 1412550939 C Ci:1:010:0 0 256 = 2d2d2d2d 2d2d2d2d 0d0a2056 332e300d 0a20534e 3a55422d 32303039 2e31302e
f6e2c340 1412554446 S Ci:1:010:0 s c0 d2 0000 0000 0100 256 <
f6e2c340 1412562936 C Ci:1:010:0 0 256 = 2d2d2d2d 2d2d2d2d 0d0a2056 332e300d 0a20534e 3a55422d 32303039 2e31302e
f6e2c340 1412566522 S Ci:1:010:0 s 80 06 0100 0000 0012 18 <
f6e2c340 1412566686 C Ci:1:010:0 0 18 = 12010002 ff000040 3c150100 00000102 0001
f6e2c340 1412608421 S Ci:1:010:0 s c0 d2 0000 0000 0100 256 <
f6e2c340 1412616944 C Ci:1:010:0 0 256 = 2d2d2d2d 2d2d2d2d 0d0a2056 332e300d 0a20534e 3a55422d 32303039 2e31302e
f6e2c340 1412619620 S Ci:1:010:0 s c0 d2 0000 0000 0100 256 <
f6e2c340 1412628066 C Ci:1:010:0 0 256 = 2d2d2d2d 2d2d2d2d 0d0a2056 332e300d 0a20534e 3a55422d 32303039 2e31302e
f6e2c340 1412631620 S Ci:1:010:0 s 80 06 0100 0000 0012 18 <
f6e2c340 1412631685 C Ci:1:010:0 0 18 = 12010002 ff000040 3c150100 00000102 0001
f6e2c340 1412674027 S Ci:1:010:0 s c0 d2 0000 0000 0100 256 <
f6e2c340 1412682580 C Ci:1:010:0 0 256 = 2d2d2d2d 2d2d2d2d 0d0a2056 332e300d 0a20534e 3a55422d 32303039 2e31302e
f6e2c340 1412686046 S Ci:1:010:0 s c0 d2 0000 0000 0100 256 <
f6e2c340 1412694689 C Ci:1:010:0 0 256 = 2d2d2d2d 2d2d2d2d 0d0a2056 332e300d 0a20534e 3a55422d 32303039 2e31302e
f6e2c340 1412698032 S Ci:1:010:0 s 80 06 0100 0000 0012 18 <
f6e2c340 1412698186 C Ci:1:010:0 0 18 = 12010002 ff000040 3c150100 00000102 0001
f6e2c340 1412740545 S Ci:1:010:0 s c0 d2 0000 0000 0100 256 <
f6e2c340 1412749061 C Ci:1:010:0 0 256 = 2d2d2d2d 2d2d2d2d 0d0a2056 332e300d 0a20534e 3a55422d 32303039 2e31302e
f6e2c340 1412752509 S Ci:1:010:0 s c0 d2 0000 0000 0100 256 <
f6e2c340 1412760936 C Ci:1:010:0 0 256 = 2d2d2d2d 2d2d2d2d 0d0a2056 332e300d 0a20534e 3a55422d 32303039 2e31302e
f6e2c340 1412764490 S Ci:1:010:0 s 80 06 0100 0000 0012 18 <
f6e2c340 1412764565 C Ci:1:010:0 0 18 = 12010002 ff000040 3c150100 00000102 0001
f72973c0 1413147949 C Ii:1:007:1 0:8 4 = 00010000
f72973c0 1413147986 S Ii:1:007:1 -115:8 4 <
f72973c0 1413155957 C Ii:1:007:1 0:8 4 = 00000100
f72973c0 1413155977 S Ii:1:007:1 -115:8 4 <
f72973c0 1413163943 C Ii:1:007:1 0:8 4 = 00020400
f72973c0 1413163974 S Ii:1:007:1 -115:8 4 <
f72973c0 1413171936 C Ii:1:007:1 0:8 4 = 00020400
f72973c0 1413171955 S Ii:1:007:1 -115:8 4 <
f72973c0 1413179942 C Ii:1:007:1 0:8 4 = 00030500
f72973c0 1413179972 S Ii:1:007:1 -115:8 4 <
f72973c0 1413187945 C Ii:1:007:1 0:8 4 = 00020400
f72973c0 1413187975 S Ii:1:007:1 -115:8 4 <
f72973c0 1413195938 C Ii:1:007:1 0:8 4 = 00020500
f72973c0 1413195970 S Ii:1:007:1 -115:8 4 <
f72973c0 1413203938 C Ii:1:007:1 0:8 4 = 00030500
f72973c0 1413203970 S Ii:1:007:1 -115:8 4 <
f72973c0 1413211938 C Ii:1:007:1 0:8 4 = 00030500
f72973c0 1413211968 S Ii:1:007:1 -115:8 4 <
f72973c0 1413219939 C Ii:1:007:1 0:8 4 = 00020400
f72973c0 1413219970 S Ii:1:007:1 -115:8 4 <
f72973c0 1413227957 C Ii:1:007:1 0:8 4 = 00030500
f72973c0 1413227986 S Ii:1:007:1 -115:8 4 <
f72973c0 1413235936 C Ii:1:007:1 0:8 4 = 00040500
f72973c0 1413235965 S Ii:1:007:1 -115:8 4 <
f72973c0 1413243957 C Ii:1:007:1 0:8 4 = 00030600
f72973c0 1413243976 S Ii:1:007:1 -115:8 4 <
f72973c0 1413251941 C Ii:1:007:1 0:8 4 = 00030500
f72973c0 1413251976 S Ii:1:007:1 -115:8 4 <
f72973c0 1413259957 C Ii:1:007:1 0:8 4 = 00040700
f72973c0 1413259986 S Ii:1:007:1 -115:8 4 <
f72973c0 1413267938 C Ii:1:007:1 0:8 4 = 00030600
f72973c0 1413267964 S Ii:1:007:1 -115:8 4 <
f72973c0 1413275938 C Ii:1:007:1 0:8 4 = 00040700
f72973c0 1413275967 S Ii:1:007:1 -115:8 4 <
f72973c0 1413283943 C Ii:1:007:1 0:8 4 = 00030600
f72973c0 1413283970 S Ii:1:007:1 -115:8 4 <
f72973c0 1413291942 C Ii:1:007:1 0:8 4 = 00050800
f72973c0 1413291972 S Ii:1:007:1 -115:8 4 <
f72973c0 1413299938 C Ii:1:007:1 0:8 4 = 00030600
f72973c0 1413299970 S Ii:1:007:1 -115:8 4 <
f72973c0 1413307942 C Ii:1:007:1 0:8 4 = 00040800
f72973c0 1413307970 S Ii:1:007:1 -115:8 4 <
f72973c0 1413315942 C Ii:1:007:1 0:8 4 = 00030600
f72973c0 1413315971 S Ii:1:007:1 -115:8 4 <
f72973c0 1413323939 C Ii:1:007:1 0:8 4 = 00020700
f72973c0 1413323972 S Ii:1:007:1 -115:8 4 <
f72973c0 1413331945 C Ii:1:007:1 0:8 4 = 00030500
f72973c0 1413331977 S Ii:1:007:1 -115:8 4 <
f72973c0 1413339955 C Ii:1:007:1 0:8 4 = 00030600
f72973c0 1413339983 S Ii:1:007:1 -115:8 4 <
f72973c0 1413347955 C Ii:1:007:1 0:8 4 = 00010400
f72973c0 1413347984 S Ii:1:007:1 -115:8 4 <
f72973c0 1413355954 C Ii:1:007:1 0:8 4 = 00030600
f72973c0 1413355982 S Ii:1:007:1 -115:8 4 <
f72973c0 1413363941 C Ii:1:007:1 0:8 4 = 00030500
f72973c0 1413363971 S Ii:1:007:1 -115:8 4 <
f72973c0 1413371957 C Ii:1:007:1 0:8 4 = 00020400
f72973c0 1413371984 S Ii:1:007:1 -115:8 4 <
f72973c0 1413379957 C Ii:1:007:1 0:8 4 = 00030600
f72973c0 1413379976 S Ii:1:007:1 -115:8 4 <
f72973c0 1413387940 C Ii:1:007:1 0:8 4 = 00020400
f72973c0 1413387959 S Ii:1:007:1 -115:8 4 <
f72973c0 1413395944 C Ii:1:007:1 0:8 4 = 00020400
f72973c0 1413395975 S Ii:1:007:1 -115:8 4 <
f72973c0 1413403956 C Ii:1:007:1 0:8 4 = 00000300
f72973c0 1413403984 S Ii:1:007:1 -115:8 4 <
f72973c0 1413411955 C Ii:1:007:1 0:8 4 = 00010400
f72973c0 1413411984 S Ii:1:007:1 -115:8 4 <
f72f3140 1413412357 S Bo:1:008:2 -115 31 = 55534243 df680000 00000000 00000600 00000000 00000000 00000000 000000
f72f3140 1413412435 C Bo:1:008:2 0 31 >
f72f3140 1413412447 S Bi:1:008:2 -115 13 <
f72f3140 1413413956 C Bi:1:008:2 0 13 = 55534253 df680000 00000000 01
f72f3140 1413413967 S Bo:1:008:2 -115 31 = 55534243 e0680000 12000000 80000603 00000012 00000000 00000000 000000
f72f3140 1413414060 C Bo:1:008:2 0 31 >
f2313ec0 1413414085 S Bi:1:008:2 -115 18 <
f2313ec0 1413415455 C Bi:1:008:2 0 18 = 70000200 0000000a 00000000 3a000000 0000
f72f3140 1413415465 S Bi:1:008:2 -115 13 <
f72f3140 1413416184 C Bi:1:008:2 0 13 = 55534253 e0680000 00000000 00
f72f3140 1413416240 S Bo:1:008:2 -115 31 = 55534243 e1680000 00000000 00000600 00000000 00000000 00000000 000000
f72f3140 1413416325 C Bo:1:008:2 0 31 >
f72f3140 1413416332 S Bi:1:008:2 -115 13 <
f72f3140 1413417559 C Bi:1:008:2 0 13 = 55534253 e1680000 00000000 01
f72f3140 1413417571 S Bo:1:008:2 -115 31 = 55534243 e2680000 12000000 80000603 00000012 00000000 00000000 000000
f72f3140 1413417702 C Bo:1:008:2 0 31 >
f6e2c240 1413417717 S Bi:1:008:2 -115 18 <
f6e2c240 1413419060 C Bi:1:008:2 0 18 = 70000200 0000000a 00000000 3a000000 0000
f72f3140 1413419087 S Bi:1:008:2 -115 13 <
f72f3140 1413419828 C Bi:1:008:2 0 13 = 55534253 e2680000 00000000 00
f72973c0 1413419834 C Ii:1:007:1 0:8 4 = 00000300
f72973c0 1413419860 S Ii:1:007:1 -115:8 4 <
f72f3140 1413419908 S Bo:1:008:2 -115 31 = 55534243 e3680000 00000000 0000061e 00000001 00000000 00000000 000000
f72f3140 1413420060 C Bo:1:008:2 0 31 >
f72f3140 1413420081 S Bi:1:008:2 -115 13 <
f72f3140 1413421078 C Bi:1:008:2 0 13 = 55534253 e3680000 00000000 01
f72f3140 1413421106 S Bo:1:008:2 -115 31 = 55534243 e4680000 12000000 80000603 00000012 00000000 00000000 000000
f72f3140 1413421186 C Bo:1:008:2 0 31 >
f6e2c240 1413421213 S Bi:1:008:2 -115 18 <
f6e2c240 1413422578 C Bi:1:008:2 0 18 = 70000200 0000000a 00000000 3a000000 0000
f72f3140 1413422587 S Bi:1:008:2 -115 13 <
f72f3140 1413423326 C Bi:1:008:2 0 13 = 55534253 e4680000 00000000 00
f72f3140 1413423366 S Bo:1:008:2 -115 31 = 55534243 e5680000 00000000 0000061e 00000000 00000000 00000000 000000
f72f3140 1413423436 C Bo:1:008:2 0 31 >
f72f3140 1413423461 S Bi:1:008:2 -115 13 <
f72f3140 1413424561 C Bi:1:008:2 0 13 = 55534253 e5680000 00000000 01
f72f3140 1413424587 S Bo:1:008:2 -115 31 = 55534243 e6680000 12000000 80000603 00000012 00000000 00000000 000000
f72f3140 1413424685 C Bo:1:008:2 0 31 >
f6e2c240 1413424712 S Bi:1:008:2 -115 18 <
f6e2c240 1413425936 C Bi:1:008:2 0 18 = 70000200 0000000a 00000000 3a000000 0000
f72f3140 1413425965 S Bi:1:008:2 -115 13 <
f72f3140 1413426935 C Bi:1:008:2 0 13 = 55534253 e6680000 00000000 00
f72f3140 1413427017 S Bo:1:008:2 -115 31 = 55534243 e7680000 00000000 00000600 00000000 00000000 00000000 000000
f72f3140 1413427060 C Bo:1:008:2 0 31 >
f72f3140 1413427078 S Bi:1:008:2 -115 13 <
f72973c0 1413427938 C Ii:1:007:1 0:8 4 = 00000300
f72973c0 1413427966 S Ii:1:007:1 -115:8 4 <
f72f3140 1413428185 C Bi:1:008:2 0 13 = 55534253 e7680000 00000000 01
f72f3140 1413428209 S Bo:1:008:2 -115 31 = 55534243 e8680000 12000000 80000603 00000012 00000000 00000000 000000
f72f3140 1413428310 C Bo:1:008:2 0 31 >
f6ee00c0 1413428329 S Bi:1:008:2 -115 18 <
f6ee00c0 1413429560 C Bi:1:008:2 0 18 = 70000200 0000000a 00000000 3a000000 0000
f72f3140 1413429589 S Bi:1:008:2 -115 13 <
f72f3140 1413430435 C Bi:1:008:2 0 13 = 55534253 e8680000 00000000 00
f72f3140 1413430969 S Bo:1:008:2 -115 31 = 55534243 e9680000 00000000 00010600 00000000 00000000 00000000 000000
f72f3140 1413431077 C Bo:1:008:2 0 31 >
f72f3140 1413431087 S Bi:1:008:2 -115 13 <
f72f3140 1413432560 C Bi:1:008:2 0 13 = 55534253 e9680000 00000000 01
f72f3140 1413432575 S Bo:1:008:2 -115 31 = 55534243 ea680000 12000000 80010603 00000012 00000000 00000000 000000
f72f3140 1413432689 C Bo:1:008:2 0 31 >
f6e2c640 1413432700 S Bi:1:008:2 -115 18 <
f6e2c640 1413434060 C Bi:1:008:2 0 18 = 70000200 0000000a 00000000 3a000000 0000
f72f3140 1413434089 S Bi:1:008:2 -115 13 <
f72f3140 1413434818 C Bi:1:008:2 0 13 = 55534253 ea680000 00000000 00
f72f3140 1413434900 S Bo:1:008:2 -115 31 = 55534243 eb680000 00000000 00010600 00000000 00000000 00000000 000000
f72f3140 1413434934 C Bo:1:008:2 0 31 >
f72f3140 1413434950 S Bi:1:008:2 -115 13 <
f72973c0 1413435957 C Ii:1:007:1 0:8 4 = 00000200
f72973c0 1413435984 S Ii:1:007:1 -115:8 4 <
f72f3140 1413436077 C Bi:1:008:2 0 13 = 55534253 eb680000 00000000 01
f72f3140 1413436145 S Bo:1:008:2 -115 31 = 55534243 ec680000 12000000 80010603 00000012 00000000 00000000 000000
f72f3140 1413436185 C Bo:1:008:2 0 31 >
ee641a40 1413436229 S Bi:1:008:2 -115 18 <
ee641a40 1413437703 C Bi:1:008:2 0 18 = 70000200 0000000a 00000000 3a000000 0000
f72f3140 1413437714 S Bi:1:008:2 -115 13 <
f72f3140 1413438580 C Bi:1:008:2 0 13 = 55534253 ec680000 00000000 00
f72f3140 1413438643 S Bo:1:008:2 -115 31 = 55534243 ed680000 00000000 0001061e 00000001 00000000 00000000 000000
f72f3140 1413438690 C Bo:1:008:2 0 31 >
f72f3140 1413438699 S Bi:1:008:2 -115 13 <
f72f3140 1413439813 C Bi:1:008:2 0 13 = 55534253 ed680000 00000000 01
f72f3140 1413439835 S Bo:1:008:2 -115 31 = 55534243 ee680000 12000000 80010603 00000012 00000000 00000000 000000
f72f3140 1413439961 C Bo:1:008:2 0 31 >
f6e2c240 1413439981 S Bi:1:008:2 -115 18 <
f6e2c240 1413441188 C Bi:1:008:2 0 18 = 70000200 0000000a 00000000 3a000000 0000
f72f3140 1413441208 S Bi:1:008:2 -115 13 <
f72f3140 1413442063 C Bi:1:008:2 0 13 = 55534253 ee680000 00000000 00
f72973c0 1413443943 C Ii:1:007:1 0:8 4 = 00000300
f72973c0 1413443996 S Ii:1:007:1 -115:8 4 <
f72f3140 1413444514 S Bo:1:008:2 -115 31 = 55534243 ef680000 00000000 0001061e 00000000 00000000 00000000 000000
f72f3140 1413444563 C Bo:1:008:2 0 31 >
f72f3140 1413444620 S Bi:1:008:2 -115 13 <
f72f3140 1413445688 C Bi:1:008:2 0 13 = 55534253 ef680000 00000000 01
f72f3140 1413445950 S Bo:1:008:2 -115 31 = 55534243 f0680000 12000000 80010603 00000012 00000000 00000000 000000
f72f3140 1413446063 C Bo:1:008:2 0 31 >
f6e2c240 1413447033 S Bi:1:008:2 -115 18 <
f6e2c240 1413447439 C Bi:1:008:2 0 18 = 70000200 0000000a 00000000 3a000000 0000
f72f3140 1413447461 S Bi:1:008:2 -115 13 <
f72f3140 1413448318 C Bi:1:008:2 0 13 = 55534253 f0680000 00000000 00
f72f3140 1413448358 S Bo:1:008:2 -115 31 = 55534243 f1680000 00000000 00010600 00000000 00000000 00000000 000000
f72f3140 1413448439 C Bo:1:008:2 0 31 >
f72f3140 1413448459 S Bi:1:008:2 -115 13 <
f72f3140 1413449567 C Bi:1:008:2 0 13 = 55534253 f1680000 00000000 01
f72f3140 1413449584 S Bo:1:008:2 -115 31 = 55534243 f2680000 12000000 80010603 00000012 00000000 00000000 000000
f72f3140 1413449689 C Bo:1:008:2 0 31 >
f6e2c240 1413449710 S Bi:1:008:2 -115 18 <
f6e2c240 1413450938 C Bi:1:008:2 0 18 = 70000200 0000000a 00000000 3a000000 0000
f72f3140 1413450976 S Bi:1:008:2 -115 13 <
f72f3140 1413451830 C Bi:1:008:2 0 13 = 55534253 f2680000 00000000 00
f72973c0 1413451834 C Ii:1:007:1 0:8 4 = 00000200
f72973c0 1413451852 S Ii:1:007:1 -115:8 4 <
f72973c0 1413459961 C Ii:1:007:1 0:8 4 = 00000300
f72973c0 1413459981 S Ii:1:007:1 -115:8 4 <
f72973c0 1413467947 C Ii:1:007:1 0:8 4 = 00000200
f72973c0 1413467978 S Ii:1:007:1 -115:8 4 <
f72973c0 1413475957 C Ii:1:007:1 0:8 4 = 00ff0200
f72973c0 1413475976 S Ii:1:007:1 -115:8 4 <
f72973c0 1413483937 C Ii:1:007:1 0:8 4 = 00ff0200
f72973c0 1413483964 S Ii:1:007:1 -115:8 4 <
f72973c0 1413491956 C Ii:1:007:1 0:8 4 = 00ff0200
f72973c0 1413491983 S Ii:1:007:1 -115:8 4 <
f72973c0 1413499943 C Ii:1:007:1 0:8 4 = 00ff0300
f72973c0 1413499972 S Ii:1:007:1 -115:8 4 <
f72973c0 1413507956 C Ii:1:007:1 0:8 4 = 00ff0300
f72973c0 1413507985 S Ii:1:007:1 -115:8 4 <
f72973c0 1413515941 C Ii:1:007:1 0:8 4 = 00ff0300
f72973c0 1413515996 S Ii:1:007:1 -115:8 4 <
f72973c0 1413523956 C Ii:1:007:1 0:8 4 = 00ff0300
f72973c0 1413523980 S Ii:1:007:1 -115:8 4 <
f72973c0 1413531938 C Ii:1:007:1 0:8 4 = 00fe0300
f72973c0 1413531961 S Ii:1:007:1 -115:8 4 <
f72973c0 1413539956 C Ii:1:007:1 0:8 4 = 00ff0200
f72973c0 1413539985 S Ii:1:007:1 -115:8 4 <
f72973c0 1413547935 C Ii:1:007:1 0:8 4 = 00ff0200
f72973c0 1413547955 S Ii:1:007:1 -115:8 4 <
f72973c0 1413555941 C Ii:1:007:1 0:8 4 = 00000200
f72973c0 1413555967 S Ii:1:007:1 -115:8 4 <
f72973c0 1413563944 C Ii:1:007:1 0:8 4 = 00ff0200
f72973c0 1413563973 S Ii:1:007:1 -115:8 4 <
f72973c0 1413571944 C Ii:1:007:1 0:8 4 = 00000100
f72973c0 1413571971 S Ii:1:007:1 -115:8 4 <
f72973c0 1413579936 C Ii:1:007:1 0:8 4 = 00000200
f72973c0 1413579954 S Ii:1:007:1 -115:8 4 <
f72973c0 1413587937 C Ii:1:007:1 0:8 4 = 00000200
f72973c0 1413587958 S Ii:1:007:1 -115:8 4 <
f72973c0 1413595957 C Ii:1:007:1 0:8 4 = 00ff0200
f72973c0 1413595988 S Ii:1:007:1 -115:8 4 <
f72973c0 1413603940 C Ii:1:007:1 0:8 4 = 00ff0300
f72973c0 1413603973 S Ii:1:007:1 -115:8 4 <
f72973c0 1413611938 C Ii:1:007:1 0:8 4 = 00000300
f72973c0 1413611965 S Ii:1:007:1 -115:8 4 <
f72973c0 1413619954 C Ii:1:007:1 0:8 4 = 00ff0400
f72973c0 1413619984 S Ii:1:007:1 -115:8 4 <
f72973c0 1413627937 C Ii:1:007:1 0:8 4 = 00ff0400
f72973c0 1413627967 S Ii:1:007:1 -115:8 4 <
f72973c0 1413635941 C Ii:1:007:1 0:8 4 = 00ff0400
f72973c0 1413635969 S Ii:1:007:1 -115:8 4 <
f72973c0 1413643955 C Ii:1:007:1 0:8 4 = 00ff0300
f72973c0 1413643982 S Ii:1:007:1 -115:8 4 <
f72973c0 1413651955 C Ii:1:007:1 0:8 4 = 00000300
f72973c0 1413651981 S Ii:1:007:1 -115:8 4 <
f72973c0 1413659956 C Ii:1:007:1 0:8 4 = 00ff0200
f72973c0 1413659984 S Ii:1:007:1 -115:8 4 <
f72973c0 1413667942 C Ii:1:007:1 0:8 4 = 00000100
f72973c0 1413668001 S Ii:1:007:1 -115:8 4 <
f72973c0 1413675937 C Ii:1:007:1 0:8 4 = 00000100
f72973c0 1413675964 S Ii:1:007:1 -115:8 4 <
f72973c0 1413683938 C Ii:1:007:1 0:8 4 = 00000100
f72973c0 1413683957 S Ii:1:007:1 -115:8 4 <
f72973c0 1413691937 C Ii:1:007:1 0:8 4 = 00ff0200
f72973c0 1413691966 S Ii:1:007:1 -115:8 4 <
f72973c0 1413699957 C Ii:1:007:1 0:8 4 = 00000100
f72973c0 1413699983 S Ii:1:007:1 -115:8 4 <
f72973c0 1413707942 C Ii:1:007:1 0:8 4 = 00000300
f72973c0 1413707969 S Ii:1:007:1 -115:8 4 <
f72973c0 1413715955 C Ii:1:007:1 0:8 4 = 00000200
f72973c0 1413715982 S Ii:1:007:1 -115:8 4 <
f72973c0 1413723955 C Ii:1:007:1 0:8 4 = 00000200
f72973c0 1413723982 S Ii:1:007:1 -115:8 4 <
f72973c0 1413731938 C Ii:1:007:1 0:8 4 = 00000200
f72973c0 1413731969 S Ii:1:007:1 -115:8 4 <
f72973c0 1413739956 C Ii:1:007:1 0:8 4 = 00000200
f72973c0 1413739983 S Ii:1:007:1 -115:8 4 <
f72973c0 1413747955 C Ii:1:007:1 0:8 4 = 00000300
f72973c0 1413747981 S Ii:1:007:1 -115:8 4 <
f72973c0 1413755937 C Ii:1:007:1 0:8 4 = 00000300
f72973c0 1413755965 S Ii:1:007:1 -115:8 4 <
f72973c0 1413763956 C Ii:1:007:1 0:8 4 = 00ff0300
f72973c0 1413763984 S Ii:1:007:1 -115:8 4 <
f72973c0 1413771957 C Ii:1:007:1 0:8 4 = 00000300
f72973c0 1413771982 S Ii:1:007:1 -115:8 4 <
f72973c0 1413779956 C Ii:1:007:1 0:8 4 = 00ff0200
f72973c0 1413779983 S Ii:1:007:1 -115:8 4 <
f72973c0 1413787955 C Ii:1:007:1 0:8 4 = 00000300
f72973c0 1413787981 S Ii:1:007:1 -115:8 4 <
f72973c0 1413795954 C Ii:1:007:1 0:8 4 = 00000100
f72973c0 1413795981 S Ii:1:007:1 -115:8 4 <
f72973c0 1413803945 C Ii:1:007:1 0:8 4 = 00ff0100
f72973c0 1413803979 S Ii:1:007:1 -115:8 4 <
f72973c0 1413811944 C Ii:1:007:1 0:8 4 = 00000100
f72973c0 1413811971 S Ii:1:007:1 -115:8 4 <
f72973c0 1413819944 C Ii:1:007:1 0:8 4 = 00000100
f72973c0 1413819971 S Ii:1:007:1 -115:8 4 <
f72973c0 1413827941 C Ii:1:007:1 0:8 4 = 00000100
f72973c0 1413827977 S Ii:1:007:1 -115:8 4 <
f72973c0 1413835940 C Ii:1:007:1 0:8 4 = 00000100
f72973c0 1413835973 S Ii:1:007:1 -115:8 4 <
f72973c0 1413843941 C Ii:1:007:1 0:8 4 = 00ff0000
f72973c0 1413843970 S Ii:1:007:1 -115:8 4 <
f72973c0 1413851941 C Ii:1:007:1 0:8 4 = 00000100
f72973c0 1413851975 S Ii:1:007:1 -115:8 4 <
f72973c0 1413859941 C Ii:1:007:1 0:8 4 = 00000100
f72973c0 1413859972 S Ii:1:007:1 -115:8 4 <
f72973c0 1413867941 C Ii:1:007:1 0:8 4 = 00000100
f72973c0 1413867974 S Ii:1:007:1 -115:8 4 <
f72973c0 1413875943 C Ii:1:007:1 0:8 4 = 00000100
f72973c0 1413875977 S Ii:1:007:1 -115:8 4 <
f72973c0 1413883943 C Ii:1:007:1 0:8 4 = 00000100
f72973c0 1413883976 S Ii:1:007:1 -115:8 4 <
f72973c0 1413891942 C Ii:1:007:1 0:8 4 = 00000100
f72973c0 1413891982 S Ii:1:007:1 -115:8 4 <
f72973c0 1413899940 C Ii:1:007:1 0:8 4 = 00000100
f72973c0 1413899972 S Ii:1:007:1 -115:8 4 <
f72973c0 1413907962 C Ii:1:007:1 0:8 4 = 00000100
f72973c0 1413907992 S Ii:1:007:1 -115:8 4 <
f72973c0 1413995944 C Ii:1:007:1 0:8 4 = 00000100
f72973c0 1413995983 S Ii:1:007:1 -115:8 4 <
f72973c0 1414003939 C Ii:1:007:1 0:8 4 = 00010000
f72973c0 1414003974 S Ii:1:007:1 -115:8 4 <
f72973c0 1414011956 C Ii:1:007:1 0:8 4 = 00000100
f72973c0 1414011986 S Ii:1:007:1 -115:8 4 <
f72973c0 1414019937 C Ii:1:007:1 0:8 4 = 00010100
f72973c0 1414019958 S Ii:1:007:1 -115:8 4 <
f72973c0 1414027945 C Ii:1:007:1 0:8 4 = 00020100
f72973c0 1414027977 S Ii:1:007:1 -115:8 4 <
f72973c0 1414035954 C Ii:1:007:1 0:8 4 = 00030100
f72973c0 1414035982 S Ii:1:007:1 -115:8 4 <
f72973c0 1414043938 C Ii:1:007:1 0:8 4 = 00020100
f72973c0 1414043968 S Ii:1:007:1 -115:8 4 <
f72973c0 1414051944 C Ii:1:007:1 0:8 4 = 00040100
f72973c0 1414051972 S Ii:1:007:1 -115:8 4 <
f72973c0 1414059955 C Ii:1:007:1 0:8 4 = 00050100
f72973c0 1414059982 S Ii:1:007:1 -115:8 4 <
f72973c0 1414067943 C Ii:1:007:1 0:8 4 = 00040000
f72973c0 1414067970 S Ii:1:007:1 -115:8 4 <
f72973c0 1414075958 C Ii:1:007:1 0:8 4 = 00050100
f72973c0 1414075986 S Ii:1:007:1 -115:8 4 <
f72973c0 1414083939 C Ii:1:007:1 0:8 4 = 00060000
f72973c0 1414083971 S Ii:1:007:1 -115:8 4 <
f72973c0 1414091956 C Ii:1:007:1 0:8 4 = 00060000
f72973c0 1414091984 S Ii:1:007:1 -115:8 4 <
f72973c0 1414099956 C Ii:1:007:1 0:8 4 = 00060000
f72973c0 1414099974 S Ii:1:007:1 -115:8 4 <
f72973c0 1414107939 C Ii:1:007:1 0:8 4 = 00070000
f72973c0 1414107967 S Ii:1:007:1 -115:8 4 <
f72973c0 1414115943 C Ii:1:007:1 0:8 4 = 00060000
f72973c0 1414115969 S Ii:1:007:1 -115:8 4 <
f72973c0 1414123935 C Ii:1:007:1 0:8 4 = 0007ff00
f72973c0 1414123953 S Ii:1:007:1 -115:8 4 <
f72973c0 1414131942 C Ii:1:007:1 0:8 4 = 00060000
f72973c0 1414131969 S Ii:1:007:1 -115:8 4 <
f72973c0 1414139939 C Ii:1:007:1 0:8 4 = 00050000
f72973c0 1414139957 S Ii:1:007:1 -115:8 4 <
f72973c0 1414147937 C Ii:1:007:1 0:8 4 = 00040000
f72973c0 1414147966 S Ii:1:007:1 -115:8 4 <
f72973c0 1414155958 C Ii:1:007:1 0:8 4 = 00040000
f72973c0 1414155986 S Ii:1:007:1 -115:8 4 <
f72973c0 1414163937 C Ii:1:007:1 0:8 4 = 00030000
f72973c0 1414163965 S Ii:1:007:1 -115:8 4 <
f72973c0 1414171944 C Ii:1:007:1 0:8 4 = 00030000
f72973c0 1414171972 S Ii:1:007:1 -115:8 4 <
f72973c0 1414179941 C Ii:1:007:1 0:8 4 = 00010000
f72973c0 1414179967 S Ii:1:007:1 -115:8 4 <
f72973c0 1414187938 C Ii:1:007:1 0:8 4 = 00010000
f72973c0 1414187966 S Ii:1:007:1 -115:8 4 <
f72973c0 1414195955 C Ii:1:007:1 0:8 4 = 00010000
f72973c0 1414195981 S Ii:1:007:1 -115:8 4 <
f72973c0 1414251958 C Ii:1:007:1 0:8 4 = 00010000
f72973c0 1414251993 S Ii:1:007:1 -115:8 4 <
f72973c0 1414259942 C Ii:1:007:1 0:8 4 = 00010000
f72973c0 1414259970 S Ii:1:007:1 -115:8 4 <
f72973c0 1414267936 C Ii:1:007:1 0:8 4 = 00010000
f72973c0 1414267958 S Ii:1:007:1 -115:8 4 <
f72973c0 1414275942 C Ii:1:007:1 0:8 4 = 00010000
f72973c0 1414275973 S Ii:1:007:1 -115:8 4 <
f72973c0 1414283957 C Ii:1:007:1 0:8 4 = 00010000
f72973c0 1414283974 S Ii:1:007:1 -115:8 4 <
f72973c0 1414291939 C Ii:1:007:1 0:8 4 = 00030000
f72973c0 1414291972 S Ii:1:007:1 -115:8 4 <
f72973c0 1414299944 C Ii:1:007:1 0:8 4 = 00020000
f72973c0 1414299972 S Ii:1:007:1 -115:8 4 <
f72973c0 1414307936 C Ii:1:007:1 0:8 4 = 00030000
f72973c0 1414307961 S Ii:1:007:1 -115:8 4 <
f72973c0 1414315938 C Ii:1:007:1 0:8 4 = 00050000
f72973c0 1414315967 S Ii:1:007:1 -115:8 4 <
f72973c0 1414323955 C Ii:1:007:1 0:8 4 = 00050000
f72973c0 1414323980 S Ii:1:007:1 -115:8 4 <
f72973c0 1414331939 C Ii:1:007:1 0:8 4 = 00060000
f72973c0 1414331971 S Ii:1:007:1 -115:8 4 <
f72973c0 1414339956 C Ii:1:007:1 0:8 4 = 00050000
f72973c0 1414339983 S Ii:1:007:1 -115:8 4 <
f72973c0 1414347956 C Ii:1:007:1 0:8 4 = 0006ff00
f72973c0 1414347985 S Ii:1:007:1 -115:8 4 <
f72973c0 1414355944 C Ii:1:007:1 0:8 4 = 00030000
f72973c0 1414355971 S Ii:1:007:1 -115:8 4 <
f72973c0 1414363942 C Ii:1:007:1 0:8 4 = 0003ff00
f72973c0 1414363971 S Ii:1:007:1 -115:8 4 <
f72973c0 1414371938 C Ii:1:007:1 0:8 4 = 00020000
f72973c0 1414371968 S Ii:1:007:1 -115:8 4 <
f72973c0 1414379944 C Ii:1:007:1 0:8 4 = 0001ff00
f72973c0 1414379972 S Ii:1:007:1 -115:8 4 <
f72973c0 1415059959 C Ii:1:007:1 0:8 4 = 01000000
f72973c0 1415059998 S Ii:1:007:1 -115:8 4 <
f72973c0 1415227940 C Ii:1:007:1 0:8 4 = 00000000
f72973c0 1415227982 S Ii:1:007:1 -115:8 4 <
f6e2c340 1415232298 S Ci:1:010:0 s c0 d2 0000 0000 0100 256 <
f6e2c340 1415240820 C Ci:1:010:0 0 256 = 2d2d2d2d 2d2d2d2d 0d0a2056 332e300d 0a20534e 3a55422d 32303039 2e31302e
f6e2c340 1415244751 S Ci:1:010:0 s c0 d2 0000 0000 0100 256 <
f6e2c340 1415253331 C Ci:1:010:0 0 256 = 2d2d2d2d 2d2d2d2d 0d0a2056 332e300d 0a20534e 3a55422d 32303039 2e31302e
f6e2c340 1415256715 S Ci:1:010:0 s 80 06 0100 0000 0012 18 <
f6e2c340 1415256814 C Ci:1:010:0 0 18 = 12010002 ff000040 3c150100 00000102 0001
f6e2c340 1415259615 S Ci:1:010:0 s c0 d2 0000 0000 0100 256 <
f6e2c340 1415268187 C Ci:1:010:0 0 256 = 2d2d2d2d 2d2d2d2d 0d0a2056 332e300d 0a20534e 3a55422d 32303039 2e31302e
f6e2c640 1415273947 S Co:1:010:0 s 40 c0 0000 0000 0000 0
f6e2c640 1415274691 C Co:1:010:0 0 0
f6e2c640 1415281661 S Co:1:010:0 s 40 c2 0001 0000 0000 0
f6e2c640 1415282810 C Co:1:010:0 0 0
f6e2c640 1415286190 S Co:1:010:0 s 40 b6 0080 0000 0000 0
f6e2c640 1415287311 C Co:1:010:0 0 0
f24779c0 1415289410 S Co:1:010:0 s 40 b5 0080 0000 0000 0
f24779c0 1415290565 C Co:1:010:0 0 0
f6e2c640 1415294455 S Co:1:010:0 s 40 b9 0000 0000 0010 16 = 01020304 05060708 090a0b0c 0d0e0f10
f6e2c640 1415295685 C Co:1:010:0 0 16 >
f24779c0 1415298353 S Co:1:010:0 s 40 cd 0000 0000 0000 0
f24779c0 1415299570 C Co:1:010:0 0 0
f24779c0 1415302382 S Co:1:010:0 s 40 d3 0001 0000 0000 0
f24779c0 1415303574 C Co:1:010:0 0 0
f6e2c640 1415306421 S Co:1:010:0 s 40 ca 0001 0000 0000 0
f6e2c640 1415306559 C Co:1:010:0 0 0
f72973c0 1415307941 C Ii:1:007:1 0:8 4 = 00010000
f72973c0 1415307966 S Ii:1:007:1 -115:8 4 <
f24779c0 1415309355 S Co:1:010:0 s 40 c8 0000 0000 0010 16 = 00000000 00000000 00000000 00000000
f24779c0 1415310692 C Co:1:010:0 0 16 >
f24779c0 1415313414 S Ci:1:010:0 s c0 cf 0000 0000 0001 1 <
f24779c0 1415313566 C Ci:1:010:0 0 1 = 01
f6e2c640 1415316425 S Co:1:010:0 s 40 bf 0000 0000 0000 0
f6e2c640 1415317186 C Co:1:010:0 0 0
f6e2c640 1415318444 S Ci:1:010:0 s c0 cf 0000 0000 0001 1 <
f6e2c640 1415318564 C Ci:1:010:0 0 1 = 01
f6e2c640 1415321369 S Co:1:010:0 s 40 be 0000 0000 0000 0
f6e2c640 1415322067 C Co:1:010:0 0 0
f72973c0 1415323944 C Ii:1:007:1 0:8 4 = 00010000
f72973c0 1415323975 S Ii:1:007:1 -115:8 4 <
f6e2c340 1415324380 S Co:1:010:0 s 40 cb 0000 0000 0007 7 = 03510002 00ff07
f6e2c340 1415337812 C Co:1:010:0 0 7 >
f6e2c340 1415346414 S Co:1:010:0 s 40 c6 0001 0000 0090 144 = 00000000 0000f03f 00000000 00000000 00000000 00000000 00000000 00000000
f6e2c340 1415348937 C Co:1:010:0 0 144 >
f6e2c340 1415351407 S Co:1:010:0 s 40 c7 0001 0000 0090 144 = 00000000 0000f03f 00000000 00000000 00000000 00000000 00000000 00000000
f6e2c340 1415353942 C Co:1:010:0 0 144 >
f6e2c340 1415356330 S Co:1:010:0 s 40 c6 0002 0000 0090 144 = 00000000 0000f03f 00000000 00000000 00000000 00000000 00000000 00000000
f6e2c340 1415358936 C Co:1:010:0 0 144 >
f6e2c340 1415361391 S Co:1:010:0 s 40 c7 0002 0000 0090 144 = 00000000 0000f03f 00000000 00000000 00000000 00000000 00000000 00000000
f6e2c340 1415363942 C Co:1:010:0 0 144 >
f6e2c340 1415366464 S Co:1:010:0 s 40 c6 0003 0000 0090 144 = 00000000 0000f03f 00000000 00000000 00000000 00000000 00000000 00000000
f6e2c340 1415368936 C Co:1:010:0 0 144 >
f6e2c340 1415371371 S Co:1:010:0 s 40 c7 0003 0000 0090 144 = 00000000 0000f03f 00000000 00000000 00000000 00000000 00000000 00000000
f6e2c340 1415373944 C Co:1:010:0 0 144 >
f03493c0 1415376414 S Co:1:010:0 s 40 c6 0004 0000 0090 144 = 00000000 0000f03f 00000000 00000000 00000000 00000000 00000000 00000000
f03493c0 1415378953 C Co:1:010:0 0 144 >
f03493c0 1415381354 S Co:1:010:0 s 40 c7 0004 0000 0090 144 = 00000000 0000f03f 00000000 00000000 00000000 00000000 00000000 00000000
f03493c0 1415383940 C Co:1:010:0 0 144 >
f03493c0 1415386421 S Co:1:010:0 s 40 c6 0005 0000 0090 144 = 00000000 0000f03f 00000000 00000000 00000000 00000000 00000000 00000000
f03493c0 1415388954 C Co:1:010:0 0 144 >
f03493c0 1415391468 S Co:1:010:0 s 40 c7 0005 0000 0090 144 = 00000000 0000f03f 00000000 00000000 00000000 00000000 00000000 00000000
f03493c0 1415394066 C Co:1:010:0 0 144 >
f03493c0 1415396386 S Co:1:010:0 s 40 c6 0006 0000 0090 144 = 00000000 0000f03f 00000000 00000000 00000000 00000000 00000000 00000000
f03493c0 1415398936 C Co:1:010:0 0 144 >
f03493c0 1415401433 S Co:1:010:0 s 40 c7 0006 0000 0090 144 = 00000000 0000f03f 00000000 00000000 00000000 00000000 00000000 00000000
f03493c0 1415403941 C Co:1:010:0 0 144 >
f6e2c340 1415406430 S Co:1:010:0 s 40 c6 0007 0000 0090 144 = 00000000 0000f03f 00000000 00000000 00000000 00000000 00000000 00000000
f6e2c340 1415408937 C Co:1:010:0 0 144 >
f6e2c340 1415411413 S Co:1:010:0 s 40 c7 0007 0000 0090 144 = 00000000 0000f03f 00000000 00000000 00000000 00000000 00000000 00000000
f72f3140 1415413411 S Bo:1:008:2 -115 31 = 55534243 f3680000 00000000 00000600 00000000 00000000 00000000 000000
f72f3140 1415413561 C Bo:1:008:2 0 31 >
f72f3140 1415413585 S Bi:1:008:2 -115 13 <
f6e2c340 1415413937 C Co:1:010:0 0 144 >
f72f3140 1415415189 C Bi:1:008:2 0 13 = 55534253 f3680000 00000000 01
f72f3140 1415415219 S Bo:1:008:2 -115 31 = 55534243 f4680000 12000000 80000603 00000012 00000000 00000000 000000
f72f3140 1415415311 C Bo:1:008:2 0 31 >
f24779c0 1415415335 S Bi:1:008:2 -115 18 <
f6e2c340 1415416425 S Co:1:010:0 s 40 c6 0008 0000 0090 144 = 00000000 0000f03f 00000000 00000000 00000000 00000000 00000000 00000000
f24779c0 1415416816 C Bi:1:008:2 0 18 = 70000200 0000000a 00000000 3a000000 0000
f72f3140 1415416830 S Bi:1:008:2 -115 13 <
f72f3140 1415417565 C Bi:1:008:2 0 13 = 55534253 f4680000 00000000 00
f72f3140 1415417653 S Bo:1:008:2 -115 31 = 55534243 f5680000 00000000 00000600 00000000 00000000 00000000 000000
f72f3140 1415417692 C Bo:1:008:2 0 31 >
f72f3140 1415417702 S Bi:1:008:2 -115 13 <
f72f3140 1415418953 C Bi:1:008:2 0 13 = 55534253 f5680000 00000000 01
f6e2c340 1415418957 C Co:1:010:0 0 144 >
f72f3140 1415418967 S Bo:1:008:2 -115 31 = 55534243 f6680000 12000000 80000603 00000012 00000000 00000000 000000
f72f3140 1415419060 C Bo:1:008:2 0 31 >
f23e7840 1415419112 S Bi:1:008:2 -115 18 <
f23e7840 1415420311 C Bi:1:008:2 0 18 = 70000200 0000000a 00000000 3a000000 0000
f72f3140 1415420342 S Bi:1:008:2 -115 13 <
f72f3140 1415421190 C Bi:1:008:2 0 13 = 55534253 f6680000 00000000 00
f72f3140 1415421242 S Bo:1:008:2 -115 31 = 55534243 f7680000 00000000 0000061e 00000001 00000000 00000000 000000
f72f3140 1415421311 C Bo:1:008:2 0 31 >
f72f3140 1415421323 S Bi:1:008:2 -115 13 <
f72f3140 1415422453 C Bi:1:008:2 0 13 = 55534253 f7680000 00000000 01
f72f3140 1415422463 S Bo:1:008:2 -115 31 = 55534243 f8680000 12000000 80000603 00000012 00000000 00000000 000000
f72f3140 1415422560 C Bo:1:008:2 0 31 >
f23e7840 1415422587 S Bi:1:008:2 -115 18 <
f6e2c340 1415423410 S Co:1:010:0 s 40 c7 0008 0000 0090 144 = 00000000 0000f03f 00000000 00000000 00000000 00000000 00000000 00000000
f23e7840 1415424078 C Bi:1:008:2 0 18 = 70000200 0000000a 00000000 3a000000 0000
f72f3140 1415424090 S Bi:1:008:2 -115 13 <
f72f3140 1415424942 C Bi:1:008:2 0 13 = 55534253 f8680000 00000000 00
f72f3140 1415425021 S Bo:1:008:2 -115 31 = 55534243 f9680000 00000000 0000061e 00000000 00000000 00000000 000000
f72f3140 1415425078 C Bo:1:008:2 0 31 >
f72f3140 1415425087 S Bi:1:008:2 -115 13 <
f6e2c340 1415425939 C Co:1:010:0 0 144 >
f72f3140 1415426203 C Bi:1:008:2 0 13 = 55534253 f9680000 00000000 01
f72f3140 1415426214 S Bo:1:008:2 -115 31 = 55534243 fa680000 12000000 80000603 00000012 00000000 00000000 000000
f72f3140 1415426315 C Bo:1:008:2 0 31 >
f23e7840 1415426329 S Bi:1:008:2 -115 18 <
f23e7840 1415427565 C Bi:1:008:2 0 18 = 70000200 0000000a 00000000 3a000000 0000
f72f3140 1415427585 S Bi:1:008:2 -115 13 <
f6e2c340 1415428347 S Co:1:010:0 s 40 c6 0009 0000 0090 144 = 00000000 0000f03f 00000000 00000000 00000000 00000000 00000000 00000000
f72f3140 1415428439 C Bi:1:008:2 0 13 = 55534253 fa680000 00000000 00
f72f3140 1415428467 S Bo:1:008:2 -115 31 = 55534243 fb680000 00000000 00000600 00000000 00000000 00000000 000000
f72f3140 1415428577 C Bo:1:008:2 0 31 >
f72f3140 1415428589 S Bi:1:008:2 -115 13 <
f72f3140 1415429702 C Bi:1:008:2 0 13 = 55534253 fb680000 00000000 01
f72f3140 1415429720 S Bo:1:008:2 -115 31 = 55534243 fc680000 12000000 80000603 00000012 00000000 00000000 000000
f72f3140 1415429827 C Bo:1:008:2 0 31 >
f23e7840 1415429839 S Bi:1:008:2 -115 18 <
f6e2c340 1415430953 C Co:1:010:0 0 144 >
f23e7840 1415431185 C Bi:1:008:2 0 18 = 70000200 0000000a 00000000 3a000000 0000
f72f3140 1415431213 S Bi:1:008:2 -115 13 <
f72f3140 1415431936 C Bi:1:008:2 0 13 = 55534253 fc680000 00000000 00
f72f3140 1415432284 S Bo:1:008:2 -115 31 = 55534243 fd680000 00000000 00010600 00000000 00000000 00000000 000000
f72f3140 1415432436 C Bo:1:008:2 0 31 >
f72f3140 1415432462 S Bi:1:008:2 -115 13 <
f6e2c340 1415433396 S Co:1:010:0 s 40 c7 0009 0000 0090 144 = 00000000 0000f03f 00000000 00000000 00000000 00000000 00000000 00000000
f72f3140 1415434078 C Bi:1:008:2 0 13 = 55534253 fd680000 00000000 01
f72f3140 1415434089 S Bo:1:008:2 -115 31 = 55534243 fe680000 12000000 80010603 00000012 00000000 00000000 000000
f72f3140 1415434188 C Bo:1:008:2 0 31 >
f23e7840 1415434197 S Bi:1:008:2 -115 18 <
f23e7840 1415435561 C Bi:1:008:2 0 18 = 70000200 0000000a 00000000 3a000000 0000
f72f3140 1415435586 S Bi:1:008:2 -115 13 <
f6e2c340 1415435940 C Co:1:010:0 0 144 >
f72f3140 1415436311 C Bi:1:008:2 0 13 = 55534253 fe680000 00000000 00
f72f3140 1415436465 S Bo:1:008:2 -115 31 = 55534243 ff680000 00000000 00010600 00000000 00000000 00000000 000000
f72f3140 1415436562 C Bo:1:008:2 0 31 >
f72f3140 1415436984 S Bi:1:008:2 -115 13 <
f72f3140 1415437689 C Bi:1:008:2 0 13 = 55534253 ff680000 00000000 01
f72f3140 1415437702 S Bo:1:008:2 -115 31 = 55534243 00690000 12000000 80010603 00000012 00000000 00000000 000000
f72f3140 1415437815 C Bo:1:008:2 0 31 >
f24779c0 1415437824 S Bi:1:008:2 -115 18 <
f6e2c340 1415438443 S Co:1:010:0 s 40 c6 000a 0000 0090 144 = 00000000 0000f03f 00000000 00000000 00000000 00000000 00000000 00000000
f24779c0 1415439202 C Bi:1:008:2 0 18 = 70000200 0000000a 00000000 3a000000 0000
f72f3140 1415439234 S Bi:1:008:2 -115 13 <
f72f3140 1415440077 C Bi:1:008:2 0 13 = 55534253 00690000 00000000 00
f72f3140 1415440108 S Bo:1:008:2 -115 31 = 55534243 01690000 00000000 0001061e 00000001 00000000 00000000 000000
f72f3140 1415440186 C Bo:1:008:2 0 31 >
f72f3140 1415440198 S Bi:1:008:2 -115 13 <
f6e2c340 1415440948 C Co:1:010:0 0 144 >
f72f3140 1415441311 C Bi:1:008:2 0 13 = 55534253 01690000 00000000 01
f72f3140 1415441337 S Bo:1:008:2 -115 31 = 55534243 02690000 12000000 80010603 00000012 00000000 00000000 000000
f72f3140 1415441436 C Bo:1:008:2 0 31 >
f6e2c340 1415441462 S Bi:1:008:2 -115 18 <
f6e2c340 1415442686 C Bi:1:008:2 0 18 = 70000200 0000000a 00000000 3a000000 0000
f72f3140 1415442712 S Bi:1:008:2 -115 13 <
f6e2c340 1415443373 S Co:1:010:0 s 40 c7 000a 0000 0090 144 = 00000000 0000f03f 00000000 00000000 00000000 00000000 00000000 00000000
f72f3140 1415443702 C Bi:1:008:2 0 13 = 55534253 02690000 00000000 00
f72f3140 1415443753 S Bo:1:008:2 -115 31 = 55534243 03690000 00000000 0001061e 00000000 00000000 00000000 000000
f72f3140 1415443811 C Bo:1:008:2 0 31 >
f72f3140 1415443836 S Bi:1:008:2 -115 13 <
f72f3140 1415445186 C Bi:1:008:2 0 13 = 55534253 03690000 00000000 01
f72f3140 1415445198 S Bo:1:008:2 -115 31 = 55534243 04690000 12000000 80010603 00000012 00000000 00000000 000000
f72f3140 1415445315 C Bo:1:008:2 0 31 >
f23e7840 1415445327 S Bi:1:008:2 -115 18 <
f6e2c340 1415445940 C Co:1:010:0 0 144 >
f23e7840 1415446564 C Bi:1:008:2 0 18 = 70000200 0000000a 00000000 3a000000 0000
f72f3140 1415446577 S Bi:1:008:2 -115 13 <
f72f3140 1415447441 C Bi:1:008:2 0 13 = 55534253 04690000 00000000 00
f72f3140 1415447488 S Bo:1:008:2 -115 31 = 55534243 05690000 00000000 00010600 00000000 00000000 00000000 000000
f72f3140 1415447567 C Bo:1:008:2 0 31 >
f72f3140 1415447576 S Bi:1:008:2 -115 13 <
f03493c0 1415448420 S Co:1:010:0 s 40 c6 000b 0000 0090 144 = 00000000 0000f03f 00000000 00000000 00000000 00000000 00000000 00000000
f72f3140 1415448815 C Bi:1:008:2 0 13 = 55534253 05690000 00000000 01
f72f3140 1415448828 S Bo:1:008:2 -115 31 = 55534243 06690000 12000000 80010603 00000012 00000000 00000000 000000
f72f3140 1415448941 C Bo:1:008:2 0 31 >
f6e2c340 1415448953 S Bi:1:008:2 -115 18 <
f6e2c340 1415450311 C Bi:1:008:2 0 18 = 70000200 0000000a 00000000 3a000000 0000
f72f3140 1415450323 S Bi:1:008:2 -115 13 <
f03493c0 1415450952 C Co:1:010:0 0 144 >
f72f3140 1415451060 C Bi:1:008:2 0 13 = 55534253 06690000 00000000 00
f03493c0 1415453353 S Co:1:010:0 s 40 c7 000b 0000 0090 144 = 00000000 0000f03f 00000000 00000000 00000000 00000000 00000000 00000000
f03493c0 1415455955 C Co:1:010:0 0 144 >
f03493c0 1415458403 S Co:1:010:0 s 40 c6 000c 0000 0090 144 = 00000000 0000f03f 00000000 00000000 00000000 00000000 00000000 00000000
f03493c0 1415460939 C Co:1:010:0 0 144 >
f03493c0 1415463470 S Co:1:010:0 s 40 c7 000c 0000 0090 144 = 00000000 0000f03f 00000000 00000000 00000000 00000000 00000000 00000000
f03493c0 1415466070 C Co:1:010:0 0 144 >
f03493c0 1415468367 S Co:1:010:0 s 40 c6 000d 0000 0090 144 = 00000000 0000f03f 00000000 00000000 00000000 00000000 00000000 00000000
f03493c0 1415470940 C Co:1:010:0 0 144 >
f03493c0 1415473430 S Co:1:010:0 s 40 c7 000d 0000 0090 144 = 00000000 0000f03f 00000000 00000000 00000000 00000000 00000000 00000000
f03493c0 1415475941 C Co:1:010:0 0 144 >
f03493c0 1415478428 S Co:1:010:0 s 40 c6 000e 0000 0090 144 = 00000000 0000f03f 00000000 00000000 00000000 00000000 00000000 00000000
f03493c0 1415480937 C Co:1:010:0 0 144 >
f03493c0 1415486387 S Co:1:010:0 s 40 c7 000e 0000 0090 144 = 00000000 0000f03f 00000000 00000000 00000000 00000000 00000000 00000000
f03493c0 1415488942 C Co:1:010:0 0 144 >
f03493c0 1415491304 S Co:1:010:0 s 40 c6 000f 0000 0090 144 = 00000000 0000f03f 00000000 00000000 00000000 00000000 00000000 00000000
f03493c0 1415493811 C Co:1:010:0 0 144 >
f03493c0 1415496528 S Co:1:010:0 s 40 c7 000f 0000 0090 144 = 00000000 0000f03f 00000000 00000000 00000000 00000000 00000000 00000000
f03493c0 1415499066 C Co:1:010:0 0 144 >
f03493c0 1415501281 S Co:1:010:0 s 40 c6 0010 0000 0090 144 = 00000000 0000f03f 00000000 00000000 00000000 00000000 00000000 00000000
f03493c0 1415503815 C Co:1:010:0 0 144 >
f23e7840 1415506352 S Co:1:010:0 s 40 c7 0010 0000 0090 144 = 00000000 0000f03f 00000000 00000000 00000000 00000000 00000000 00000000
f23e7840 1415508815 C Co:1:010:0 0 144 >
f23e7840 1415510466 S Ci:1:010:0 s c0 d2 0000 0000 0100 256 <
f23e7840 1415518940 C Ci:1:010:0 0 256 = 2d2d2d2d 2d2d2d2d 0d0a2056 332e300d 0a20534e 3a55422d 32303039 2e31302e
f72973c0 1415979946 C Ii:1:007:1 0:8 4 = 00010000
f72973c0 1415979983 S Ii:1:007:1 -115:8 4 <
f72973c0 1415987937 C Ii:1:007:1 0:8 4 = 00000100
f72973c0 1415987965 S Ii:1:007:1 -115:8 4 <
f72973c0 1416011961 C Ii:1:007:1 0:8 4 = 00010000
f72973c0 1416011988 S Ii:1:007:1 -115:8 4 <
f72973c0 1416027958 C Ii:1:007:1 0:8 4 = 00010000
f72973c0 1416027991 S Ii:1:007:1 -115:8 4 <
f72973c0 1416067946 C Ii:1:007:1 0:8 4 = 00010000
f72973c0 1416068008 S Ii:1:007:1 -115:8 4 <
f72973c0 1416075941 C Ii:1:007:1 0:8 4 = 00000100
f72973c0 1416075993 S Ii:1:007:1 -115:8 4 <
f72973c0 1416083939 C Ii:1:007:1 0:8 4 = 00010000
f72973c0 1416083968 S Ii:1:007:1 -115:8 4 <
f72973c0 1416107941 C Ii:1:007:1 0:8 4 = 00010000
f72973c0 1416107960 S Ii:1:007:1 -115:8 4 <
f72973c0 1416123945 C Ii:1:007:1 0:8 4 = 00010000
f72973c0 1416123976 S Ii:1:007:1 -115:8 4 <
f72973c0 1416131955 C Ii:1:007:1 0:8 4 = 00010000
f72973c0 1416131982 S Ii:1:007:1 -115:8 4 <
f72973c0 1416139956 C Ii:1:007:1 0:8 4 = 00010000
f72973c0 1416139983 S Ii:1:007:1 -115:8 4 <
f72973c0 1416147942 C Ii:1:007:1 0:8 4 = 00010000
f72973c0 1416147968 S Ii:1:007:1 -115:8 4 <
f72973c0 1416155942 C Ii:1:007:1 0:8 4 = 00010000
f72973c0 1416155968 S Ii:1:007:1 -115:8 4 <
f72973c0 1416163956 C Ii:1:007:1 0:8 4 = 00000100
f72973c0 1416163982 S Ii:1:007:1 -115:8 4 <
f72973c0 1416171938 C Ii:1:007:1 0:8 4 = 00010000
f72973c0 1416171966 S Ii:1:007:1 -115:8 4 <
f72973c0 1416179937 C Ii:1:007:1 0:8 4 = 00010000
f72973c0 1416179965 S Ii:1:007:1 -115:8 4 <
f72973c0 1416187945 C Ii:1:007:1 0:8 4 = 00010000
f72973c0 1416187973 S Ii:1:007:1 -115:8 4 <
f72973c0 1416195954 C Ii:1:007:1 0:8 4 = 00010000
f72973c0 1416195980 S Ii:1:007:1 -115:8 4 <
f72973c0 1416203937 C Ii:1:007:1 0:8 4 = 00010000
f72973c0 1416203966 S Ii:1:007:1 -115:8 4 <
f72973c0 1416211939 C Ii:1:007:1 0:8 4 = 00010000
f72973c0 1416211969 S Ii:1:007:1 -115:8 4 <
f72973c0 1416219937 C Ii:1:007:1 0:8 4 = 00010000
f72973c0 1416219964 S Ii:1:007:1 -115:8 4 <
f72973c0 1416235955 C Ii:1:007:1 0:8 4 = 00010000
f72973c0 1416235984 S Ii:1:007:1 -115:8 4 <
f72973c0 1416243938 C Ii:1:007:1 0:8 4 = 00010000
f72973c0 1416243966 S Ii:1:007:1 -115:8 4 <
f72973c0 1416251943 C Ii:1:007:1 0:8 4 = 00010000
f72973c0 1416251969 S Ii:1:007:1 -115:8 4 <
f72973c0 1416259959 C Ii:1:007:1 0:8 4 = 00010000
f72973c0 1416259978 S Ii:1:007:1 -115:8 4 <
f72973c0 1416267958 C Ii:1:007:1 0:8 4 = 00010000
f72973c0 1416267986 S Ii:1:007:1 -115:8 4 <
f72973c0 1416275937 C Ii:1:007:1 0:8 4 = 00020000
f72973c0 1416275965 S Ii:1:007:1 -115:8 4 <
f72973c0 1416283960 C Ii:1:007:1 0:8 4 = 00010000
f72973c0 1416283983 S Ii:1:007:1 -115:8 4 <
f72973c0 1416291938 C Ii:1:007:1 0:8 4 = 00020000
f72973c0 1416291966 S Ii:1:007:1 -115:8 4 <
f72973c0 1416299942 C Ii:1:007:1 0:8 4 = 00020000
f72973c0 1416299968 S Ii:1:007:1 -115:8 4 <
f72973c0 1416307937 C Ii:1:007:1 0:8 4 = 00030000
f72973c0 1416307966 S Ii:1:007:1 -115:8 4 <
f72973c0 1416315955 C Ii:1:007:1 0:8 4 = 00020000
f72973c0 1416315982 S Ii:1:007:1 -115:8 4 <
f72973c0 1416323940 C Ii:1:007:1 0:8 4 = 00030000
f72973c0 1416323972 S Ii:1:007:1 -115:8 4 <
f72973c0 1416331957 C Ii:1:007:1 0:8 4 = 00020000
f72973c0 1416331986 S Ii:1:007:1 -115:8 4 <
f72973c0 1416339956 C Ii:1:007:1 0:8 4 = 00020000
f72973c0 1416339981 S Ii:1:007:1 -115:8 4 <
f72973c0 1416347944 C Ii:1:007:1 0:8 4 = 00020000
f72973c0 1416347973 S Ii:1:007:1 -115:8 4 <
f72973c0 1416355955 C Ii:1:007:1 0:8 4 = 00020000
f72973c0 1416355979 S Ii:1:007:1 -115:8 4 <
f72973c0 1416363956 C Ii:1:007:1 0:8 4 = 00010000
f72973c0 1416363981 S Ii:1:007:1 -115:8 4 <
f72f3140 1417412240 S Bo:1:008:2 -115 31 = 55534243 07690000 00000000 00000600 00000000 00000000 00000000 000000
f72f3140 1417412314 C Bo:1:008:2 0 31 >
f72f3140 1417412341 S Bi:1:008:2 -115 13 <
f72f3140 1417413828 C Bi:1:008:2 0 13 = 55534253 07690000 00000000 01
f72f3140 1417413842 S Bo:1:008:2 -115 31 = 55534243 08690000 12000000 80000603 00000012 00000000 00000000 000000
f72f3140 1417413937 C Bo:1:008:2 0 31 >
f03493c0 1417413953 S Bi:1:008:2 -115 18 <
f03493c0 1417415315 C Bi:1:008:2 0 18 = 70000200 0000000a 00000000 3a000000 0000
f72f3140 1417415328 S Bi:1:008:2 -115 13 <
f72f3140 1417416061 C Bi:1:008:2 0 13 = 55534253 08690000 00000000 00
f72f3140 1417416639 S Bo:1:008:2 -115 31 = 55534243 09690000 00000000 00000600 00000000 00000000 00000000 000000
f72f3140 1417416687 C Bo:1:008:2 0 31 >
f72f3140 1417418262 S Bi:1:008:2 -115 13 <
f72f3140 1417418437 C Bi:1:008:2 0 13 = 55534253 09690000 00000000 01
f72f3140 1417418461 S Bo:1:008:2 -115 31 = 55534243 0a690000 12000000 80000603 00000012 00000000 00000000 000000
f72f3140 1417418562 C Bo:1:008:2 0 31 >
f03493c0 1417418583 S Bi:1:008:2 -115 18 <
f03493c0 1417419936 C Bi:1:008:2 0 18 = 70000200 0000000a 00000000 3a000000 0000
f72f3140 1417419950 S Bi:1:008:2 -115 13 <
f72f3140 1417420690 C Bi:1:008:2 0 13 = 55534253 0a690000 00000000 00
f72f3140 1417420820 S Bo:1:008:2 -115 31 = 55534243 0b690000 00000000 0000061e 00000001 00000000 00000000 000000
f72f3140 1417420936 C Bo:1:008:2 0 31 >
f72f3140 1417421085 S Bi:1:008:2 -115 13 <
f72f3140 1417422062 C Bi:1:008:2 0 13 = 55534253 0b690000 00000000 01
f72f3140 1417422075 S Bo:1:008:2 -115 31 = 55534243 0c690000 12000000 80000603 00000012 00000000 00000000 000000
f72f3140 1417422190 C Bo:1:008:2 0 31 >
f23e7840 1417422199 S Bi:1:008:2 -115 18 <
f23e7840 1417423578 C Bi:1:008:2 0 18 = 70000200 0000000a 00000000 3a000000 0000
f72f3140 1417423592 S Bi:1:008:2 -115 13 <
f72f3140 1417424311 C Bi:1:008:2 0 13 = 55534253 0c690000 00000000 00
f72f3140 1417424389 S Bo:1:008:2 -115 31 = 55534243 0d690000 00000000 0000061e 00000000 00000000 00000000 000000
f72f3140 1417424453 C Bo:1:008:2 0 31 >
f72f3140 1417424464 S Bi:1:008:2 -115 13 <
f72f3140 1417425562 C Bi:1:008:2 0 13 = 55534253 0d690000 00000000 01
f72f3140 1417425591 S Bo:1:008:2 -115 31 = 55534243 0e690000 12000000 80000603 00000012 00000000 00000000 000000
f72f3140 1417425703 C Bo:1:008:2 0 31 >
f23e7840 1417425715 S Bi:1:008:2 -115 18 <
f23e7840 1417426954 C Bi:1:008:2 0 18 = 70000200 0000000a 00000000 3a000000 0000
f72f3140 1417426968 S Bi:1:008:2 -115 13 <
f72f3140 1417427813 C Bi:1:008:2 0 13 = 55534253 0e690000 00000000 00
f72f3140 1417427879 S Bo:1:008:2 -115 31 = 55534243 0f690000 00000000 00000600 00000000 00000000 00000000 000000
f72f3140 1417427936 C Bo:1:008:2 0 31 >
f72f3140 1417427949 S Bi:1:008:2 -115 13 <
f72f3140 1417429066 C Bi:1:008:2 0 13 = 55534253 0f690000 00000000 01
f72f3140 1417429080 S Bo:1:008:2 -115 31 = 55534243 10690000 12000000 80000603 00000012 00000000 00000000 000000
f72f3140 1417429192 C Bo:1:008:2 0 31 >
f2313ec0 1417429202 S Bi:1:008:2 -115 18 <
f2313ec0 1417430453 C Bi:1:008:2 0 18 = 70000200 0000000a 00000000 3a000000 0000
f72f3140 1417430467 S Bi:1:008:2 -115 13 <
f72f3140 1417431456 C Bi:1:008:2 0 13 = 55534253 10690000 00000000 00
f72f3140 1417431598 S Bo:1:008:2 -115 31 = 55534243 11690000 00000000 00010600 00000000 00000000 00000000 000000
f72f3140 1417431703 C Bo:1:008:2 0 31 >
f72f3140 1417431714 S Bi:1:008:2 -115 13 <
f72f3140 1417433186 C Bi:1:008:2 0 13 = 55534253 11690000 00000000 01
f72f3140 1417433216 S Bo:1:008:2 -115 31 = 55534243 12690000 12000000 80010603 00000012 00000000 00000000 000000
f72f3140 1417433311 C Bo:1:008:2 0 31 >
f6e2c640 1417433452 S Bi:1:008:2 -115 18 <
f6e2c640 1417434686 C Bi:1:008:2 0 18 = 70000200 0000000a 00000000 3a000000 0000
f72f3140 1417434734 S Bi:1:008:2 -115 13 <
f72f3140 1417435436 C Bi:1:008:2 0 13 = 55534253 12690000 00000000 00
f72f3140 1417435513 S Bo:1:008:2 -115 31 = 55534243 13690000 00000000 00010600 00000000 00000000 00000000 000000
f72f3140 1417435578 C Bo:1:008:2 0 31 >
f72f3140 1417435600 S Bi:1:008:2 -115 13 <
f72f3140 1417436686 C Bi:1:008:2 0 13 = 55534253 13690000 00000000 01
f72f3140 1417436724 S Bo:1:008:2 -115 31 = 55534243 14690000 12000000 80010603 00000012 00000000 00000000 000000
f72f3140 1417436828 C Bo:1:008:2 0 31 >
f6e2c640 1417436848 S Bi:1:008:2 -115 18 <
f6e2c640 1417438186 C Bi:1:008:2 0 18 = 70000200 0000000a 00000000 3a000000 0000
f72f3140 1417438225 S Bi:1:008:2 -115 13 <
f72f3140 1417438936 C Bi:1:008:2 0 13 = 55534253 14690000 00000000 00
f72f3140 1417438995 S Bo:1:008:2 -115 31 = 55534243 15690000 00000000 0001061e 00000001 00000000 00000000 000000
f72f3140 1417439077 C Bo:1:008:2 0 31 >
f72f3140 1417439097 S Bi:1:008:2 -115 13 <
f72f3140 1417440061 C Bi:1:008:2 0 13 = 55534253 15690000 00000000 01
f72f3140 1417440076 S Bo:1:008:2 -115 31 = 55534243 16690000 12000000 80010603 00000012 00000000 00000000 000000
f72f3140 1417440191 C Bo:1:008:2 0 31 >
f03493c0 1417440203 S Bi:1:008:2 -115 18 <
f03493c0 1417441940 C Bi:1:008:2 0 18 = 70000200 0000000a 00000000 3a000000 0000
f72f3140 1417441955 S Bi:1:008:2 -115 13 <
f72f3140 1417442685 C Bi:1:008:2 0 13 = 55534253 16690000 00000000 00
f72f3140 1417442757 S Bo:1:008:2 -115 31 = 55534243 17690000 00000000 0001061e 00000000 00000000 00000000 000000
f72f3140 1417442811 C Bo:1:008:2 0 31 >
f72f3140 1417442828 S Bi:1:008:2 -115 13 <
f72f3140 1417443937 C Bi:1:008:2 0 13 = 55534253 17690000 00000000 01
f72f3140 1417443970 S Bo:1:008:2 -115 31 = 55534243 18690000 12000000 80010603 00000012 00000000 00000000 000000
f72f3140 1417444065 C Bo:1:008:2 0 31 >
f6ee00c0 1417444089 S Bi:1:008:2 -115 18 <
f6ee00c0 1417445439 C Bi:1:008:2 0 18 = 70000200 0000000a 00000000 3a000000 0000
f72f3140 1417445464 S Bi:1:008:2 -115 13 <
f72f3140 1417446187 C Bi:1:008:2 0 13 = 55534253 18690000 00000000 00
f72f3140 1417446242 S Bo:1:008:2 -115 31 = 55534243 19690000 00000000 00010600 00000000 00000000 00000000 000000
f72f3140 1417446315 C Bo:1:008:2 0 31 >
f72f3140 1417446334 S Bi:1:008:2 -115 13 <
f72f3140 1417447456 C Bi:1:008:2 0 13 = 55534253 19690000 00000000 01
f72f3140 1417447473 S Bo:1:008:2 -115 31 = 55534243 1a690000 12000000 80010603 00000012 00000000 00000000 000000
f72f3140 1417447561 C Bo:1:008:2 0 31 >
f23e7840 1417447589 S Bi:1:008:2 -115 18 <
f23e7840 1417448829 C Bi:1:008:2 0 18 = 70000200 0000000a 00000000 3a000000 0000
f72f3140 1417448859 S Bi:1:008:2 -115 13 <
f72f3140 1417449703 C Bi:1:008:2 0 13 = 55534253 1a690000 00000000 00
f72973c0 1418619973 C Ii:1:007:1 0:8 4 = 01000000
f72973c0 1418620040 S Ii:1:007:1 -115:8 4 <
f72973c0 1418763941 C Ii:1:007:1 0:8 4 = 00000000
f72973c0 1418763977 S Ii:1:007:1 -115:8 4 <
f72973c0 1418947942 C Ii:1:007:1 0:8 4 = 0000ff00
f72973c0 1418947979 S Ii:1:007:1 -115:8 4 <
f72973c0 1418955956 C Ii:1:007:1 0:8 4 = 00fe0000
f72973c0 1418955980 S Ii:1:007:1 -115:8 4 <
f72973c0 1418963956 C Ii:1:007:1 0:8 4 = 00fc0000
f72973c0 1418963984 S Ii:1:007:1 -115:8 4 <
f72973c0 1418971958 C Ii:1:007:1 0:8 4 = 00fbfe00
f72973c0 1418971986 S Ii:1:007:1 -115:8 4 <
f72973c0 1418979957 C Ii:1:007:1 0:8 4 = 00f9fd00
f72973c0 1418979984 S Ii:1:007:1 -115:8 4 <
f72973c0 1418987945 C Ii:1:007:1 0:8 4 = 00f7fc00
f72973c0 1418987973 S Ii:1:007:1 -115:8 4 <
f72973c0 1418995957 C Ii:1:007:1 0:8 4 = 00f6fc00
f72973c0 1418995974 S Ii:1:007:1 -115:8 4 <
f72973c0 1419003958 C Ii:1:007:1 0:8 4 = 00f4fc00
f72973c0 1419003989 S Ii:1:007:1 -115:8 4 <
f72973c0 1419011943 C Ii:1:007:1 0:8 4 = 00f5fb00
f72973c0 1419011971 S Ii:1:007:1 -115:8 4 <
f72973c0 1419019944 C Ii:1:007:1 0:8 4 = 00f4fb00
f72973c0 1419019972 S Ii:1:007:1 -115:8 4 <
f72973c0 1419027940 C Ii:1:007:1 0:8 4 = 00f1fa00
f72973c0 1419027973 S Ii:1:007:1 -115:8 4 <
f72973c0 1419035956 C Ii:1:007:1 0:8 4 = 00f2f900
f72973c0 1419035984 S Ii:1:007:1 -115:8 4 <
f72973c0 1419043939 C Ii:1:007:1 0:8 4 = 00effa00
f72973c0 1419043967 S Ii:1:007:1 -115:8 4 <
f72973c0 1419051939 C Ii:1:007:1 0:8 4 = 00eff800
f72973c0 1419051970 S Ii:1:007:1 -115:8 4 <
f72973c0 1419059938 C Ii:1:007:1 0:8 4 = 00edf800
f72973c0 1419059966 S Ii:1:007:1 -115:8 4 <
f72973c0 1419067956 C Ii:1:007:1 0:8 4 = 00ebf500
f72973c0 1419067983 S Ii:1:007:1 -115:8 4 <
f72973c0 1419075956 C Ii:1:007:1 0:8 4 = 00eaf200
f72973c0 1419075983 S Ii:1:007:1 -115:8 4 <
f72973c0 1419083956 C Ii:1:007:1 0:8 4 = 00ebf000
f72973c0 1419083983 S Ii:1:007:1 -115:8 4 <
f72973c0 1419091956 C Ii:1:007:1 0:8 4 = 00e9ef00
f72973c0 1419091983 S Ii:1:007:1 -115:8 4 <
f72973c0 1419099939 C Ii:1:007:1 0:8 4 = 00eaf000
f72973c0 1419099966 S Ii:1:007:1 -115:8 4 <
f72973c0 1419107937 C Ii:1:007:1 0:8 4 = 00eaf100
f72973c0 1419107959 S Ii:1:007:1 -115:8 4 <
f72973c0 1419115944 C Ii:1:007:1 0:8 4 = 00e9f300
f72973c0 1419115974 S Ii:1:007:1 -115:8 4 <
f72973c0 1419123944 C Ii:1:007:1 0:8 4 = 00eaf300
f72973c0 1419123972 S Ii:1:007:1 -115:8 4 <
f72973c0 1419131944 C Ii:1:007:1 0:8 4 = 00eaf600
f72973c0 1419131970 S Ii:1:007:1 -115:8 4 <
f72973c0 1419139958 C Ii:1:007:1 0:8 4 = 00edf600
f72973c0 1419139976 S Ii:1:007:1 -115:8 4 <
f72973c0 1419147937 C Ii:1:007:1 0:8 4 = 00eef700
f72973c0 1419147957 S Ii:1:007:1 -115:8 4 <
f72973c0 1419155944 C Ii:1:007:1 0:8 4 = 00f0f900
f72973c0 1419155972 S Ii:1:007:1 -115:8 4 <
f72973c0 1419163958 C Ii:1:007:1 0:8 4 = 00f3fa00
f72973c0 1419163976 S Ii:1:007:1 -115:8 4 <
f72973c0 1419171943 C Ii:1:007:1 0:8 4 = 00f5fb00
f72973c0 1419171998 S Ii:1:007:1 -115:8 4 <
f72973c0 1419179946 C Ii:1:007:1 0:8 4 = 00f7fc00
f72973c0 1419179993 S Ii:1:007:1 -115:8 4 <
f72973c0 1419187939 C Ii:1:007:1 0:8 4 = 00f9fc00
f72973c0 1419187963 S Ii:1:007:1 -115:8 4 <
f72973c0 1419195958 C Ii:1:007:1 0:8 4 = 00fafd00
f72973c0 1419195985 S Ii:1:007:1 -115:8 4 <
f72973c0 1419203941 C Ii:1:007:1 0:8 4 = 00fcfd00
f72973c0 1419203994 S Ii:1:007:1 -115:8 4 <
f72973c0 1419211941 C Ii:1:007:1 0:8 4 = 00fdfe00
f72973c0 1419211991 S Ii:1:007:1 -115:8 4 <
f72973c0 1419219957 C Ii:1:007:1 0:8 4 = 00fefd00
f72973c0 1419220006 S Ii:1:007:1 -115:8 4 <
f72973c0 1419227956 C Ii:1:007:1 0:8 4 = 00feff00
f72973c0 1419227985 S Ii:1:007:1 -115:8 4 <
f72973c0 1419235938 C Ii:1:007:1 0:8 4 = 0000ff00
f72973c0 1419235964 S Ii:1:007:1 -115:8 4 <
f72973c0 1419243956 C Ii:1:007:1 0:8 4 = 00ffff00
f72973c0 1419243983 S Ii:1:007:1 -115:8 4 <
f72973c0 1419251941 C Ii:1:007:1 0:8 4 = 00ff0000
f72973c0 1419251968 S Ii:1:007:1 -115:8 4 <
f72973c0 1419259955 C Ii:1:007:1 0:8 4 = 0000ff00
f72973c0 1419259981 S Ii:1:007:1 -115:8 4 <
f72973c0 1419267939 C Ii:1:007:1 0:8 4 = 00ff0000
f72973c0 1419267967 S Ii:1:007:1 -115:8 4 <
f72973c0 1419275956 C Ii:1:007:1 0:8 4 = 00ff0000
f72973c0 1419275982 S Ii:1:007:1 -115:8 4 <
f72973c0 1419283939 C Ii:1:007:1 0:8 4 = 00ff0000
f72973c0 1419283967 S Ii:1:007:1 -115:8 4 <
f72973c0 1419291938 C Ii:1:007:1 0:8 4 = 00ff0000
f72973c0 1419291967 S Ii:1:007:1 -115:8 4 <
f72973c0 1419299941 C Ii:1:007:1 0:8 4 = 00ff0000
f72973c0 1419299962 S Ii:1:007:1 -115:8 4 <
f72973c0 1419307938 C Ii:1:007:1 0:8 4 = 00ff0000
f72973c0 1419307957 S Ii:1:007:1 -115:8 4 <
f72973c0 1419315938 C Ii:1:007:1 0:8 4 = 00feff00
f72973c0 1419315963 S Ii:1:007:1 -115:8 4 <
f72973c0 1419323965 C Ii:1:007:1 0:8 4 = 00feff00
f72973c0 1419324017 S Ii:1:007:1 -115:8 4 <
f72973c0 1419331941 C Ii:1:007:1 0:8 4 = 00fdff00
f72973c0 1419331966 S Ii:1:007:1 -115:8 4 <
f72973c0 1419339954 C Ii:1:007:1 0:8 4 = 00fdff00
f72973c0 1419339975 S Ii:1:007:1 -115:8 4 <
f72973c0 1419347959 C Ii:1:007:1 0:8 4 = 00feff00
f72973c0 1419347986 S Ii:1:007:1 -115:8 4 <
f72973c0 1419355944 C Ii:1:007:1 0:8 4 = 00ff0000
f72973c0 1419355970 S Ii:1:007:1 -115:8 4 <
f72973c0 1419363938 C Ii:1:007:1 0:8 4 = 0000ff00
f72973c0 1419363963 S Ii:1:007:1 -115:8 4 <
f72f3140 1419411928 S Bo:1:008:2 -115 31 = 55534243 1b690000 00000000 00000600 00000000 00000000 00000000 000000
f72f3140 1419412062 C Bo:1:008:2 0 31 >
f72f3140 1419412092 S Bi:1:008:2 -115 13 <
f72f3140 1419413579 C Bi:1:008:2 0 13 = 55534253 1b690000 00000000 01
f72f3140 1419413592 S Bo:1:008:2 -115 31 = 55534243 1c690000 12000000 80000603 00000012 00000000 00000000 000000
f72f3140 1419413686 C Bo:1:008:2 0 31 >
f23e7840 1419413716 S Bi:1:008:2 -115 18 <
f23e7840 1419415071 C Bi:1:008:2 0 18 = 70000200 0000000a 00000000 3a000000 0000
f72f3140 1419415084 S Bi:1:008:2 -115 13 <
f72f3140 1419415828 C Bi:1:008:2 0 13 = 55534253 1c690000 00000000 00
f72f3140 1419415880 S Bo:1:008:2 -115 31 = 55534243 1d690000 00000000 00000600 00000000 00000000 00000000 000000
f72f3140 1419415937 C Bo:1:008:2 0 31 >
f72f3140 1419415963 S Bi:1:008:2 -115 13 <
f72f3140 1419417061 C Bi:1:008:2 0 13 = 55534253 1d690000 00000000 01
f72f3140 1419417086 S Bo:1:008:2 -115 31 = 55534243 1e690000 12000000 80000603 00000012 00000000 00000000 000000
f72f3140 1419417186 C Bo:1:008:2 0 31 >
f03493c0 1419417217 S Bi:1:008:2 -115 18 <
f03493c0 1419418690 C Bi:1:008:2 0 18 = 70000200 0000000a 00000000 3a000000 0000
f72f3140 1419418706 S Bi:1:008:2 -115 13 <
f72f3140 1419419455 C Bi:1:008:2 0 13 = 55534253 1e690000 00000000 00
f72f3140 1419419534 S Bo:1:008:2 -115 31 = 55534243 1f690000 00000000 0000061e 00000001 00000000 00000000 000000
f72f3140 1419419691 C Bo:1:008:2 0 31 >
f72f3140 1419419705 S Bi:1:008:2 -115 13 <
f72f3140 1419420703 C Bi:1:008:2 0 13 = 55534253 1f690000 00000000 01
f72f3140 1419420714 S Bo:1:008:2 -115 31 = 55534243 20690000 12000000 80000603 00000012 00000000 00000000 000000
f72f3140 1419420812 C Bo:1:008:2 0 31 >
f6e2c640 1419420838 S Bi:1:008:2 -115 18 <
f6e2c640 1419422204 C Bi:1:008:2 0 18 = 70000200 0000000a 00000000 3a000000 0000
f72f3140 1419422214 S Bi:1:008:2 -115 13 <
f72f3140 1419422940 C Bi:1:008:2 0 13 = 55534253 20690000 00000000 00
f72f3140 1419422983 S Bo:1:008:2 -115 31 = 55534243 21690000 00000000 0000061e 00000000 00000000 00000000 000000
f72f3140 1419423074 C Bo:1:008:2 0 31 >
f72f3140 1419423085 S Bi:1:008:2 -115 13 <
f72f3140 1419424186 C Bi:1:008:2 0 13 = 55534253 21690000 00000000 01
f72f3140 1419424214 S Bo:1:008:2 -115 31 = 55534243 22690000 12000000 80000603 00000012 00000000 00000000 000000
f72f3140 1419424328 C Bo:1:008:2 0 31 >
f6e2c640 1419424339 S Bi:1:008:2 -115 18 <
f6e2c640 1419425578 C Bi:1:008:2 0 18 = 70000200 0000000a 00000000 3a000000 0000
f72f3140 1419425591 S Bi:1:008:2 -115 13 <
f72f3140 1419426436 C Bi:1:008:2 0 13 = 55534253 22690000 00000000 00
f72f3140 1419426474 S Bo:1:008:2 -115 31 = 55534243 23690000 00000000 00000600 00000000 00000000 00000000 000000
f72f3140 1419426563 C Bo:1:008:2 0 31 >
f72f3140 1419426574 S Bi:1:008:2 -115 13 <
f72f3140 1419427687 C Bi:1:008:2 0 13 = 55534253 23690000 00000000 01
f72f3140 1419427702 S Bo:1:008:2 -115 31 = 55534243 24690000 12000000 80000603 00000012 00000000 00000000 000000
f72f3140 1419427815 C Bo:1:008:2 0 31 >
f6e2c640 1419427827 S Bi:1:008:2 -115 18 <
f6e2c640 1419429315 C Bi:1:008:2 0 18 = 70000200 0000000a 00000000 3a000000 0000
f72f3140 1419429328 S Bi:1:008:2 -115 13 <
f72f3140 1419430065 C Bi:1:008:2 0 13 = 55534253 24690000 00000000 00
f72f3140 1419430710 S Bo:1:008:2 -115 31 = 55534243 25690000 00000000 00010600 00000000 00000000 00000000 000000
f72f3140 1419430829 C Bo:1:008:2 0 31 >
f72f3140 1419430840 S Bi:1:008:2 -115 13 <
f72f3140 1419432312 C Bi:1:008:2 0 13 = 55534253 25690000 00000000 01
f72f3140 1419432339 S Bo:1:008:2 -115 31 = 55534243 26690000 12000000 80010603 00000012 00000000 00000000 000000
f72f3140 1419432454 C Bo:1:008:2 0 31 >
f03493c0 1419432465 S Bi:1:008:2 -115 18 <
f03493c0 1419433812 C Bi:1:008:2 0 18 = 70000200 0000000a 00000000 3a000000 0000
f72f3140 1419433825 S Bi:1:008:2 -115 13 <
f72f3140 1419434579 C Bi:1:008:2 0 13 = 55534253 26690000 00000000 00
f72f3140 1419434625 S Bo:1:008:2 -115 31 = 55534243 27690000 00000000 00010600 00000000 00000000 00000000 000000
f72f3140 1419434687 C Bo:1:008:2 0 31 >
f72f3140 1419434700 S Bi:1:008:2 -115 13 <
f72f3140 1419435829 C Bi:1:008:2 0 13 = 55534253 27690000 00000000 01
f72f3140 1419435841 S Bo:1:008:2 -115 31 = 55534243 28690000 12000000 80010603 00000012 00000000 00000000 000000
f72f3140 1419435937 C Bo:1:008:2 0 31 >
f23e7840 1419435964 S Bi:1:008:2 -115 18 <
f23e7840 1419437328 C Bi:1:008:2 0 18 = 70000200 0000000a 00000000 3a000000 0000
f72f3140 1419437338 S Bi:1:008:2 -115 13 <
f72f3140 1419438066 C Bi:1:008:2 0 13 = 55534253 28690000 00000000 00
f72f3140 1419438111 S Bo:1:008:2 -115 31 = 55534243 29690000 00000000 0001061e 00000001 00000000 00000000 000000
f72f3140 1419438191 C Bo:1:008:2 0 31 >
f72f3140 1419438201 S Bi:1:008:2 -115 13 <
f72f3140 1419439442 C Bi:1:008:2 0 13 = 55534253 29690000 00000000 01
f72f3140 1419439458 S Bo:1:008:2 -115 31 = 55534243 2a690000 12000000 80010603 00000012 00000000 00000000 000000
f72f3140 1419439567 C Bo:1:008:2 0 31 >
f23e7840 1419439578 S Bi:1:008:2 -115 18 <
f23e7840 1419440812 C Bi:1:008:2 0 18 = 70000200 0000000a 00000000 3a000000 0000
f72f3140 1419440826 S Bi:1:008:2 -115 13 <
f72f3140 1419441690 C Bi:1:008:2 0 13 = 55534253 2a690000 00000000 00
f72f3140 1419441722 S Bo:1:008:2 -115 31 = 55534243 2b690000 00000000 0001061e 00000000 00000000 00000000 000000
f72f3140 1419441812 C Bo:1:008:2 0 31 >
f72f3140 1419441826 S Bi:1:008:2 -115 13 <
f72f3140 1419442937 C Bi:1:008:2 0 13 = 55534253 2b690000 00000000 01
f72f3140 1419442966 S Bo:1:008:2 -115 31 = 55534243 2c690000 12000000 80010603 00000012 00000000 00000000 000000
f72f3140 1419443078 C Bo:1:008:2 0 31 >
f6ee00c0 1419443089 S Bi:1:008:2 -115 18 <
f72973c0 1419443938 C Ii:1:007:1 0:8 4 = 01000000
f72973c0 1419443972 S Ii:1:007:1 -115:8 4 <
f6ee00c0 1419444312 C Bi:1:008:2 0 18 = 70000200 0000000a 00000000 3a000000 0000
f72f3140 1419444337 S Bi:1:008:2 -115 13 <
f72f3140 1419445187 C Bi:1:008:2 0 13 = 55534253 2c690000 00000000 00
f72f3140 1419445230 S Bo:1:008:2 -115 31 = 55534243 2d690000 00000000 00010600 00000000 00000000 00000000 000000
f72f3140 1419445316 C Bo:1:008:2 0 31 >
f72f3140 1419445325 S Bi:1:008:2 -115 13 <
f72f3140 1419446315 C Bi:1:008:2 0 13 = 55534253 2d690000 00000000 01
f72f3140 1419446326 S Bo:1:008:2 -115 31 = 55534243 2e690000 12000000 80010603 00000012 00000000 00000000 000000
f72f3140 1419446437 C Bo:1:008:2 0 31 >
f6e2c640 1419446451 S Bi:1:008:2 -115 18 <
f6e2c640 1419448067 C Bi:1:008:2 0 18 = 70000200 0000000a 00000000 3a000000 0000
f72f3140 1419448082 S Bi:1:008:2 -115 13 <
f72f3140 1419448940 C Bi:1:008:2 0 13 = 55534253 2e690000 00000000 00
f72973c0 1419579962 C Ii:1:007:1 0:8 4 = 00000000
f72973c0 1419580002 S Ii:1:007:1 -115:8 4 <
f72973c0 1419707970 C Ii:1:007:1 0:8 4 = 00010000
f72973c0 1419708030 S Ii:1:007:1 -115:8 4 <
f72973c0 1419723943 C Ii:1:007:1 0:8 4 = 00010000
f72973c0 1419723997 S Ii:1:007:1 -115:8 4 <
f72973c0 1419731949 C Ii:1:007:1 0:8 4 = 00010000
f72973c0 1419731998 S Ii:1:007:1 -115:8 4 <
f72973c0 1419739943 C Ii:1:007:1 0:8 4 = 0000ff00
f72973c0 1419739995 S Ii:1:007:1 -115:8 4 <
f72973c0 1419747942 C Ii:1:007:1 0:8 4 = 00010000
f72973c0 1419747990 S Ii:1:007:1 -115:8 4 <
f72973c0 1419755941 C Ii:1:007:1 0:8 4 = 00010000
f72973c0 1419755990 S Ii:1:007:1 -115:8 4 <
f72305c0 1419913950 C Ii:1:009:1 0:8 8 = 01000000 00000000
f72305c0 1419914001 S Ii:1:009:1 -115:8 8 <
f72305c0 1420033962 C Ii:1:009:1 0:8 8 = 00000000 00000000
f72305c0 1420034012 S Ii:1:009:1 -115:8 8 <
f72305c0 1420129943 C Ii:1:009:1 0:8 8 = 01000000 00000000
f72305c0 1420129998 S Ii:1:009:1 -115:8 8 <
f72305c0 1420273954 C Ii:1:009:1 0:8 8 = 01000600 00000000
f72305c0 1420274044 S Ii:1:009:1 -115:8 8 <
