f6e2c340 1412170178 S Ci:1:010:0 s c0 d2 0000 0000 0100 256 <
f6e2c340 1412178693 C Ci:1:010:0 0 256 = 2d2d2d2d 2d2d2d2d 0d0a2056 332e300d 0a20534e 3a55422d 32303039 2e31302e
f6e2c340 1412182647 S Ci:1:010:0 s c0 d2 0000 0000 0100 256 <
f6e2c340 1412191186 C Ci:1:010:0 0 256 = 2d2d2d2d 2d2d2d2d 0d0a2056 332e300d 0a20534e 3a55422d 32303039 2e31302e
f6e2c340 1412193777 S Ci:1:010:0 s 80 06 0100 0000 0012 18 <
f6e2c340 1412193936 C Ci:1:010:0 0 18 = 12010002 ff000040 3c150100 00000102 0001
f6e2c340 1412196671 S Ci:1:010:0 s c0 d2 0000 0000 0100 256 <
f6e2c340 1412205203 C Ci:1:010:0 0 256 = 2d2d2d2d 2d2d2d2d 0d0a2056 332e300d 0a20534e 3a55422d 32303039 2e31302e
f6e2c340 1412211196 S Ci:1:010:0 s c0 d2 0000 0000 0100 256 <
f6e2c340 1412219687 C Ci:1:010:0 0 256 = 2d2d2d2d 2d2d2d2d 0d0a2056 332e300d 0a20534e 3a55422d 32303039 2e31302e
f23e7940 1412223065 S Ci:1:010:0 s c0 d2 0000 0000 0100 256 <
f23e7940 1412231565 C Ci:1:010:0 0 256 = 2d2d2d2d 2d2d2d2d 0d0a2056 332e300d 0a20534e 3a55422d 32303039 2e31302e
f23e7940 1412235075 S Ci:1:010:0 s 80 06 0100 0000 0012 18 <
f23e7940 1412235203 C Ci:1:010:0 0 18 = 12010002 ff000040 3c150100 00000102 0001
f23e7940 1412275326 S Ci:1:010:0 s c0 d2 0000 0000 0100 256 <
f23e7940 1412283832 C Ci:1:010:0 0 256 = 2d2d2d2d 2d2d2d2d 0d0a2056 332e300d 0a20534e 3a55422d 32303039 2e31302e
f23e7940 1412287347 S Ci:1:010:0 s c0 d2 0000 0000 0100 256 <
f23e7940 1412295828 C Ci:1:010:0 0 256 = 2d2d2d2d 2d2d2d2d 0d0a2056 332e300d 0a20534e 3a55422d 32303039 2e31302e
f23e7940 1412299307 S Ci:1:010:0 s 80 06 0100 0000 0012 18 <
f23e7940 1412299436 C Ci:1:010:0 0 18 = 12010002 ff000040 3c150100 00000102 0001
f23e7940 1412341988 S Ci:1:010:0 s c0 d2 0000 0000 0100 256 <
f23e7940 1412350566 C Ci:1:010:0 0 256 = 2d2d2d2d 2d2d2d2d 0d0a2056 332e300d 0a20534e 3a55422d 32303039 2e31302e
f6e2c5c0 1412353849 S Ci:1:010:0 s c0 d2 0000 0000 0100 256 <
f6e2c5c0 1412362312 C Ci:1:010:0 0 256 = 2d2d2d2d 2d2d2d2d 0d0a2056 332e300d 0a20534e 3a55422d 32303039 2e31302e
f6e2c5c0 1412365844 S Ci:1:010:0 s 80 06 0100 0000 0012 18 <
f6e2c5c0 1412365936 C Ci:1:010:0 0 18 = 12010002 ff000040 3c150100 00000102 0001
f23e7940 1412408792 S Ci:1:010:0 s c0 d2 0000 0000 0100 256 <
f23e7940 1412417312 C Ci:1:010:0 0 256 = 2d2d2d2d 2d2d2d2d 0d0a2056 332e300d 0a20534e 3a55422d 32303039 2e31302e
f23e7940 1412420871 S Ci:1:010:0 s c0 d2 0000 0000 0100 256 <
f23e7940 1412429453 C Ci:1:010:0 0 256 = 2d2d2d2d 2d2d2d2d 0d0a2056 332e300d 0a20534e 3a55422d 32303039 2e31302e
f6e2c5c0 1412434696 S Ci:1:010:0 s 80 06 0100 0000 0012 18 <
f6e2c5c0 1412434824 C Ci:1:010:0 0 18 = 12010002 ff000040 3c150100 00000102 0001
f6e2c5c0 1412475852 S Ci:1:010:0 s c0 d2 0000 0000 0100 256 <
f6e2c5c0 1412484313 C Ci:1:010:0 0 256 = 2d2d2d2d 2d2d2d2d 0d0a2056 332e300d 0a20534e 3a55422d 32303039 2e31302e
f23e7940 1412487755 S Ci:1:010:0 s c0 d2 0000 0000 0100 256 <
f23e7940 1412496313 C Ci:1:010:0 0 256 = 2d2d2d2d 2d2d2d2d 0d0a2056 332e300d 0a20534e 3a55422d 32303039 2e31302e
f6e2c340 1412501589 S Ci:1:010:0 s 80 06 0100 0000 0012 18 <
f6e2c340 1412501689 C Ci:1:010:0 0 18 = 12010002 ff000040 3c150100 00000102 0001
f6e2c340 1412542426 S Ci:1:010:0 s c0 d2 0000 0000 0100 256 <
f6e2c340 1412550939 C Ci:1:010:0 0 256 = 2d2d2d2d 2d2d2d2d 0d0a2056 332e300d 0a20534e 3a55422d 32303039 2e31302e
f6e2c340 1412554446 S Ci:1:010:0 s c0 d2 0000 0000 0100 256 <
f6e2c340 1412562936 C Ci:1:010:0 0 256 = 2d2d2d2d 2d2d2d2d 0d0a2056 332e300d 0a20534e 3a55422d 32303039 2e31302e
f6e2c340 1412566522 S Ci:1:010:0 s 80 06 0100 0000 0012 18 <
f6e2c340 1412566686 C Ci:1:010:0 0 18 = 12010002 ff000040 3c150100 00000102 0001
f6e2c340 1412608421 S Ci:1:010:0 s c0 d2 0000 0000 0100 256 <
f6e2c340 1412616944 C Ci:1:010:0 0 256 = 2d2d2d2d 2d2d2d2d 0d0a2056 332e300d 0a20534e 3a55422d 32303039 2e31302e
f6e2c340 1412619620 S Ci:1:010:0 s c0 d2 0000 0000 0100 256 <
f6e2c340 1412628066 C Ci:1:010:0 0 256 = 2d2d2d2d 2d2d2d2d 0d0a2056 332e300d 0a20534e 3a55422d 32303039 2e31302e
f6e2c340 1412631620 S Ci:1:010:0 s 80 06 0100 0000 0012 18 <
f6e2c340 1412631685 C Ci:1:010:0 0 18 = 12010002 ff000040 3c150100 00000102 0001
f6e2c340 1412674027 S Ci:1:010:0 s c0 d2 0000 0000 0100 256 <
f6e2c340 1412682580 C Ci:1:010:0 0 256 = 2d2d2d2d 2d2d2d2d 0d0a2056 332e300d 0a20534e 3a55422d 32303039 2e31302e
f6e2c340 1412686046 S Ci:1:010:0 s c0 d2 0000 0000 0100 256 <
f6e2c340 1412694689 C Ci:1:010:0 0 256 = 2d2d2d2d 2d2d2d2d 0d0a2056 332e300d 0a20534e 3a55422d 32303039 2e31302e
f6e2c340 1412698032 S Ci:1:010:0 s 80 06 0100 0000 0012 18 <
f6e2c340 1412698186 C Ci:1:010:0 0 18 = 12010002 ff000040 3c150100 00000102 0001
f6e2c340 1412740545 S Ci:1:010:0 s c0 d2 0000 0000 0100 256 <
f6e2c340 1412749061 C Ci:1:010:0 0 256 = 2d2d2d2d 2d2d2d2d 0d0a2056 332e300d 0a20534e 3a55422d 32303039 2e31302e
f6e2c340 1412752509 S Ci:1:010:0 s c0 d2 0000 0000 0100 256 <
f6e2c340 1412760936 C Ci:1:010:0 0 256 = 2d2d2d2d 2d2d2d2d 0d0a2056 332e300d 0a20534e 3a55422d 32303039 2e31302e
f6e2c340 1412764490 S Ci:1:010:0 s 80 06 0100 0000 0012 18 <
f6e2c340 1412764565 C Ci:1:010:0 0 18 = 12010002 ff000040 3c150100 00000102 0001
f6e2c340 1415232298 S Ci:1:010:0 s c0 d2 0000 0000 0100 256 <
f6e2c340 1415240820 C Ci:1:010:0 0 256 = 2d2d2d2d 2d2d2d2d 0d0a2056 332e300d 0a20534e 3a55422d 32303039 2e31302e
f6e2c340 1415244751 S Ci:1:010:0 s c0 d2 0000 0000 0100 256 <
f6e2c340 1415253331 C Ci:1:010:0 0 256 = 2d2d2d2d 2d2d2d2d 0d0a2056 332e300d 0a20534e 3a55422d 32303039 2e31302e
f6e2c340 1415256715 S Ci:1:010:0 s 80 06 0100 0000 0012 18 <
f6e2c340 1415256814 C Ci:1:010:0 0 18 = 12010002 ff000040 3c150100 00000102 0001
f6e2c340 1415259615 S Ci:1:010:0 s c0 d2 0000 0000 0100 256 <
f6e2c340 1415268187 C Ci:1:010:0 0 256 = 2d2d2d2d 2d2d2d2d 0d0a2056 332e300d 0a20534e 3a55422d 32303039 2e31302e
f6e2c640 1415273947 S Co:1:010:0 s 40 c0 0000 0000 0000 0
f6e2c640 1415274691 C Co:1:010:0 0 0
f6e2c640 1415281661 S Co:1:010:0 s 40 c2 0001 0000 0000 0
f6e2c640 1415282810 C Co:1:010:0 0 0
f6e2c640 1415286190 S Co:1:010:0 s 40 b6 0080 0000 0000 0
f6e2c640 1415287311 C Co:1:010:0 0 0
f24779c0 1415289410 S Co:1:010:0 s 40 b5 0080 0000 0000 0
f24779c0 1415290565 C Co:1:010:0 0 0
f6e2c640 1415294455 S Co:1:010:0 s 40 b9 0000 0000 0010 16 = 01020304 05060708 090a0b0c 0d0e0f10
f6e2c640 1415295685 C Co:1:010:0 0 16 >
f24779c0 1415298353 S Co:1:010:0 s 40 cd 0000 0000 0000 0
f24779c0 1415299570 C Co:1:010:0 0 0
f24779c0 1415302382 S Co:1:010:0 s 40 d3 0001 0000 0000 0
f24779c0 1415303574 C Co:1:010:0 0 0
f6e2c640 1415306421 S Co:1:010:0 s 40 ca 0001 0000 0000 0
f6e2c640 1415306559 C Co:1:010:0 0 0
f24779c0 1415309355 S Co:1:010:0 s 40 c8 0000 0000 0010 16 = 00000000 00000000 00000000 00000000
f24779c0 1415310692 C Co:1:010:0 0 16 >
f24779c0 1415313414 S Ci:1:010:0 s c0 cf 0000 0000 0001 1 <
f24779c0 1415313566 C Ci:1:010:0 0 1 = 01
f6e2c640 1415316425 S Co:1:010:0 s 40 bf 0000 0000 0000 0
f6e2c640 1415317186 C Co:1:010:0 0 0
f6e2c640 1415318444 S Ci:1:010:0 s c0 cf 0000 0000 0001 1 <
f6e2c640 1415318564 C Ci:1:010:0 0 1 = 01
f6e2c640 1415321369 S Co:1:010:0 s 40 be 0000 0000 0000 0
f6e2c640 1415322067 C Co:1:010:0 0 0
f6e2c340 1415324380 S Co:1:010:0 s 40 cb 0000 0000 0007 7 = 03510002 00ff07
f6e2c340 1415337812 C Co:1:010:0 0 7 >
f6e2c340 1415346414 S Co:1:010:0 s 40 c6 0001 0000 0090 144 = 00000000 0000f03f 00000000 00000000 00000000 00000000 00000000 00000000
f6e2c340 1415348937 C Co:1:010:0 0 144 >
f6e2c340 1415351407 S Co:1:010:0 s 40 c7 0001 0000 0090 144 = 00000000 0000f03f 00000000 00000000 00000000 00000000 00000000 00000000
f6e2c340 1415353942 C Co:1:010:0 0 144 >
f6e2c340 1415356330 S Co:1:010:0 s 40 c6 0002 0000 0090 144 = 00000000 0000f03f 00000000 00000000 00000000 00000000 00000000 00000000
f6e2c340 1415358936 C Co:1:010:0 0 144 >
f6e2c340 1415361391 S Co:1:010:0 s 40 c7 0002 0000 0090 144 = 00000000 0000f03f 00000000 00000000 00000000 00000000 00000000 00000000
f6e2c340 1415363942 C Co:1:010:0 0 144 >
f6e2c340 1415366464 S Co:1:010:0 s 40 c6 0003 0000 0090 144 = 00000000 0000f03f 00000000 00000000 00000000 00000000 00000000 00000000
f6e2c340 1415368936 C Co:1:010:0 0 144 >
f6e2c340 1415371371 S Co:1:010:0 s 40 c7 0003 0000 0090 144 = 00000000 0000f03f 00000000 00000000 00000000 00000000 00000000 00000000
f6e2c340 1415373944 C Co:1:010:0 0 144 >
f03493c0 1415376414 S Co:1:010:0 s 40 c6 0004 0000 0090 144 = 00000000 0000f03f 00000000 00000000 00000000 00000000 00000000 00000000
f03493c0 1415378953 C Co:1:010:0 0 144 >
f03493c0 1415381354 S Co:1:010:0 s 40 c7 0004 0000 0090 144 = 00000000 0000f03f 00000000 00000000 00000000 00000000 00000000 00000000
f03493c0 1415383940 C Co:1:010:0 0 144 >
f03493c0 1415386421 S Co:1:010:0 s 40 c6 0005 0000 0090 144 = 00000000 0000f03f 00000000 00000000 00000000 00000000 00000000 00000000
f03493c0 1415388954 C Co:1:010:0 0 144 >
f03493c0 1415391468 S Co:1:010:0 s 40 c7 0005 0000 0090 144 = 00000000 0000f03f 00000000 00000000 00000000 00000000 00000000 00000000
f03493c0 1415394066 C Co:1:010:0 0 144 >
f03493c0 1415396386 S Co:1:010:0 s 40 c6 0006 0000 0090 144 = 00000000 0000f03f 00000000 00000000 00000000 00000000 00000000 00000000
f03493c0 1415398936 C Co:1:010:0 0 144 >
f03493c0 1415401433 S Co:1:010:0 s 40 c7 0006 0000 0090 144 = 00000000 0000f03f 00000000 00000000 00000000 00000000 00000000 00000000
f03493c0 1415403941 C Co:1:010:0 0 144 >
f6e2c340 1415406430 S Co:1:010:0 s 40 c6 0007 0000 0090 144 = 00000000 0000f03f 00000000 00000000 00000000 00000000 00000000 00000000
f6e2c340 1415408937 C Co:1:010:0 0 144 >
f6e2c340 1415411413 S Co:1:010:0 s 40 c7 0007 0000 0090 144 = 00000000 0000f03f 00000000 00000000 00000000 00000000 00000000 00000000
f6e2c340 1415413937 C Co:1:010:0 0 144 >
f6e2c340 1415416425 S Co:1:010:0 s 40 c6 0008 0000 0090 144 = 00000000 0000f03f 00000000 00000000 00000000 00000000 00000000 00000000
f6e2c340 1415418957 C Co:1:010:0 0 144 >
f6e2c340 1415423410 S Co:1:010:0 s 40 c7 0008 0000 0090 144 = 00000000 0000f03f 00000000 00000000 00000000 00000000 00000000 00000000
f6e2c340 1415425939 C Co:1:010:0 0 144 >
f6e2c340 1415428347 S Co:1:010:0 s 40 c6 0009 0000 0090 144 = 00000000 0000f03f 00000000 00000000 00000000 00000000 00000000 00000000
f6e2c340 1415430953 C Co:1:010:0 0 144 >
f6e2c340 1415433396 S Co:1:010:0 s 40 c7 0009 0000 0090 144 = 00000000 0000f03f 00000000 00000000 00000000 00000000 00000000 00000000
f6e2c340 1415435940 C Co:1:010:0 0 144 >
f6e2c340 1415438443 S Co:1:010:0 s 40 c6 000a 0000 0090 144 = 00000000 0000f03f 00000000 00000000 00000000 00000000 00000000 00000000
f6e2c340 1415440948 C Co:1:010:0 0 144 >
f6e2c340 1415443373 S Co:1:010:0 s 40 c7 000a 0000 0090 144 = 00000000 0000f03f 00000000 00000000 00000000 00000000 00000000 00000000
f6e2c340 1415445940 C Co:1:010:0 0 144 >
f03493c0 1415448420 S Co:1:010:0 s 40 c6 000b 0000 0090 144 = 00000000 0000f03f 00000000 00000000 00000000 00000000 00000000 00000000
f03493c0 1415450952 C Co:1:010:0 0 144 >
f03493c0 1415453353 S Co:1:010:0 s 40 c7 000b 0000 0090 144 = 00000000 0000f03f 00000000 00000000 00000000 00000000 00000000 00000000
f03493c0 1415455955 C Co:1:010:0 0 144 >
f03493c0 1415458403 S Co:1:010:0 s 40 c6 000c 0000 0090 144 = 00000000 0000f03f 00000000 00000000 00000000 00000000 00000000 00000000
f03493c0 1415460939 C Co:1:010:0 0 144 >
f03493c0 1415463470 S Co:1:010:0 s 40 c7 000c 0000 0090 144 = 00000000 0000f03f 00000000 00000000 00000000 00000000 00000000 00000000
f03493c0 1415466070 C Co:1:010:0 0 144 >
f03493c0 1415468367 S Co:1:010:0 s 40 c6 000d 0000 0090 144 = 00000000 0000f03f 00000000 00000000 00000000 00000000 00000000 00000000
f03493c0 1415470940 C Co:1:010:0 0 144 >
f03493c0 1415473430 S Co:1:010:0 s 40 c7 000d 0000 0090 144 = 00000000 0000f03f 00000000 00000000 00000000 00000000 00000000 00000000
f03493c0 1415475941 C Co:1:010:0 0 144 >
f03493c0 1415478428 S Co:1:010:0 s 40 c6 000e 0000 0090 144 = 00000000 0000f03f 00000000 00000000 00000000 00000000 00000000 00000000
f03493c0 1415480937 C Co:1:010:0 0 144 >
f03493c0 1415486387 S Co:1:010:0 s 40 c7 000e 0000 0090 144 = 00000000 0000f03f 00000000 00000000 00000000 00000000 00000000 00000000
f03493c0 1415488942 C Co:1:010:0 0 144 >
f03493c0 1415491304 S Co:1:010:0 s 40 c6 000f 0000 0090 144 = 00000000 0000f03f 00000000 00000000 00000000 00000000 00000000 00000000
f03493c0 1415493811 C Co:1:010:0 0 144 >
f03493c0 1415496528 S Co:1:010:0 s 40 c7 000f 0000 0090 144 = 00000000 0000f03f 00000000 00000000 00000000 00000000 00000000 00000000
f03493c0 1415499066 C Co:1:010:0 0 144 >
f03493c0 1415501281 S Co:1:010:0 s 40 c6 0010 0000 0090 144 = 00000000 0000f03f 00000000 00000000 00000000 00000000 00000000 00000000
f03493c0 1415503815 C Co:1:010:0 0 144 >
f23e7840 1415506352 S Co:1:010:0 s 40 c7 0010 0000 0090 144 = 00000000 0000f03f 00000000 00000000 00000000 00000000 00000000 00000000
f23e7840 1415508815 C Co:1:010:0 0 144 >
f23e7840 1415510466 S Ci:1:010:0 s c0 d2 0000 0000 0100 256 <
f23e7840 1415518940 C Ci:1:010:0 0 256 = 2d2d2d2d 2d2d2d2d 0d0a2056 332e300d 0a20534e 3a55422d 32303039 2e31302e
