efd6bf40 379352546 C Ii:2:003:6 0:1 544 = 56be2d44 04b3d242 2ee6f043 68385a44 caaf5543 0a450543 5ceed643 8fa45e43
efd6bf40 379365651 S Ii:2:003:6 -115:1 544 <
efd6bf40 379415033 C Ii:2:003:6 0:1 544 = 56632c44 0107c842 374eee43 bb9a5844 d9e34f43 1045ff42 88a7d343 43d45843
efd6bf40 379419660 S Ii:2:003:6 -115:1 544 <
efd6bf40 379477543 C Ii:2:003:6 0:1 544 = 177f2e44 0c53d842 2606f243 4e175b44 4e7d5b43 ede60a43 2a60d943 69fe6343
efd6bf40 379484324 S Ii:2:003:6 -115:1 544 <
efd6bf40 379540026 C Ii:2:003:6 0:1 544 = 79dc3144 9e51f442 9b79f943 33645e44 f4736943 826f1843 5ebce043 fc127343
efd6bf40 379550695 S Ii:2:003:6 -115:1 544 <
efd6bf40 379602526 C Ii:2:003:6 0:1 544 = 9eaf4b44 d6fe6143 30811644 119d7844 23a9a743 57157f43 62df0944 c0dcac43
efd6bf40 379611694 S Ii:2:003:6 -115:1 544 <
efd6bf40 379665031 C Ii:2:003:6 0:1 544 = 6ea94b44 9e706143 c4621644 f20c7844 2830a643 0f187c43 b71a0944 32e5aa43
efd6bf40 379670315 S Ii:2:003:6 -115:1 544 <
efd6bf40 379727529 C Ii:2:003:6 0:1 544 = b5fe4944 2cea5b43 02161544 cc8b7644 3ecba343 2e5f7743 14bd0744 ebe3a843
efd6bf40 379735652 S Ii:2:003:6 -115:1 544 <
efd6bf40 379790030 C Ii:2:003:6 0:1 544 = 4ae04944 65385c43 da001544 8ff17644 3ec2a443 0e1d7943 6a470844 c886a943
efd6bf40 379806672 S Ii:2:003:6 -115:1 544 <
efd6bf40 379852543 C Ii:2:003:6 0:1 544 = b1282e44 dfc0d642 4ffef143 343c5b44 2d4a5a43 86610943 05fbd843 e34c6343
efd6bf40 379866677 S Ii:2:003:6 -115:1 544 <
efd6bf40 379915034 C Ii:2:003:6 0:1 544 = bde02b44 05a6c442 a0abec43 20715844 42b64e43 4a91fd42 dd42d343 1c535843
efd6b4c0 379925530 S Ii:2:003:6 -115:1 544 <
efd6b4c0 379977547 C Ii:2:003:6 0:1 544 = 2c2d2f44 a32be042 4c3ff343 95795b44 174b5943 a31a0943 b48ed843 e2796343
efd6b4c0 379990429 S Ii:2:003:6 -115:1 544 <
efd6b4c0 380040031 C Ii:2:003:6 0:1 544 = 3dfb2f44 50fce442 fb6cf543 ecd85c44 ee715f43 fca20f43 2cb3db43 64ae6843
efd6b4c0 380050698 S Ii:2:003:6 -115:1 544 <
efd6b4c0 380102525 C Ii:2:003:6 0:1 544 = 7e1a4c44 0f3b6443 c8d71644 09777944 13e6a843 b9a98043 d1530a44 57faad43
efd6b4c0 380114191 S Ii:2:003:6 -115:1 544 <
efd6b4c0 380165023 C Ii:2:003:6 0:1 544 = 1eba4c44 a31b6643 fb661744 b8817944 e609a943 4e6c8143 50970a44 d359ae43
efd6b4c0 380174676 S Ii:2:003:6 -115:1 544 <
efd6b4c0 380227542 C Ii:2:003:6 0:1 544 = 35e04a44 89d95e43 f2af1544 855f7744 7b0ca443 d7d27843 b9030844 e751a943
efd6b4c0 380237762 S Ii:2:003:6 -115:1 544 <
efd6b4c0 380290039 C Ii:2:003:6 0:1 544 = dd6f4a44 89ef5d43 334c1544 d5ff7644 66faa343 39c17843 dc1e0844 a359a943
efd6b4c0 380298684 S Ii:2:003:6 -115:1 544 <
efd6b4c0 380352523 C Ii:2:003:6 0:1 544 = 828c2d44 3029d342 22d0f043 21925a44 91865543 73d70743 7abbd743 badd6043
efd6b4c0 380358675 S Ii:2:003:6 -115:1 544 <
efd6b4c0 380415028 C Ii:2:003:6 0:1 544 = be812d44 fd32d242 73bbf043 c8a55a44 56ea5643 b9b50743 ccdad743 692b6043
efd6b4c0 380428251 S Ii:2:003:6 -115:1 544 <
efd6b4c0 380477546 C Ii:2:003:6 0:1 544 = 44fe2e44 b550dc42 6f47f343 a6715b44 dcea5943 13df0943 8418d943 bf746443
efd6b4c0 380490702 S Ii:2:003:6 -115:1 544 <
efd6b4c0 380540033 C Ii:2:003:6 0:1 544 = 24d92e44 9f04dc42 e394f243 f9da5a44 c7715843 03610943 dea6d843 389b6243
efd6b4c0 380547645 S Ii:2:003:6 -115:1 544 <
efd6b4c0 380602523 C Ii:2:003:6 0:1 544 = 3b774c44 41ea6443 08221744 70107944 521ba843 ec488043 88370a44 e764ad43
efd6b4c0 380608603 S Ii:2:003:6 -115:1 544 <
efd6b4c0 380665024 C Ii:2:003:6 0:1 544 = 62e54c44 66286743 59fb1744 5d467a44 f82daa43 4ab78243 734e0b44 430bb043
eb02de40 380675662 S Ii:2:003:6 -115:1 544 <
eb02de40 380727524 C Ii:2:003:6 0:1 544 = 466b4a44 30af5c43 4a0f1544 02fe7644 15b0a443 a8807943 69950844 9163a943
eb02de40 380735521 S Ii:2:003:6 -115:1 544 <
eb02de40 380790026 C Ii:2:003:6 0:1 544 = fd4b4944 8e985843 d0f31344 ebb87544 3affa143 caf47343 15230744 01e8a643
eb02de40 380795651 S Ii:2:003:6 -115:1 544 <
eb02de40 380852545 C Ii:2:003:6 0:1 544 = 7f882e44 8eb8d842 65f7f143 3dcc5a44 4c745843 bd680843 8361d843 273c6243
eb02de40 380865929 S Ii:2:003:6 -115:1 544 <
eb02de40 380915024 C Ii:2:003:6 0:1 544 = 507c2f44 60cbe142 766bf443 3e5f5c44 0e995f43 e8920f43 31c3db43 14496843
eb02de40 380934700 S Ii:2:003:6 -115:1 544 <
eb02de40 380977524 C Ii:2:003:6 0:1 544 = ac532f44 3ebade42 95f4f343 7b455c44 3bf05d43 19300e43 0ae9da43 39196843
eb02de40 380986697 S Ii:2:003:6 -115:1 544 <
eb02de40 381040026 C Ii:2:003:6 0:1 544 = 121b3044 4c7de542 e024f543 eb8d5c44 c77a5f43 bf2f1043 96f7db43 275c6943
eb02de40 381050483 S Ii:2:003:6 -115:1 544 <
eb02de40 381102525 C Ii:2:003:6 0:1 544 = d7924c44 578e6443 31f71644 bfbd7844 6cc2a743 2e9a7e43 29ea0944 6e07ad43
eb02de40 381113504 S Ii:2:003:6 -115:1 544 <
eb02de40 381165043 C Ii:2:003:6 0:1 544 = a99c4c44 36086743 40591744 f04f7944 5adda843 4e4f8143 83990a44 5232ae43
eb02de40 381183675 S Ii:2:003:6 -115:1 544 <
eb02de40 381227533 C Ii:2:003:6 0:1 544 = 9c974b44 e5fd6143 0d6e1644 81aa7844 554fa743 7a177f43 99bf0944 feabac43
eb02de40 381236381 S Ii:2:003:6 -115:1 544 <
eb02de40 381290047 C Ii:2:003:6 0:1 544 = 2d1b4844 62195443 ccb21244 74ec7444 6370a043 240b7143 85010644 b98aa543
eb02de40 381302672 S Ii:2:003:6 -115:1 544 <
eb02de40 381352526 C Ii:2:003:6 0:1 544 = 0ab22c44 950fcb42 bc8fee43 9ad85844 1d605043 05010043 72b7d343 39235943
efd6bf40 381367094 S Ii:2:003:6 -115:1 544 <
efd6bf40 381415049 C Ii:2:003:6 0:1 544 = 27372d44 695fce42 566cef43 257c5944 bb0f5243 a3640243 b8f9d443 34ad5b43
efd6bf40 381426709 S Ii:2:003:6 -115:1 544 <
efd6bf40 381477533 C Ii:2:003:6 0:1 544 = 82012f44 b62cdc42 a54ff343 f8135c44 118d5d43 a5860c43 e83cda43 3c346643
efd6bf40 381494696 S Ii:2:003:6 -115:1 544 <
efd6bf40 381540026 C Ii:2:003:6 0:1 544 = 75fe3044 0013ed42 93f0f643 2ee55d44 dfc36343 cb0c1343 424edd43 31cd6c43
efd6bf40 381545670 S Ii:2:003:6 -115:1 544 <
efd6bf40 381602526 C Ii:2:003:6 0:1 544 = 2a224344 d3bc3f43 7e790d44 e4ca6f44 73eb9543 eb265b43 03b10044 e2809a43
efd6bf40 381614105 S Ii:2:003:6 -115:1 544 <
efd6bf40 381665023 C Ii:2:003:6 0:1 544 = 5e244d44 e7cc6843 a2a91744 94927944 2d6ca943 2aee8043 756b0a44 26efad43
efd6bf40 381668672 S Ii:2:003:6 -115:1 544 <
efd6bf40 381727530 C Ii:2:003:6 0:1 544 = 1f904a44 bba25f43 1c771544 fd6d7744 3dc9a443 d2af7943 06460844 67cda943
efd6bf40 381740590 S Ii:2:003:6 -115:1 544 <
efd6bf40 381790031 C Ii:2:003:6 0:1 544 = 46b14944 d32e5c43 bba11444 34187744 fa1aa443 a5a47843 0c200844 888ca943
efd6bf40 381798697 S Ii:2:003:6 -115:1 544 <
efd6bf40 381852532 C Ii:2:003:6 0:1 544 = 5b543544 afcb0843 ac63ff43 fa146244 c3c07443 17762443 71f2e543 1b3c7e43
efd6bf40 381856399 S Ii:2:003:6 -115:1 544 <
efd6bf40 381915029 C Ii:2:003:6 0:1 544 = 0d0a2e44 e5c8d742 21f6f043 c47d5a44 8ddb5743 ba9c0743 4ba7d743 e3586143
efd6bf40 381926234 S Ii:2:003:6 -115:1 544 <
efd6bf40 381977543 C Ii:2:003:6 0:1 544 = 54632f44 cf0ce142 7ebaf343 83975b44 15e85c43 ff120c43 5c53da43 31e26543
efd6bf40 381986597 S Ii:2:003:6 -115:1 544 <
efd6bf40 382040025 C Ii:2:003:6 0:1 544 = 00f33044 5145ed42 3df7f643 4dcc5d44 128f6443 8d5f1443 e41fde43 5c7b6d43
efd6bf40 382045414 S Ii:2:003:6 -115:1 544 <
efd6bf40 382102543 C Ii:2:003:6 0:1 544 = 217a3244 e123fa42 c1f1f943 59de5f44 1af56c43 c6bf1b43 d71fe243 53b07543
efd6bf40 382114693 S Ii:2:003:6 -115:1 544 <
efd6bf40 382165044 C Ii:2:003:6 0:1 544 = 71d44c44 51426743 546b1744 d39f7944 a8c2a843 ad468143 247c0a44 ed38ae43
efd6bf40 382181570 S Ii:2:003:6 -115:1 544 <
efd6bf40 382227525 C Ii:2:003:6 0:1 544 = 956f4a44 94eb5d43 67d31444 95177744 4d09a443 5fc87743 ea240844 4cf2a843
efd6bf40 382246697 S Ii:2:003:6 -115:1 544 <
efd6bf40 382290029 C Ii:2:003:6 0:1 544 = db7b4944 cbf45943 791e1444 e3227644 1a41a243 ea7c7443 d62b0744 fd40a743
efd6bf40 382301900 S Ii:2:003:6 -115:1 544 <
efd6bf40 382352526 C Ii:2:003:6 0:1 544 = 61274744 6b265143 3fb71144 99257444 53809e43 f6486d43 f0480544 c7a3a343
efd6bf40 382360538 S Ii:2:003:6 -115:1 544 <
efd6bf40 382415047 C Ii:2:003:6 0:1 544 = def22e44 d9fbdb42 a36cf243 33a85b44 5ccc5b43 e3b40b43 60a3d943 647c6543
efd6bf40 382424138 S Ii:2:003:6 -115:1 544 <
efd6bf40 382477531 C Ii:2:003:6 0:1 544 = ecd22d44 90a2d142 17ecef43 dd095a44 78ab5443 10250443 aefbd543 cd495e43
efd6bf40 382487580 S Ii:2:003:6 -115:1 544 <
efd6bf40 382540028 C Ii:2:003:6 0:1 544 = b9b23044 16e8e942 7e05f643 eb175d44 f5236043 3b910f43 66ecdb43 8c276943
efd6bf40 382553786 S Ii:2:003:6 -115:1 544 <
efd6bf40 382602546 C Ii:2:003:6 0:1 544 = 53933144 29dcf542 86fbf843 bad75e44 11cd6743 9ac41743 8f7bdf43 e30c7143
efd6bf40 382618692 S Ii:2:003:6 -115:1 544 <
efd6bf40 382665033 C Ii:2:003:6 0:1 544 = 3f2a4b44 a0a35f43 c85e1544 e21d7844 14f5a643 2baf7c43 34210944 a190ab43
efd6bf40 382678745 S Ii:2:003:6 -115:1 544 <
efd6bf40 382727526 C Ii:2:003:6 0:1 544 = 9c0b4a44 c0625c43 5b601444 fb837644 dccfa243 be3f7543 53130744 a8b0a743
efd6bf40 382734675 S Ii:2:003:6 -115:1 544 <
efd6bf40 382790028 C Ii:2:003:6 0:1 544 = 5a524844 7db65543 c9ba1244 a5c97444 a38a9f43 ea596f43 07d30544 e1fca443
efd6bf40 382799923 S Ii:2:003:6 -115:1 544 <
efd6bf40 382852526 C Ii:2:003:6 0:1 544 = 6ee54944 3eca5a43 aa121444 f24d7644 10b7a243 dad07543 b11b0744 58b5a743
efd6bf40 382869321 S Ii:2:003:6 -115:1 544 <
efd6bf40 382915039 C Ii:2:003:6 0:1 544 = c7c02e44 30eeda42 312ef243 d6995b44 37c15b43 6f280b43 26f2d843 878c6443
efd6bf40 382932087 S Ii:2:003:6 -115:1 544 <
efd6bf40 382977527 C Ii:2:003:6 0:1 544 = ac512f44 72a1e142 0eb7f343 d31d5c44 c0965c43 c1eb0b43 2196d943 8ccf6543
efd6bf40 382989395 S Ii:2:003:6 -115:1 544 <
efd6bf40 383040032 C Ii:2:003:6 0:1 544 = c4d83144 a43af342 6e38f843 90eb5d44 d6f66443 e2f51443 6d8edd43 d7906e43
efd6bf40 383048591 S Ii:2:003:6 -115:1 544 <
efd6bf40 383102556 C Ii:2:003:6 0:1 544 = 87723144 2ee5f142 8859f843 cb015e44 7b5c6543 0e791443 0990dd43 fc0e6e43
efd6bf40 383109720 S Ii:2:003:6 -115:1 544 <
efd6bf40 383165027 C Ii:2:003:6 0:1 544 = cbdc4b44 4bf86243 eb881644 eadb7844 2ae6a743 25f87f43 d1b10944 2205ad43
efd6bf40 383175673 S Ii:2:003:6 -115:1 544 <
efd6bf40 383227564 C Ii:2:003:6 0:1 544 = 119b4a44 3c9b5e43 031b1544 64777744 4b68a543 1a667b43 75830844 1e57aa43
efd6bf40 383232932 S Ii:2:003:6 -115:1 544 <
efd6bf40 383290029 C Ii:2:003:6 0:1 544 = 3c3c4844 ed025543 d2ab1244 72c97444 24ae9f43 85a86f43 dc730544 618aa443
efd6bf40 383297214 S Ii:2:003:6 -115:1 544 <
efd6bf40 383352524 C Ii:2:003:6 0:1 544 = f1a74944 5e305a43 7e1b1444 0ad97544 92e6a143 85cc7343 6ba50644 ccd2a643
efd6bf40 383365652 S Ii:2:003:6 -115:1 544 <
efd6bf40 383415041 C Ii:2:003:6 0:1 544 = 44c72d44 a619d442 58c1f043 dccd5a44 03575743 3d100843 d219d743 b9ac6043
efd6bf40 383419442 S Ii:2:003:6 -115:1 544 <
efd6bf40 383477527 C Ii:2:003:6 0:1 544 = fa023044 f873e642 6ad3f443 6ae65c44 13026143 9c381243 2bccdb43 7b796a43
efd6bf40 383486648 S Ii:2:003:6 -115:1 544 <
efd6bf40 383540027 C Ii:2:003:6 0:1 544 = ee1c3144 0871ed42 3cedf643 11af5d44 4ba36343 a3be1343 3b0ddd43 28d06c43
efd6bf40 383548155 S Ii:2:003:6 -115:1 544 <
efd6bf40 383602524 C Ii:2:003:6 0:1 544 = 4d243144 7964f042 d54af743 769b5d44 51fd6243 fd071343 3ee9dc43 437f6c43
efd6bf40 383608865 S Ii:2:003:6 -115:1 544 <
efd6bf40 383665043 C Ii:2:003:6 0:1 544 = 1e7c4c44 49776643 d2261744 73d37844 b1ffa743 f7518043 bb9f0944 fcd6ac43
efd6bf40 383674681 S Ii:2:003:6 -115:1 544 <
efd6bf40 383727529 C Ii:2:003:6 0:1 544 = 9fad4b44 e3046443 026f1644 34aa7844 0878a743 cc0a8043 a6560944 248aac43
efd6bf40 383737096 S Ii:2:003:6 -115:1 544 <
efd6bf40 383790029 C Ii:2:003:6 0:1 544 = 71124944 307a5843 e9a31344 bf177644 e71da243 a9207543 2ba60644 6781a743
efd6bf40 383806692 S Ii:2:003:6 -115:1 544 <
efd6bf40 383852528 C Ii:2:003:6 0:1 544 = b3454744 72675143 71b51144 c5d17344 5ad29d43 68f36b43 fcaa0444 aa04a343
efd6bf40 383860752 S Ii:2:003:6 -115:1 544 <
efd6bf40 383915049 C Ii:2:003:6 0:1 544 = 9be62c44 b531cc42 d559ee43 75fc5844 3c085143 55430143 1317d443 e6665a43
efd6bf40 383928877 S Ii:2:003:6 -115:1 544 <
efd6bf40 383977545 C Ii:2:003:6 0:1 544 = d2032f44 4b16de42 e7f0f243 78a95b44 fc9b5b43 a6bd0b43 c7ddd843 da556443
efd6bf40 383987673 S Ii:2:003:6 -115:1 544 <
efd6bf40 384040056 C Ii:2:003:6 0:1 544 = ffae3044 dfc2ec42 0a8df643 f5bd5d44 94f76443 7a661443 5868dd43 b60b6e43
efd6bf40 384058607 S Ii:2:003:6 -115:1 544 <
efd6bf40 384102542 C Ii:2:003:6 0:1 544 = 11ac3244 0e53fa42 675cfa43 893f5f44 75156b43 b5661b43 12e2e043 d1d87343
efd6bf40 384106791 S Ii:2:003:6 -115:1 544 <
efd6bf40 384165030 C Ii:2:003:6 0:1 544 = 78104c44 b1966443 938e1644 32937844 d68fa643 02a87d43 5bf20844 fea2ab43
efd6bf40 384177908 S Ii:2:003:6 -115:1 544 <
efd6bf40 384227534 C Ii:2:003:6 0:1 544 = 5fec4a44 8f645f43 c2821544 81617744 ac7ca543 552f7b43 906e0844 096daa43
efd6bf40 384239443 S Ii:2:003:6 -115:1 544 <
efd6bf40 384290034 C Ii:2:003:6 0:1 544 = e49d4944 43f55a43 55211444 b19f7644 745da343 9ea57843 cebb0744 fbfea843
efd6bf40 384301668 S Ii:2:003:6 -115:1 544 <
efd6bf40 384352527 C Ii:2:003:6 0:1 544 = d18f4744 95d55143 49f81144 77a37444 a75f9f43 1c9e6f43 c46f0544 8885a443
efd6bf40 384365677 S Ii:2:003:6 -115:1 544 <
efd6bf40 384415045 C Ii:2:003:6 0:1 544 = 14a42d44 af4dd142 5e35f043 4d345a44 2ad05543 133c0543 a724d643 ca3e5f43
efd6bf40 384426673 S Ii:2:003:6 -115:1 544 <
efd6bf40 384477546 C Ii:2:003:6 0:1 544 = 04de3044 6dfaed42 bd39f643 2f085d44 3a8b6043 5b2f1143 2b49db43 5e4c6a43
efd6bf40 384498688 S Ii:2:003:6 -115:1 544 <
efd6bf40 384540032 C Ii:2:003:6 0:1 544 = 0ba83044 5919ec42 30a8f643 645c5d44 9b0d6343 64a61343 d874dc43 4e846b43
efd6bf40 384553287 S Ii:2:003:6 -115:1 544 <
efd6bf40 384602526 C Ii:2:003:6 0:1 544 = d6e13144 875af542 3638f943 4ded5e44 17b66843 c7251a43 784ddf43 ff387243
efd6bf40 384610895 S Co:2:003:0 s 40 cb 0000 0000 0007 7 = 03010002 00ff07
efd6b0c0 384616183 S Ii:2:003:6 -115:1 544 <
efd6bf40 384624271 C Co:2:003:0 0 7 >
efd6b0c0 384665028 C Ii:2:003:6 0:1 544 = f0274c44 9d086443 fc6d1644 5d8d7844 9fefa743 cc2b8043 ad870944 b5d9ac43
efd6b0c0 384673973 S Ii:2:003:6 -115:1 544 <
efd6b0c0 384727526 C Ii:2:003:6 0:1 544 = 8b842f44 f11fe242 1c08f443 3d8f5b44 b4885b43 c8c00c43 9dcad843 3a706443
efd6b0c0 384736779 S Ii:2:003:6 -115:1 544 <
efd6b0c0 384790033 C Ii:2:003:6 0:1 544 = 54f90e44 adc78bc1 1421b343 1d703b44 013db542 15f83541 449a9843 f94ac742
efd6b0c0 384797384 S Ii:2:003:6 -115:1 544 <
efd6b0c0 384852528 C Ii:2:003:6 0:1 544 = 34a40c44 384ad8c1 b15bae43 d7843944 5e0fa842 5dd7a640 095a9543 6640b942
efd6b0c0 384858686 S Ii:2:003:6 -115:1 544 <
efd6b0c0 384915025 C Ii:2:003:6 0:1 544 = f0e10d44 80cbb4c1 00c8b043 2fc23a44 192fae42 7c1ffb40 5bc49643 cabbbf42
efd6b0c0 384923036 S Ii:2:003:6 -115:1 544 <
efd6b0c0 384977528 C Ii:2:003:6 0:1 544 = 56330f44 e25593c1 cc28b343 cd7d3b44 5b0eb642 f0c33841 2ec89843 db78c842
efd6b0c0 384991992 S Ii:2:003:6 -115:1 544 <
efd6b0c0 385040030 C Ii:2:003:6 0:1 544 = 93623044 c1fce842 9099f543 588b5c44 49815f43 b5eb0f43 138ada43 34d76843
efd6b0c0 385047322 S Ii:2:003:6 -115:1 544 <
efd6b0c0 385102543 C Ii:2:003:6 0:1 544 = 24ee3244 597bff42 1360fb43 dd975f44 07126b43 10eb1b43 27bfe043 14f17443
efd6b0c0 385114203 S Ii:2:003:6 -115:1 544 <
efd6b0c0 385165029 C Ii:2:003:6 0:1 544 = f1842f44 b44ae142 cdd1f443 cea55c44 f0f35f43 4f031043 0de4da43 fd646943
efd6b0c0 385173932 S Ii:2:003:6 -115:1 544 <
efd6b0c0 385227531 C Ii:2:003:6 0:1 544 = b87e2f44 d5a7e142 dad3f343 58f65b44 66045d43 462d0d43 6cd6d943 d33e6743
efd6b0c0 385234690 S Ii:2:003:6 -115:1 544 <
efd6b0c0 385290030 C Ii:2:003:6 0:1 544 = 47860d44 557ec5c1 e72bb043 b59e3944 994ca842 135c8540 a0b09443 554bba42
efd6b0c0 385297118 S Ii:2:003:6 -115:1 544 <
efd6b0c0 385352549 C Ii:2:003:6 0:1 544 = 9d120c44 bee7eec1 82b7ad43 ea743844 c2ada042 66df56bf 738b9243 3156b142
efd6b0c0 385364789 S Ii:2:003:6 -115:1 544 <
efd6b0c0 385415029 C Ii:2:003:6 0:1 544 = ecc20d44 cb86b4c1 1317b143 f8d13a44 8b26b142 faac1641 e73a9743 4769c242
efd6b0c0 385423986 S Ii:2:003:6 -115:1 544 <
efd6b0c0 385477530 C Ii:2:003:6 0:1 544 = f13c0e44 b17faac1 791bb243 96273b44 9a4eb442 57c52141 bfca9743 734dc542
efd6b0c0 385486677 S Ii:2:003:6 -115:1 544 <
efd6b0c0 385540031 C Ii:2:003:6 0:1 544 = 69a83144 3cb4f342 15d4f843 6e155e44 33d16443 229c1443 1657dd43 59856e43
efd6b0c0 385546681 S Ii:2:003:6 -115:1 544 <
efd6b0c0 385602532 C Ii:2:003:6 0:1 544 = 60e23144 f712f442 7db9f843 16fa5d44 70326543 77be1543 c4c7dd43 4efc6e43
efd6b0c0 385615170 S Ii:2:003:6 -115:1 544 <
efd6b0c0 385665030 C Ii:2:003:6 0:1 544 = 8ba93144 3a9cf342 a919f943 a0895e44 29486743 8fa61743 d97ede43 350a7143
efd6b0c0 385682442 S Ii:2:003:6 -115:1 544 <
efd6b0c0 385727533 C Ii:2:003:6 0:1 544 = b9a42e44 dd3edb42 8a93f243 0dad5b44 4ec45b43 b4180c43 1dd8d843 578b6543
efd6b0c0 385735645 S Ii:2:003:6 -115:1 544 <
efd6b0c0 385790039 C Ii:2:003:6 0:1 544 = e1c20c44 166ddbc1 2368ae43 cf153944 29a5a442 fb081640 27ff9343 cfdab442
efd6b0c0 385800356 S Ii:2:003:6 -115:1 544 <
efd6b0c0 385852551 C Ii:2:003:6 0:1 544 = 8d280c44 75e4edc1 6170ad43 3c353844 eb489f42 608637bf 359d9243 45f6af42
efd6b0c0 385863873 S Ii:2:003:6 -115:1 544 <
efd6b0c0 385915026 C Ii:2:003:6 0:1 544 = 6a960d44 96ebb6c1 d42db143 7ea03a44 c403b242 5dcb0f41 314d9743 ca89c142
efd6b0c0 385919610 S Ii:2:003:6 -115:1 544 <
efd6b0c0 385977529 C Ii:2:003:6 0:1 544 = 0cc30f44 234d74c1 54ecb443 fe9d3c44 99d2bf42 006c8241 ac999a43 97ecd042
efd6b0c0 385985659 S Ii:2:003:6 -115:1 544 <
efd6b0c0 386040046 C Ii:2:003:6 0:1 544 = 35412e44 0094d742 4ba7f143 cc945a44 701a5843 2d6b0943 f95bd743 94486243
efd6b0c0 386046379 S Ii:2:003:6 -115:1 544 <
efd6b0c0 386102525 C Ii:2:003:6 0:1 544 = 76ff3144 f0ddf642 ae72f943 e7485e44 fac36643 07f41643 bb49de43 e6807043
efd6b0c0 386115676 S Ii:2:003:6 -115:1 544 <
efd6b0c0 386165031 C Ii:2:003:6 0:1 544 = f4303044 faf8e942 4909f643 1ac75c44 17be6143 9ca81143 5a34dc43 3a536b43
efd6b0c0 386173142 S Ii:2:003:6 -115:1 544 <
efd6b0c0 386227528 C Ii:2:003:6 0:1 544 = 541c3044 5f33e842 8061f543 e3b15c44 da806143 391a1343 80b9dc43 df216c43
efd6b0c0 386237511 S Ii:2:003:6 -115:1 544 <
efd6b0c0 386290040 C Ii:2:003:6 0:1 544 = 23610d44 a5d2c3c1 cac5af43 11e33944 ed05ab42 dd89a740 69bd9543 59edbb42
efd6b0c0 386304412 S Ii:2:003:6 -115:1 544 <
efd6b0c0 386352528 C Ii:2:003:6 0:1 544 = 12b80a44 d0cc0ec2 890caa43 c9e93644 87669442 def5b7c0 b30e9043 0b11a542
efd6b0c0 386355824 S Ii:2:003:6 -115:1 544 <
efd6b0c0 386415055 C Ii:2:003:6 0:1 544 = 09040e44 303aa5c1 6cc1b143 59873a44 d3f4b042 9bd41241 e26b9743 9650c242
f6fdfa40 386434124 S Ii:2:003:6 -115:1 544 <
f6fdfa40 386477547 C Ii:2:003:6 0:1 544 = 58c90f44 5b4a63c1 eeacb543 24173d44 94c1c142 472d9141 982f9c43 0710d542
f6fdfa40 386486668 S Ii:2:003:6 -115:1 544 <
f6fdfa40 386540048 C Ii:2:003:6 0:1 544 = 25de2f44 5eb9e642 a83ff543 13c65c44 68226043 33e71043 83aadb43 30036a43
f6fdfa40 386547682 S Ii:2:003:6 -115:1 544 <
f6fdfa40 386602524 C Ii:2:003:6 0:1 544 = ae293244 37c7f942 0d15fa43 ed855e44 a9b76643 74f91743 bce7de43 67167143
f6fdfa40 386615650 S Ii:2:003:6 -115:1 544 <
f6fdfa40 386665025 C Ii:2:003:6 0:1 544 = 1ffb2f44 0df7e642 6016f543 5a275c44 ddf35d43 78a50e43 502cda43 efd26743
f6fdfa40 386673949 S Ii:2:003:6 -115:1 544 <
f6fdfa40 386727544 C Ii:2:003:6 0:1 544 = 0ef52e44 9dc6df42 7e87f343 aacb5b44 17925c43 fe200e43 be2ada43 38dc6743
f6fdfa40 386736610 S Ii:2:003:6 -115:1 544 <
f6fdfa40 386790048 C Ii:2:003:6 0:1 544 = 5d970c44 65d3d9c1 5062ae43 d7593944 8a68a642 654aa040 d6789543 9a64b942
f6fdfa40 386802709 S Ii:2:003:6 -115:1 544 <
f6fdfa40 386852545 C Ii:2:003:6 0:1 544 = f3d70c44 80f7c6c1 563faf43 967a3944 7ed9a542 6f2f6d40 c1f59443 aae2b842
f6fdfa40 386859144 S Ii:2:003:6 -115:1 544 <
f6fdfa40 386915032 C Ii:2:003:6 0:1 544 = 40f90e44 1cc28fc1 95c2b243 29363b44 dfe1b342 d7bb3041 a0719843 f179c642
f6fdfa40 386925716 S Ii:2:003:6 -115:1 544 <
f6fdfa40 386977531 C Ii:2:003:6 0:1 544 = 52670f44 0d386ec1 82d5b443 670c3c44 2a36b942 16946541 ca269a43 a473cc42
f6fdfa40 386986671 S Ii:2:003:6 -115:1 544 <
f6fdfa40 387040033 C Ii:2:003:6 0:1 544 = 72423244 8c60fb42 ca5afa43 cd155f44 37596943 4eb91a43 1275e043 7fe17343
f6fdfa40 387049250 S Ii:2:003:6 -115:1 544 <
f6fdfa40 387102547 C Ii:2:003:6 0:1 544 = 53703044 a3d4eb42 c3b7f643 c8ac5d44 12ce6343 70911543 bdb4dd43 be966e43
f6fdfa40 387114634 S Ii:2:003:6 -115:1 544 <
f6fdfa40 387165037 C Ii:2:003:6 0:1 544 = b3f12e44 5c64df42 bf26f343 7a685b44 6ca55a43 ff700c43 f9b5d843 1ed86443
f6fdfa40 387178534 S Ii:2:003:6 -115:1 544 <
f6fdfa40 387227548 C Ii:2:003:6 0:1 544 = 37092f44 d6d1df42 b3a9f243 502a5b44 899e5a43 0d910c43 5dc5d843 9b626343
f6fdfa40 387234663 S Ii:2:003:6 -115:1 544 <
f6fdfa40 387290030 C Ii:2:003:6 0:1 544 = 98840c44 2cdcd8c1 33d9ae43 c1363944 efa0a342 facb6340 2c9b9443 3cf6b642
f6fdfa40 387300669 S Ii:2:003:6 -115:1 544 <
f6fdfa40 387352525 C Ii:2:003:6 0:1 544 = f5740e44 25659dc1 d6a7b243 d9a23b44 d6e4b342 4c2f3e41 301d9943 2559c842
f6fdfa40 387360380 S Ii:2:003:6 -115:1 544 <
f6fdfa40 387415044 C Ii:2:003:6 0:1 544 = 1a720d44 7572bcc1 d296b043 fb813a44 92d6ae42 df721241 64659743 984ac142
f6fdfa40 387424690 S Ii:2:003:6 -115:1 544 <
f6fdfa40 387477543 C Ii:2:003:6 0:1 544 = 6f581044 dd0730c1 639cb643 c53e3d44 2e9fc142 8d419341 5cc39b43 ec7dd442
f6fdfa40 387485685 S Ii:2:003:6 -115:1 544 <
f6fdfa40 387540029 C Ii:2:003:6 0:1 544 = ef0f3244 c852f942 1bc1f943 24b75e44 b6466743 b4c01743 8f14df43 7ada6f43
f6fdfa40 387546692 S Ii:2:003:6 -115:1 544 <
f6fdfa40 387602532 C Ii:2:003:6 0:1 544 = 3e153144 ffb3f042 2d41f843 fbc45d44 38b16343 4aeb1543 1ba1dd43 9a786d43
f6fdfa40 387616455 S Ii:2:003:6 -115:1 544 <
f6fdfa40 387665025 C Ii:2:003:6 0:1 544 = aaec3044 c67bf142 1efcf743 d9155e44 1a526443 c5881643 b1fbdd43 b03a6f43
f6fdfa40 387677284 S Ii:2:003:6 -115:1 544 <
f6fdfa40 387727531 C Ii:2:003:6 0:1 544 = db092e44 3288d742 3677f143 673d5b44 8c095943 26e50a43 ce4cd843 0d546243
f6fdfa40 387738000 S Ii:2:003:6 -115:1 544 <
f6fdfa40 387790032 C Ii:2:003:6 0:1 544 = f43d0d44 5dc4c1c1 7b6aaf43 15923944 74f2a642 778b7f40 cb039543 81c3b842
f6fdfa40 387799879 S Ii:2:003:6 -115:1 544 <
f6fdfa40 387852537 C Ii:2:003:6 0:1 544 = 2dc40c44 a120cfc1 b811af43 7f3f3944 2106a342 01651740 a4ee9343 63bdb442
f6fdfa40 387862522 S Ii:2:003:6 -115:1 544 <
f6fdfa40 387915043 C Ii:2:003:6 0:1 544 = 8f8a0d44 5713b8c1 070ab143 c2743a44 17e9ad42 ee3d0141 57369743 271dc042
f6fdfa40 387926679 S Ii:2:003:6 -115:1 544 <
f6fdfa40 387977544 C Ii:2:003:6 0:1 544 = 957b1144 5560e5c0 447eb843 8f6c3e44 8ab6cd42 cbd4bf41 81f59e43 f762e042
f6fdfa40 387990675 S Ii:2:003:6 -115:1 544 <
f6fdfa40 388040025 C Ii:2:003:6 0:1 544 = 49fe2f44 6760e842 7b5ef543 d2df5c44 a4ec5f43 a73d1143 ac7adb43 5b166a43
f6fdfa40 388054257 S Ii:2:003:6 -115:1 544 <
f6fdfa40 388102526 C Ii:2:003:6 0:1 544 = 6c3f3344 24c9ff42 acb7fb43 86b55f44 5e036a43 18be1a43 ade3e043 1e777343
f6fdfa40 388116763 S Ii:2:003:6 -115:1 544 <
f6fdfa40 388165030 C Ii:2:003:6 0:1 544 = b8df2f44 097ce642 365ef543 6d485c44 78fc5c43 a8ca0e43 3b83da43 ab5e6743
f6fdfa40 388175676 S Ii:2:003:6 -115:1 544 <
f6fdfa40 388227528 C Ii:2:003:6 0:1 544 = 9aff2f44 2e7ee942 550bf643 c1115d44 21736043 50f11143 eb10dc43 37e76a43
f6fdfa40 388238682 S Ii:2:003:6 -115:1 544 <
f6fdfa40 388290033 C Ii:2:003:6 0:1 544 = 8bf90c44 c480cac1 7778af43 250a3a44 2d91ac42 2029da40 0f0f9643 c2f3be42
f6fdfa40 388299973 S Ii:2:003:6 -115:1 544 <
f6fdfa40 388352547 C Ii:2:003:6 0:1 544 = e03a0c44 81b8e5c1 28d6ad43 3eee3844 efa8a042 774b9f3f 39449343 b848b242
f6fdfa40 388363264 S Ii:2:003:6 -115:1 544 <
f6fdfa40 388415041 C Ii:2:003:6 0:1 544 = 80200f44 79f087c1 2506b343 321e3b44 0e70b242 e2012041 14b39743 150ac442
f6fdfa40 388426733 S Ii:2:003:6 -115:1 544 <
f6fdfa40 388477535 C Ii:2:003:6 0:1 544 = 1c881044 349144c1 778cb643 3ec13c44 94b0be42 72408541 d7779b43 177dd142
f6fdfa40 388485652 S Ii:2:003:6 -115:1 544 <
f6fdfa40 388540047 C Ii:2:003:6 0:1 544 = 989d3244 ad29fe42 5c4cfb43 229b5f44 bd056a43 aa471b43 1a89e043 200d7443
f6fdfa40 388547443 S Ii:2:003:6 -115:1 544 <
f6fdfa40 388602533 C Ii:2:003:6 0:1 544 = 0d823144 ebfff342 7f5bf843 e7cd5e44 21066643 398c1743 491ddf43 13cd7043
f6fdfa40 388607365 S Ii:2:003:6 -115:1 544 <
f6fdfa40 388665035 C Ii:2:003:6 0:1 544 = 38e12f44 ffbbe542 92fff443 48745c44 91345d43 ed4a0e43 1f76da43 46f76743
f6fdfa40 388677891 S Ii:2:003:6 -115:1 544 <
f6fdfa40 388727528 C Ii:2:003:6 0:1 544 = 1c7f2f44 d80ce342 8f52f443 8e185c44 df7a5a43 949c0b43 db13d943 69546543
f6fdfa40 388742678 S Ii:2:003:6 -115:1 544 <
f6fdfa40 388790029 C Ii:2:003:6 0:1 544 = a1d20d44 cc07afc1 3433b143 bb2d3a44 9384ab42 b0cec440 1f669643 673fbe42
f6fdfa40 388799609 S Ii:2:003:6 -115:1 544 <
f6fdfa40 388852530 C Ii:2:003:6 0:1 544 = f8520d44 6c5dbcc1 d914b043 e7193a44 de76a742 fc09c140 703b9643 c759be42
f6fdfa40 388861193 S Ii:2:003:6 -115:1 544 <
f6fdfa40 388915033 C Ii:2:003:6 0:1 544 = 86cb0d44 b54aa4c1 809cb143 8fc93a44 1ebead42 8a150741 0ca99743 a246c242
f6fdfa40 388922458 S Ii:2:003:6 -115:1 544 <
f6fdfa40 388977525 C Ii:2:003:6 0:1 544 = 8ca31044 16832cc1 8d74b643 bda43d44 2963c242 5ba69341 ed819c43 7297d542
f6fdfa40 388985642 S Ii:2:003:6 -115:1 544 <
f6fdfa40 389040025 C Ii:2:003:6 0:1 544 = 367c3144 3cb1f042 4c48f743 2a7d5d44 d6eb6143 4bc21343 0f3cdd43 acc96c43
f6fdfa40 389051795 S Ii:2:003:6 -115:1 544 <
f6fdfa40 389102544 C Ii:2:003:6 0:1 544 = 057e3044 a723ec42 5cc6f643 a9255d44 eb2c5f43 0e151143 b18cdb43 b4786a43
f6fdfa40 389111988 S Ii:2:003:6 -115:1 544 <
f6fdfa40 389165030 C Ii:2:003:6 0:1 544 = c5e92f44 09f2e542 6e8bf543 94b55c44 d5cb5e43 18231043 5e1cdb43 59326a43
f6fdfa40 389174951 S Ii:2:003:6 -115:1 544 <
f6fdfa40 389227545 C Ii:2:003:6 0:1 544 = ef552f44 95e9e042 f6ebf343 ca875c44 80335e43 7acf0e43 058cda43 51c46843
f6fdfa40 389235686 S Ii:2:003:6 -115:1 544 <
f6fdfa40 389290040 C Ii:2:003:6 0:1 544 = 82330d44 71e2c5c1 b07eaf43 53183a44 f3eea642 290ca940 bdbc9543 705dba42
f6fdfa40 389298678 S Ii:2:003:6 -115:1 544 <
f6fdfa40 389352535 C Ii:2:003:6 0:1 544 = 67400e44 045e9dc1 80fdb143 5ea53a44 061baa42 a704c440 f60b9643 a587bc42
f6fdfa40 389358715 S Ii:2:003:6 -115:1 544 <
f6fdfa40 389415026 C Ii:2:003:6 0:1 544 = 74f80d44 bd43aec1 e41ab143 49723a44 2206ab42 9ea3c640 12939643 e40cbf42
f6fdfa40 389428608 S Ii:2:003:6 -115:1 544 <
f6fdfa40 389477547 C Ii:2:003:6 0:1 544 = befd1044 7ca80dc1 85e7b643 ac883d44 233dc542 30919c41 75cd9c43 3200d942
f6fdfa40 389488562 S Ii:2:003:6 -115:1 544 <
f6fdfa40 389540033 C Ii:2:003:6 0:1 544 = 0bb83244 d65cfd42 2891fa43 859f5f44 d1cc6843 ee941a43 7c4fe043 e4527443
f6fdfa40 389555649 S Ii:2:003:6 -115:1 544 <
f6fdfa40 389602526 C Ii:2:003:6 0:1 544 = 66123144 7430ee42 d414f743 faf05d44 21d16143 a4db1343 4ccfdc43 874b6d43
f6fdfa40 389608398 S Ii:2:003:6 -115:1 544 <
f6fdfa40 389665029 C Ii:2:003:6 0:1 544 = 00b62e44 5d55da42 be0df243 bc055b44 664a5743 59210843 d242d743 0c686243
f6fdfa40 389685882 S Ii:2:003:6 -115:1 544 <
f6fdfa40 389727531 C Ii:2:003:6 0:1 544 = 1d662e44 7d77d942 4dd8f143 3ff25a44 d6315543 f3be0643 f990d643 63b86043
f6fdfa40 389738356 S Ii:2:003:6 -115:1 544 <
f6fdfa40 389790044 C Ii:2:003:6 0:1 544 = 16b90c44 3453d3c1 9be3ae43 808f3944 60f9a142 d89c2840 d25b9443 94feb542
f6fdfa40 389798315 S Ii:2:003:6 -115:1 544 <
f6fdfa40 389852531 C Ii:2:003:6 0:1 544 = d7bf0d44 ff08adc1 b673b143 95033b44 1c63ae42 51221141 a2679743 aa22c242
f6fdfa40 389860764 S Ii:2:003:6 -115:1 544 <
f6fdfa40 389915026 C Ii:2:003:6 0:1 544 = ad600f44 f0d77dc1 022bb443 6f373c44 d877b542 e5bd4f41 e3709943 6bbfc842
f6fdfa40 389928497 S Ii:2:003:6 -115:1 544 <
f6fdfa40 389977525 C Ii:2:003:6 0:1 544 = ff021144 12f713c1 f641b743 60ef3c44 6570bd42 ee648241 29189b43 4c8ed042
f6fdfa40 389982667 S Ii:2:003:6 -115:1 544 <
f6fdfa40 390040031 C Ii:2:003:6 0:1 544 = 335e3144 f289f142 114ff843 b6de5d44 42286243 44451343 336ddd43 cb2e6d43
f6fdfa40 390057111 S Ii:2:003:6 -115:1 544 <
f6fdfa40 390102541 C Ii:2:003:6 0:1 544 = 24333244 35dbf842 d78bf943 3a105f44 ef6e6643 cc9e1843 e5b9df43 1b567143
f6fdfa40 390114271 S Ii:2:003:6 -115:1 544 <
f6fdfa40 390165032 C Ii:2:003:6 0:1 544 = d1133044 0863e942 ceb8f543 892b5d44 4c875f43 5d8b1143 8cf3db43 219d6943
f6fdfa40 390178617 S Ii:2:003:6 -115:1 544 <
f6fdfa40 390227534 C Ii:2:003:6 0:1 544 = f2d42d44 bd25d542 b5e8f043 04915a44 4fce5443 73920643 40aad643 79065f43
f6fdfa40 390242176 S Ii:2:003:6 -115:1 544 <
f6fdfa40 390290048 C Ii:2:003:6 0:1 544 = 56740e44 2c3daac1 bd0cb243 52a33a44 2a68a842 d21dcf40 059a9643 2ed6bb42
f6fdfa40 390306044 S Ii:2:003:6 -115:1 544 <
f6fdfa40 390352527 C Ii:2:003:6 0:1 544 = 5f410c44 1fded6c1 4aafae43 2d143944 31e89d42 c789983f 369a9343 cb34b242
f6fdfa40 390366707 S Ii:2:003:6 -115:1 544 <
f6fdfa40 390415030 C Ii:2:003:6 0:1 544 = ead90e44 fd538bc1 0aebb343 28023c44 1d96b542 fa304c41 15909943 59dfc942
f6fdfa40 390424555 S Ii:2:003:6 -115:1 544 <
f6fdfa40 390477527 C Ii:2:003:6 0:1 544 = 28211044 80e044c1 56d0b543 e3773d44 16aec042 7c8c8b41 01bf9b43 ac0fd342
f6fdfa40 390490559 S Ii:2:003:6 -115:1 544 <
f6fdfa40 390540034 C Ii:2:003:6 0:1 544 = fa5c3044 747beb42 4a0cf643 f3f25c44 8e845e43 6c570f43 8cfbda43 e1d36843
f6fdfa40 390553761 S Ii:2:003:6 -115:1 544 <
f6fdfa40 390602528 C Ii:2:003:6 0:1 544 = a6073244 b95af842 de78f943 1d505e44 f7536343 a5981543 5eb8dd43 651c6e43
f6fdfa40 390613121 S Ii:2:003:6 -115:1 544 <
f6fdfa40 390665048 C Ii:2:003:6 0:1 544 = b2b32f44 a4abe442 21e0f443 a2515c44 af065c43 e6c20d43 884bda43 49f76643
f6fdfa40 390677610 S Ii:2:003:6 -115:1 544 <
f6fdfa40 390727543 C Ii:2:003:6 0:1 544 = f8423044 f5c0eb42 a3c6f543 43495d44 31cb6143 b2351343 27bddc43 640a6c43
f6fdfa40 390735684 S Ii:2:003:6 -115:1 544 <
f6fdfa40 390790031 C Ii:2:003:6 0:1 544 = f4ba0c44 5f99d2c1 96dcae43 1bc83944 28aea642 32e47540 fe1d9543 4c88b942
f6fdfa40 390797648 S Ii:2:003:6 -115:1 544 <
f6fdfa40 390852535 C Ii:2:003:6 0:1 544 = f9550e44 f778a2c1 0759b243 48093b44 8ec5ae42 b18c0b41 12979743 39fac142
f6fdfa40 390863588 S Ii:2:003:6 -115:1 544 <
f6fdfa40 390915058 C Ii:2:003:6 0:1 544 = 06c50f44 98c06fc1 0b13b543 42013c44 9b62b742 166b4a41 7bd09943 6523ca42
f6fdfa40 390924587 S Ii:2:003:6 -115:1 544 <
f6fdfa40 390977547 C Ii:2:003:6 0:1 544 = 00411044 358036c1 4986b643 b8b53c44 3064be42 8b588441 00899b43 4c2cd142
f6fdfa40 390986669 S Ii:2:003:6 -115:1 544 <
f6fdfa40 391040050 C Ii:2:003:6 0:1 544 = 40e93144 d6e2f642 3958f943 41ca5e44 e83b6643 faad1743 8f02df43 54317143
f6fdfa40 391045649 S Ii:2:003:6 -115:1 544 <
f6fdfa40 391102547 C Ii:2:003:6 0:1 544 = 96753044 f18bec42 b617f743 33a45d44 77f86143 fb1b1343 d6ebdc43 83ac6c43
f6fdfa40 391112651 S Ii:2:003:6 -115:1 544 <
f6fdfa40 391165034 C Ii:2:003:6 0:1 544 = 1f2b2e44 f7d3d842 86adf143 37335b44 0b415843 c85b0843 2eb5d743 f18c6243
f6fdfa40 391175649 S Ii:2:003:6 -115:1 544 <
f6fdfa40 391227546 C Ii:2:003:6 0:1 544 = 48362e44 753bd842 f9faf143 6c805a44 062f5443 4fa50543 3b42d643 94e85e43
f6fdfa40 391242693 S Ii:2:003:6 -115:1 544 <
f6fdfa40 391290034 C Ii:2:003:6 0:1 544 = fa0c0b44 c04b04c2 3390ab43 b8613744 42a49342 62d3b8c0 e46b9043 fa9ca642
f6fdfa40 391300133 S Ii:2:003:6 -115:1 544 <
f6fdfa40 391352530 C Ii:2:003:6 0:1 544 = 10b40d44 f1c9b3c1 aeffb043 a3373a44 8606ad42 f8cdd040 17009743 103ebf42
f6fdfa40 391367907 S Ii:2:003:6 -115:1 544 <
f6fdfa40 391415041 C Ii:2:003:6 0:1 544 = 227f0f44 23e767c1 d4a6b443 7d6c3c44 57f8bd42 1c007441 770f9b43 8539d142
f6fdfa40 391425642 S Ii:2:003:6 -115:1 544 <
f6fdfa40 391477527 C Ii:2:003:6 0:1 544 = 05be0f44 9c145bc1 2bceb543 a0f73c44 491dc042 1d2c8141 77b09b43 d355d242
f6fdfa40 391481681 S Ii:2:003:6 -115:1 544 <
f6fdfa40 391540032 C Ii:2:003:6 0:1 544 = 8acf2f44 bc8fe342 47f3f443 3d4f5c44 a48d5d43 9a270e43 285ada43 efe26743
f6fdfa40 391547338 S Ii:2:003:6 -115:1 544 <
f6fdfa40 391602548 C Ii:2:003:6 0:1 544 = 8ee63044 1baeeb42 0daff643 c3345d44 80985f43 5a591043 fe88db43 49496a43
f6fdfa40 391617653 S Ii:2:003:6 -115:1 544 <
f6fdfa40 391665047 C Ii:2:003:6 0:1 544 = 145c2d44 86fdd342 1c1af143 f8375a44 8de05543 deb50543 7557d643 295b5f43
f6fdfa40 391676335 S Ii:2:003:6 -115:1 544 <
f6fdfa40 391727527 C Ii:2:003:6 0:1 544 = d2112e44 17d4d842 78a2f243 387f5b44 31425943 26310a43 82c6d843 34f26343
f6fdfa40 391735654 S Ii:2:003:6 -115:1 544 <
f6fdfa40 391790033 C Ii:2:003:6 0:1 544 = 4cea0b44 f0b6ebc1 5af2ad43 ef293944 5ddfa142 cac4c43f 622a9443 0e06b442
f6fdfa40 391795459 S Ii:2:003:6 -115:1 544 <
f6fdfa40 391852529 C Ii:2:003:6 0:1 544 = 2c920c44 d7bfd2c1 114faf43 73183944 75f6a242 b887cc3f 4a649443 289fb442
f6fdfa40 391858369 S Ii:2:003:6 -115:1 544 <
f6fdfa40 391915034 C Ii:2:003:6 0:1 544 = 44240f44 746f7cc1 cc52b443 424a3b44 581bb542 10b52c41 951a9943 07fcc742
f6fdfa40 391926663 S Ii:2:003:6 -115:1 544 <
f6fdfa40 391977529 C Ii:2:003:6 0:1 544 = e9690f44 0d3581c1 24c0b443 1d233c44 781fb942 d3154d41 d62f9a43 9c63cb42
f6fdfa40 391987350 S Ii:2:003:6 -115:1 544 <
f6fdfa40 392040044 C Ii:2:003:6 0:1 544 = ff6c3244 60f1fb42 5029fb43 ff7a5f44 3a786b43 1f681c43 3659e143 913c7543
f6fdfa40 392047469 S Ii:2:003:6 -115:1 544 <
f6fdfa40 392102546 C Ii:2:003:6 0:1 544 = b4783144 1445f342 21fef843 a5b75e44 47936743 79a71743 9aa9df43 ae427243
f6fdfa40 392110737 S Ii:2:003:6 -115:1 544 <
f6fdfa40 392165031 C Ii:2:003:6 0:1 544 = f81b2e44 e975d942 044ff243 360f5b44 19945843 b2880843 e5ccd743 b7956143
f6fdfa40 392176783 S Ii:2:003:6 -115:1 544 <
f6fdfa40 392227532 C Ii:2:003:6 0:1 544 = 211e2e44 3c99d642 ab66f143 718b5a44 e32a5643 835a0643 96dcd643 00ac5f43
f6fdfa40 392235663 S Ii:2:003:6 -115:1 544 <
f6fdfa40 392290031 C Ii:2:003:6 0:1 544 = 779f0b44 58e8ebc1 4599ad43 de4b3844 94aa9c42 ddfb0dc0 f26f9243 647fae42
f6fdfa40 392296614 S Ii:2:003:6 -115:1 544 <
f6fdfa40 392352532 C Ii:2:003:6 0:1 544 = a3d10d44 d05cabc1 aabfb143 b8cd3a44 926bb242 0f3b0441 15a29743 ed24c342
f6fdfa40 392361785 S Ii:2:003:6 -115:1 544 <
f6fdfa40 392415038 C Ii:2:003:6 0:1 544 = 4dd80e44 1cd787c1 bc6db443 a8123c44 640abb42 7a245641 398f9a43 7ff6cd42
f6fdfa40 392427267 S Ii:2:003:6 -115:1 544 <
f6fdfa40 392477549 C Ii:2:003:6 0:1 544 = ad6c1044 64cc2dc1 6091b643 90b23d44 4340c442 52368841 953d9c43 09ead542
f6fdfa40 392489693 S Ii:2:003:6 -115:1 544 <
f6fdfa40 392540048 C Ii:2:003:6 0:1 544 = d5853144 048df442 72e0f843 4eea5d44 56ed6343 81361443 7f87dd43 3b556e43
f6fdfa40 392554481 S Ii:2:003:6 -115:1 544 <
f6fdfa40 392602549 C Ii:2:003:6 0:1 544 = c2523044 84c9eb42 1999f643 06cf5c44 e35b5f43 16570f43 b238db43 31276943
f6fdfa40 392615649 S Ii:2:003:6 -115:1 544 <
f6fdfa40 392665036 C Ii:2:003:6 0:1 544 = 78fb2e44 6d29de42 16bcf343 f99a5b44 2d445b43 5bfa0a43 0a40d943 1ce66443
f6fdfa40 392677733 S Ii:2:003:6 -115:1 544 <
f6fdfa40 392727544 C Ii:2:003:6 0:1 544 = 97f22f44 a2c3e742 6e6af543 f8ea5c44 0c5d6143 d9bb1043 6a33dc43 9ce96a43
f6fdfa40 392738699 S Ii:2:003:6 -115:1 544 <
f6fdfa40 392790029 C Ii:2:003:6 0:1 544 = 364d0b44 5ec900c2 818dac43 99743844 0d5b9d42 03f407c0 99cd9243 a8ffae42
f6fdfa40 392800016 S Ii:2:003:6 -115:1 544 <
f6fdfa40 392852529 C Ii:2:003:6 0:1 544 = c0c90e44 3ef79ac1 0785b243 61583b44 564cb242 dab11341 07e49743 1673c442
f6fdfa40 392856477 S Ii:2:003:6 -115:1 544 <
f6fdfa40 392915028 C Ii:2:003:6 0:1 544 = cece0f44 64846bc1 f8a6b443 d8283c44 88f5ba42 f56c5741 785b9a43 d6eecc42
f6fdfa40 392922367 S Ii:2:003:6 -115:1 544 <
f6fdfa40 392977526 C Ii:2:003:6 0:1 544 = a0dd1044 286c07c1 35aab743 4a883d44 e29ac442 578f8641 57b49c43 bd99d542
f6fdfa40 392986678 S Ii:2:003:6 -115:1 544 <
f6fdfa40 393040027 C Ii:2:003:6 0:1 544 = ba3e3244 bd8ef842 4ebffa43 58815f44 67cb6943 ab671943 6a99e043 31647443
f6fdfa40 393047291 S Ii:2:003:6 -115:1 544 <
f6fdfa40 393102544 C Ii:2:003:6 0:1 544 = 061e3044 8ca8e942 ccf8f643 79e55d44 5d946343 f70a1443 f453dd43 81e76c43
f6fdfa40 393106668 S Ii:2:003:6 -115:1 544 <
f6fdfa40 393165033 C Ii:2:003:6 0:1 544 = 06912e44 acbddf42 4552f343 a7cf5b44 c26b5b43 de760b43 b785d943 42596543
f6fdfa40 393177373 S Ii:2:003:6 -115:1 544 <
f6fdfa40 393227547 C Ii:2:003:6 0:1 544 = 8f0c2c44 8ea6c842 2d95ed43 23b65844 cebf4e43 6631fd42 ee33d343 13935843
f6fdfa40 393241586 S Ii:2:003:6 -115:1 544 <
f6fdfa40 393290032 C Ii:2:003:6 0:1 544 = 02220d44 c1bfc2c1 6c4eb043 776b3944 d842a442 cd29d23f b38e9443 953fb542
f6fdfa40 393297568 S Ii:2:003:6 -115:1 544 <
f6fdfa40 393352527 C Ii:2:003:6 0:1 544 = b7180e44 4c16a3c1 c038b243 e6f63a44 57ceb242 33800a41 58149843 6297c342
f6fdfa40 393362692 S Ii:2:003:6 -115:1 544 <
f6fdfa40 393415031 C Ii:2:003:6 0:1 544 = 3c660f44 158e66c1 44ffb443 84933c44 32cabe42 a1657441 978c9b43 3d74d142
f734e940 393424561 S Ii:2:003:6 -115:1 544 <
f734e940 393477532 C Ii:2:003:6 0:1 544 = 2c261244 ee145cc0 bd78ba43 b0653f44 dd73d242 d887ca41 ea74a043 cd59e542
f734e940 393485669 S Ii:2:003:6 -115:1 544 <
f734e940 393540026 C Ii:2:003:6 0:1 544 = 25553044 23d5e942 f10ff643 f3665d44 10486043 c12b1143 1b2fdc43 11da6a43
f734e940 393555649 S Ii:2:003:6 -115:1 544 <
f734e940 393602547 C Ii:2:003:6 0:1 544 = 2a103144 ac30ef42 484df743 549c5d44 5c626143 08ea1143 1296dc43 44656b43
f734e940 393615692 S Ii:2:003:6 -115:1 544 <
f734e940 393665048 C Ii:2:003:6 0:1 544 = e9bd2d44 2fc0d742 8204f243 f4995a44 6e865543 14f50543 9ce9d643 ac0f6043
f734e940 393672289 S Ii:2:003:6 -115:1 544 <
f734e940 393727529 C Ii:2:003:6 0:1 544 = 9dbe2c44 aeaecd42 cd35f043 91495a44 7e855343 a9c40343 44abd543 daef5d43
f734e940 393736832 S Ii:2:003:6 -115:1 544 <
f734e940 393790035 C Ii:2:003:6 0:1 544 = cb8f0d44 2525b1c1 6f76b143 11f93a44 52a3ae42 f86df440 7dfc9643 5cb7bf42
f734e940 393796203 S Ii:2:003:6 -115:1 544 <
f734e940 393852544 C Ii:2:003:6 0:1 544 = 5de00d44 93ffa3c1 1304b243 fa283b44 4467b042 3936f940 fceb9743 9f6fc242
f734e940 393864056 S Ii:2:003:6 -115:1 544 <
f734e940 393915044 C Ii:2:003:6 0:1 544 = f8790f44 d3756cc1 40d8b443 811a3c44 cc92b742 0bd64741 bd949943 1d17ca42
f734e940 393934731 S Ii:2:003:6 -115:1 544 <
f734e940 393977527 C Ii:2:003:6 0:1 544 = 84481144 73b8efc0 7896b843 e5de3d44 1a3fc642 e5ca9941 41219d43 eb64d742
f734e940 393987615 S Ii:2:003:6 -115:1 544 <
f734e940 394040028 C Ii:2:003:6 0:1 544 = ee833144 9a15f642 a6f9f843 bbb25e44 d8dd6643 008f1743 fa5bdf43 c3ca7143
f734e940 394053783 S Ii:2:003:6 -115:1 544 <
f734e940 394102528 C Ii:2:003:6 0:1 544 = 65ac3044 fd4eec42 7a15f743 15d95d44 0fc86243 a7d51443 80e9dd43 c1526e43
f734e940 394117985 S Ii:2:003:6 -115:1 544 <
f734e940 394165047 C Ii:2:003:6 0:1 544 = 0b2b2e44 1ec9d942 7432f243 2f9f5b44 a8b65943 1e220b43 4e2cd943 63b26343
f734e940 394175705 S Ii:2:003:6 -115:1 544 <
f734e940 394227548 C Ii:2:003:6 0:1 544 = 27002c44 5a57c642 10afed43 0c145944 2ded4e43 b476fe42 d3fcd243 a4b05843
f734e940 394234693 S Ii:2:003:6 -115:1 544 <
f734e940 394290026 C Ii:2:003:6 0:1 544 = e73f0d44 9bfeccc1 b87caf43 999a3944 2741a342 83dd0a40 398b9443 bde5b442
f734e940 394296277 S Ii:2:003:6 -115:1 544 <
f734e940 394352546 C Ii:2:003:6 0:1 544 = be150d44 36fcc6c1 3aa0b043 89353a44 4ca5a742 0df08a40 11b79543 1fbbb842
f734e940 394358679 S Ii:2:003:6 -115:1 544 <
f734e940 394415036 C Ii:2:003:6 0:1 544 = 91660f44 152c71c1 aa71b543 a6fe3c44 3959bc42 63c06d41 4a779a43 19b1ce42
f734e940 394426688 S Ii:2:003:6 -115:1 544 <
f734e940 394477532 C Ii:2:003:6 0:1 544 = 60ee1044 769f09c1 ef05b843 ac623e44 f145ca42 83b6af41 9e239e43 70a6dc42
f734e940 394485649 S Co:2:003:0 s 40 cb 0000 0000 0007 7 = 02010002 00ff07
efd52f40 394488270 S Ii:2:003:6 -115:1 544 <
f734e940 394499150 C Co:2:003:0 0 7 >
efd52f40 394540031 C Ii:2:003:6 0:1 544 = 04553044 6a0aed42 01a1f643 97455d44 7b966043 ae2d1243 40f4db43 16216b43
efd52f40 394552971 S Ii:2:003:6 -115:1 544 <
efd52f40 394602525 C Ii:2:003:6 0:1 544 = b4c04a44 e99e6043 36b01544 09a97744 da0ca543 8cb87b43 dd6a0844 f8d3aa43
efd52f40 394613159 S Ii:2:003:6 -115:1 544 <
efd52f40 394665026 C Ii:2:003:6 0:1 544 = 79814844 b9ca5743 488a1344 d79f7544 1418a143 97847343 5e390644 3275a643
efd52f40 394676539 S Ii:2:003:6 -115:1 544 <
efd52f40 394727537 C Ii:2:003:6 0:1 544 = ebef4844 78b75743 82d41344 892d7644 9a79a243 a80d7743 4de60644 54e9a743
efd52f40 394739208 S Ii:2:003:6 -115:1 544 <
efd52f40 394790046 C Ii:2:003:6 0:1 544 = cf9b2f44 9567e342 75d0f443 5de25c44 2b4b5d43 71ea0e43 d09dda43 4c616843
efd52f40 394797261 S Ii:2:003:6 -115:1 544 <
efd52f40 394852533 C Ii:2:003:6 0:1 544 = ced32e44 0397dd42 b2a8f343 92105c44 bc6f5a43 679a0b43 c303d943 9bd76443
f23b4240 394866030 S Ii:2:003:6 -115:1 544 <
f23b4240 394915045 C Ii:2:003:6 0:1 544 = cc6a3044 c565e742 32e5f543 d7d55c44 8c7b5e43 84ac0f43 31bada43 c9436843
f23b4240 394920404 S Ii:2:003:6 -115:1 544 <
f23b4240 394977546 C Ii:2:003:6 0:1 544 = e1333244 72bbf942 106dfa43 71f95e44 9d956543 d8351643 8738de43 ebef6f43
f23b4240 394986698 S Ii:2:003:6 -115:1 544 <
f23b4240 395040031 C Ii:2:003:6 0:1 544 = e1374b44 58106143 a65e1644 67987844 39afa643 a90a7e43 a5f10844 3f7eac43
f23b4240 395047877 S Ii:2:003:6 -115:1 544 <
f23b4240 395102534 C Ii:2:003:6 0:1 544 = 40154a44 039e5c43 91e91444 7c7f7744 68a2a443 97687943 580b0844 159da943
f23b4240 395110698 S Ii:2:003:6 -115:1 544 <
f23b4240 395165034 C Ii:2:003:6 0:1 544 = 32a14844 b06e5743 12a61344 a8aa7544 d7a7a043 0c8f7243 05040644 5b0ea643
f23b4240 395173167 S Ii:2:003:6 -115:1 544 <
f23b4240 395227533 C Ii:2:003:6 0:1 544 = c4ae4644 301c4f43 516e1144 b38d7344 c1f69b43 9f736943 0c030444 5ad5a143
f23b4240 395237530 S Ii:2:003:6 -115:1 544 <
f23b4240 395290032 C Ii:2:003:6 0:1 544 = a0b22d44 8690d442 26d5f143 c52b5a44 d63f5443 b8e60343 e01dd543 e5ba5d43
f23b4240 395297188 S Ii:2:003:6 -115:1 544 <
f23b4240 395352528 C Ii:2:003:6 0:1 544 = 70752f44 6123e342 f3f3f443 8f995c44 e75c5d43 7d970d43 b2d4d943 af726743
f23b4240 395355692 S Ii:2:003:6 -115:1 544 <
f23b4240 395415043 C Ii:2:003:6 0:1 544 = 0f563144 a84ff242 2b85f843 0fb35e44 dace6343 1f7b1543 60f5dd43 7cb46f43
efd52f40 395424097 S Ii:2:003:6 -115:1 544 <
efd52f40 395477528 C Ii:2:003:6 0:1 544 = dfa93144 248ef442 c50df943 50865e44 75a76543 acaa1543 6d47de43 39776f43
efd52f40 395488015 S Ii:2:003:6 -115:1 544 <
efd52f40 395540027 C Ii:2:003:6 0:1 544 = b6664244 029a3d43 b5600d44 938b6f44 7e059443 d2f25843 14a7ff43 f18a9943
efd52f40 395550039 S Ii:2:003:6 -115:1 544 <
efd52f40 395602526 C Ii:2:003:6 0:1 544 = 6c554944 71565843 1f041444 6bcb7544 f40da043 2b3f7143 16dd0544 c392a543
efd52f40 395606666 S Ii:2:003:6 -115:1 544 <
efd52f40 395665027 C Ii:2:003:6 0:1 544 = a1084a44 45965c43 6e1e1544 da057744 15cea243 3cf37543 5c290744 bb4ca843
efd52f40 395675650 S Ii:2:003:6 -115:1 544 <
efd52f40 395727528 C Ii:2:003:6 0:1 544 = 38ad4844 a1585743 d5121444 65337644 1147a143 e46d7343 7e670644 0658a643
efd52f40 395734693 S Ii:2:003:6 -115:1 544 <
efd52f40 395790048 C Ii:2:003:6 0:1 544 = ffd83544 77310b43 3fd10044 a30b6344 d9bd7643 2b5f2643 0827e643 84218043
efd52f40 395803170 S Ii:2:003:6 -115:1 544 <
efd52f40 395852557 C Ii:2:003:6 0:1 544 = 32872f44 b4f3e142 75c8f443 8d0c5c44 d08d5b43 bf860b43 4a98d843 959a6443
efd52f40 395856607 S Ii:2:003:6 -115:1 544 <
efd52f40 395915036 C Ii:2:003:6 0:1 544 = 22a33044 62b6ec42 8ef6f643 8d805d44 f15c5f43 170a1043 11fcda43 49436943
efd52f40 395927982 S Ii:2:003:6 -115:1 544 <
efd52f40 395977547 C Ii:2:003:6 0:1 544 = 1bb03244 2288fb42 d708fb43 83135f44 027d6743 cadb1743 2f4bdf43 185f7143
efd52f40 395986732 S Ii:2:003:6 -115:1 544 <
efd52f40 396040032 C Ii:2:003:6 0:1 544 = b9d13244 eebafe42 12a6fb43 79306044 1f436d43 c4e91c43 9a98e143 6b227643
efd52f40 396058693 S Ii:2:003:6 -115:1 544 <
efd52f40 396102539 C Ii:2:003:6 0:1 544 = 53f24a44 9f4d6143 39121644 44507844 0dbea543 535d7c43 e69f0844 d546ab43
efd52f40 396117839 S Ii:2:003:6 -115:1 544 <
efd52f40 396165048 C Ii:2:003:6 0:1 544 = 4baf4944 b85c5b43 efa51444 7c837644 9cf0a143 54827543 25060744 ab22a843
efd52f40 396178328 S Ii:2:003:6 -115:1 544 <
efd52f40 396227538 C Ii:2:003:6 0:1 544 = a5bb4644 8f164e43 eb481144 2b467344 3a229b43 fae86743 a6720344 9ee5a043
efd52f40 396235762 S Ii:2:003:6 -115:1 544 <
efd52f40 396290030 C Ii:2:003:6 0:1 544 = 51b44644 57954f43 729d1144 55317344 ed589b43 46ef6743 0a950344 b50ea143
efd52f40 396297776 S Ii:2:003:6 -115:1 544 <
efd52f40 396352532 C Ii:2:003:6 0:1 544 = d71a3044 28f3e742 5af8f643 4f425d44 a6166043 ecaa1043 8b65db43 cdfe6a43
efd52f40 396364556 S Ii:2:003:6 -115:1 544 <
efd52f40 396415047 C Ii:2:003:6 0:1 544 = f9cd2f44 cd42e642 349ff543 e92e5d44 0ec35f43 70f60f43 c242db43 7f3f6943
efd52f40 396430722 S Ii:2:003:6 -115:1 544 <
efd52f40 396477550 C Ii:2:003:6 0:1 544 = 89ba3144 0f1bf642 ca73f943 d5a35e44 c05e6643 3ce51543 f601de43 e6ea6f43
efd52f40 396484609 S Ii:2:003:6 -115:1 544 <
efd52f40 396540047 C Ii:2:003:6 0:1 544 = 22ec3144 8ae2f742 df14fa43 10ab5e44 a0416543 44111643 9da5dd43 f1116f43
efd52f40 396550717 S Ii:2:003:6 -115:1 544 <
efd52f40 396602529 C Ii:2:003:6 0:1 544 = cec84a44 94765f43 bdd91544 317a7744 69faa343 ea617843 ef770744 4684a943
efd52f40 396615676 S Ii:2:003:6 -115:1 544 <
efd52f40 396665049 C Ii:2:003:6 0:1 544 = 3abd4a44 20d55f43 729c1544 a58e7744 72e2a443 bda97b43 80f20744 fc10aa43
efd52f40 396678054 S Ii:2:003:6 -115:1 544 <
efd52f40 396727545 C Ii:2:003:6 0:1 544 = 91f14744 38065443 110b1344 9b207544 4c07a043 04f47143 69b90544 adb0a543
efd52f40 396737470 S Ii:2:003:6 -115:1 544 <
efd52f40 396790048 C Ii:2:003:6 0:1 544 = ec6b4744 0c4b5143 854e1244 f7647444 9b679e43 8aa26d43 b3bc0444 e97ba343
efd52f40 396801679 S Ii:2:003:6 -115:1 544 <
efd52f40 396852535 C Ii:2:003:6 0:1 544 = 96ce2f44 e8a8e142 487ff443 91135c44 35e35a43 36c80b43 e09dd843 2bb36443
efd52f40 396864792 S Ii:2:003:6 -115:1 544 <
efd52f40 396915056 C Ii:2:003:6 0:1 544 = aea33044 55e3ea42 aa96f643 9bf95c44 ec4c5f43 ead20f43 0e9ada43 c8e76843
efd52f40 396925655 S Ii:2:003:6 -115:1 544 <
efd52f40 396977548 C Ii:2:003:6 0:1 544 = 20063244 3c42f742 70fdf943 e6c85e44 74956543 541a1643 1b03de43 e2ed6f43
efd52f40 396990682 S Ii:2:003:6 -115:1 544 <
efd52f40 397040043 C Ii:2:003:6 0:1 544 = 92313244 1b62f742 bebffa43 767a5f44 6a4c6843 f7d41843 d7b5df43 3fbc7243
efd52f40 397057542 S Ii:2:003:6 -115:1 544 <
efd52f40 397102530 C Ii:2:003:6 0:1 544 = afb34944 da895a43 86ae1444 d6287744 1fc2a343 47157843 b14d0744 6ef8a843
efd52f40 397113408 S Ii:2:003:6 -115:1 544 <
efd52f40 397165036 C Ii:2:003:6 0:1 544 = 9f194944 c0d25843 06ea1344 d0bc7544 171ea143 b1737243 aeeb0544 7e84a643
efd52f40 397172443 S Ii:2:003:6 -115:1 544 <
efd52f40 397227550 C Ii:2:003:6 0:1 544 = 002b4644 c60e4d43 95fc1044 44dc7244 3b979a43 99f06543 0be30244 6d2fa043
efd52f40 397234913 S Ii:2:003:6 -115:1 544 <
efd52f40 397290049 C Ii:2:003:6 0:1 544 = 8b414844 30cb5443 d9dc1244 afbb7444 60589f43 3df06e43 224d0544 2e7aa443
efd52f40 397302944 S Ii:2:003:6 -115:1 544 <
efd52f40 397352535 C Ii:2:003:6 0:1 544 = d14f3144 1c3cf242 2566f843 bf435e44 33f96543 e45b1643 b1c2dd43 1f3e6f43
efd52f40 397365617 S Ii:2:003:6 -115:1 544 <
efd52f40 397415026 C Ii:2:003:6 0:1 544 = a4983044 22a9eb42 83dcf643 7dd05d44 53326243 d2ff1243 6c68dc43 b27f6b43
efd52f40 397426673 S Ii:2:003:6 -115:1 544 <
efd52f40 397477530 C Ii:2:003:6 0:1 544 = 47153244 a1d9f542 5162f943 1f9b5e44 0a726543 952a1643 f5c2dd43 c51a6f43
efd52f40 397486691 S Ii:2:003:6 -115:1 544 <
efd52f40 397540028 C Ii:2:003:6 0:1 544 = 56ac3044 587ee942 8f71f643 93d05c44 1a875f43 d5890f43 e2b7da43 65906943
efd52f40 397543992 S Ii:2:003:6 -115:1 544 <
efd52f40 397602557 C Ii:2:003:6 0:1 544 = 639d4a44 bd3e5e43 e5741544 ee7d7744 2650a443 2b647943 32cb0744 a9a4a943
efd52f40 397608824 S Ii:2:003:6 -115:1 544 <
efd52f40 397665051 C Ii:2:003:6 0:1 544 = c3934944 e28e5943 04781444 517f7644 59bfa243 de7c7643 5e1e0744 8b5ea843
efd52f40 397678734 S Ii:2:003:6 -115:1 544 <
efd52f40 397727535 C Ii:2:003:6 0:1 544 = 123f4744 5b275143 1a0b1244 e9447444 8c219e43 b8836c43 a2ad0444 b661a343
efd52f40 397738694 S Ii:2:003:6 -115:1 544 <
efd52f40 397790034 C Ii:2:003:6 0:1 544 = 5b224944 c43e5843 87e21344 0d937544 c468a043 3faf7143 0b0f0644 4cb8a543
efd52f40 397803813 S Ii:2:003:6 -115:1 544 <
efd52f40 397852530 C Ii:2:003:6 0:1 544 = 79292f44 30aee042 78c2f343 36995b44 9c4a5943 68d90943 c373d743 0d5f6343
efd52f40 397867211 S Ii:2:003:6 -115:1 544 <
efd52f40 397915029 C Ii:2:003:6 0:1 544 = 79573144 3f45f242 2d82f843 4f365e44 4ce46243 b2b11443 5f04dd43 d73e6e43
efd52f40 397933507 S Ii:2:003:6 -115:1 544 <
efd52f40 397977532 C Ii:2:003:6 0:1 544 = 3a613344 9d760143 bd7afc43 26656044 9d146d43 7e511e43 401ce243 62677743
efd52f40 397984412 S Ii:2:003:6 -115:1 544 <
efd52f40 398040028 C Ii:2:003:6 0:1 544 = 2ac53044 af2fed42 cf24f743 fdcb5d44 49c96143 1e781343 6ac8dc43 c2bd6c43
efd52f40 398053828 S Ii:2:003:6 -115:1 544 <
efd52f40 398102529 C Ii:2:003:6 0:1 544 = 665f4a44 f2bd5c43 72bd1444 78c97644 6005a343 f8877743 01670744 264aa843
efd52f40 398112258 S Ii:2:003:6 -115:1 544 <
efd52f40 398165031 C Ii:2:003:6 0:1 544 = 1ae14744 e4595343 02621244 71537444 42989d43 d1df6c43 3ca10444 ff7ca343
efd52f40 398176006 S Ii:2:003:6 -115:1 544 <
efd52f40 398227528 C Ii:2:003:6 0:1 544 = 67064844 bf555543 2bee1244 5fde7444 5e409f43 cf556f43 f2360544 1e53a443
efd52f40 398240501 S Ii:2:003:6 -115:1 544 <
efd52f40 398290030 C Ii:2:003:6 0:1 544 = c96d4944 a1a15a43 de431444 7da67644 a02ba243 75ab7543 b4b10644 89c4a743
efd52f40 398302217 S Ii:2:003:6 -115:1 544 <
efd52f40 398352533 C Ii:2:003:6 0:1 544 = a0cd2e44 445bde42 37a6f343 13fd5b44 a7885b43 35d70b43 8dd8d843 b2096543
efd52f40 398365636 S Ii:2:003:6 -115:1 544 <
efd52f40 398415043 C Ii:2:003:6 0:1 544 = e8153144 ee4cef42 c49ff743 cd6b5d44 32626043 f8901143 28e7db43 7a256b43
efd52f40 398424445 S Ii:2:003:6 -115:1 544 <
efd52f40 398477546 C Ii:2:003:6 0:1 544 = c8e53144 fc44f742 31f8f943 99375e44 c9dd6343 53a31543 db92dd43 92626e43
efd52f40 398485660 S Ii:2:003:6 -115:1 544 <
efd52f40 398540046 C Ii:2:003:6 0:1 544 = b4133044 3229e742 dbacf543 e4ab5c44 ff855d43 53910f43 6971da43 29d46843
efd52f40 398546022 S Ii:2:003:6 -115:1 544 <
efd52f40 398602527 C Ii:2:003:6 0:1 544 = 40fb4944 335e5c43 ba9a1444 30ce7644 e68da343 445a7943 53b60744 986fa943
efd52f40 398610686 S Ii:2:003:6 -115:1 544 <
efd52f40 398665034 C Ii:2:003:6 0:1 544 = 73484844 03c15543 19351344 9c737544 5412a043 19d37243 83370644 b433a643
efd52f40 398676373 S Ii:2:003:6 -115:1 544 <
efd52f40 398727527 C Ii:2:003:6 0:1 544 = cbf34644 d3fa4f43 29bf1144 17a07344 39c39c43 6ef76a43 a7140444 4832a243
efd52f40 398735672 S Ii:2:003:6 -115:1 544 <
efd52f40 398790046 C Ii:2:003:6 0:1 544 = b6b24844 6d715543 db181344 e4ce7444 1ee99e43 36b66f43 92760544 847da443
efd52f40 398802415 S Ii:2:003:6 -115:1 544 <
efd52f40 398852548 C Ii:2:003:6 0:1 544 = 95632f44 6ceae242 fccdf343 58d85b44 aa205b43 9fc70c43 0edad843 308f6543
efd52f40 398870351 S Ii:2:003:6 -115:1 544 <
efd52f40 398915030 C Ii:2:003:6 0:1 544 = 1b813144 8509f342 dff5f843 fe735e44 1a546443 5a951643 2ad3dd43 a58f6f43
efd52f40 398921409 S Ii:2:003:6 -115:1 544 <
efd52f40 398977536 C Ii:2:003:6 0:1 544 = 960f3344 07e3ff42 7570fb43 193f6044 697d6b43 c1141d43 7e77e143 55167643
efd52f40 398994703 S Ii:2:003:6 -115:1 544 <
efd52f40 399040046 C Ii:2:003:6 0:1 544 = 375c3044 1f2bea42 b7bcf543 46d25c44 03585e43 c58f0f43 1b00db43 32ae6843
efd52f40 399050681 S Ii:2:003:6 -115:1 544 <
efd52f40 399102534 C Ii:2:003:6 0:1 544 = fd634944 87315a43 03171444 a8aa7544 75a5a043 80707343 176a0644 c256a643
efd52f40 399113661 S Ii:2:003:6 -115:1 544 <
efd52f40 399165047 C Ii:2:003:6 0:1 544 = 583a4644 a7344c43 f7af1044 83be7244 0cdb9a43 a19f6743 85710344 179fa043
efd52f40 399172660 S Ii:2:003:6 -115:1 544 <
efd52f40 399227532 C Ii:2:003:6 0:1 544 = aa344844 23765443 dbd41244 910d7544 0d9c9f43 1ed67143 02fa0544 3db0a543
efd52f40 399242565 S Ii:2:003:6 -115:1 544 <
efd52f40 399290045 C Ii:2:003:6 0:1 544 = 72df4844 b2545743 63851344 cae47544 65bba143 4dab7543 a6dc0644 a272a743
efd52f40 399299765 S Ii:2:003:6 -115:1 544 <
efd52f40 399352549 C Ii:2:003:6 0:1 544 = b80f2f44 c6d5de42 9b40f343 7dd65b44 26685b43 2a3c0d43 2135d943 e6b86543
efd52f40 399360368 S Ii:2:003:6 -115:1 544 <
efd52f40 399415029 C Ii:2:003:6 0:1 544 = f18f3244 2624f842 ae3af943 24805e44 0d1d6643 34bb1743 b5f3de43 0db57043
efd52f40 399419976 S Ii:2:003:6 -115:1 544 <
efd52f40 399477554 C Ii:2:003:6 0:1 544 = 7b4d3244 b4adf842 0c7bf943 f3ab5e44 3d036643 41f01743 8cf7de43 acae7043
efd52f40 399483336 S Ii:2:003:6 -115:1 544 <
efd52f40 399540037 C Ii:2:003:6 0:1 544 = a4513144 13c6f342 fb44f843 d81c5e44 98fe6443 7be51543 0e10de43 b08e6e43
efd52f40 399552341 S Ii:2:003:6 -115:1 544 <
efd52f40 399602535 C Ii:2:003:6 0:1 544 = b3ea4044 602b3743 0ec90b44 e5056e44 74599243 c1ba5643 5dfefd43 cbde9743
efd52f40 399616094 S Ii:2:003:6 -115:1 544 <
efd52f40 399665041 C Ii:2:003:6 0:1 544 = 68314744 62835043 9ef11144 e14d7444 00019f43 40e06f43 e1590544 d391a443
efd52f40 399669491 S Ii:2:003:6 -115:1 544 <
f23b4240 399686731 S Co:2:003:0 s 40 cb 0000 0000 0007 7 = 05010002 00ff07
f23b4240 399700159 C Co:2:003:0 0 7 >
efd52f40 399727530 C Ii:2:003:6 0:1 544 = 7c654644 c6e94d43 a6f31044 cbbc7244 58629b43 eda56843 7e9a0344 f00ea143
efd52f40 399745662 S Ii:2:003:6 -115:1 544 <
efd52f40 399790028 C Ii:2:003:6 0:1 544 = 881b4844 ef085543 56b21244 c6467444 5fae9e43 62dc6e43 d5db0444 c7f7a343
efd52f40 399800569 S Ii:2:003:6 -115:1 544 <
efd52f40 399852546 C Ii:2:003:6 0:1 544 = f6a94a44 e36d5f43 555f1544 7a037744 0ee9a343 1e8f7843 7b970744 2496a943
efd52f40 399865678 S Ii:2:003:6 -115:1 544 <
efd52f40 399915028 C Ii:2:003:6 0:1 544 = 48ed4b44 e8bd6443 76c21644 23c97844 e0d8a743 e0a08043 fbca0944 797bad43
efd52f40 399918665 S Ii:2:003:6 -115:1 544 <
efd52f40 399977531 C Ii:2:003:6 0:1 544 = 2cc14c44 e0a96743 d0881744 1fbb7944 5f40a943 be3b8243 8b720a44 020aaf43
efd52f40 399985661 S Ii:2:003:6 -115:1 544 <
efd52f40 400040032 C Ii:2:003:6 0:1 544 = 445f4944 c6e75843 39e91344 33107644 f534a243 e3cf7543 59a50644 65dfa743
efd52f40 400049573 S Ii:2:003:6 -115:1 544 <
efd52f40 400102531 C Ii:2:003:6 0:1 544 = df404a44 e8235b43 4d7f1444 793e7644 fa52a243 6e4a7643 d9ec0644 11d1a743
efd52f40 400114618 S Ii:2:003:6 -115:1 544 <
efd52f40 400165027 C Ii:2:003:6 0:1 544 = 2b7c4644 5b764e43 c5591144 cbd27244 c5459b43 3b1e6843 c63b0344 b8a1a043
efd52f40 400175657 S Ii:2:003:6 -115:1 544 <
efd52f40 400227527 C Ii:2:003:6 0:1 544 = 25783644 477e0d43 2b7b0144 cc476344 b0be7943 8e602a43 1986e843 c30c8243
efd52f40 400238679 S Ii:2:003:6 -115:1 544 <
efd52f40 400290032 C Ii:2:003:6 0:1 544 = b6743844 811b1643 827c0344 4fc66544 567f8143 7c273443 e4a8ec43 2e928643
efd52f40 400297049 S Ii:2:003:6 -115:1 544 <
efd52f40 400352528 C Ii:2:003:6 0:1 544 = be2f3844 36cb1443 d9100344 2f726544 fdcc8043 98d13243 5c4bec43 e6168643
efd52f40 400356407 S Ii:2:003:6 -115:1 544 <
efd52f40 400415047 C Ii:2:003:6 0:1 544 = b1874c44 78eb6643 0e6a1744 15f47844 0b96a743 264d8043 9b780944 5fe2ac43
efd52f40 400426669 S Ii:2:003:6 -115:1 544 <
efd52f40 400477532 C Ii:2:003:6 0:1 544 = 24f74b44 b7c56443 6ffb1644 f08f7844 5474a743 14258043 96750944 6cf3ac43
efd52f40 400486691 S Ii:2:003:6 -115:1 544 <
efd52f40 400540036 C Ii:2:003:6 0:1 544 = fae23144 2c91f642 a69af943 59be5e44 98c66743 c2891943 ca49df43 c8bd7143
efd52f40 400547931 S Ii:2:003:6 -115:1 544 <
efd52f40 400602528 C Ii:2:003:6 0:1 544 = 82644144 87153a43 b35f0c44 13576e44 251f9343 24305743 e8a5fe43 ac589843
efd52f40 400606687 S Ii:2:003:6 -115:1 544 <
efd52f40 400665033 C Ii:2:003:6 0:1 544 = a9374944 f0c15943 d8e41344 df2e7644 10f0a243 23737643 e3060744 d56fa843
efd52f40 400672797 S Ii:2:003:6 -115:1 544 <
efd52f40 400727530 C Ii:2:003:6 0:1 544 = 86734744 e1b25043 22e51144 85ad7344 7b539e43 3a046d43 a2750444 6a4aa343
efd52f40 400741300 S Ii:2:003:6 -115:1 544 <
efd52f40 400790029 C Ii:2:003:6 0:1 544 = ec563544 c84e0943 0c280044 35f26144 225a7543 42122643 52abe543 41917e43
efd52f40 400796653 S Ii:2:003:6 -115:1 544 <
efd52f40 400852533 C Ii:2:003:6 0:1 544 = de8e4a44 d7a45e43 a0ac1544 b7f77644 fc01a443 40f67843 91760744 ce30a943
efd52f40 400862666 S Ii:2:003:6 -115:1 544 <
efd52f40 400915037 C Ii:2:003:6 0:1 544 = c91e4c44 8ef66443 cf211744 f5517944 ee57a843 aee28043 abd00944 da85ad43
efd52f40 400923514 S Ii:2:003:6 -115:1 544 <
efd52f40 400977546 C Ii:2:003:6 0:1 544 = e30a3144 6cc5ee42 416df843 035c5e44 57af6643 02f31643 6416de43 21976f43
efd52f40 400996215 S Ii:2:003:6 -115:1 544 <
efd52f40 401040033 C Ii:2:003:6 0:1 544 = fb363144 d41ff042 5966f843 7b8f5e44 0f336743 5bd01743 3cbbde43 0d0b7043
efd52f40 401048620 S Ii:2:003:6 -115:1 544 <
efd52f40 401102546 C Ii:2:003:6 0:1 544 = 2f484044 1d6d3543 a5220b44 750f6d44 dde19043 2a055343 2a09fc43 66b99543
efd52f40 401109985 S Ii:2:003:6 -115:1 544 <
efd52f40 401165035 C Ii:2:003:6 0:1 544 = 85db2c44 24b0cf42 262bf043 44b65944 78205443 58b30443 aa35d543 41365d43
efd52f40 401176322 S Ii:2:003:6 -115:1 544 <
efd52f40 401227533 C Ii:2:003:6 0:1 544 = 7c712d44 9783d242 c4d9f043 ed455a44 4d2b5743 f2970743 efa4d643 16066143
efd52f40 401234664 S Ii:2:003:6 -115:1 544 <
efd52f40 401290029 C Ii:2:003:6 0:1 544 = fb5f3f44 31903243 a2750a44 e0706c44 ccb29043 3dd15143 b89efb43 05809543
efd52f40 401302736 S Ii:2:003:6 -115:1 544 <
efd52f40 401352533 C Ii:2:003:6 0:1 544 = 6b4a3044 66feeb42 380cf743 ed905d44 07a56343 58211443 43f6dc43 8c146d43
efd52f40 401364316 S Ii:2:003:6 -115:1 544 <
efd52f40 401415030 C Ii:2:003:6 0:1 544 = 19ec3844 ef6c1843 34f60344 d4e86544 25a18243 aaab3543 b485ed43 c0188743
f23b4240 401419793 S Ii:2:003:6 -115:1 544 <
f23b4240 401477547 C Ii:2:003:6 0:1 544 = 9fac4244 c2733e43 609d0d44 83266f44 f9c89443 16925a43 f4ceff43 25f19943
f23b4240 401487228 S Ii:2:003:6 -115:1 544 <
f23b4240 401540048 C Ii:2:003:6 0:1 544 = 79884244 7f003e43 f3bc0d44 f50a6f44 02879443 ec475a43 18a8ff43 60899943
f23b4240 401553801 S Ii:2:003:6 -115:1 544 <
f23b4240 401602551 C Ii:2:003:6 0:1 544 = 67713f44 f5543143 4acf0a44 93b56c44 c7239043 a0605043 f20bfb43 e3359543
f23b4240 401615649 S Ii:2:003:6 -115:1 544 <
f23b4240 401665050 C Ii:2:003:6 0:1 544 = 0d512e44 c7a9d942 07b0f343 690a5c44 8e2b5e43 7b220e43 39e7d943 5cca6643
f23b4240 401676360 S Ii:2:003:6 -115:1 544 <
f23b4240 401727531 C Ii:2:003:6 0:1 544 = 65684644 8cb94d43 18a31144 47787344 0bb09d43 40c96b43 df430444 a1c6a243
f23b4240 401735673 S Ii:2:003:6 -115:1 544 <
f23b4240 401790037 C Ii:2:003:6 0:1 544 = ba602d44 d2d9d142 e040f143 af8a5a44 11fe5643 5f7f0743 d755d643 847c6043
f23b4240 401809883 S Ii:2:003:6 -115:1 544 <
f23b4240 401852530 C Ii:2:003:6 0:1 544 = dc794a44 88695e43 00631544 a79d7644 6290a343 09e67743 400b0744 995ba843
f23b4240 401866684 S Ii:2:003:6 -115:1 544 <
f23b4240 401915033 C Ii:2:003:6 0:1 544 = a8764b44 6ff96143 7c6c1644 38d57744 f919a643 12717c43 13b00844 3a47ab43
f23b4240 401926735 S Ii:2:003:6 -115:1 544 <
f23b4240 401977531 C Ii:2:003:6 0:1 544 = ebb14c44 18b96743 8ec31744 5a627944 32a8a943 b3fe8143 91430a44 e578ae43
f23b4240 401986690 S Ii:2:003:6 -115:1 544 <
f23b4240 402040033 C Ii:2:003:6 0:1 544 = 0deb4144 e0f13b43 cd000d44 b7116f44 25369543 1d6e5a43 93b0ff43 4bae9943
f23b4240 402062689 S Ii:2:003:6 -115:1 544 <
f23b4240 402102548 C Ii:2:003:6 0:1 544 = 75013f44 a8d53043 843d0a44 887c6c44 db6a8f43 41a04f43 4d3ffa43 6f419443
f23b4240 402114729 S Ii:2:003:6 -115:1 544 <
f23b4240 402165034 C Ii:2:003:6 0:1 544 = dbd44644 07054e43 0a691144 4bdb7244 33139c43 14de6843 a1730344 dc3ea143
f23b4240 402172360 S Ii:2:003:6 -115:1 544 <
f23b4240 402227528 C Ii:2:003:6 0:1 544 = b4383544 68850943 ab9d0044 9b0e6244 8af17543 0dcc2643 b801e643 470a7f43
f23b4240 402238366 S Ii:2:003:6 -115:1 544 <
f23b4240 402290050 C Ii:2:003:6 0:1 544 = 28892d44 5c6dd442 40c4f143 bf955a44 bb475943 86f70943 7f68d743 18da6243
f23b4240 402298731 S Ii:2:003:6 -115:1 544 <
f23b4240 402352527 C Ii:2:003:6 0:1 544 = e2494144 e1d53943 9c500c44 db826e44 8de19343 8fb55843 14ebfe43 9e259843
f23b4240 402358725 S Ii:2:003:6 -115:1 544 <
f23b4240 402415028 C Ii:2:003:6 0:1 544 = 04123244 9390f942 8739fa43 5a705f44 f0096b43 cf541b43 1763e043 dd987343
f23b4240 402432000 S Ii:2:003:6 -115:1 544 <
f23b4240 402477529 C Ii:2:003:6 0:1 544 = 5fad4244 2f5c3f43 5fce0d44 85756f44 76259543 297a5b43 c4260044 a4fa9943
f23b4240 402486220 S Ii:2:003:6 -115:1 544 <
f23b4240 402540053 C Ii:2:003:6 0:1 544 = 8cc14144 0ded3b43 75f10c44 c17c6e44 ac689343 ece05743 9a54fe43 3df49743
f23b4240 402555771 S Ii:2:003:6 -115:1 544 <
f23b4240 402602533 C Ii:2:003:6 0:1 544 = 55d94744 5f645543 653b1344 d3e17444 2693a043 8fa87243 a0de0544 de9ca543
f23b4240 402614101 S Ii:2:003:6 -115:1 544 <
f23b4240 402665033 C Ii:2:003:6 0:1 544 = b77c2e44 3e08df42 b797f343 45e85b44 7f675e43 f6ca0e43 120eda43 f13e6743
f23b4240 402675702 S Ii:2:003:6 -115:1 544 <
f23b4240 402727536 C Ii:2:003:6 0:1 544 = 0a993544 68ec0a43 97b50044 1ef36244 78d67843 dac62943 6864e743 80498143
f23b4240 402738671 S Ii:2:003:6 -115:1 544 <
f23b4240 402790049 C Ii:2:003:6 0:1 544 = 03f13644 ee7e0f43 7cec0144 76f46344 da6d7d43 d7802e43 eebce943 b95b8343
f23b4240 402797599 S Ii:2:003:6 -115:1 544 <
f23b4240 402852536 C Ii:2:003:6 0:1 544 = 14533044 6635ec42 fa56f643 91ab5c44 c0076143 e83d1143 9f4cdb43 288a6943
f23b4240 402862689 S Ii:2:003:6 -115:1 544 <
f23b4240 402915036 C Ii:2:003:6 0:1 544 = d70d4344 96674143 e8380e44 74cf6f44 14af9543 896e5d43 39760044 b68e9a43
f23b4240 402922681 S Ii:2:003:6 -115:1 544 <
f23b4240 402977537 C Ii:2:003:6 0:1 544 = e8553b44 db5a2243 80b30644 17bf6844 7ed78743 b8674143 cd0af343 442b8d43
f23b4240 402987364 S Ii:2:003:6 -115:1 544 <
f23b4240 403040034 C Ii:2:003:6 0:1 544 = d88a3944 ccb21a43 aab30444 29ac6644 a7c18343 55b93843 eb0bef43 74ce8843
f23b4240 403055649 S Ii:2:003:6 -115:1 544 <
f23b4240 403102531 C Ii:2:003:6 0:1 544 = ca9a3744 f01d1243 aba10244 5c2d6544 226e8043 13a83143 5243eb43 7c618543
f23b4240 403115651 S Ii:2:003:6 -115:1 544 <
f23b4240 403165036 C Ii:2:003:6 0:1 544 = 23f14644 8f675043 30fe1144 02c67344 55e59c43 78016b43 0c080444 d5fba143
f23b4240 403177967 S Ii:2:003:6 -115:1 544 <
f23b4240 403227530 C Ii:2:003:6 0:1 544 = 46523744 c3411243 49550244 56f56344 d7257d43 73772e43 b9bde943 48ae8343
f23b4240 403238684 S Ii:2:003:6 -115:1 544 <
f23b4240 403290049 C Ii:2:003:6 0:1 544 = bbc53844 e3a31743 72d30344 b0f66544 9d3e8243 bf9c3743 4a6bee43 0cc48743
f23b4240 403302893 S Ii:2:003:6 -115:1 544 <
f23b4240 403352531 C Ii:2:003:6 0:1 544 = aaf64b44 2ca96543 983b1744 47797944 005da943 6a998143 fdfe0944 ea21ae43
f23b4240 403365717 S Ii:2:003:6 -115:1 544 <
f23b4240 403415030 C Ii:2:003:6 0:1 544 = 6fbd4144 baed3b43 a8ef0c44 61636f44 6c0a9543 a73c5b43 17e1ff43 80139a43
f23b4240 403424238 S Ii:2:003:6 -115:1 544 <
f23b4240 403477528 C Ii:2:003:6 0:1 544 = 69ba3844 42871643 439f0344 f5ad6544 765f8143 5d193443 4b6dec43 05818643
f23b4240 403490715 S Ii:2:003:6 -115:1 544 <
f23b4240 403540048 C Ii:2:003:6 0:1 544 = e6314b44 99936243 241a1644 7e827744 bd6da543 6e847c43 0a3a0844 e6a6aa43
f23b4240 403546690 S Ii:2:003:6 -115:1 544 <
f23b4240 403602561 C Ii:2:003:6 0:1 544 = 483e2f44 9e6ce342 bfedf443 61a15c44 257a5e43 6b261043 6438da43 afb26843
f23b4240 403618685 S Ii:2:003:6 -115:1 544 <
f23b4240 403665039 C Ii:2:003:6 0:1 544 = c71d3544 9ba80943 a7560044 4c736244 745a7643 74cf2743 626be643 0c8f8043
efd6b0c0 403679535 S Ii:2:003:6 -115:1 544 <
efd6b0c0 403727530 C Ii:2:003:6 0:1 544 = 368a3e44 a1722f43 e2e40944 74486b44 cbfd8c43 126e4b43 013ef843 68879243
efd6b0c0 403737689 S Ii:2:003:6 -115:1 544 <
efd6b0c0 403790047 C Ii:2:003:6 0:1 544 = c7a74844 69ef5743 51aa1344 fc787544 1f34a043 e6247243 0ec10544 5eb6a543
efd6b0c0 403799804 S Ii:2:003:6 -115:1 544 <
efd6b0c0 403852546 C Ii:2:003:6 0:1 544 = 634e3044 30bfeb42 8c6ff743 28165d44 0eea5f43 6b711143 be2ddb43 bd2a6a43
efd6b0c0 403867094 S Ii:2:003:6 -115:1 544 <
efd6b0c0 403915038 C Ii:2:003:6 0:1 544 = 8e6d4444 55854643 7e770f44 1d0d7144 1fc89843 ea8a6243 a2f50144 08739e43
efd6b0c0 403930629 S Ii:2:003:6 -115:1 544 <
efd6b0c0 403977532 C Ii:2:003:6 0:1 544 = eb333a44 aea61f43 07cd0544 ec096844 853f8643 7dad3e43 055bf143 6b9f8b43
efd6b0c0 403985705 S Ii:2:003:6 -115:1 544 <
efd6b0c0 404040036 C Ii:2:003:6 0:1 544 = f8983044 063fef42 e290f743 a3e75d44 40d36343 a7bf1443 639fdc43 fb496e43
efd6b0c0 404051586 S Ii:2:003:6 -115:1 544 <
efd6b0c0 404102535 C Ii:2:003:6 0:1 544 = 59994844 38345743 465f1344 a1597544 d68ba043 96427243 27cd0544 6f09a643
efd6b0c0 404110727 S Ii:2:003:6 -115:1 544 <
efd6b0c0 404165033 C Ii:2:003:6 0:1 544 = ce163544 e1000943 0b230044 dccc6144 29807343 f0ec2343 27fee443 053b7d43
efd6b0c0 404173254 S Ii:2:003:6 -115:1 544 <
efd6b0c0 404227533 C Ii:2:003:6 0:1 544 = 18552e44 9358db42 3d22f343 bc855b44 020c5b43 d5950b43 b7f6d843 74396543
efd6b0c0 404231093 S Ii:2:003:6 -115:1 544 <
efd6b0c0 404290034 C Ii:2:003:6 0:1 544 = eb642f44 4b36e342 943ff643 5e345d44 0c596243 b4ab1243 fb1edc43 e76d6c43
efd6b0c0 404298671 S Ii:2:003:6 -115:1 544 <
efd6b0c0 404352528 C Ii:2:003:6 0:1 544 = 74643844 28bf1543 96780344 0a916544 d9918143 04d23343 5b58ec43 8ab08643
efd6b0c0 404363215 S Ii:2:003:6 -115:1 544 <
efd6b0c0 404415036 C Ii:2:003:6 0:1 544 = 555b3144 e5ddf442 9819f943 033a5e44 676b6543 75e41643 7f07de43 d0f86f43
efd6b0c0 404426754 S Ii:2:003:6 -115:1 544 <
efd6b0c0 404477533 C Ii:2:003:6 0:1 544 = 6e383244 eac6f842 2ca3fa43 21105f44 4ede6843 42251a43 5387df43 38897343
efd6b0c0 404482676 S Ii:2:003:6 -115:1 544 <
efd6b0c0 404540033 C Ii:2:003:6 0:1 544 = bed43a44 8b572043 88cf0544 548c6744 fdfb8543 53933d43 871bf143 c5408b43
efd6b0c0 404549399 S Ii:2:003:6 -115:1 544 <
efd6b0c0 404602536 C Ii:2:003:6 0:1 544 = 8b982f44 ca79e642 c164f543 00145d44 78696043 f3751343 8145dc43 23d26c43
efd6b0c0 404609633 S Ii:2:003:6 -115:1 544 <
efd6b0c0 404665028 C Ii:2:003:6 0:1 544 = 86f82d44 12ebd942 0dddf243 8abf5b44 d0a25b43 28eb0b43 66c1d843 624d6543
efd6b0c0 404674133 S Ii:2:003:6 -115:1 544 <
efd6b0c0 404727536 C Ii:2:003:6 0:1 544 = f6523544 11020943 761a0044 ca266244 9ce37343 1f762543 dadbe443 be947e43
efd6b0c0 404735472 S Ii:2:003:6 -115:1 544 <
f734e940 404778046 S Co:2:003:0 s 40 cb 0000 0000 0007 7 = 01010002 00ff07
f734e940 404791409 C Co:2:003:0 0 7 >
efd6b0c0 404791416 C Ii:2:003:6 0:1 544 = 87eb4644 c8fd4d43 b6751144 1ef67244 33289c43 67356943 8eab0344 74e5a143
efd6b0c0 404806702 S Ii:2:003:6 -115:1 544 <
efd6b0c0 404852536 C Ii:2:003:6 0:1 544 = 80964a44 78195f43 18631544 b7e37644 3e82a343 37ea7743 ba540744 4c13a943
efd6b0c0 404867304 S Ii:2:003:6 -115:1 544 <
efd6b0c0 404915028 C Ii:2:003:6 0:1 544 = fcff0f44 0cb051c1 1b38b643 6a623d44 380bc442 9b759c41 d6559c43 70ced642
efd6b0c0 404926678 S Ii:2:003:6 -115:1 544 <
efd6b0c0 404977529 C Ii:2:003:6 0:1 544 = 41fd1044 3f3d09c1 bfebb743 59473e44 3309ca42 8b6eb441 d4ce9d43 f92fde42
efd6b0c0 404986677 S Ii:2:003:6 -115:1 544 <
efd6b0c0 405040034 C Ii:2:003:6 0:1 544 = 81d70f44 f75c5ac1 b6deb543 d8363c44 0b95bd42 5cfd7f41 9fd39943 598ccf42
efd6b0c0 405047991 S Ii:2:003:6 -115:1 544 <
efd6b0c0 405102535 C Ii:2:003:6 0:1 544 = 8bb00d44 07b8aec1 e3a7b143 c8da3a44 c0b3b242 7a9c1341 35bf9643 c8aec342
efd6b0c0 405106690 S Ii:2:003:6 -115:1 544 <
efd6b0c0 405165057 C Ii:2:003:6 0:1 544 = d2da4844 b88c5743 96fa1344 e8a87544 119ea143 7f237543 4f690644 5941a743
efd6b0c0 405173788 S Ii:2:003:6 -115:1 544 <
efd6b0c0 405227532 C Ii:2:003:6 0:1 544 = 99fb4744 2d9d5443 6a0e1344 922c7544 feaba043 bcb87343 700f0644 acaca643
efd6b0c0 405234671 S Ii:2:003:6 -115:1 544 <
efd6b0c0 405290050 C Ii:2:003:6 0:1 544 = e3144844 99715643 86621344 83d07544 64aea143 7e4a7543 11490644 4d02a743
efd6b0c0 405305662 S Ii:2:003:6 -115:1 544 <
efd6b0c0 405352528 C Ii:2:003:6 0:1 544 = 5a6b4a44 648c5c43 2ed81444 48567644 68b9a243 5c5f7643 3db20644 abe8a743
efd6b0c0 405363835 S Ii:2:003:6 -115:1 544 <
efd6b0c0 405415039 C Ii:2:003:6 0:1 544 = a2551044 57bf37c1 8dc6b643 36f23c44 7837c142 80818d41 1c599b43 8051d342
f23b4a40 405423728 S Ii:2:003:6 -115:1 544 <
f23b4a40 405477533 C Ii:2:003:6 0:1 544 = 94cf1044 ef8c1ec1 0d31b843 c4b33d44 d0e9c642 8b7aa141 fc929c43 46efd942
f23b4a40 405491425 S Ii:2:003:6 -115:1 544 <
f23b4a40 405540030 C Ii:2:003:6 0:1 544 = 46dc0f44 41ab52c1 e09ab643 6c443d44 e0aac242 ddf19541 0cba9b43 9049d542
f23b4a40 405550125 S Ii:2:003:6 -115:1 544 <
f23b4a40 405602550 C Ii:2:003:6 0:1 544 = 04cf0c44 8962d1c1 eb75b043 b3fc3a44 8eb9b042 426e1641 be1e9743 6f62c342
f23b4a40 405614667 S Ii:2:003:6 -115:1 544 <
f23b4a40 405665029 C Ii:2:003:6 0:1 544 = 5c4b4744 346a5143 e14c1244 0c9d7344 07969d43 4fd46c43 182d0444 1a37a343
f23b4a40 405674721 S Ii:2:003:6 -115:1 544 <
f23b4a40 405727538 C Ii:2:003:6 0:1 544 = 36b54644 26ed4e43 5b021244 9d537344 371e9d43 18156b43 b6f00344 9d87a243
f23b4a40 405738017 S Ii:2:003:6 -115:1 544 <
f23b4a40 405790033 C Ii:2:003:6 0:1 544 = 375a4944 4de95943 fe5e1444 e4537644 d0e6a243 8f447743 97130744 9a30a843
f23b4a40 405805683 S Ii:2:003:6 -115:1 544 <
f23b4a40 405852532 C Ii:2:003:6 0:1 544 = 6d004b44 3b796143 c5191644 07e97744 350fa543 17377c43 07290844 09a1aa43
f23b4a40 405862739 S Ii:2:003:6 -115:1 544 <
f23b4a40 405915036 C Ii:2:003:6 0:1 544 = b8f31044 5f061ac1 0c43b843 57413e44 6e0fca42 27c8ac41 41609d43 07f8dc42
f23b4a40 405927686 S Ii:2:003:6 -115:1 544 <
f23b4a40 405977551 C Ii:2:003:6 0:1 544 = 5def1044 662423c1 57b4b743 ed763d44 8134c342 fa559c41 9b139c43 4fc4d742
f23b4a40 405985423 S Ii:2:003:6 -115:1 544 <
f23b4a40 406040049 C Ii:2:003:6 0:1 544 = 83ad0e44 a3dc99c1 6582b343 0d5c3b44 9762b342 935f1d41 146f9743 b18fc642
f23b4a40 406047389 S Ii:2:003:6 -115:1 544 <
f23b4a40 406102557 C Ii:2:003:6 0:1 544 = ebcc0e44 1fe986c1 1bb5b443 bd863c44 b8cabc42 d79f7341 113a9a43 303dcf42
f23b4a40 406110667 S Ii:2:003:6 -115:1 544 <
f23b4a40 406165035 C Ii:2:003:6 0:1 544 = efd44644 b9104f43 6c361244 1c4e7444 80349f43 fc1e6f43 e92a0544 f4bda443
f23b4a40 406169609 S Ii:2:003:6 -115:1 544 <
f23b4a40 406227534 C Ii:2:003:6 0:1 544 = 15184744 35a95043 fb451244 72857444 8bbd9e43 5cb36e43 44e00444 e910a443
f23b4a40 406236969 S Ii:2:003:6 -115:1 544 <
f23b4a40 406290047 C Ii:2:003:6 0:1 544 = a1404944 7f3e5843 dd1d1444 c3ea7544 0d06a243 c8d37443 e77b0644 d82fa743
f23b4a40 406295650 S Ii:2:003:6 -115:1 544 <
f23b4a40 406352530 C Ii:2:003:6 0:1 544 = 24944a44 83ee5e43 8da31544 95877644 b395a243 8d6f7643 17eb0644 5127a843
f23b4a40 406366671 S Ii:2:003:6 -115:1 544 <
f23b4a40 406415031 C Ii:2:003:6 0:1 544 = 1da31344 72269e3f 3c58bd43 e18e4044 4040dc42 ee1cfd41 2a77a143 e9c6ee42
f23b4a40 406426685 S Ii:2:003:6 -115:1 544 <
f23b4a40 406477530 C Ii:2:003:6 0:1 544 = a41d1144 cfe00bc1 4872b843 a18f3e44 1ebdcf42 f32bc441 2c879e43 c75ae142
f23b4a40 406481862 S Ii:2:003:6 -115:1 544 <
f23b4a40 406540050 C Ii:2:003:6 0:1 544 = be321044 11b85ec1 9990b643 cb3f3d44 0cd1c342 f7359541 8f459b43 0e64d742
f23b4a40 406547461 S Ii:2:003:6 -115:1 544 <
f23b4a40 406602531 C Ii:2:003:6 0:1 544 = bfc00e44 afac91c1 f905b443 2d6f3c44 411fbd42 e5896541 be359943 5632ce42
f23b4a40 406618356 S Ii:2:003:6 -115:1 544 <
f23b4a40 406665030 C Ii:2:003:6 0:1 544 = 752b4844 18565343 ae071344 0be27444 4c1ca043 63ad7043 f94b0544 f9a8a543
f23b4a40 406672814 S Ii:2:003:6 -115:1 544 <
f23b4a40 406727531 C Ii:2:003:6 0:1 544 = 79c24844 bafd5643 eec11344 ec807544 57c1a043 21ef7143 06ce0544 bf59a643
f23b4a40 406736625 S Ii:2:003:6 -115:1 544 <
f23b4a40 406790030 C Ii:2:003:6 0:1 544 = 1b0b4a44 d7ce5b43 40401544 bc7a7744 0aeaa443 e0627b43 3e170844 ab90aa43
f23b4a40 406802621 S Ii:2:003:6 -115:1 544 <
f23b4a40 406852549 C Ii:2:003:6 0:1 544 = 97c14a44 e37e5e43 c3b51544 8e567744 73bca443 ad8d7b43 90070844 d76eaa43
f23b4a40 406866675 S Ii:2:003:6 -115:1 544 <
f23b4a40 406915032 C Ii:2:003:6 0:1 544 = 97421244 9b9670c0 d01dba43 ae1e3f44 7721d342 5b1dd441 7db59f43 0fa9e642
f23b4a40 406926609 S Ii:2:003:6 -115:1 544 <
f23b4a40 406977537 C Ii:2:003:6 0:1 544 = 5ca31044 089838c1 3615b743 2a273d44 b18dc242 c7018e41 6d729b43 206fd342
f23b4a40 406987482 S Ii:2:003:6 -115:1 544 <
f23b4a40 407040031 C Ii:2:003:6 0:1 544 = 7a201044 3d1755c1 5190b643 44b23c44 9f4bbf42 3bb38341 84f59a43 9c20d242
f23b4a40 407049106 S Ii:2:003:6 -115:1 544 <
f23b4a40 407102550 C Ii:2:003:6 0:1 544 = a16c0e44 99a1a6c1 4df9b243 17de3b44 fcabbb42 63a36341 91a89943 3c5acc42
f23b4a40 407121688 S Ii:2:003:6 -115:1 544 <
f23b4a40 407165037 C Ii:2:003:6 0:1 544 = 14d34744 38025343 d7a31244 ac1c7544 1084a043 47d97143 20cb0544 8c13a643
f23b4a40 407175686 S Ii:2:003:6 -115:1 544 <
f23b4a40 407227532 C Ii:2:003:6 0:1 544 = 1de94744 2e815343 e1e51244 e8197544 fa84a043 74697143 27750544 6a5ba543
f23b4a40 407238605 S Ii:2:003:6 -115:1 544 <
f23b4a40 407290038 C Ii:2:003:6 0:1 544 = b4674744 83925043 e0341244 cdff7344 083b9e43 86bb6d43 02bb0444 568ca343
f23b4a40 407298675 S Ii:2:003:6 -115:1 544 <
f23b4a40 407352538 C Ii:2:003:6 0:1 544 = d0474a44 3aa85b43 c3c41444 b6247644 904fa243 e2fd7543 41d40644 d691a743
f23b4a40 407368081 S Ii:2:003:6 -115:1 544 <
f23b4a40 407415045 C Ii:2:003:6 0:1 544 = fff11144 2f9499c0 baa4ba43 2d2f3f44 e528d242 5b13d141 6d999f43 192ee442
f6d0ddc0 407422671 S Ii:2:003:6 -115:1 544 <
f6d0ddc0 407477549 C Ii:2:003:6 0:1 544 = 1e8b1044 ac9c44c1 a0d3b743 9e033e44 aab9c842 7ae4aa41 7c3d9d43 2d6ddc42
f6d0ddc0 407488579 S Ii:2:003:6 -115:1 544 <
f6d0ddc0 407540036 C Ii:2:003:6 0:1 544 = 156e0f44 cf8082c1 dd32b443 5d543c44 6c3bba42 3ab35141 819f9943 bb86cd42
f6d0ddc0 407552325 S Ii:2:003:6 -115:1 544 <
f6d0ddc0 407602558 C Ii:2:003:6 0:1 544 = 36770e44 daf5a2c1 d9b9b243 ea5c3b44 c89cb342 9edd2541 43d09743 3a2fc742
f6d0ddc0 407615687 S Ii:2:003:6 -115:1 544 <
f6d0ddc0 407665036 C Ii:2:003:6 0:1 544 = af714744 1eee5043 a2381244 07e87344 99069e43 96d76c43 d8960444 342ea443
f6d0ddc0 407678684 S Ii:2:003:6 -115:1 544 <
f6d0ddc0 407727531 C Ii:2:003:6 0:1 544 = e0734944 acdf5943 8a6c1444 46197644 4bf7a143 73117643 03a10644 a0e1a743
f6d0ddc0 407735643 S Ii:2:003:6 -115:1 544 <
f6d0ddc0 407790032 C Ii:2:003:6 0:1 544 = cb294a44 57df5b43 12101544 cb337744 613ba443 4d537b43 7ad00744 0f78aa43
f6d0ddc0 407802686 S Ii:2:003:6 -115:1 544 <
f6d0ddc0 407852537 C Ii:2:003:6 0:1 544 = 0a784a44 3c615d43 1c391544 9ce97644 8aeea243 7d757843 a12c0744 c707a943
f6d0ddc0 407864615 S Ii:2:003:6 -115:1 544 <
f6d0ddc0 407915038 C Ii:2:003:6 0:1 544 = 963c1244 88f3bcc0 bd98b943 48553e44 d65aca42 4c06bc41 651a9e43 e0e2e042
f6d0ddc0 407930701 S Ii:2:003:6 -115:1 544 <
f6d0ddc0 407977534 C Ii:2:003:6 0:1 544 = 5dd71044 432829c1 0476b743 5d1e3d44 41cdc142 771b8f41 87809b43 b7a2d742
f6d0ddc0 407986748 S Ii:2:003:6 -115:1 544 <
f6d0ddc0 408040052 C Ii:2:003:6 0:1 544 = ff980f44 800176c1 cb70b543 fe4c3c44 6067b942 c75f5e41 5d659943 c568ce42
f6d0ddc0 408047198 S Ii:2:003:6 -115:1 544 <
f6d0ddc0 408102427 C Ii:2:003:6 0:1 544 = e1250e44 e9cbafc1 a63db343 e3e43b44 c0a5b842 bfe85541 0f339943 9b90cd42
f6d0ddc0 408107985 S Ii:2:003:6 -115:1 544 <
f6d0ddc0 408165049 C Ii:2:003:6 0:1 544 = 71104744 ac3f4f43 eae41144 edd07344 046e9d43 bb256d43 0fae0444 621ea443
f6d0ddc0 408176263 S Ii:2:003:6 -115:1 544 <
f6d0ddc0 408227537 C Ii:2:003:6 0:1 544 = ff274844 dabb5543 75221344 42637444 ce639e43 7e346f43 f3300544 13cda443
f6d0ddc0 408235706 S Ii:2:003:6 -115:1 544 <
f6d0ddc0 408290064 C Ii:2:003:6 0:1 544 = 796a4944 0e295943 4e221444 a7dc7544 d836a143 39567443 d2ad0644 44b4a743
f6d0ddc0 408295701 S Ii:2:003:6 -115:1 544 <
f6d0ddc0 408352549 C Ii:2:003:6 0:1 544 = e41a4c44 bdc96343 1dd51644 bb277844 d7d8a543 e9577d43 18c40844 f76eac43
f6d0ddc0 408364148 S Ii:2:003:6 -115:1 544 <
f6d0ddc0 408415034 C Ii:2:003:6 0:1 544 = c90b1244 6438aac0 2e11ba43 d9f53e44 0055ce42 18e6c541 bc229f43 af06e542
f6d0ddc0 408423999 S Ii:2:003:6 -115:1 544 <
f6d0ddc0 408477529 C Ii:2:003:6 0:1 544 = fc871144 1c4c06c1 f8c9b843 f13a3e44 1c3fc742 6680aa41 7a999d43 8b4dde42
f6d0ddc0 408488063 S Ii:2:003:6 -115:1 544 <
f6d0ddc0 408540035 C Ii:2:003:6 0:1 544 = 98631144 516d0fc1 908bb843 439f3d44 da31c642 0b848c41 61229c43 679ed842
f6d0ddc0 408548867 S Ii:2:003:6 -115:1 544 <
f6d0ddc0 408602532 C Ii:2:003:6 0:1 544 = 4e8a0d44 65f3adc1 ce08b243 11c83a44 80dcb042 49690141 051b9743 b257c442
f6d0ddc0 408607342 S Ii:2:003:6 -115:1 544 <
f6d0ddc0 408664927 C Ii:2:003:6 0:1 544 = 66674944 60135a43 4d991444 32377644 9f21a243 d1547543 59db0644 afd0a743
f6d0ddc0 408674695 S Ii:2:003:6 -115:1 544 <
f6d0ddc0 408727415 C Ii:2:003:6 0:1 544 = 30274844 6fc15343 1ded1244 34037544 ccb39f43 b17f6f43 998f0544 c5c0a543
f6d0ddc0 408739012 S Ii:2:003:6 -115:1 544 <
f6d0ddc0 408789926 C Ii:2:003:6 0:1 544 = 8d244844 a4aa5443 cdf81244 faed7444 09fa9f43 c32a7043 ff790544 4847a543
f6d0ddc0 408805360 S Ii:2:003:6 -115:1 544 <
f6d0ddc0 408852534 C Ii:2:003:6 0:1 544 = 7bb04a44 b23e5e43 b5e01444 b70b7644 6c0aa243 24787443 f09d0644 1cdea743
f6d0ddc0 408863874 S Ii:2:003:6 -115:1 544 <
f6d0ddc0 408915037 C Ii:2:003:6 0:1 544 = 74831144 040bf9c0 e22bb943 9cf53d44 1ebfc642 d310a141 7e249d43 5a5fda42
f6d0ddc0 408927192 S Ii:2:003:6 -115:1 544 <
f6d0ddc0 408977535 C Ii:2:003:6 0:1 544 = e4021144 b4c529c1 beabb743 abf13d44 3f14c942 a38b9f41 fd0f9d43 1a9cdb42
f6d0ddc0 408986472 S Ii:2:003:6 -115:1 544 <
f6d0ddc0 409040031 C Ii:2:003:6 0:1 544 = c9c01144 56f5b8c0 da35b943 47b93e44 46eecd42 3861ae41 274f9e43 9380e042
f6d0ddc0 409045653 S Ii:2:003:6 -115:1 544 <
f6d0ddc0 409102538 C Ii:2:003:6 0:1 544 = c36f0c44 267dd7c1 9c15af43 c7b33944 3afaa942 f6567c40 ae939543 95debb42
f6d0ddc0 409114678 S Ii:2:003:6 -115:1 544 <
f6d0ddc0 409165046 C Ii:2:003:6 0:1 544 = caf04744 37285443 c8d81244 24937444 03309e43 ee526c43 efc60444 1709a443
f6d0ddc0 409170667 S Ii:2:003:6 -115:1 544 <
f6d0ddc0 409227534 C Ii:2:003:6 0:1 544 = 8aa94844 495b5643 e8991344 04217544 732fa043 629d6f43 518c0544 787ba543
f6d0ddc0 409238046 S Ii:2:003:6 -115:1 544 <
f6d0ddc0 409290030 C Ii:2:003:6 0:1 544 = 14504944 e4cc5a43 af741444 77787644 6feea243 bcfa7543 ecf80644 6842a843
f6d0ddc0 409296347 S Ii:2:003:6 -115:1 544 <
f6d0ddc0 409352405 C Ii:2:003:6 0:1 544 = 13864b44 4b576143 561b1644 9dd57744 1bbea543 f89c7a43 30510844 2f6eab43
f6d0ddc0 409363562 S Ii:2:003:6 -115:1 544 <
f6d0ddc0 409414906 C Ii:2:003:6 0:1 544 = ada00f44 38af72c1 aac8b443 b2713c44 e56abb42 e6f95441 d6dc9943 ce3ece42
f6fdfb40 409424857 S Ii:2:003:6 -115:1 544 <
f6fdfb40 409477408 C Ii:2:003:6 0:1 544 = 8c051044 841852c1 a35eb543 a3793c44 16f9ba42 a49d5641 f7df9943 ffaccf42
f6fdfb40 409489709 S Ii:2:003:6 -115:1 544 <
f6fdfb40 409540032 C Ii:2:003:6 0:1 544 = b8fb0e44 07f088c1 fd63b443 9db83b44 7c79b742 8b373141 590d9943 7866cc42
f6fdfb40 409551601 S Ii:2:003:6 -115:1 544 <
f6fdfb40 409602532 C Ii:2:003:6 0:1 544 = 1b0a0e44 81f6a9c1 6a09b243 4bf03b44 9995b842 b0f53041 75259943 b728ce42
f6fdfb40 409608568 S Ii:2:003:6 -115:1 544 <
f6fdfb40 409665032 C Ii:2:003:6 0:1 544 = e9ce4844 a3e15743 dbcd1344 d5ef7544 f4afa243 059e7443 4acb0644 1b4fa843
f6fdfb40 409681450 S Ii:2:003:6 -115:1 544 <
f6fdfb40 409727529 C Ii:2:003:6 0:1 544 = c6324744 ea0e5043 99ef1144 75117444 68299e43 76826c43 f2bd0444 201fa443
f6fdfb40 409738681 S Ii:2:003:6 -115:1 544 <
f6fdfb40 409790034 C Ii:2:003:6 0:1 544 = f1744844 c29c5543 11441344 39317544 9d559f43 dfb86e43 106d0544 5788a543
f6fdfb40 409805695 S Ii:2:003:6 -115:1 544 <
f6fdfb40 409852548 C Ii:2:003:6 0:1 544 = 080a4c44 71576343 fba81644 a3f57744 eb8da543 e5b17a43 fe760844 7934ab43
f6fdfb40 409865641 S Ii:2:003:6 -115:1 544 <
f6fdfb40 409915037 C Ii:2:003:6 0:1 544 = ab6b1144 f4c1e8c0 d6b8b943 9c993e44 637cce42 74a7b241 4bf39e43 b343e242
f6fdfb40 409926682 S Ii:2:003:6 -115:1 544 <
f6fdfb40 409977426 C Ii:2:003:6 0:1 544 = c6501244 f1fb95c0 e036ba43 c0483f44 9374d342 deacc241 8ae39f43 487ee742
f6fdfb40 409986668 S Ii:2:003:6 -115:1 544 <
f6fdfb40 410039905 C Ii:2:003:6 0:1 544 = 3d1e0f44 4fd58fc1 0cf3b343 d4143c44 420eb942 e12e4941 239c9943 9620cd42
f6fdfb40 410050535 S Ii:2:003:6 -115:1 544 <
f6fdfb40 410102405 C Ii:2:003:6 0:1 544 = 53460d44 e853cfc1 99f2af43 43493a44 b0e0ab42 f8b38f40 0f149643 0b67be42
f6fdfb40 410112767 S Ii:2:003:6 -115:1 544 <
f6fdfb40 410165036 C Ii:2:003:6 0:1 544 = 1fc04744 d0a25143 90bb1244 53687444 61629e43 64a86c43 7d1d0544 39c3a443
f6fdfb40 410181789 S Ii:2:003:6 -115:1 544 <
f6fdfb40 410227535 C Ii:2:003:6 0:1 544 = b5a74844 865b5543 b3541344 48a77544 f9bea143 75557343 17bb0644 90a2a743
f6fdfb40 410242687 S Ii:2:003:6 -115:1 544 <
f6fdfb40 410290034 C Ii:2:003:6 0:1 544 = 3b3b4a44 60965c43 d9061544 016c7744 c813a543 d3c87943 3c0a0844 a6daaa43
f6fdfb40 410302382 S Ii:2:003:6 -115:1 544 <
f6fdfb40 410352529 C Ii:2:003:6 0:1 544 = 4e2c4b44 c53b5f43 c5e31544 bba97744 9d44a443 02f67843 c5be0744 cf60aa43
f6fdfb40 410360626 S Ii:2:003:6 -115:1 544 <
f6fdfb40 410415035 C Ii:2:003:6 0:1 544 = dd2c1144 b7e418c1 34acb743 27eb3d44 e09cc542 0b879041 7d719c43 f9c0d942
f6fdfb40 410427507 S Ii:2:003:6 -115:1 544 <
f6fdfb40 410477547 C Ii:2:003:6 0:1 544 = 80e41144 3497bdc0 579fb943 737e3e44 8c3bca42 4c0aa841 92249e43 5d68e042
f6fdfb40 410488545 S Ii:2:003:6 -115:1 544 <
f6fdfb40 410540034 C Ii:2:003:6 0:1 544 = c2740f44 2ba573c1 722db543 54c53c44 d85ebc42 f4b76041 4aa99a43 a552d142
f6fdfb40 410549021 S Ii:2:003:6 -115:1 544 <
f6fdfb40 410602532 C Ii:2:003:6 0:1 544 = a7c00e44 ef6b88c1 1949b443 c8d63c44 de5bbd42 a6855e41 68979a43 9e9fd142
f6fdfb40 410614728 S Ii:2:003:6 -115:1 544 <
f6fdfb40 410664907 C Ii:2:003:6 0:1 544 = a36a4744 2cb15143 2f161244 d16e7444 95889e43 e35c6d43 a6fb0444 faaea443
f6fdfb40 410680628 S Ii:2:003:6 -115:1 544 <
f6fdfb40 410727407 C Ii:2:003:6 0:1 544 = b0054644 59a64b43 05951044 9f957244 c2e39a43 379c6543 af520344 9811a143
f6fdfb40 410739209 S Ii:2:003:6 -115:1 544 <
f6fdfb40 410789919 C Ii:2:003:6 0:1 544 = b2094a44 0de15b43 3ddd1444 a3c97644 b6fea243 d9187643 42460744 ee70a943
f6fdfb40 410795231 S Ii:2:003:6 -115:1 544 <
f6fdfb40 410852534 C Ii:2:003:6 0:1 544 = 3a274b44 a3856143 75411644 b80e7844 0059a543 3d207b43 e4880844 f9c0ab43
f6fdfb40 410859492 S Ii:2:003:6 -115:1 544 <
f6fdfb40 410915033 C Ii:2:003:6 0:1 544 = 26281144 a79218c1 a033b843 3d783e44 4abdc842 5d7aa241 b5bf9d43 00c4df42
f6fdfb40 410929991 S Ii:2:003:6 -115:1 544 <
f6fdfb40 410977532 C Ii:2:003:6 0:1 544 = 5c931144 92c5fdc0 0bb8b843 7a373e44 35f5c842 908fa241 2c509d43 4dd3de42
f6fdfb40 410998091 S Ii:2:003:6 -115:1 544 <
f6fdfb40 411040035 C Ii:2:003:6 0:1 544 = d6f40e44 39e08cc1 63e9b343 54b83b44 0fb0b342 65bf2041 db1d9843 7f8ac942
f6fdfb40 411055650 S Ii:2:003:6 -115:1 544 <
f6fdfb40 411102548 C Ii:2:003:6 0:1 544 = 2b650f44 d1ad80c1 bdb4b443 e58d3c44 d610bd42 68e05f41 51849a43 df5fd142
f6fdfb40 411108645 S Ii:2:003:6 -115:1 544 <
f6fdfb40 411165033 C Ii:2:003:6 0:1 544 = ea844844 4acf5543 ad6b1344 198a7544 0461a043 aa6f7243 c8610644 db7da743
f6fdfb40 411176392 S Ii:2:003:6 -115:1 544 <
f6fdfb40 411227530 C Ii:2:003:6 0:1 544 = 3b284944 e5315943 ce091444 784e7644 621fa243 fb1a7443 b9de0644 e325a843
f6fdfb40 411237187 S Ii:2:003:6 -115:1 544 <
f6fdfb40 411289926 C Ii:2:003:6 0:1 544 = 4a5c4944 64235943 ac101444 a8487644 1ddfa143 7a9d7343 6f9d0644 dc10a843
f6fdfb40 411303753 S Ii:2:003:6 -115:1 544 <
f6fdfb40 411352404 C Ii:2:003:6 0:1 544 = 9a354a44 7f755a43 b1851444 79d37544 2021a143 f2177343 3b680644 a431a743
f6fdfb40 411360021 S Ii:2:003:6 -115:1 544 <
f6fdfb40 411414908 C Ii:2:003:6 0:1 544 = f1f51144 9a96c4c0 e7b6b943 23763e44 c110cb42 4c77a241 54f99d43 e2e1df42
f6fdfb40 411423884 S Ii:2:003:6 -115:1 544 <
f6fdfb40 411477426 C Ii:2:003:6 0:1 544 = bb5d1144 c14500c1 b458b943 b9a03e44 e4f5ca42 5a1ba841 5c169e43 7faedf42
f6fdfb40 411483891 S Ii:2:003:6 -115:1 544 <
f6fdfb40 411540035 C Ii:2:003:6 0:1 544 = 33d80f44 848e58c1 0ec4b543 57203d44 d038be42 675e6641 bcdd9a43 9061d142
f6fdfb40 411549144 S Ii:2:003:6 -115:1 544 <
f6fdfb40 411602531 C Ii:2:003:6 0:1 544 = a2bf0d44 0f13b2c1 0650b143 00313b44 f828ad42 a51ae140 4fc29643 0e19c342
f6fdfb40 411606864 S Ii:2:003:6 -115:1 544 <
f6fdfb40 411665031 C Ii:2:003:6 0:1 544 = f4f34644 d9515043 cec41144 47c37344 e5f29b43 16c56843 93c00344 b059a243
f6fdfb40 411676278 S Ii:2:003:6 -115:1 544 <
f6fdfb40 411727552 C Ii:2:003:6 0:1 544 = 9dcc4944 7e175b43 9ea71444 e0327644 56b3a143 b63e7443 f08b0644 ae61a843
f6fdfb40 411732211 S Ii:2:003:6 -115:1 544 <
f6fdfb40 411790032 C Ii:2:003:6 0:1 544 = 05674a44 30925e43 eb621544 df567744 b052a443 b5ca7843 3f180844 f28aaa43
f6fdfb40 411800925 S Ii:2:003:6 -115:1 544 <
f6fdfb40 411852533 C Ii:2:003:6 0:1 544 = c6004d44 58296743 8d851744 d3297944 01dca743 30758043 27b70944 d33dae43
f6fdfb40 411858673 S Ii:2:003:6 -115:1 544 <
f6fdfb40 411915057 C Ii:2:003:6 0:1 544 = d83a1144 71c81bc1 6fe5b743 20ad3d44 18edc242 b13f8d41 b11e9c43 ab0dd942
f6fdfb40 411925654 S Ii:2:003:6 -115:1 544 <
f6fdfb40 411977410 C Ii:2:003:6 0:1 544 = df9e0f44 49c573c1 0c25b543 2c253c44 6911b842 1b733d41 c1239943 6e6dcc42
f6fdfb40 411988991 S Ii:2:003:6 -115:1 544 <
f6fdfb40 412039904 C Ii:2:003:6 0:1 544 = a1fe0f44 b28452c1 dad6b543 97b43c44 1446bb42 bad54f41 42509a43 37e9cf42
f6fdfb40 412047247 S Ii:2:003:6 -115:1 544 <
f6fdfb40 412102412 C Ii:2:003:6 0:1 544 = a0b90d44 8333b5c1 915cb243 0eb93b44 4500b242 fb340e41 4e3a9843 3dabc842
f6fdfb40 412109011 S Ii:2:003:6 -115:1 544 <
f6fdfb40 412165037 C Ii:2:003:6 0:1 544 = 88594844 443a5543 84061344 00727544 fe559f43 e14d6f43 7da00544 488ca543
f6fdfb40 412178679 S Ii:2:003:6 -115:1 544 <
f6fdfb40 412227537 C Ii:2:003:6 0:1 544 = 7c6d4844 7e355643 f0361344 40f67444 b2ee9e43 48526e43 0f5b0544 2df1a443
f6fdfb40 412242684 S Ii:2:003:6 -115:1 544 <
f6fdfb40 412290061 C Ii:2:003:6 0:1 544 = 13224a44 79645d43 e6061544 a8c37644 fcc3a243 cbef7443 02210744 c4e4a843
f6fdfb40 412306675 S Ii:2:003:6 -115:1 544 <
f6fdfb40 412352533 C Ii:2:003:6 0:1 544 = f3e94c44 30436843 ac9c1744 67e27844 1ba8a643 72af7d43 c8330944 75dcac43
f6fdfb40 412361740 S Ii:2:003:6 -115:1 544 <
f6fdfb40 412415038 C Ii:2:003:6 0:1 544 = 7e4c1144 7d41edc0 be66b843 df4d3e44 ced7ca42 b158a741 f7ee9d43 68bfde42
f6fdfb40 412431654 S Ii:2:003:6 -115:1 544 <
f6fdfb40 412477537 C Ii:2:003:6 0:1 544 = f23e1244 f4da85c0 234cba43 213e3f44 5c14cf42 670fbb41 e6489f43 9552e342
f6fdfb40 412486691 S Ii:2:003:6 -115:1 544 <
f6fdfb40 412540048 C Ii:2:003:6 0:1 544 = b63a0f44 154689c1 faf5b343 b1cd3b44 8ac2b342 e53c1941 067d9843 12c4c842
f6fdfb40 412545322 S Ii:2:003:6 -115:1 544 <
f6fdfb40 412602406 C Ii:2:003:6 0:1 544 = ae280e44 2baba4c1 a039b243 053d3b44 4644ac42 923cb940 24cb9643 c3e8c142
f6fdfb40 412608930 S Ii:2:003:6 -115:1 544 <
f6fdfb40 412664905 C Ii:2:003:6 0:1 544 = ec484944 6b7e5a43 6a241444 69b97544 b97ea043 1fc47043 51250644 22e0a643
f6fdfb40 412680442 S Ii:2:003:6 -115:1 544 <
f6fdfb40 412727408 C Ii:2:003:6 0:1 544 = cb0d4844 8e4d5543 af261344 4f5d7544 f0ee9f43 2dca6f43 66820544 baeda543
f6fdfb40 412735612 S Ii:2:003:6 -115:1 544 <
f6fdfb40 412789927 C Ii:2:003:6 0:1 544 = 26da4944 3fc45c43 c5cf1444 382a7744 aceea243 35697643 de290744 a356a943
f6fdfb40 412800971 S Ii:2:003:6 -115:1 544 <
f6fdfb40 412852552 C Ii:2:003:6 0:1 544 = 5beb4b44 2a906443 8bbc1644 14da7744 6c34a443 d3d27843 e5eb0744 4830aa43
f6fdfb40 412857250 S Ii:2:003:6 -115:1 544 <
f6fdfb40 412915053 C Ii:2:003:6 0:1 544 = 42131044 a9a444c1 20bab543 1b6f3c44 1dbcb842 b01d3f41 76629943 dd94ce42
f6fdfb40 412930714 S Ii:2:003:6 -115:1 544 <
f6fdfb40 412977538 C Ii:2:003:6 0:1 544 = 04941044 d59426c1 62ffb643 a10b3d44 e3e6bc42 2ed06a41 a7ad9a43 873ed242
f6fdfb40 412990798 S Ii:2:003:6 -115:1 544 <
f734e940 413035785 S Co:2:003:0 s 40 cc 0000 0000 0010 16 = 01010101 01010101 01010101 01010101
f734e940 413037154 C Co:2:003:0 0 16 >
f6fdfb40 413040035 C Ii:2:003:6 0:1 544 = 935b0f44 d64a73c1 f28db443 612d3c44 33aab742 01583841 80059943 8a08cd42
f6fdfb40 413040846 S Co:2:003:0 s 40 cb 0000 0000 0007 7 = 04010002 00ff07
f734e940 413046378 S Ii:2:003:6 -115:1 544 <
f6fdfb40 413054279 C Co:2:003:0 0 7 >
f734e940 413102538 C Ii:2:003:6 0:1 544 = 27d00d44 85fca3c1 00b1b143 dd783b44 6b6db642 5bcf3341 8bc29843 0fd5ca42
f734e940 413107220 S Ii:2:003:6 -115:1 544 <
f734e940 413165048 C Ii:2:003:6 0:1 544 = a5dcf147 d8e2ec47 dbddeb47 ac41e747 5941e547 76b1e547 483de647 e273e747
f734e940 413176619 S Ii:2:003:6 -115:1 544 <
f734e940 413227551 C Ii:2:003:6 0:1 544 = 7d8372c8 586073c8 ac6572c8 18e972c8 71dd72c8 68aa73c8 faa973c8 733474c8
f734e940 413242064 S Ii:2:003:6 -115:1 544 <
f734e940 413290029 C Ii:2:003:6 0:1 544 = f0bf72c8 b25f73c8 fc2272c8 fe0073c8 6fdd72c8 36c573c8 7d8f73c8 0b3474c8
f734e940 413301964 S Ii:2:003:6 -115:1 544 <
f734e940 413352531 C Ii:2:003:6 0:1 544 = 59cc72c8 bd5e73c8 e20972c8 ddd572c8 b3da72c8 938873c8 d79e73c8 043474c8
f734e940 413365088 S Ii:2:003:6 -115:1 544 <
f734e940 413415048 C Ii:2:003:6 0:1 544 = b68c72c8 6f6073c8 218772c8 d8e372c8 ceda72c8 7ea573c8 a4aa73c8 0c3474c8
efd6b0c0 413422699 S Ii:2:003:6 -115:1 544 <
efd6b0c0 413477534 C Ii:2:003:6 0:1 544 = b6cc72c8 785f73c8 5f4172c8 ac0173c8 5adc72c8 39c673c8 2b9073c8 263474c8
efd6b0c0 413482691 S Ii:2:003:6 -115:1 544 <
efd6b0c0 413540057 C Ii:2:003:6 0:1 544 = f3a772c8 415f73c8 da1772c8 25cc72c8 d3db72c8 e97673c8 07a873c8 3d3474c8
efd6b0c0 413552415 S Ii:2:003:6 -115:1 544 <
efd6b0c0 413602545 C Ii:2:003:6 0:1 544 = 298c72c8 7e6073c8 6c6972c8 33e572c8 a3da72c8 03a673c8 3ba973c8 f23374c8
efd6b0c0 413608629 S Ii:2:003:6 -115:1 544 <
efd6b0c0 413665033 C Ii:2:003:6 0:1 544 = dcda72c8 5d5f73c8 ca5472c8 fbf372c8 3fdb72c8 42c073c8 069773c8 023474c8
efd6b0c0 413675674 S Ii:2:003:6 -115:1 544 <
efd6b0c0 413727551 C Ii:2:003:6 0:1 544 = 6b6772c8 785f73c8 a35772c8 a3e372c8 7edb72c8 3a8473c8 90ab73c8 3e3374c8
efd6b0c0 413735660 S Ii:2:003:6 -115:1 544 <
efd6b0c0 413790030 C Ii:2:003:6 0:1 544 = 7cae72c8 7e6073c8 371772c8 19f572c8 8ddb72c8 98bc73c8 be9773c8 fc3374c8
efd6b0c0 413804997 S Ii:2:003:6 -115:1 544 <
efd6b0c0 413852530 C Ii:2:003:6 0:1 544 = 6dda72c8 495d73c8 674672c8 e8e572c8 80da72c8 7aae73c8 c49673c8 403474c8
efd6b0c0 413863267 S Ii:2:003:6 -115:1 544 <
efd6b0c0 413915033 C Ii:2:003:6 0:1 544 = 2a8072c8 045f73c8 b66e72c8 0be772c8 c4db72c8 71a873c8 20ab73c8 033474c8
efd6b0c0 413922674 S Ii:2:003:6 -115:1 544 <
efd6b0c0 413977534 C Ii:2:003:6 0:1 544 = b4c872c8 766073c8 123c72c8 0b0473c8 8edb72c8 2ec773c8 978373c8 b13374c8
efd6b0c0 413985688 S Ii:2:003:6 -115:1 544 <
efd6b0c0 414040033 C Ii:2:003:6 0:1 544 = 4dcb72c8 3e5e73c8 2e0f72c8 97dd72c8 a7da72c8 ab8d73c8 9c9b73c8 433474c8
efd6b0c0 414046259 S Ii:2:003:6 -115:1 544 <
efd6b0c0 414102537 C Ii:2:003:6 0:1 544 = 607572c8 c35e73c8 dc7772c8 b9dd72c8 59da72c8 f99f73c8 b1ae73c8 e53374c8
efd6b0c0 414118664 S Ii:2:003:6 -115:1 544 <
efd6b0c0 414165030 C Ii:2:003:6 0:1 544 = 6bcd72c8 056073c8 642f72c8 edfd72c8 3fdc72c8 92c773c8 3e9073c8 ab3374c8
efd6b0c0 414172256 S Ii:2:003:6 -115:1 544 <
efd6b0c0 414227551 C Ii:2:003:6 0:1 544 = f8bb72c8 765f73c8 585a72c8 dbc472c8 c2da72c8 297e73c8 50ac73c8 eb3374c8
efd6b0c0 414240603 S Ii:2:003:6 -115:1 544 <
efd6b0c0 414290030 C Ii:2:003:6 0:1 544 = 388c72c8 5c6073c8 2e5572c8 5bed72c8 52db72c8 a2a773c8 e0a973c8 f03374c8
efd6b0c0 414298000 S Ii:2:003:6 -115:1 544 <
efd6b0c0 414352531 C Ii:2:003:6 0:1 544 = 82dc72c8 715f73c8 434772c8 68fc72c8 dfdb72c8 93c373c8 189473c8 fd3374c8
efd6b0c0 414358694 S Ii:2:003:6 -115:1 544 <
efd6b0c0 414415032 C Ii:2:003:6 0:1 544 = 0b7e72c8 a45f73c8 614b72c8 5ee072c8 07dc72c8 9d7573c8 10a873c8 483374c8
efd6b0c0 414432822 S Ii:2:003:6 -115:1 544 <
efd6b0c0 414477548 C Ii:2:003:6 0:1 544 = 62a572c8 346073c8 e23872c8 7ef072c8 f0db72c8 b5b473c8 b29e73c8 e83374c8
efd6b0c0 414493868 S Ii:2:003:6 -115:1 544 <
efd6b0c0 414540030 C Ii:2:003:6 0:1 544 = 7ada72c8 705e73c8 743e72c8 a3ef72c8 84db72c8 74bc73c8 569a73c8 5b3474c8
efd6b0c0 414545495 S Ii:2:003:6 -115:1 544 <
efd6b0c0 414602536 C Ii:2:003:6 0:1 544 = ab6672c8 995e73c8 286b72c8 dfe872c8 fcdc72c8 1ea373c8 d9af73c8 a53374c8
efd6b0c0 414614677 S Ii:2:003:6 -115:1 544 <
efd6b0c0 414665029 C Ii:2:003:6 0:1 544 = 14b672c8 456073c8 442e72c8 740173c8 22dd72c8 86c573c8 9f8573c8 ef3374c8
efd6b0c0 414675655 S Ii:2:003:6 -115:1 544 <
efd6b0c0 414727531 C Ii:2:003:6 0:1 544 = 98cf72c8 ab5d73c8 f91672c8 b0dd72c8 adda72c8 249d73c8 199f73c8 213474c8
efd6b0c0 414745659 S Ii:2:003:6 -115:1 544 <
efd6b0c0 414790030 C Ii:2:003:6 0:1 544 = 519372c8 506073c8 afa372c8 03e172c8 e1db72c8 a4a673c8 ceaf73c8 103474c8
efd6b0c0 414798673 S Ii:2:003:6 -115:1 544 <
efd6b0c0 414852533 C Ii:2:003:6 0:1 544 = 36cf72c8 526073c8 1a3d72c8 94f972c8 0adb72c8 0dc673c8 189373c8 f53374c8
efd6b0c0 414855675 S Ii:2:003:6 -115:1 544 <
efd6b0c0 414915035 C Ii:2:003:6 0:1 544 = e7c172c8 015f73c8 071a72c8 b2c272c8 c8da72c8 e48373c8 4c9f73c8 e53374c8
efd6b0c0 414925661 S Ii:2:003:6 -115:1 544 <
efd6b0c0 414977536 C Ii:2:003:6 0:1 544 = 6e9b72c8 1b6173c8 8c6772c8 91ed72c8 25db72c8 13aa73c8 1ca473c8 ff3374c8
efd6b0c0 414985666 S Ii:2:003:6 -115:1 544 <
efd6b0c0 415040036 C Ii:2:003:6 0:1 544 = bbe872c8 e75f73c8 cc5472c8 7af172c8 5bda72c8 ddc773c8 e88973c8 fe3374c8
efd6b0c0 415046663 S Ii:2:003:6 -115:1 544 <
efd6b0c0 415102532 C Ii:2:003:6 0:1 544 = e77672c8 8c5f73c8 a37472c8 2bda72c8 65db72c8 146773c8 deac73c8 0b3374c8
efd6b0c0 415106665 S Ii:2:003:6 -115:1 544 <
efd6b0c0 415165033 C Ii:2:003:6 0:1 544 = df9b72c8 566073c8 4f5472c8 52f172c8 1edc72c8 42b173c8 fc9f73c8 b93374c8
efd6b0c0 415171962 S Ii:2:003:6 -115:1 544 <
efd6b0c0 415227548 C Ii:2:003:6 0:1 544 = c3de72c8 635e73c8 ea3b72c8 01f372c8 fbda72c8 9cbf73c8 c09673c8 f53374c8
efd6b0c0 415240596 S Ii:2:003:6 -115:1 544 <
efd6b0c0 415290049 C Ii:2:003:6 0:1 544 = 576c72c8 645e73c8 c57872c8 99e972c8 1add72c8 caa073c8 9db073c8 8f3374c8
efd6b0c0 415302311 S Ii:2:003:6 -115:1 544 <
efd6b0c0 415352531 C Ii:2:003:6 0:1 544 = 5ab872c8 a76073c8 4b1572c8 65fd72c8 71dc72c8 41c073c8 759173c8 c43374c8
efd6b0c0 415360791 S Ii:2:003:6 -115:1 544 <
efd6b0c0 415415036 C Ii:2:003:6 0:1 544 = 4bd072c8 7d5d73c8 d33672c8 cde772c8 57da72c8 f0a873c8 ad9473c8 233474c8
f23b49c0 415422030 S Ii:2:003:6 -115:1 544 <
f23b49c0 415477534 C Ii:2:003:6 0:1 544 = ae9172c8 546073c8 aa9272c8 4be572c8 eadc72c8 bba273c8 8aaf73c8 fb3374c8
f23b49c0 415486675 S Ii:2:003:6 -115:1 544 <
f23b49c0 415540049 C Ii:2:003:6 0:1 544 = f6d172c8 646073c8 142f72c8 1e0273c8 badb72c8 6dc873c8 958e73c8 103474c8
f23b49c0 415549489 S Ii:2:003:6 -115:1 544 <
f23b49c0 415602536 C Ii:2:003:6 0:1 544 = 71b772c8 925e73c8 ee0d72c8 06d072c8 6adb72c8 668a73c8 3da373c8 123474c8
f23b49c0 415607999 S Ii:2:003:6 -115:1 544 <
f23b49c0 415665032 C Ii:2:003:6 0:1 544 = 6f8e72c8 c06073c8 238872c8 57e772c8 7cdb72c8 baa573c8 50ab73c8 ef3374c8
f23b49c0 415677340 S Ii:2:003:6 -115:1 544 <
f23b49c0 415727532 C Ii:2:003:6 0:1 544 = 32dd72c8 c55f73c8 534b72c8 43f172c8 6adb72c8 64c473c8 239073c8 153474c8
f23b49c0 415736520 S Ii:2:003:6 -115:1 544 <
f23b49c0 415790032 C Ii:2:003:6 0:1 544 = 407572c8 f85f73c8 174072c8 45e372c8 dfdc72c8 958673c8 a9a673c8 513374c8
f23b49c0 415805596 S Ii:2:003:6 -115:1 544 <
f23b49c0 415852535 C Ii:2:003:6 0:1 544 = 05a872c8 936173c8 a83c72c8 12f172c8 13dc72c8 acb373c8 32a073c8 363474c8
f23b49c0 415863897 S Ii:2:003:6 -115:1 544 <
f23b49c0 415915052 C Ii:2:003:6 0:1 544 = c1e772c8 a75e73c8 e66072c8 d3f572c8 70da72c8 48bd73c8 748a73c8 203474c8
f23b49c0 415930739 S Ii:2:003:6 -115:1 544 <
f23b49c0 415977413 C Ii:2:003:6 0:1 544 = b17a72c8 4d5f73c8 b26672c8 99ee72c8 64dd72c8 bda473c8 49aa73c8 e83374c8
f23b49c0 415986244 S Ii:2:003:6 -115:1 544 <
f23b49c0 416040053 C Ii:2:003:6 0:1 544 = 8fad72c8 176073c8 864e72c8 faf572c8 66db72c8 2fba73c8 1b9273c8 1a3474c8
f23b49c0 416048978 S Ii:2:003:6 -115:1 544 <
f23b49c0 416102536 C Ii:2:003:6 0:1 544 = edd372c8 db5d73c8 b12c72c8 82eb72c8 80da72c8 c8bc73c8 f39573c8 2e3474c8
f23b49c0 416107983 S Ii:2:003:6 -115:1 544 <
f23b49c0 416165039 C Ii:2:003:6 0:1 544 = e06d72c8 305e73c8 466e72c8 7ce372c8 b7dd72c8 d19e73c8 a2b573c8 ec3374c8
f23b49c0 416174671 S Ii:2:003:6 -115:1 544 <
f23b49c0 416227546 C Ii:2:003:6 0:1 544 = 4fc272c8 266073c8 082b72c8 12fb72c8 27dd72c8 69c173c8 4f8a73c8 173474c8
f23b49c0 416235641 S Ii:2:003:6 -115:1 544 <
f23b49c0 416290040 C Ii:2:003:6 0:1 544 = 00bf72c8 fe5e73c8 040d72c8 b3d872c8 88db72c8 d99f73c8 0b9f73c8 f73374c8
f23b49c0 416294667 S Ii:2:003:6 -115:1 544 <
f23b49c0 416352553 C Ii:2:003:6 0:1 544 = c18c72c8 b76073c8 2b8172c8 08f272c8 c2dc72c8 faa773c8 e7aa73c8 193474c8
f23b49c0 416363584 S Ii:2:003:6 -115:1 544 <
f23b49c0 416415033 C Ii:2:003:6 0:1 544 = 69e572c8 405f73c8 5d5a72c8 56f772c8 17db72c8 17c473c8 4a8873c8 223474c8
f23b49c0 416424291 S Ii:2:003:6 -115:1 544 <
f23b49c0 416477536 C Ii:2:003:6 0:1 544 = 2a7872c8 725f73c8 871772c8 74e972c8 53dd72c8 159473c8 92a373c8 713374c8
f23b49c0 416488001 S Ii:2:003:6 -115:1 544 <
f23b49c0 416539905 C Ii:2:003:6 0:1 544 = 07a972c8 e96073c8 6f3c72c8 7cf172c8 eedb72c8 c2b573c8 8f9b73c8 213474c8
f23b49c0 416550679 S Ii:2:003:6 -115:1 544 <
f23b49c0 416602407 C Ii:2:003:6 0:1 544 = 0fdd72c8 955e73c8 754d72c8 fcf272c8 35db72c8 32bc73c8 8e8a73c8 043474c8
f23b49c0 416617831 S Ii:2:003:6 -115:1 544 <
f23b49c0 416664911 C Ii:2:003:6 0:1 544 = 147572c8 e45e73c8 d27472c8 0be872c8 5fdd72c8 a0a073c8 43b073c8 d13374c8
f23b49c0 416675365 S Ii:2:003:6 -115:1 544 <
f23b49c0 416727552 C Ii:2:003:6 0:1 544 = 1db472c8 6f6073c8 983f72c8 bdf772c8 4adc72c8 41be73c8 a09473c8 f03374c8
f23b49c0 416735671 S Ii:2:003:6 -115:1 544 <
f23b49c0 416790050 C Ii:2:003:6 0:1 544 = face72c8 1f5e73c8 5a1972c8 5ce672c8 e9da72c8 0aa673c8 b29a73c8 3d3474c8
f23b49c0 416805715 S Ii:2:003:6 -115:1 544 <
f23b49c0 416852551 C Ii:2:003:6 0:1 544 = 3d8472c8 0e6073c8 948d72c8 a0e172c8 4cdd72c8 15a573c8 25ac73c8 e63374c8
f23b49c0 416862709 S Ii:2:003:6 -115:1 544 <
f23b49c0 416915037 C Ii:2:003:6 0:1 544 = dad172c8 216073c8 af3b72c8 79f872c8 86da72c8 c9c673c8 ca8273c8 a93374c8
f23b49c0 416934712 S Ii:2:003:6 -115:1 544 <
f23b49c0 416977538 C Ii:2:003:6 0:1 544 = 64c372c8 bf5e73c8 2f0972c8 4dcf72c8 56db72c8 b89c73c8 e29d73c8 163474c8
f23b49c0 416986635 S Ii:2:003:6 -115:1 544 <
f23b49c0 417040038 C Ii:2:003:6 0:1 544 = 7f7c72c8 aa5f73c8 c08b72c8 cae172c8 f2db72c8 06a473c8 f6ac73c8 db3374c8
f23b49c0 417055672 S Ii:2:003:6 -115:1 544 <
f23b49c0 417102533 C Ii:2:003:6 0:1 544 = bcd772c8 ba5f73c8 b04a72c8 02fa72c8 1ddc72c8 bbc973c8 ea8573c8 e63374c8
f23b49c0 417114251 S Ii:2:003:6 -115:1 544 <
f23b49c0 417165040 C Ii:2:003:6 0:1 544 = 23b772c8 f65f73c8 e64472c8 46d972c8 cedc72c8 936a73c8 0aa773c8 293474c8
f23b49c0 417174710 S Ii:2:003:6 -115:1 544 <
f23b49c0 417227414 C Ii:2:003:6 0:1 544 = cf8c72c8 3d6173c8 a06172c8 a7ed72c8 99db72c8 b8a573c8 fda573c8 d73374c8
f23b49c0 417238749 S Ii:2:003:6 -115:1 544 <
f23b49c0 417289909 C Ii:2:003:6 0:1 544 = 0bd672c8 fc5e73c8 763f72c8 630973c8 63dc72c8 55c673c8 8d8373c8 cc3374c8
f23b49c0 417295665 S Ii:2:003:6 -115:1 544 <
f23b49c0 417352534 C Ii:2:003:6 0:1 544 = a66672c8 b05f73c8 a44b72c8 6cdd72c8 99dd72c8 e39373c8 1daa73c8 3b3374c8
f23b49c0 417365844 S Ii:2:003:6 -115:1 544 <
f23b49c0 417415030 C Ii:2:003:6 0:1 544 = cda972c8 ae6173c8 a52472c8 f8f072c8 8adb72c8 42b673c8 469c73c8 0a3474c8
f23b49c0 417426673 S Ii:2:003:6 -115:1 544 <
f23b49c0 417477534 C Ii:2:003:6 0:1 544 = e4d772c8 525e73c8 3a5772c8 cef972c8 58db72c8 ebbf73c8 fd8d73c8 bb3374c8
f23b49c0 417496964 S Ii:2:003:6 -115:1 544 <
f23b49c0 417540059 C Ii:2:003:6 0:1 544 = c75572c8 be5f73c8 785372c8 93df72c8 93dc72c8 fc9073c8 ccaa73c8 1c3374c8
f23b49c0 417558309 S Ii:2:003:6 -115:1 544 <
f23b49c0 417602554 C Ii:2:003:6 0:1 544 = 80a372c8 8a6073c8 823d72c8 77ef72c8 deda72c8 09b173c8 be9373c8 b83374c8
f23b49c0 417614172 S Ii:2:003:6 -115:1 544 <
f23b49c0 417665052 C Ii:2:003:6 0:1 544 = 75da72c8 845e73c8 b94572c8 bde672c8 51db72c8 efbc73c8 9a9973c8 f23374c8
f23b49c0 417675747 S Ii:2:003:6 -115:1 544 <
