cd4ae2c0 1721526243 S Ii:2:002:6 -115:1 544 <
cd4ae2c0 1721562575 C Ii:2:002:6 -75:1 512 = c911e545 fcd7f045 e41fec45 4c46dd45 b580e245 71f6e445 0378e445 186cdf45
cd4ae2c0 1721577995 S Ii:2:002:6 -115:1 544 <
cd4ae2c0 1721617800 C Ii:2:002:6 -75:1 512 = 89051846 d5b11a46 a6c81c46 18ad2146 fc0f1b46 00000000 f3b92446 c25c2746
cd4ae2c0 1721634238 S Ii:2:002:6 -115:1 544 <
cd4ae2c0 1721679756 C Ii:2:002:6 -75:1 512 = c29a0946 272a0746 fb65ff45 c06c0246 9c9d0346 ec4a0346 2bca0046 69e8ff45
cd4ae2c0 1721694272 S Ii:2:002:6 -115:1 544 <
cd4ae2c0 1721734392 C Ii:2:002:6 -75:1 512 = b0421345 97f71a45 23022f45 04f81245 00000000 6ac4ef44 4a260245 9779e844
cd4ae2c0 1721742056 S Ii:2:002:6 -115:1 544 <
cd4ae2c0 1721796889 C Ii:2:002:6 -75:1 512 = 510d8cc5 efe899c5 b15d96c5 f9ba93c5 c4aa92c5 e9de97c5 d3d699c5 1273a5c5
cd4ae2c0 1721818215 S Ii:2:002:6 -115:1 544 <
cd4ae2c0 1721851689 C Ii:2:002:6 -75:1 512 = c1f20ec6 0dc009c6 ca6711c6 00000000 5cb40cc6 d3390ac6 ea6b0dc6 49d908c6
cd4ae2c0 1721871557 S Ii:2:002:6 -115:1 544 <
cd4ae2c0 1721914156 C Ii:2:002:6 -75:1 512 = a94d05c6 ebcb03c6 a46f02c6 5cad01c6 084e04c6 e95205c6 e1150bc6 a72109c6
cd4ae2c0 1721928299 S Ii:2:002:6 -115:1 544 <
cd4ae2c0 1721968825 C Ii:2:002:6 -75:1 512 = 916c5bc5 0cd878c5 00000000 96c71ec5 bfb114c5 871a22c5 07ca0dc5 1a7615c5
cd4ae2c0 1721979570 S Ii:2:002:6 -115:1 544 <
cd4ae2c0 1722031323 C Ii:2:002:6 -75:1 512 = 50a47445 b6897945 6d7a7945 244d6f45 24ce6b45 04f05345 cbb15d45 807b6545
cd4ae2c0 1722042287 S Ii:2:002:6 -115:1 544 <
cd4ae2c0 1722086001 C Ii:2:002:6 -75:1 512 = ebdf0746 00000000 26111646 27b01846 f1fd1446 5c141b46 c9941846 42121146
cd4ae2c0 1722094229 S Ii:2:002:6 -115:1 544 <
cd4ae2c0 1722148575 C Ii:2:002:6 -75:1 512 = 30301e46 27be1d46 58421b46 e16f1a46 865f1446 100e1746 01241946 e3071e46
cd4ae2c0 1722159308 S Ii:2:002:6 -115:1 544 <
cd4ae2c0 1722203148 C Ii:2:002:6 -75:1 512 = 00000000 f8d9af45 9c11b545 1fe2ad45 375db945 0ac4b445 ce0da645 0a11ab45
cd4ae2c0 1722219251 S Ii:2:002:6 -115:1 544 <
cd4ae2c0 1722265701 C Ii:2:002:6 -75:1 512 = f8b472c4 aa018ec4 017695c4 e27ac4c4 b79bb2c4 85d9a3c4 898776c4 33ffb4c4
cd4ae2c0 1722282280 S Ii:2:002:6 -115:1 544 <
cd4ae2c0 1722328136 C Ii:2:002:6 -75:1 512 = 2945e7c5 2f4de2c5 17bee8c5 9660dfc5 c3b2e2c5 dd58f0c5 3d30edc5 527beac5
cd4ae2c0 1722339314 S Ii:2:002:6 -115:1 544 <
cd4ae2c0 1722382876 C Ii:2:002:6 -75:1 512 = 3c4613c6 9e4f14c6 fb0b1ac6 382218c6 fe7216c6 ab4111c6 22ee18c6 00000000
cd4ae2c0 1722398204 S Ii:2:002:6 -115:1 544 <
cd4ae2c0 1722445392 C Ii:2:002:6 -75:1 512 = 2350b3c5 6ad8b9c5 3e37b0c5 34b9b3c5 fd7cc1c5 e81fbec5 0976bbc5 6234bac5
cd4ae2c0 1722453355 S Ii:2:002:6 -115:1 544 <
cd4ae2c0 1722500062 C Ii:2:002:6 -75:1 512 = 0676ad42 2db191c3 f34311c3 4a12cbc1 af079543 fbfd1fc3 00000000 9a049e44
cd4ae2c0 1722530817 S Ii:2:002:6 -115:1 544 <
cd4ae2c0 1722562524 C Ii:2:002:6 -75:1 512 = 2a38e545 e7f7f045 1838ec45 9060dd45 ce9be245 d10ae545 a290e445 378ddf45
cd4ae2c0 1722572842 S Ii:2:002:6 -115:1 544 <
cd4ae2c0 1722617275 C Ii:2:002:6 -75:1 512 = 0f021846 a9b11a46 56c41c46 60a52146 230d1b46 00000000 d2be2446 e8652746
cd4ae2c0 1722619801 S Ii:2:002:6 -115:1 544 <
cd4ae2c0 1722679760 C Ii:2:002:6 -75:1 512 = 02840946 15160746 1b38ff45 3f4f0246 22840346 2f330346 3bb40046 0fc3ff45
cd4ae2c0 1722687006 S Ii:2:002:6 -115:1 544 <
cd4ae2c0 1722734379 C Ii:2:002:6 -75:1 512 = 63451345 7eec1a45 20fb2e45 fff01245 00000000 0d85ef44 89090245 f526e844
cd4ae2c0 1722741682 S Ii:2:002:6 -115:1 544 <
cd4ae2c0 1722796947 C Ii:2:002:6 -75:1 512 = b0168cc5 32f499c5 526696c5 f2c493c5 c8b192c5 02eb97c5 33df99c5 1f7ea5c5
cd4ae2c0 1722806496 S Ii:2:002:6 -115:1 544 <
cd4ae2c0 1722851631 C Ii:2:002:6 -75:1 512 = 2f030fc6 7ed209c6 157911c6 00000000 a8ac0cc6 8a360ac6 53660dc6 c4da08c6
cd4ae2c0 1722863229 S Ii:2:002:6 -115:1 544 <
cd4ae2c0 1722914145 C Ii:2:002:6 -75:1 512 = 593805c6 18b803c6 425d02c6 019701c6 903804c6 e23b05c6 05fd0ac6 fd0e09c6
cd4ae2c0 1722918593 S Ii:2:002:6 -115:1 544 <
cd4ae2c0 1722968752 C Ii:2:002:6 -75:1 512 = ff935bc5 09f978c5 00000000 abb21ec5 99a414c5 b41022c5 13c50dc5 fb6015c5
cd4ae2c0 1722979544 S Ii:2:002:6 -115:1 544 <
cd4ae2c0 1723031335 C Ii:2:002:6 -75:1 512 = 0a517445 a53f7945 6f237945 f6016f45 5e776b45 e8a45345 9a5f5d45 30226545
cd4ae2c0 1723047810 S Ii:2:002:6 -115:1 544 <
cd4ae2c0 1723086085 C Ii:2:002:6 -75:1 512 = 44060846 00000000 6c051646 f3a71846 f7f11446 28061b46 c1851846 b3021146
cd4ae2c0 1723091254 S Ii:2:002:6 -115:1 544 <
cd4ae2c0 1723148500 C Ii:2:002:6 -75:1 512 = 42311e46 2ac81d46 2e491b46 a0781a46 a2651446 d4161746 b62c1946 5e0f1e46
cd4ae2c0 1723170233 S Ii:2:002:6 -115:1 544 <
cd4ae2c0 1723203127 C Ii:2:002:6 -75:1 512 = 00000000 d5c6af45 78f4b445 3cc6ad45 e946b945 3ca9b445 5bfaa545 01fdaa45
cd4ae2c0 1723218751 S Ii:2:002:6 -115:1 544 <
cd4ae2c0 1723265691 C Ii:2:002:6 -75:1 512 = 218974c4 33cb8ec4 b54896c4 d858c5c4 cf82b3c4 7fb6a4c4 435b78c4 0de6b5c4
cd4ae2c0 1723270904 S Ii:2:002:6 -115:1 544 <
cd4ae2c0 1723328143 C Ii:2:002:6 -75:1 512 = 501be7c5 bc2ce2c5 6e98e8c5 6b38dfc5 f387e2c5 8d29f0c5 a60aedc5 f55feac5
cd4ae2c0 1723338268 S Ii:2:002:6 -115:1 544 <
cd4ae2c0 1723382874 C Ii:2:002:6 -75:1 512 = bf4d13c6 c15714c6 13131ac6 452d18c6 c57b16c6 544d11c6 19f618c6 00000000
cd4ae2c0 1723392018 S Ii:2:002:6 -115:1 544 <
cd4ae2c0 1723445391 C Ii:2:002:6 -75:1 512 = 2e58b3c5 f1deb9c5 c242b0c5 63b3b3c5 397ec1c5 001bbec5 a675bbc5 8f36bac5
cd4ae2c0 1723455548 S Ii:2:002:6 -115:1 544 <
cd4ae2c0 1723500072 C Ii:2:002:6 -75:1 512 = f267ae42 18ef90c3 ad8310c3 e03cbbc1 b75f9543 25491ec3 00000000 e5639d44
cd4ae2c0 1723509347 S Ii:2:002:6 -115:1 544 <
cd4ae2c0 1723562509 C Ii:2:002:6 -75:1 512 = 1237e545 4202f145 3242ec45 0268dd45 2ea1e245 b906e545 c390e445 048cdf45
cd4ae2c0 1723573010 S Ii:2:002:6 -115:1 544 <
cd4ae2c0 1723617254 C Ii:2:002:6 -75:1 512 = 1e251846 4cd61a46 41ec1c46 bbcb2146 f7311b46 00000000 e7bd2446 c55f2746
cd4ae2c0 1723621653 S Ii:2:002:6 -115:1 544 <
cd4ae2c0 1723679825 C Ii:2:002:6 -75:1 512 = 46a30946 2f330746 f27aff45 c2700246 a39f0346 18510346 5fcf0046 f9f7ff45
cd4ae2c0 1723699240 S Ii:2:002:6 -115:1 544 <
cd4ae2c0 1723734454 C Ii:2:002:6 -75:1 512 = b8101345 46db1a45 5fd62e45 60c61245 00000000 beedef44 b2240245 9b74e844
cd4ae2c0 1723742202 S Ii:2:002:6 -115:1 544 <
cd4ae2c0 1723796952 C Ii:2:002:6 -75:1 512 = 5a428cc5 c4149ac5 959096c5 6ff293c5 7cda92c5 330b98c5 c1059ac5 50a7a5c5
cd4ae2c0 1723814487 S Ii:2:002:6 -115:1 544 <
cd4ae2c0 1723851690 C Ii:2:002:6 -75:1 512 = 45f10ec6 fdc409c6 0c6611c6 00000000 8fab0cc6 bd340ac6 8a620dc6 6cd108c6
cd4ae2c0 1723862250 S Ii:2:002:6 -115:1 544 <
cd4ae2c0 1723914145 C Ii:2:002:6 -75:1 512 = b74405c6 e2c303c6 616c02c6 10a101c6 c74204c6 734605c6 75090bc6 821c09c6
cd4ae2c0 1723938224 S Ii:2:002:6 -115:1 544 <
cd4ae2c0 1723968753 C Ii:2:002:6 -75:1 512 = be4c5bc5 32be78c5 00000000 9add1ec5 61c514c5 152622c5 18d80dc5 0a7b15c5
cd4ae2c0 1723978203 S Ii:2:002:6 -115:1 544 <
cd4ae2c0 1724031338 C Ii:2:002:6 -75:1 512 = da807445 cf6b7945 ec5f7945 74426f45 06ad6b45 98d25345 5c855d45 4c756545
cd4ae2c0 1724047318 S Ii:2:002:6 -115:1 544 <
cd4ae2c0 1724086015 C Ii:2:002:6 -75:1 512 = a3100846 00000000 dcf91546 8b991846 52e61446 c5f91a46 5c7c1846 62fb1046
cd4ae2c0 1724099066 S Ii:2:002:6 -115:1 544 <
cd4ae2c0 1724148574 C Ii:2:002:6 -75:1 512 = 35211e46 bab51d46 933d1b46 e46a1a46 b5571446 f9041746 5e211946 ad011e46
cd4ae2c0 1724166235 S Ii:2:002:6 -115:1 544 <
cd4ae2c0 1724203147 C Ii:2:002:6 -75:1 512 = 00000000 2dd9af45 b107b545 6fdbad45 ca5fb945 a2bfb445 b416a645 fc0eab45
cd4ae2c0 1724226283 S Ii:2:002:6 -115:1 544 <
cd4ae2c0 1724265703 C Ii:2:002:6 -75:1 512 = 2b9273c4 315a8ec4 e9f195c4 fb03c5c4 f414b3c4 8c2ba4c4 d24a77c4 3f46b5c4
cd4ae2c0 1724286277 S Ii:2:002:6 -115:1 544 <
cd4ae2c0 1724328144 C Ii:2:002:6 -75:1 512 = c712e7c5 671be2c5 3d8ee8c5 5f2edfc5 1e88e2c5 ab1cf0c5 64feecc5 5953eac5
cd4ae2c0 1724344765 S Ii:2:002:6 -115:1 544 <
cd4ae2c0 1724382875 C Ii:2:002:6 -75:1 512 = 784f13c6 125814c6 51191ac6 5e3118c6 017d16c6 0c4c11c6 84f118c6 00000000
cd4ae2c0 1724399267 S Ii:2:002:6 -115:1 544 <
cd4ae2c0 1724445381 C Ii:2:002:6 -75:1 512 = e459b3c5 5fdab9c5 643ab0c5 48b9b3c5 e074c1c5 0b19bec5 2a7abbc5 6a38bac5
cd4ae2c0 1724459228 S Ii:2:002:6 -115:1 544 <
cd4ae2c0 1724500019 C Ii:2:002:6 -75:1 512 = bdfbab42 abe191c3 211512c3 ae01c0c1 89a99443 18d71fc3 00000000 5c9d9e44
cd4ae2c0 1724519709 S Ii:2:002:6 -115:1 544 <
cd4ae2c0 1724562577 C Ii:2:002:6 -75:1 512 = d33fe545 690cf145 e544ec45 a172dd45 52afe245 f412e545 979ee445 089bdf45
cd4ae2c0 1724579306 S Ii:2:002:6 -115:1 544 <
cd4ae2c0 1724617324 C Ii:2:002:6 -75:1 512 = 5c101846 efbf1a46 cede1c46 f8bc2146 1b211b46 00000000 01aa2446 ab4d2746
cd4ae2c0 1724626131 S Ii:2:002:6 -115:1 544 <
cd4ae2c0 1724679827 C Ii:2:002:6 -75:1 512 = 38a50946 df300746 017cff45 1c740246 b6a20346 4b570346 9dd50046 53feff45
cd4ae2c0 1724694571 S Ii:2:002:6 -115:1 544 <
cd4ae2c0 1724734374 C Ii:2:002:6 -75:1 512 = c91c1345 51ea1a45 7ce82e45 95e21245 00000000 a072ef44 6af80145 8322e844
cd4ae2c0 1724745329 S Ii:2:002:6 -115:1 544 <
cd4ae2c0 1724796880 C Ii:2:002:6 -75:1 512 = 51078cc5 fedf99c5 725996c5 69b793c5 979c92c5 3bd197c5 a9c299c5 8a6ba5c5
cd4ae2c0 1724806534 S Ii:2:002:6 -115:1 544 <
cd4ae2c0 1724851630 C Ii:2:002:6 -75:1 512 = f9f30ec6 4ac609c6 ea6911c6 00000000 6fb20cc6 843c0ac6 856a0dc6 cfda08c6
cd4ae2c0 1724861275 S Ii:2:002:6 -115:1 544 <
cd4ae2c0 1724914150 C Ii:2:002:6 -75:1 512 = 353305c6 00b603c6 305b02c6 919301c6 c33504c6 7a3a05c6 eef80ac6 ba0e09c6
cd4ae2c0 1724922262 S Ii:2:002:6 -115:1 544 <
cd4ae2c0 1724968766 C Ii:2:002:6 -75:1 512 = 719d5bc5 b40a79c5 00000000 bb881ec5 807614c5 3acf21c5 bb790dc5 092d15c5
cd4ae2c0 1724978231 S Ii:2:002:6 -115:1 544 <
cd4ae2c0 1725032531 C Ii:2:002:6 -75:1 512 = 739c7445 4d9b7945 4e857945 c95a6f45 9fd06b45 b40b5445 faaa5d45 d7976545
cd4ae2c0 1725045680 S Ii:2:002:6 -115:1 544 <
cd4ae2c0 1725086002 C Ii:2:002:6 -75:1 512 = aaf70746 00000000 dc101646 67b11846 4afe1446 eb101b46 298d1846 d60f1146
cd4ae2c0 1725090950 S Ii:2:002:6 -115:1 544 <
cd4ae2c0 1725148514 C Ii:2:002:6 -75:1 512 = 0a2c1e46 20c01d46 40401b46 c2701a46 e3631446 6d0c1746 82271946 2e0a1e46
cd4ae2c0 1725159156 S Ii:2:002:6 -115:1 544 <
cd4ae2c0 1725203143 C Ii:2:002:6 -75:1 512 = 00000000 36baaf45 30e7b445 c8baad45 2c33b945 9c9cb445 14eea545 8fe5aa45
cd4ae2c0 1725212397 S Ii:2:002:6 -115:1 544 <
cd4ae2c0 1725265628 C Ii:2:002:6 -75:1 512 = 1ac672c4 8b138ec4 ea7a95c4 ef7bc4c4 d6c4b2c4 06aaa3c4 b13b76c4 63eab4c4
cd4ae2c0 1725274220 S Ii:2:002:6 -115:1 544 <
cd4ae2c0 1725328143 C Ii:2:002:6 -75:1 512 = c6fde6c5 d00be2c5 6a7ee8c5 c51cdfc5 3870e2c5 4114f0c5 a6f3ecc5 de4beac5
cd4ae2c0 1725336887 S Ii:2:002:6 -115:1 544 <
cd4ae2c0 1725382876 C Ii:2:002:6 -75:1 512 = 725413c6 6b5d14c6 c71a1ac6 873418c6 6e7f16c6 b65011c6 76f618c6 00000000
cd4ae8c0 1725390223 S Ii:2:002:6 -115:1 544 <
cd4ae8c0 1725445400 C Ii:2:002:6 -75:1 512 = c875b3c5 0ffbb9c5 c65fb0c5 3ee0b3c5 8499c1c5 f740bec5 489fbbc5 095bbac5
cd4ae8c0 1725456702 S Ii:2:002:6 -115:1 544 <
cd4ae8c0 1725500019 C Ii:2:002:6 -75:1 512 = 5277a342 6c9093c3 191516c3 3206dbc1 59c69343 756321c3 00000000 9bd39e44
cd4ae8c0 1725516027 S Ii:2:002:6 -115:1 544 <
cd4ae8c0 1725562588 C Ii:2:002:6 -75:1 512 = e328e545 0bf7f045 0831ec45 2d5cdd45 fa94e245 c4fbe445 ec82e445 6384df45
cd4ae8c0 1725571239 S Ii:2:002:6 -115:1 544 <
cd4ae8c0 1725617279 C Ii:2:002:6 -75:1 512 = 49111846 91b51a46 1cd21c46 99b72146 3a1d1b46 00000000 88bd2446 3f632746
cd4ae8c0 1725636269 S Ii:2:002:6 -115:1 544 <
cd4ae8c0 1725679836 C Ii:2:002:6 -75:1 512 = 93ae0946 1a3e0746 cf91ff45 4f790246 81ad0346 145a0346 3ddd0046 ed060046
cd4ae8c0 1725690272 S Ii:2:002:6 -115:1 544 <
cd4ae8c0 1725734450 C Ii:2:002:6 -75:1 512 = 8de01245 48bb1a45 3ebf2e45 2dcc1245 00000000 357cef44 35080245 7810e844
cd4ae8c0 1725744893 S Ii:2:002:6 -115:1 544 <
cd4ae8c0 1725796952 C Ii:2:002:6 -75:1 512 = f8348cc5 92129ac5 f88896c5 6ceb93c5 a4d592c5 6f0498c5 54fd99c5 589aa5c5
cd4ae8c0 1725809299 S Ii:2:002:6 -115:1 544 <
cd4ae8c0 1725851701 C Ii:2:002:6 -75:1 512 = 550a0fc6 67dc09c6 307f11c6 00000000 8b9b0cc6 a8260ac6 4b550dc6 5ec708c6
cd4ae8c0 1725869951 S Ii:2:002:6 -115:1 544 <
cd4ae8c0 1725914156 C Ii:2:002:6 -75:1 512 = 9d5105c6 9ccf03c6 7a7a02c6 41b001c6 6d4e04c6 0b5505c6 3b140bc6 eb3209c6
cd4ae8c0 1725930265 S Ii:2:002:6 -115:1 544 <
cd4ae8c0 1725968771 C Ii:2:002:6 -75:1 512 = 472d5bc5 229778c5 00000000 2f9c1ec5 6c8a14c5 4ffa21c5 4ea80dc5 872c15c5
cd4ae8c0 1725979649 S Ii:2:002:6 -115:1 544 <
cd4ae8c0 1726031270 C Ii:2:002:6 -75:1 512 = 22ca7445 b9bc7945 0cb37945 ac896f45 020b6c45 3b2a5445 c7c75d45 23ba6545
cd4ae8c0 1726047328 S Ii:2:002:6 -115:1 544 <
cd4ae8c0 1726086075 C Ii:2:002:6 -75:1 512 = 1eed0746 00000000 0f1e1646 0dc11846 370d1546 e81e1b46 c99e1846 691e1146
cd4ae8c0 1726091255 S Ii:2:002:6 -115:1 544 <
cd4ae8c0 1726148581 C Ii:2:002:6 -75:1 512 = e8051e46 e8a01d46 4c231b46 224c1a46 06421446 64e81646 ac041946 2ee61d46
cd4ae8c0 1726161685 S Ii:2:002:6 -115:1 544 <
cd4ae8c0 1726203151 C Ii:2:002:6 -75:1 512 = 00000000 e7caaf45 0a07b545 d5d3ad45 404fb945 b5b0b445 a105a645 e200ab45
cd4ae8c0 1726212257 S Ii:2:002:6 -115:1 544 <
cd4ae8c0 1726265631 C Ii:2:002:6 -75:1 512 = 005971c4 b3358dc4 f4cb94c4 56b0c3c4 ad3db2c4 bb19a3c4 f3ef74c4 7a43b4c4
cd4ae8c0 1726279235 S Ii:2:002:6 -115:1 544 <
cd4ae8c0 1726328154 C Ii:2:002:6 -75:1 512 = f108e7c5 bf14e2c5 1182e8c5 6225dfc5 227ee2c5 431ef0c5 28f7ecc5 ff4aeac5
cd4ae8c0 1726349302 S Ii:2:002:6 -115:1 544 <
cd4ae8c0 1726382876 C Ii:2:002:6 -75:1 512 = 975713c6 a16214c6 37191ac6 c14518c6 928c16c6 575611c6 800119c6 00000000
cd4ae8c0 1726394215 S Ii:2:002:6 -115:1 544 <
cd4ae8c0 1726445389 C Ii:2:002:6 -75:1 512 = f17cb3c5 f104bac5 d065b0c5 69eab3c5 99a6c1c5 d548bec5 a3a4bbc5 1f62bac5
cd4ae8c0 1726454245 S Ii:2:002:6 -115:1 544 <
cd4ae8c0 1726500068 C Ii:2:002:6 -75:1 512 = 0426b942 952f8ec3 97470dc3 59579bc1 a6d69743 13c119c3 00000000 63bd9e44
cd4ae8c0 1726519257 S Ii:2:002:6 -115:1 544 <
cd4ae8c0 1726562577 C Ii:2:002:6 -75:1 512 = 1769e545 e829f145 e45eec45 2191dd45 7ac9e245 0333e545 3dc1e445 70bbdf45
cd4ae8c0 1726577999 S Ii:2:002:6 -115:1 544 <
cd4ae8c0 1726617335 C Ii:2:002:6 -75:1 512 = 49e71746 588d1a46 2ca91c46 85912146 28f21a46 00000000 6ec82446 d86a2746
cd4ae8c0 1726638268 S Ii:2:002:6 -115:1 544 <
cd4ae8c0 1726679756 C Ii:2:002:6 -75:1 512 = 3c900946 431d0746 5f4aff45 b05b0246 d08d0346 48430346 34c10046 e8d1ff45
cd4ae8c0 1726699261 S Ii:2:002:6 -115:1 544 <
cd4ae8c0 1726734444 C Ii:2:002:6 -75:1 512 = a45f1345 42321b45 d5522f45 4a391345 00000000 9042ef44 3ad60145 52e3e744
cd4ae8c0 1726749264 S Ii:2:002:6 -115:1 544 <
cd4ae8c0 1726796880 C Ii:2:002:6 -75:1 512 = 51d28bc5 7bab99c5 321d96c5 738093c5 9a6892c5 cf9e97c5 a29799c5 5432a5c5
cd4ae8c0 1726809262 S Ii:2:002:6 -115:1 544 <
cd4ae8c0 1726851632 C Ii:2:002:6 -75:1 512 = 6c240fc6 e9ef09c6 939611c6 00000000 87880cc6 5f110ac6 ab3c0dc6 0dae08c6
cd4ae8c0 1726866227 S Ii:2:002:6 -115:1 544 <
cd4ae8c0 1726914147 C Ii:2:002:6 -75:1 512 = 1d5c05c6 afdc03c6 fc8302c6 40bc01c6 915d04c6 506305c6 871f0bc6 483b09c6
cd4ae8c0 1726939261 S Ii:2:002:6 -115:1 544 <
cd4ae8c0 1726968825 C Ii:2:002:6 -75:1 512 = 4ffe5ac5 e76878c5 00000000 6afb1ec5 64e614c5 9c4e22c5 7f020ec5 e8ae15c5
cd4ae8c0 1726986275 S Ii:2:002:6 -115:1 544 <
cd4ae8c0 1727031323 C Ii:2:002:6 -75:1 512 = 48cb7445 7dbd7945 4bb87945 bc866f45 e9fd6b45 783c5445 39c05d45 27ae6545
cd4ae8c0 1727059256 S Ii:2:002:6 -115:1 544 <
cd4ae8c0 1727086077 C Ii:2:002:6 -75:1 512 = 19e60746 00000000 6b261646 24c71846 a8161546 2c251b46 17a41846 ca211146
cd4ae8c0 1727107808 S Ii:2:002:6 -115:1 544 <
cd4ae8c0 1727148507 C Ii:2:002:6 -75:1 512 = 250f1e46 80a71d46 29281b46 ab521a46 a34d1446 13e91646 b70a1946 21ec1d46
cd4ae8c0 1727166263 S Ii:2:002:6 -115:1 544 <
cd4ae8c0 1727203152 C Ii:2:002:6 -75:1 512 = 00000000 c794af45 f0c6b445 c69ead45 c114b945 8776b445 39c8a545 06c7aa45
cd4ae8c0 1727218911 S Ii:2:002:6 -115:1 544 <
cd4ae8c0 1727265642 C Ii:2:002:6 -75:1 512 = 281772c4 ba978dc4 3c3d95c4 5222c4c4 1578b2c4 a476a3c4 51c375c4 d882b4c4
cd4ae8c0 1727279159 S Ii:2:002:6 -115:1 544 <
cd4ae8c0 1727328128 C Ii:2:002:6 -75:1 512 = dacee6c5 08d9e1c5 1b4be8c5 18ecdec5 c44ce2c5 11ebefc5 bdc7ecc5 2b17eac5
cd4ae8c0 1727338213 S Ii:2:002:6 -115:1 544 <
cd4ae8c0 1727382874 C Ii:2:002:6 -75:1 512 = 187013c6 5a7b14c6 32311ac6 0a5918c6 2ba216c6 c26c11c6 c01819c6 00000000
cd4ae8c0 1727391292 S Ii:2:002:6 -115:1 544 <
cd4ae8c0 1727445378 C Ii:2:002:6 -75:1 512 = 5793b3c5 c414bac5 407db0c5 bcf5b3c5 d0b9c1c5 7753bec5 e8acbbc5 106cbac5
cd4ae8c0 1727451915 S Ii:2:002:6 -115:1 544 <
cd4ae8c0 1727500075 C Ii:2:002:6 -75:1 512 = c5e9c242 af928bc3 42df06c3 0dc54cc1 44489b43 3f6312c3 00000000 b7269e44
cd4ae8c0 1727513794 S Ii:2:002:6 -115:1 544 <
cd4ae8c0 1727562578 C Ii:2:002:6 -75:1 512 = 4f80e545 9543f145 3c7bec45 54a4dd45 44e4e245 7f4ee545 23d6e445 38d1df45
cd4ae8c0 1727574232 S Ii:2:002:6 -115:1 544 <
cd4ae8c0 1727617270 C Ii:2:002:6 -75:1 512 = 58e31746 8b8f1a46 88a61c46 c98c2146 d3f41a46 00000000 9dcf2446 37752746
cd4ae8c0 1727625459 S Ii:2:002:6 -115:1 544 <
cd4ae8c0 1727679767 C Ii:2:002:6 -75:1 512 = 5c900946 601a0746 6a4fff45 c55f0246 838d0346 d3440346 8fc20046 63d3ff45
cd4ae8c0 1727696575 S Ii:2:002:6 -115:1 544 <
cd4ae8c0 1727734413 C Ii:2:002:6 -75:1 512 = 726f1345 c5331b45 5f492f45 0f431345 00000000 7661ef44 11f10145 2629e844
cd4ae8c0 1727746095 S Ii:2:002:6 -115:1 544 <
cd4ae8c0 1727796939 C Ii:2:002:6 -75:1 512 = acf98bc5 8cd799c5 bc4396c5 73a893c5 bc8292c5 c6b997c5 c3b599c5 8d52a5c5
cd4ae8c0 1727814224 S Ii:2:002:6 -115:1 544 <
cd4ae8c0 1727851656 C Ii:2:002:6 -75:1 512 = f9370fc6 46050ac6 13a611c6 00000000 a67c0cc6 e9030ac6 d9300dc6 56a408c6
cd4ae8c0 1727862454 S Ii:2:002:6 -115:1 544 <
cd4ae8c0 1727914139 C Ii:2:002:6 -75:1 512 = 207305c6 89ed03c6 d69402c6 afcc01c6 b86e04c6 dc7505c6 cf330bc6 d74f09c6
cd4ae8c0 1727926529 S Ii:2:002:6 -115:1 544 <
cd4ae8c0 1727968754 C Ii:2:002:6 -75:1 512 = 065d5bc5 e4ba78c5 00000000 f1f01ec5 2cd614c5 1f3c22c5 53ef0dc5 959e15c5
cd4ae8c0 1727976508 S Ii:2:002:6 -115:1 544 <
cd4ae8c0 1728031281 C Ii:2:002:6 -75:1 512 = 90ec7445 5fd47945 bcc87945 65ad6f45 f50f6c45 a1525445 12c95d45 f4c06545
cd4ae8c0 1728042266 S Ii:2:002:6 -115:1 544 <
cd4ae8c0 1728086009 C Ii:2:002:6 -75:1 512 = 07c80746 00000000 811f1646 7ebf1846 c8111546 1d221b46 e89e1846 381b1146
cd4ae8c0 1728103946 S Ii:2:002:6 -115:1 544 <
cd4ae8c0 1728148578 C Ii:2:002:6 -75:1 512 = 460b1e46 6ba11d46 2d251b46 06511a46 86431446 c3e71646 f0ff1846 a0e21d46
cd4ae8c0 1728162226 S Ii:2:002:6 -115:1 544 <
cd4ae8c0 1728203147 C Ii:2:002:6 -75:1 512 = 00000000 a76eaf45 9d9eb445 a17ead45 03ecb845 1458b445 47a1a545 c9aaaa45
cd4ae8c0 1728214249 S Ii:2:002:6 -115:1 544 <
cd4ae8c0 1728265632 C Ii:2:002:6 -75:1 512 = b6ce71c4 97748dc4 a02395c4 3904c4c4 2e73b2c4 2e5ba3c4 12af75c4 7282b4c4
cd4ae8c0 1728270253 S Ii:2:002:6 -115:1 544 <
cd4ae8c0 1728328147 C Ii:2:002:6 -75:1 512 = 7a04e7c5 880ee2c5 4571e8c5 da1fdfc5 0770e2c5 6121f0c5 40eeecc5 a23feac5
cd4ae8c0 1728339310 S Ii:2:002:6 -115:1 544 <
cd4ae8c0 1728382883 C Ii:2:002:6 -75:1 512 = a87313c6 4b7f14c6 073b1ac6 c15d18c6 c0a516c6 eb7611c6 0f1c19c6 00000000
cd4ae8c0 1728396587 S Ii:2:002:6 -115:1 544 <
cd4ae8c0 1728445460 C Ii:2:002:6 -75:1 512 = aeabb3c5 7321bac5 a695b0c5 0607b4c5 80d1c1c5 4e6fbec5 97cfbbc5 3c7ebac5
cd4ae8c0 1728450477 S Ii:2:002:6 -115:1 544 <
cd4ae8c0 1728500077 C Ii:2:002:6 -75:1 512 = 7f7ebb42 24578dc3 eb680bc3 712f8cc1 8c6f9843 f13d17c3 00000000 76099d44
cd4ae8c0 1728519289 S Ii:2:002:6 -115:1 544 <
cd4ae8c0 1728562567 C Ii:2:002:6 -75:1 512 = 59bde545 ff7cf145 b5b0ec45 f4d9dd45 0d19e345 867de545 e213e545 8d0ee045
cd4ae8c0 1728569321 S Ii:2:002:6 -115:1 544 <
cd4ae8c0 1728617339 C Ii:2:002:6 -75:1 512 = f7e61746 398a1a46 06a71c46 fc852146 33ee1a46 00000000 c6e32446 84892746
cd4ae8c0 1728630277 S Ii:2:002:6 -115:1 544 <
cd4ae8c0 1728679761 C Ii:2:002:6 -75:1 512 = da830946 cb100746 0d2fff45 0e4d0246 857e0346 fc350346 d1b10046 ccb6ff45
cd4ae8c0 1728697212 S Ii:2:002:6 -115:1 544 <
cd4ae8c0 1728734405 C Ii:2:002:6 -75:1 512 = 851f1345 6ff01a45 8bf12e45 95f71245 00000000 3d22ef44 0cd60145 a1ffe744
cd4ae8c0 1728746866 S Ii:2:002:6 -115:1 544 <
cd4ae8c0 1728796943 C Ii:2:002:6 -75:1 512 = c9bc8bc5 c6a499c5 261496c5 797893c5 dc4e92c5 248a97c5 738899c5 af22a5c5
cd4ae8c0 1728819291 S Ii:2:002:6 -115:1 544 <
cd4ae8c0 1728851644 C Ii:2:002:6 -75:1 512 = 251e0fc6 6bf009c6 979011c6 00000000 72800cc6 a1080ac6 e2300dc6 1ca808c6
cd4ae8c0 1728865836 S Ii:2:002:6 -115:1 544 <
cd4ae8c0 1728914146 C Ii:2:002:6 -75:1 512 = 5c6e05c6 7beb03c6 518e02c6 dcc201c6 f76604c6 1e6d05c6 362b0bc6 a44609c6
cd4ae8c0 1728924066 S Ii:2:002:6 -115:1 544 <
cd4ae8c0 1728968780 C Ii:2:002:6 -75:1 512 = 3b745bc5 bed878c5 00000000 4b311fc5 de1715c5 157022c5 0e380ec5 a8d915c5
cd4ae8c0 1728979253 S Ii:2:002:6 -115:1 544 <
cd4ae8c0 1729031258 C Ii:2:002:6 -75:1 512 = 75cd7445 adc67945 4ed07945 a29e6f45 2e0b6c45 1d425445 a5d45d45 dbbb6545
cd4ae8c0 1729039243 S Ii:2:002:6 -115:1 544 <
cd4ae8c0 1729086021 C Ii:2:002:6 -75:1 512 = 44d70746 00000000 b52c1646 9bcb1846 de1d1546 692a1b46 89a71846 83211146
cd4ae8c0 1729099730 S Ii:2:002:6 -115:1 544 <
cd4ae8c0 1729148529 C Ii:2:002:6 -75:1 512 = 18061e46 e3a31d46 f7241b46 404d1a46 c6401446 24e61646 e6011946 28e21d46
cd4ae8c0 1729168751 S Ii:2:002:6 -115:1 544 <
cd4ae8c0 1729203145 C Ii:2:002:6 -75:1 512 = 00000000 597daf45 bda7b445 348cad45 f0fcb845 9e5db445 bfa2a545 a3a4aa45
cd4ae8c0 1729210902 S Ii:2:002:6 -115:1 544 <
cd4ae8c0 1729265704 C Ii:2:002:6 -75:1 512 = adbb71c4 227f8dc4 412795c4 db13c4c4 979fb2c4 d791a3c4 0b0876c4 c8aeb4c4
cd4ae8c0 1729269282 S Ii:2:002:6 -115:1 544 <
cd4ae8c0 1729328157 C Ii:2:002:6 -75:1 512 = 96cde6c5 1bdce1c5 d237e8c5 40e9dec5 363fe2c5 9de6efc5 8ec5ecc5 f60eeac5
cd4ae8c0 1729339258 S Ii:2:002:6 -115:1 544 <
cd4ae8c0 1729382883 C Ii:2:002:6 -75:1 512 = 1f4813c6 575614c6 a40e1ac6 3e3718c6 208016c6 8d4f11c6 8ff618c6 00000000
cd4ae8c0 1729388402 S Ii:2:002:6 -115:1 544 <
cd4ae8c0 1729445403 C Ii:2:002:6 -75:1 512 = d191b3c5 b60abac5 317db0c5 61f1b3c5 12b9c1c5 8460bec5 4eb5bbc5 695dbac5
cd4ae8c0 1729471466 S Ii:2:002:6 -115:1 544 <
cd4ae8c0 1729500008 C Ii:2:002:6 -75:1 512 = d200b942 41b88dc3 24220dc3 917093c1 e1ae9743 f29919c3 00000000 7fbb9c44
cd4ae8c0 1729530208 S Ii:2:002:6 -115:1 544 <
cd4ae8c0 1729562520 C Ii:2:002:6 -75:1 512 = d038e545 a7fcf045 442fec45 3c4edd45 8f8de245 8202e545 a99fe445 c299df45
cd4ae8c0 1729575462 S Ii:2:002:6 -115:1 544 <
cd4ae8c0 1729617317 C Ii:2:002:6 -75:1 512 = a9091846 b4a71a46 e0c41c46 9fa32146 710b1b46 00000000 f2d32446 28792746
cd4ae8c0 1729634881 S Ii:2:002:6 -115:1 544 <
cd4ae8c0 1729679828 C Ii:2:002:6 -75:1 512 = aebb0946 11470746 ea95ff45 fd7b0246 b5b20346 1a730346 84ed0046 e7130046
cd4ae8c0 1729694338 S Ii:2:002:6 -115:1 544 <
cd4ae8c0 1729734451 C Ii:2:002:6 -75:1 512 = abc81245 c4a51a45 fbb02e45 d5a01245 00000000 8737ef44 70d80145 b90de844
cd4ae8c0 1729747786 S Ii:2:002:6 -115:1 544 <
cd4ae8c0 1729796884 C Ii:2:002:6 -75:1 512 = 450d8cc5 a3f299c5 566d96c5 8ec693c5 319a92c5 b0d197c5 ccd599c5 b86ea5c5
cd4ae8c0 1729809265 S Ii:2:002:6 -115:1 544 <
cd4ae8c0 1729851702 C Ii:2:002:6 -75:1 512 = f3070fc6 a2d409c6 b77a11c6 00000000 72950cc6 ea1d0ac6 7b460dc6 7db808c6
cd4ae8c0 1729861803 S Ii:2:002:6 -115:1 544 <
cd4ae8c0 1729914147 C Ii:2:002:6 -75:1 512 = 2c5005c6 d5ce03c6 b06f02c6 faa201c6 944504c6 475105c6 300d0bc6 b12a09c6
cd4ae8c0 1729920974 S Ii:2:002:6 -115:1 544 <
cd4ae8c0 1729968776 C Ii:2:002:6 -75:1 512 = b1a65bc5 f90f79c5 00000000 6fe41ec5 5bd014c5 901322c5 73ea0dc5 907a15c5
cd4ae8c0 1729974263 S Ii:2:002:6 -115:1 544 <
cd4ae8c0 1730031261 C Ii:2:002:6 -75:1 512 = 9af97345 0e007945 4a077945 aae36e45 2d3f6b45 097b5345 08045d45 d3f96445
cd4ae8c0 1730047700 S Ii:2:002:6 -115:1 544 <
cd4ae8c0 1730086009 C Ii:2:002:6 -75:1 512 = 35e50746 00000000 77071646 07a61846 2afe1446 e2071b46 93831846 f0011146
cd4ae8c0 1730094756 S Ii:2:002:6 -115:1 544 <
cd4ae8c0 1730148515 C Ii:2:002:6 -75:1 512 = f91c1e46 8dbb1d46 ae3f1b46 66691a46 35591446 8bfb1646 d3161946 03f91d46
cd4ae8c0 1730160413 S Ii:2:002:6 -115:1 544 <
cd4ae8c0 1730203145 C Ii:2:002:6 -75:1 512 = 00000000 faa7af45 d6d6b445 69bdad45 032db945 de90b445 8fd7a545 3fd4aa45
cd4ae8c0 1730210250 S Ii:2:002:6 -115:1 544 <
cd4ae8c0 1730265633 C Ii:2:002:6 -75:1 512 = 616174c4 59c98ec4 fb7496c4 1559c5c4 55f5b3c4 8ff8a4c4 9fce78c4 dd18b6c4
cd4ae8c0 1730286267 S Ii:2:002:6 -115:1 544 <
cd4ae8c0 1730328145 C Ii:2:002:6 -75:1 512 = e074e7c5 ed87e2c5 3feae8c5 4098dfc5 3de8e2c5 4690f0c5 376dedc5 d8baeac5
cd4ae8c0 1730357620 S Ii:2:002:6 -115:1 544 <
cd4ae8c0 1730382876 C Ii:2:002:6 -75:1 512 = b84f13c6 2e5d14c6 22161ac6 b54318c6 168916c6 555911c6 ca0019c6 00000000
cd4ae8c0 1730402203 S Ii:2:002:6 -115:1 544 <
cd4ae8c0 1730445466 C Ii:2:002:6 -75:1 512 = 4c7db3c5 1ef1b9c5 525cb0c5 60deb3c5 32a4c1c5 774bbec5 ba98bbc5 ba48bac5
cd4ae8c0 1730462969 S Ii:2:002:6 -115:1 544 <
cd4ae8c0 1730500067 C Ii:2:002:6 -75:1 512 = d308a142 ddfc93c3 76171ac3 4e0100c2 c66c9143 6e2526c3 00000000 fcec9d44
cd4ae8c0 1730514225 S Ii:2:002:6 -115:1 544 <
cd4ae8c0 1730562576 C Ii:2:002:6 -75:1 512 = f941e545 0400f145 023aec45 465cdd45 3d99e245 1c07e545 b89be445 5599df45
cd4ae8c0 1730578203 S Ii:2:002:6 -115:1 544 <
cd4ae8c0 1730617327 C Ii:2:002:6 -75:1 512 = 30111846 9ab21a46 8ccc1c46 bbae2146 80161b46 00000000 aac22446 a3632746
cd4ae8c0 1730636908 S Ii:2:002:6 -115:1 544 <
cd4ae8c0 1730679836 C Ii:2:002:6 -75:1 512 = 7bbc0946 884a0746 009aff45 09820246 dcb80346 4e710346 33f30046 bb150046
cd4ae8c0 1730698899 S Ii:2:002:6 -115:1 544 <
cd4ae8c0 1730734453 C Ii:2:002:6 -75:1 512 = 2cda1245 1aae1a45 e6af2e45 57a41245 00000000 331bf044 69340245 30ebe844
cd4ae8c0 1730754922 S Ii:2:002:6 -115:1 544 <
cd4ae8c0 1730796896 C Ii:2:002:6 -75:1 512 = 3e148cc5 e6f699c5 356f96c5 a8c893c5 a0a392c5 afd597c5 d1e099c5 6d73a5c5
cd4ae8c0 1730799225 S Ii:2:002:6 -115:1 544 <
cd4ae8c0 1730851645 C Ii:2:002:6 -75:1 512 = d70d0fc6 aeda09c6 aa8011c6 00000000 aca60cc6 4f360ac6 af590dc6 36ce08c6
cd4ae8c0 1730862213 S Ii:2:002:6 -115:1 544 <
cd4ae8c0 1730914159 C Ii:2:002:6 -75:1 512 = 5d4b05c6 e4c903c6 316d02c6 869f01c6 053e04c6 214c05c6 92050bc6 922409c6
cd4ae8c0 1730922270 S Ii:2:002:6 -115:1 544 <
cd4ae8c0 1730968838 C Ii:2:002:6 -75:1 512 = 84d15bc5 b13a79c5 00000000 f9841ec5 7c7e14c5 5fbc21c5 ef7f0dc5 5a1115c5
cd4ae8c0 1730982270 S Ii:2:002:6 -115:1 544 <
cd4ae8c0 1731031259 C Ii:2:002:6 -75:1 512 = 69707445 fc6d7945 f8697945 864a6f45 5ca76b45 8bf15345 f7785d45 df566545
cd4ae8c0 1731045816 S Ii:2:002:6 -115:1 544 <
cd4ae8c0 1731086008 C Ii:2:002:6 -75:1 512 = 63e70746 00000000 f3041646 c2a31846 0bf91446 120b1b46 558b1846 ab031146
cd4ae8c0 1731094764 S Ii:2:002:6 -115:1 544 <
cd4ae8c0 1731148575 C Ii:2:002:6 -75:1 512 = 00151e46 fdb21d46 d3351b46 fa5a1a46 93541446 33ef1646 ec051946 59ed1d46
cd4ae8c0 1731167526 S Ii:2:002:6 -115:1 544 <
cd4ae8c0 1731203135 C Ii:2:002:6 -75:1 512 = 00000000 ab9faf45 02c7b445 66b1ad45 592ab945 7f8db445 e3d0a545 b8d2aa45
cd4ae8c0 1731210284 S Ii:2:002:6 -115:1 544 <
cd4ae8c0 1731265647 C Ii:2:002:6 -75:1 512 = d75972c4 049e8dc4 1b8095c4 061cc4c4 fff1b2c4 f5dea3c4 867f76c4 c8ebb4c4
cd4ae8c0 1731279115 S Ii:2:002:6 -115:1 544 <
cd4ae8c0 1731328146 C Ii:2:002:6 -75:1 512 = 0d21e7c5 a534e2c5 4a93e8c5 833adfc5 5c93e2c5 613cf0c5 8918edc5 8c60eac5
cd4ae8c0 1731339241 S Ii:2:002:6 -115:1 544 <
cd4ae8c0 1731382877 C Ii:2:002:6 -75:1 512 = 5f4013c6 d85314c6 e3061ac6 d13018c6 887816c6 564611c6 49f118c6 00000000
cd4ae8c0 1731390227 S Ii:2:002:6 -115:1 544 <
cd4ae8c0 1731445401 C Ii:2:002:6 -75:1 512 = e17cb3c5 fbecb9c5 a355b0c5 bbe1b3c5 dba4c1c5 854cbec5 949ebbc5 4d4bbac5
cd4ae8c0 1731459303 S Ii:2:002:6 -115:1 544 <
cd4ae8c0 1731500068 C Ii:2:002:6 -75:1 512 = 5279b042 d4bb8fc3 eba50fc3 1246acc1 47c09643 f53e1cc3 00000000 dcfb9d44
cd4ae8c0 1731514254 S Ii:2:002:6 -115:1 544 <
cd4ae8c0 1731562522 C Ii:2:002:6 -75:1 512 = 4254e545 5614f145 074dec45 d669dd45 3ea8e245 1015e545 95b3e445 9bb5df45
cd4ae8c0 1731582229 S Ii:2:002:6 -115:1 544 <
cd4ae8c0 1731617317 C Ii:2:002:6 -75:1 512 = dc091846 65ad1a46 4bc81c46 5ca92146 590f1b46 00000000 55c92446 646a2746
cd4ae8c0 1731630516 S Ii:2:002:6 -115:1 544 <
cd4ae8c0 1731679776 C Ii:2:002:6 -75:1 512 = 71b60946 41470746 429aff45 ad800246 92b30346 136b0346 5fef0046 f50b0046
cd4ae8c0 1731693689 S Ii:2:002:6 -115:1 544 <
cd4ae8c0 1731734381 C Ii:2:002:6 -75:1 512 = f2401345 29161b45 da0c2f45 0b031345 00000000 bfecef44 16200245 ebc2e844
cd4ae8c0 1731743044 S Ii:2:002:6 -115:1 544 <
cd4ae8c0 1731796903 C Ii:2:002:6 -75:1 512 = 5de98bc5 75c999c5 694696c5 9c9d93c5 b17992c5 09ae97c5 d2b499c5 5143a5c5
cd4ae8c0 1731807033 S Ii:2:002:6 -115:1 544 <
cd4ae8c0 1731851631 C Ii:2:002:6 -75:1 512 = f3300fc6 bdfd09c6 34a711c6 00000000 79740cc6 5c000ac6 a1240dc6 8b9908c6
cd4ae8c0 1731858266 S Ii:2:002:6 -115:1 544 <
cd4ae8c0 1731914145 C Ii:2:002:6 -75:1 512 = 9f7005c6 1df203c6 9f9502c6 9ac901c6 536804c6 a67b05c6 8a330bc6 b64c09c6
cd4ae8c0 1731919065 S Ii:2:002:6 -115:1 544 <
cd4ae8c0 1731968760 C Ii:2:002:6 -75:1 512 = 2a495bc5 f5ad78c5 00000000 2ed21ec5 50c514c5 420022c5 f5c70dc5 9d7415c5
cd4ae8c0 1731979293 S Ii:2:002:6 -115:1 544 <
cd4ae8c0 1732031277 C Ii:2:002:6 -75:1 512 = 64bd7445 25b17945 71b07945 05986f45 bee46b45 b0325445 ecaf5d45 299f6545
cd4ae8c0 1732050283 S Ii:2:002:6 -115:1 544 <
cd4ae8c0 1732086001 C Ii:2:002:6 -75:1 512 = b4e00746 00000000 a90b1646 e0a51846 61031546 20111b46 8d871846 8a031146
cd4ae8c0 1732101645 S Ii:2:002:6 -115:1 544 <
cd4ae8c0 1732148505 C Ii:2:002:6 -75:1 512 = aefd1d46 ea971d46 7d1c1b46 f7401a46 0e391446 1cdb1646 d3f41846 81d81d46
cd4ae8c0 1732158265 S Ii:2:002:6 -115:1 544 <
cd4ae8c0 1732203137 C Ii:2:002:6 -75:1 512 = 00000000 1db5af45 c7dfb445 72cead45 6641b945 7c99b445 e4e4a545 3ae3aa45
cd4ae8c0 1732214814 S Ii:2:002:6 -115:1 544 <
cd4ae8c0 1732265630 C Ii:2:002:6 -75:1 512 = 959972c4 71bb8dc4 3cb795c4 ec6ac4c4 0af0b2c4 22d9a3c4 149276c4 4216b5c4
cd4ae8c0 1732283921 S Ii:2:002:6 -115:1 544 <
cd4ae8c0 1732328145 C Ii:2:002:6 -75:1 512 = f802e7c5 351de2c5 ef74e8c5 d921dfc5 ee82e2c5 5823f0c5 2b02edc5 4f55eac5
cd4ae8c0 1732339257 S Ii:2:002:6 -115:1 544 <
cd4ae8c0 1732382877 C Ii:2:002:6 -75:1 512 = 7a5513c6 5c6814c6 021b1ac6 7a4218c6 638c16c6 715911c6 4d0719c6 00000000
cd4ae8c0 1732398223 S Ii:2:002:6 -115:1 544 <
cd4ae8c0 1732445383 C Ii:2:002:6 -75:1 512 = ea95b3c5 a809bac5 7a7db0c5 8affb3c5 f0c7c1c5 d964bec5 fdc0bbc5 6274bac5
cd4ae8c0 1732455798 S Ii:2:002:6 -115:1 544 <
cd4ae8c0 1732500066 C Ii:2:002:6 -75:1 512 = 3bf3c242 d90f8bc3 100807c3 59ff44c1 e61f9b43 767213c3 00000000 b2579c44
cd4ae8c0 1732510263 S Ii:2:002:6 -115:1 544 <
cd4ae8c0 1732562510 C Ii:2:002:6 -75:1 512 = 4a91e545 bd45f145 4f76ec45 959bdd45 1ed8e245 8f42e545 d5d9e445 0dd9df45
cd4ae8c0 1732570247 S Ii:2:002:6 -115:1 544 <
cd4ae8c0 1732617255 C Ii:2:002:6 -75:1 512 = 65031846 2da71a46 7fc31c46 0ea72146 d10c1b46 00000000 78db2446 2c7a2746
cd4ae8c0 1732630445 S Ii:2:002:6 -115:1 544 <
cd4ae8c0 1732679758 C Ii:2:002:6 -75:1 512 = 5e930946 bb200746 1f51ff45 e95c0246 738f0346 65450346 67ca0046 88d0ff45
cd4ae8c0 1732698566 S Ii:2:002:6 -115:1 544 <
cd4ae8c0 1732734453 C Ii:2:002:6 -75:1 512 = 88521345 38261b45 562f2f45 b41d1345 00000000 76b6ef44 c0f40145 d47de844
cd4ae8c0 1732758269 S Ii:2:002:6 -115:1 544 <
cd4ae8c0 1732796896 C Ii:2:002:6 -75:1 512 = e8a78bc5 c68199c5 2e0196c5 ee5c93c5 553f92c5 7e6797c5 b87699c5 be08a5c5
cd4ae8c0 1732818017 S Ii:2:002:6 -115:1 544 <
cd4ae8c0 1732851632 C Ii:2:002:6 -75:1 512 = 1c150fc6 2be809c6 f08711c6 00000000 507c0cc6 870e0ac6 d0300dc6 14a908c6
cd4ae8c0 1732859305 S Ii:2:002:6 -115:1 544 <
cd4ae8c0 1732914151 C Ii:2:002:6 -75:1 512 = a96f05c6 d1ef03c6 2c9502c6 d3c901c6 056504c6 da7505c6 0f2e0bc6 024b09c6
cd4ae8c0 1732926270 S Ii:2:002:6 -115:1 544 <
cd4ae8c0 1732968770 C Ii:2:002:6 -75:1 512 = bcf55ac5 0d6978c5 00000000 dcfd1ec5 760a15c5 cb4122c5 7f110ec5 57a215c5
cd4ae8c0 1732978214 S Ii:2:002:6 -115:1 544 <
cd4ae8c0 1733031275 C Ii:2:002:6 -75:1 512 = 1ac27445 e0c77945 b8af7945 61a56f45 7de86b45 01455445 8ecf5d45 56ba6545
cd4ae8c0 1733047308 S Ii:2:002:6 -115:1 544 <
cd4ae8c0 1733086009 C Ii:2:002:6 -75:1 512 = bcc50746 00000000 31211646 41be1846 c5141546 aa1f1b46 11a11846 351f1146
cd4ae8c0 1733098213 S Ii:2:002:6 -115:1 544 <
cd4ae8c0 1733148510 C Ii:2:002:6 -75:1 512 = 3bee1d46 fa7e1d46 45071b46 8f2a1a46 5a271446 ffc91646 3fe41846 21c51d46
cd4ae8c0 1733169235 S Ii:2:002:6 -115:1 544 <
cd4ae8c0 1733203126 C Ii:2:002:6 -75:1 512 = 00000000 9c43af45 1f68b445 3751ad45 8dc7b845 2a29b445 1f76a545 236faa45
cd4ae8c0 1733222246 S Ii:2:002:6 -115:1 544 <
cd4ae8c0 1733265651 C Ii:2:002:6 -75:1 512 = 20cf71c4 bb5b8dc4 f04995c4 6feec3c4 5e7ab2c4 a371a3c4 63d075c4 0db5b4c4
cd4ae8c0 1733278701 S Ii:2:002:6 -115:1 544 <
cd4ae8c0 1733328132 C Ii:2:002:6 -75:1 512 = fde9e6c5 8001e2c5 9c5de8c5 8b0edfc5 7f65e2c5 1206f0c5 23efecc5 4e30eac5
cd4ae8c0 1733334852 S Ii:2:002:6 -115:1 544 <
cd4ae8c0 1733382878 C Ii:2:002:6 -75:1 512 = 906013c6 4e7814c6 16291ac6 c54c18c6 9f9716c6 a16211c6 021119c6 00000000
cd4ae8c0 1733391527 S Ii:2:002:6 -115:1 544 <
cd4ae8c0 1733445384 C Ii:2:002:6 -75:1 512 = 11bcb3c5 4e30bac5 99a0b0c5 ec1cb4c5 5cdcc1c5 a984bec5 9bcdbbc5 5399bac5
cd4ae8c0 1733457775 S Ii:2:002:6 -115:1 544 <
cd4ae8c0 1733500009 C Ii:2:002:6 -75:1 512 = b18bbd42 f01f8cc3 bd7208c3 e3de60c1 82429a43 1ac615c3 00000000 c70d9d44
cd4ae8c0 1733526271 S Ii:2:002:6 -115:1 544 <
cd4ae8c0 1733562530 C Ii:2:002:6 -75:1 512 = 6a7de545 583bf145 3474ec45 f0a0dd45 9cd9e245 a24de545 56d1e445 55d9df45
cd4ae8c0 1733574289 S Ii:2:002:6 -115:1 544 <
cd4ae8c0 1733617263 C Ii:2:002:6 -75:1 512 = 1df91746 989e1a46 4abb1c46 38a02146 4b001b46 00000000 cfef2446 01932746
cd4ae8c0 1733627030 S Ii:2:002:6 -115:1 544 <
cd4ae8c0 1733679826 C Ii:2:002:6 -75:1 512 = fa930946 fc200746 6a59ff45 b25e0246 e4920346 66440346 e9cf0046 65d6ff45
cd4ae8c0 1733694165 S Ii:2:002:6 -115:1 544 <
cd4ae8c0 1733734380 C Ii:2:002:6 -75:1 512 = 089c1345 3f731b45 14752f45 e3611345 00000000 7930ef44 c1c70145 1315e844
cd4ae8c0 1733742282 S Ii:2:002:6 -115:1 544 <
cd4ae8c0 1733796881 C Ii:2:002:6 -75:1 512 = e7b48bc5 408b99c5 ee0596c5 d25f93c5 8e4992c5 1b6f97c5 4e7d99c5 3a13a5c5
cd4ae8c0 1733804800 S Ii:2:002:6 -115:1 544 <
cd4ae8c0 1733851648 C Ii:2:002:6 -75:1 512 = 3e410fc6 470d0ac6 52b111c6 00000000 b46d0cc6 67fb09c6 291c0dc6 7d9808c6
cd4ae8c0 1733874267 S Ii:2:002:6 -115:1 544 <
cd4ae8c0 1733914158 C Ii:2:002:6 -75:1 512 = a46805c6 d4e903c6 c68c02c6 5dc801c6 845f04c6 df7405c6 602e0bc6 154609c6
cd4ae8c0 1733930877 S Ii:2:002:6 -115:1 544 <
cd4ae8c0 1733968826 C Ii:2:002:6 -75:1 512 = 9a1c5bc5 f78978c5 00000000 b7c01ec5 27c414c5 11fe21c5 fdcf0dc5 c17215c5
cd4ae8c0 1733982268 S Ii:2:002:6 -115:1 544 <
cd4ae8c0 1734031330 C Ii:2:002:6 -75:1 512 = 68c57445 6dca7945 47b27945 b3aa6f45 fde26b45 a3325445 f8cf5d45 bfb66545
cd4ae8c0 1734042275 S Ii:2:002:6 -115:1 544 <
cd4ae8c0 1734086020 C Ii:2:002:6 -75:1 512 = a2ce0746 00000000 fe1e1646 65bf1846 ae141546 ae201b46 8ca01846 84201146
cd4ae8c0 1734096532 S Ii:2:002:6 -115:1 544 <
cd4ae8c0 1734148581 C Ii:2:002:6 -75:1 512 = 46fb1d46 13941d46 97191b46 103d1a46 e3371446 d5da1646 7df41846 03da1d46
cd4ae8c0 1734176147 S Ii:2:002:6 -115:1 544 <
cd4ae8c0 1734203132 C Ii:2:002:6 -75:1 512 = 00000000 a48eaf45 d5b0b445 ba99ad45 310cb945 016db445 69b9a545 5eb5aa45
cd4ae8c0 1734213279 S Ii:2:002:6 -115:1 544 <
cd4ae8c0 1734265693 C Ii:2:002:6 -75:1 512 = b53070c4 dba48cc4 487794c4 103bc3c4 b684b1c4 4aa4a2c4 902674c4 f0c3b3c4
cd4ae8c0 1734282220 S Ii:2:002:6 -115:1 544 <
cd4ae8c0 1734328134 C Ii:2:002:6 -75:1 512 = f1e4e6c5 e1fee1c5 6858e8c5 2c06dfc5 ca5fe2c5 f5ffefc5 76e4ecc5 162eeac5
cd4ae8c0 1734343612 S Ii:2:002:6 -115:1 544 <
cd4ae8c0 1734382899 C Ii:2:002:6 -75:1 512 = 446f13c6 f58414c6 ad381ac6 075818c6 daa316c6 0a7211c6 a21c19c6 00000000
cd4ae8c0 1734399231 S Ii:2:002:6 -115:1 544 <
cd4ae8c0 1734445444 C Ii:2:002:6 -75:1 512 = 07a5b3c5 7b10bac5 3084b0c5 1c0cb4c5 99c6c1c5 5374bec5 97c9bbc5 458abac5
cd4ae8c0 1734462267 S Ii:2:002:6 -115:1 544 <
cd4ae8c0 1734500023 C Ii:2:002:6 -75:1 512 = 186cc342 32c58ac3 23f204c3 29f23dc1 e1899b43 a45e11c3 00000000 e8d79c44
cd4ae8c0 1734512404 S Ii:2:002:6 -115:1 544 <
cd4ae8c0 1734562521 C Ii:2:002:6 -75:1 512 = 31d5e545 ad8ff145 fac1ec45 48ecdd45 291ee345 e395e545 5b14e545 041ee045
cd4ae8c0 1734579304 S Ii:2:002:6 -115:1 544 <
cd4ae8c0 1734617324 C Ii:2:002:6 -75:1 512 = acf31746 509e1a46 95b81c46 809a2146 d6001b46 00000000 3beb2446 18892746
cd4ae8c0 1734629310 S Ii:2:002:6 -115:1 544 <
cd4ae8c0 1734679838 C Ii:2:002:6 -75:1 512 = 76a30946 5e2c0746 9c6fff45 ef640246 489d0346 294c0346 ecd20046 16e6ff45
cd4ae8c0 1734690264 S Ii:2:002:6 -115:1 544 <
cd4ae8c0 1734734402 C Ii:2:002:6 -75:1 512 = c0c21345 278b1b45 3f822f45 12861345 00000000 dec0ef44 a40e0245 2397e844
cd4ae8c0 1734750209 S Ii:2:002:6 -115:1 544 <
cd4ae8c0 1734796951 C Ii:2:002:6 -75:1 512 = 4cb18bc5 f88399c5 a60796c5 125d93c5 884d92c5 467997c5 d18299c5 7017a5c5
cd4ae8c0 1734809602 S Ii:2:002:6 -115:1 544 <
c9d1f6c0 1734822159 S Co:2:002:0 s 40 cb 0000 0000 0007 7 = 03010002 00ff07
c9d1f6c0 1734835647 C Co:2:002:0 0 7 >
cd4ae8c0 1734851630 C Ii:2:002:6 -75:1 512 = c81d0fc6 4bec09c6 c78f11c6 00000000 257d0cc6 4b0c0ac6 6d2e0dc6 2ba508c6
cd4ae8c0 1734862712 S Ii:2:002:6 -115:1 544 <
cd4ae8c0 1734914154 C Ii:2:002:6 -75:1 512 = c36105c6 bee003c6 648402c6 19c301c6 5f6204c6 b56f05c6 90270bc6 fd3b09c6
cd4ae8c0 1734929268 S Ii:2:002:6 -115:1 544 <
cd4ae8c0 1734968758 C Ii:2:002:6 -75:1 512 = fe4efe43 63cf5342 00000000 54e9f743 b35c2444 81f8db43 fcbf4244 d6372244
cd4ae8c0 1734979257 S Ii:2:002:6 -115:1 544 <
cd4ae8c0 1735031327 C Ii:2:002:6 -75:1 512 = ca0c0c44 b0bd2044 cc812344 2f5af543 8ea8d643 e1ea5842 13ea4743 e9f9a043
cd4ae8c0 1735039226 S Ii:2:002:6 -115:1 544 <
cd4ae8c0 1735086008 C Ii:2:002:6 -75:1 512 = 11272f43 00000000 2d293544 30ac5d44 78522744 b5697c44 4d5d5b44 af3bd243
cd4ae8c0 1735098269 S Ii:2:002:6 -115:1 544 <
cd4ae8c0 1735148585 C Ii:2:002:6 -75:1 512 = e67a1b44 ee7d1e44 6d4ceb43 aa80cc43 1f920842 012b3443 1f049743 24201c44
cd4ae8c0 1735163237 S Ii:2:002:6 -115:1 544 <
cd4ae8c0 1735203146 C Ii:2:002:6 -75:1 512 = 00000000 38b22f44 cc0d5844 c2cd2144 70db7644 50bb5544 dfcbc643 775d0544
cd4ae8c0 1735209252 S Ii:2:002:6 -115:1 544 <
cd4ae8c0 1735265652 C Ii:2:002:6 -75:1 512 = d4ea0344 1628b643 ecae9743 5f8c91c2 6e6d9342 fdb04343 72700144 6dd77542
cd4ae8c0 1735285805 S Ii:2:002:6 -115:1 544 <
cd4ae8c0 1735328138 C Ii:2:002:6 -75:1 512 = 3e561544 26bd3d44 05690744 ce605c44 c90f3b44 e10e9243 c0c7d543 32ccfe43
cd4ae8c0 1735339583 S Ii:2:002:6 -115:1 544 <
cd4ae8c0 1735382876 C Ii:2:002:6 -75:1 512 = e905af43 b6999043 bdd1acc2 d0446942 cc883443 6173fb43 7fec3b42 00000000
cd4ae8c0 1735390380 S Ii:2:002:6 -115:1 544 <
cd4ae8c0 1735445380 C Ii:2:002:6 -75:1 512 = fb583944 4fdc0244 47b95744 85c73644 21458943 3f41cd43 7d33f643 dde9fc43
cd4ae8c0 1735454725 S Ii:2:002:6 -115:1 544 <
cd4ae8c0 1735500045 C Ii:2:002:6 -75:1 512 = c164bf43 16e4dc40 e3391843 33658943 5c6c1544 f7320d43 00000000 0dc32f44
cd4ae8c0 1735509345 S Ii:2:002:6 -115:1 544 <
cd4ae8c0 1735562506 C Ii:2:002:6 -75:1 512 = a21f2944 765a7e44 6f3b5d44 e5c6d543 31500d44 19b02144 32ba2444 fd4cf743
cd4ae8c0 1735574322 S Ii:2:002:6 -115:1 544 <
cd4ae8c0 1735617324 C Ii:2:002:6 -75:1 512 = 28880b42 ed1b3543 77ac9743 90811c44 cf772943 00000000 44944944 f15d7244
cd4ae8c0 1735629697 S Ii:2:002:6 -115:1 544 <
cd4ae8c0 1735679768 C Ii:2:002:6 -75:1 512 = 6cd27844 f1b65744 5448cb43 71890744 ad2d1c44 81641f44 a496ec43 e9a7cd43
cd4ae8c0 1735694478 S Ii:2:002:6 -115:1 544 <
cd4ae8c0 1735734395 C Ii:2:002:6 -75:1 512 = 784e4043 08229d43 7c631f44 72303543 00000000 15d33144 504f5a44 79c52344
cd4ae8c0 1735739792 S Ii:2:002:6 -115:1 544 <
cd4ae8c0 1735796893 C Ii:2:002:6 -75:1 512 = 4ff73b44 7e1a9343 7c95d743 f82a0044 15700344 660fb543 9bc19543 0cb996c2
cd4ae8c0 1735806223 S Ii:2:002:6 -115:1 544 <
cd4ae8c0 1735851636 C Ii:2:002:6 -75:1 512 = fc282543 3b6af443 9620fe41 00000000 27811744 c2024044 b1820944 43b85e44
cd4ae8c0 1735862455 S Ii:2:002:6 -115:1 544 <
cd4ae8c0 1735914145 C Ii:2:002:6 -75:1 512 = 06028843 88fccb43 45a6f443 ae9cfb43 3d87a943 15638a43 48d5c3c2 27e03f42
cd4ae8c0 1735930249 S Ii:2:002:6 -115:1 544 <
cd4ae8c0 1735968758 C Ii:2:002:6 -75:1 512 = b8240044 e8536042 00000000 55b81144 ef6a3a44 ffea0344 88da5844 ed123844
cd4ae8c0 1735977284 S Ii:2:002:6 -115:1 544 <
cd4ae8c0 1736031255 C Ii:2:002:6 -75:1 512 = 4a110b44 e2b91f44 8c932244 7533f343 e389d443 142f4542 ef014343 5e619e43
cd4ae8c0 1736042254 S Ii:2:002:6 -115:1 544 <
cd4ae8c0 1736086077 C Ii:2:002:6 -75:1 512 = 68c02743 00000000 85f83444 0f995d44 3b0e2744 44287c44 9fee5a44 fc66d143
cd4ae8c0 1736093789 S Ii:2:002:6 -115:1 544 <
cd4ae8c0 1736148531 C Ii:2:002:6 -75:1 512 = 28361b44 a58f1e44 28f4ea43 c939cc43 37000442 36d03243 09c09643 c6c51b44
cd4ae8c0 1736166286 S Ii:2:002:6 -115:1 544 <
cd4ae8c0 1736203133 C Ii:2:002:6 -75:1 512 = 00000000 e5443044 32b55844 c4412244 45637744 fa4c5644 fdf5c743 1a240644
cd4ae8c0 1736218931 S Ii:2:002:6 -115:1 544 <
cd4ae8c0 1736265646 C Ii:2:002:6 -75:1 512 = eddc0444 bd64b743 27c69843 5e6b8bc2 d2209742 84194543 09400244 608d7e42
cd4ae8c0 1736279234 S Ii:2:002:6 -115:1 544 <
cd4ae8c0 1736328136 C Ii:2:002:6 -75:1 512 = 617b1644 ac0b3f44 69960844 438c5d44 10ac3c44 67ba9443 8d4ed843 abd00044
cd4ae8c0 1736334539 S Ii:2:002:6 -115:1 544 <
cd4ae8c0 1736382878 C Ii:2:002:6 -75:1 512 = 7d83af43 f9479143 a02dabc2 7bc96d42 947c3543 de64fc43 907f3e42 00000000
cd4ae8c0 1736389259 S Ii:2:002:6 -115:1 544 <
cd4ae8c0 1736445466 C Ii:2:002:6 -75:1 512 = dc913a44 39390444 4e5f5944 45413844 56da8b43 e227d043 3d23f943 b4daff43
cd4ae8c0 1736466292 S Ii:2:002:6 -115:1 544 <
cd4ae8c0 1736500022 C Ii:2:002:6 -75:1 512 = d393c143 24ae3141 85251d43 a9648b43 cf791644 89081243 00000000 0eb73244
cd4ae8c0 1736514276 S Ii:2:002:6 -115:1 544 <
cd4ae8c0 1736562523 C Ii:2:002:6 -75:1 512 = 769e2944 5ae97e44 81ba5d44 fff1d643 a0940d44 d2e42144 bf592544 c8e8f743
cd4ae8c0 1736578244 S Ii:2:002:6 -115:1 544 <
cd4ae8c0 1736617317 C Ii:2:002:6 -75:1 512 = 28891742 dabe3743 b4069943 34221d44 94f12b43 00000000 0ec44844 ec407144
cd4ae8c0 1736622215 S Ii:2:002:6 -115:1 544 <
cd4ae8c0 1736679831 C Ii:2:002:6 -75:1 512 = c1387a44 d3045944 8e6acd43 83cf0844 6a311d44 189f2044 fdfbee43 2ba2d043
cd4ae8c0 1736709248 S Ii:2:002:6 -115:1 544 <
cd4ae8c0 1736734399 C Ii:2:002:6 -75:1 512 = 53143f43 bf749c43 ee171f44 e47d3343 00000000 59ee3344 3c945c44 e7f22544
cd4ae8c0 1736750248 S Ii:2:002:6 -115:1 544 <
cd4ae8c0 1736796884 C Ii:2:002:6 -75:1 512 = ee643c44 ca4c9443 1144d843 858f0044 45260444 e1e1b543 70b99743 c32991c2
cd4ae8c0 1736802212 S Ii:2:002:6 -115:1 544 <
cd4ae8c0 1736851646 C Ii:2:002:6 -75:1 512 = b1322143 7757f243 d12add41 00000000 74951544 26633e44 72b00744 bec15c44
cd4ae8c0 1736861704 S Ii:2:002:6 -115:1 544 <
cd4ae8c0 1736914158 C Ii:2:002:6 -75:1 512 = 84e18a43 e833cf43 6dfbf743 482eff43 8107ac43 a52b8e43 c45eb7c2 942b5042
cd4ae8c0 1736946221 S Ii:2:002:6 -115:1 544 <
cd4ae8c0 1736968772 C Ii:2:002:6 -75:1 512 = b21f0144 da676e42 00000000 2c241144 96ba3944 3f1a0344 67045844 97063744
cd4ae8c0 1736990956 S Ii:2:002:6 -115:1 544 <
cd4ae8c0 1737031251 C Ii:2:002:6 -75:1 512 = a47c0b44 ac122044 b02e2344 f6caf343 e578d543 37954d42 8dfe4343 4a0c9f43
cd4ae8c0 1737042231 S Ii:2:002:6 -115:1 544 <
cd4ae8c0 1737086013 C Ii:2:002:6 -75:1 512 = 4ca01643 00000000 c5c33544 3a655e44 7ebf2744 51137d44 4cd95b44 cc06d343
cd4ae8c0 1737099260 S Ii:2:002:6 -115:1 544 <
cd4ae8c0 1737148575 C Ii:2:002:6 -75:1 512 = 2bb21b44 c1ed1e44 b73ceb43 91accc43 8fd10642 190d3343 71f19643 c0591c44
cd4ae8c0 1737166252 S Ii:2:002:6 -115:1 544 <
cd4ae8c0 1737203126 C Ii:2:002:6 -75:1 512 = 00000000 610a2f44 93ed5744 614a2144 477f7644 49925544 1c03c643 80190544
cd4ae8c0 1737218989 S Ii:2:002:6 -115:1 544 <
cd4ae8c0 1737265653 C Ii:2:002:6 -75:1 512 = 96a30344 f4b1b443 6b239643 02f895c2 d34c8a42 b2443f43 88aa0044 c7dc6542
cd4ae8c0 1737272647 S Ii:2:002:6 -115:1 544 <
cd4ae8c0 1737328144 C Ii:2:002:6 -75:1 512 = 92651644 0f403f44 6e6e0844 55a75d44 bab83c44 73859443 ad5fd843 12cd0044
cd4ae8c0 1737342273 S Ii:2:002:6 -115:1 544 <
cd4ae8c0 1737382878 C Ii:2:002:6 -75:1 512 = f157af43 d60e9143 f525acc2 8dec6a42 03673443 4500fc43 bf3a3c42 00000000
cd4ae8c0 1737393017 S Ii:2:002:6 -115:1 544 <
cd4ae8c0 1737445386 C Ii:2:002:6 -75:1 512 = 6e403944 fb770244 3ba75744 409f3644 07778843 0cbccc43 3ff1f543 58fafc43
cd4ae8c0 1737462915 S Ii:2:002:6 -115:1 544 <
cd4ae8c0 1737500002 C Ii:2:002:6 -75:1 512 = bbd6c043 d5da1a41 a9311c43 2b418b43 4d5b1644 eade1143 00000000 87723044
cd4ae8c0 1737514225 S Ii:2:002:6 -115:1 544 <
cd4ae8c0 1737562509 C Ii:2:002:6 -75:1 512 = c0b52844 66b37d44 d40e5d44 a1a3d443 c0a20c44 5d0a2144 32822444 8cfdf643
cd4ae8c0 1737572856 S Ii:2:002:6 -115:1 544 <
cd4ae8c0 1737617326 C Ii:2:002:6 -75:1 512 = 72641142 05d23543 14fc9743 5aa91c44 e09e2a43 00000000 0aa04944 485c7244
cd4ae8c0 1737634376 S Ii:2:002:6 -115:1 544 <
cd4ae8c0 1737679759 C Ii:2:002:6 -75:1 512 = bd817844 20d45744 3197ca43 727e0744 46011c44 a1641f44 891aec43 3abccd43
cd4ae8c0 1737698553 S Ii:2:002:6 -115:1 544 <
cd4ae8c0 1737734386 C Ii:2:002:6 -75:1 512 = 47a14843 cbfea043 7b2b2144 ea743c43 00000000 c89f3144 62445a44 93c22344
cd4ae8c0 1737750021 S Ii:2:002:6 -115:1 544 <
cd4ae8c0 1737796942 C Ii:2:002:6 -75:1 512 = f60a3c44 c00a9343 e2b2d743 043d0044 bfc60344 bb44b543 e2d39643 e16b94c2
cd4ae8c0 1737807308 S Ii:2:002:6 -115:1 544 <
cd4ae8c0 1737851657 C Ii:2:002:6 -75:1 512 = 386c2b43 7f37f743 9d6b1642 00000000 07341644 d3ee3e44 864a0844 56355d44
cd4ae8c0 1737859256 S Ii:2:002:6 -115:1 544 <
cd4ae8c0 1737914142 C Ii:2:002:6 -75:1 512 = a35c8843 e2accc43 5a06f643 46f1fc43 e90caa43 2cee8b43 273cbfc2 747c4342
cd4ae8c0 1737934213 S Ii:2:002:6 -115:1 544 <
cd4ae8c0 1737968828 C Ii:2:002:6 -75:1 512 = 885aff43 43dc5842 00000000 d1e81244 8b753b44 2dde0444 00ce5944 44e93844
cd4ae8c0 1737984189 S Ii:2:002:6 -115:1 544 <
cd4ae8c0 1738031256 C Ii:2:002:6 -75:1 512 = c83e0b44 ca0b2044 a96a2344 4678f443 f7afd543 d3954e42 ef344543 caac9f43
cd4ae8c0 1738038577 S Ii:2:002:6 -115:1 544 <
cd4ae8c0 1738086004 C Ii:2:002:6 -75:1 512 = 0fdd2943 00000000 c9613544 c4235e44 13462744 b6997c44 0c955b44 e920d243
cd4ae8c0 1738094747 S Ii:2:002:6 -115:1 544 <
cd4ae8c0 1738148507 C Ii:2:002:6 -75:1 512 = 381e1c44 9c8b1f44 efd0ec43 4785ce43 6fc81242 28443543 08de9743 4e821c44
cd4ae8c0 1738162247 S Ii:2:002:6 -115:1 544 <
cd4ae8c0 1738203155 C Ii:2:002:6 -75:1 512 = 00000000 00a03044 e2435944 fb852244 e3a77744 45a15644 4035c843 db1b0644
cd4ae8c0 1738214245 S Ii:2:002:6 -115:1 544 <
cd4ae8c0 1738265638 C Ii:2:002:6 -75:1 512 = 0c810444 7eacb643 df029843 a5d390c2 43699242 3c2d4443 13a20144 1dca7742
cd4ae8c0 1738270692 S Ii:2:002:6 -115:1 544 <
cd4ae8c0 1738328140 C Ii:2:002:6 -75:1 512 = d57d1544 2e503e44 17a10744 6dac5c44 31cb3b44 d7d09243 8a3fd643 7fcaff43
cd4ae8c0 1738344372 S Ii:2:002:6 -115:1 544 <
cd4ae8c0 1738382901 C Ii:2:002:6 -75:1 512 = 8aa5ac43 55288e43 b8ccb9c2 01aa5342 70d32f43 a2eaf843 9ae72342 00000000
cd4ae8c0 1738401022 S Ii:2:002:6 -115:1 544 <
cd4ae8c0 1738445397 C Ii:2:002:6 -75:1 512 = ea5a3a44 ee8c0344 504a5844 d5c33744 7dc28a43 e2a1ce43 12dff743 76fafe43
cd4ae8c0 1738459264 S Ii:2:002:6 -115:1 544 <
cd4ae8c0 1738500022 C Ii:2:002:6 -75:1 512 = 79b7c243 9da35941 28ba1e43 3bc68c43 32ee1644 a0671443 00000000 9ced2f44
cd4ae8c0 1738507648 S Ii:2:002:6 -115:1 544 <
cd4ae8c0 1738562568 C Ii:2:002:6 -75:1 512 = 98802944 b4c47e44 51db5d44 9944d743 b9830d44 5f2c2244 577e2544 e277f843
cd4ae8c0 1738578189 S Ii:2:002:6 -115:1 544 <
cd4ae8c0 1738617282 C Ii:2:002:6 -75:1 512 = 035e2842 210e3b43 e1819b43 37291e44 64ad2f43 00000000 bec54844 9e5f7144
cd4ae8c0 1738639234 S Ii:2:002:6 -115:1 544 <
cd4ae8c0 1738679827 C Ii:2:002:6 -75:1 512 = 2dad7944 42ff5844 db2dcd43 b5480844 5e171d44 6a9f2044 4c8aee43 3337d043
cd4ae8c0 1738698222 S Ii:2:002:6 -115:1 544 <
cd4ae8c0 1738734455 C Ii:2:002:6 -75:1 512 = 8a9f4543 f4a9a043 e6e12044 254b3a43 00000000 891e3244 86bd5a44 d22e2444
cd4ae8c0 1738746282 S Ii:2:002:6 -115:1 544 <
cd4ae8c0 1738796897 C Ii:2:002:6 -75:1 512 = 29f33d44 d1309743 cc91da43 790f0244 b77a0544 9734b843 f0f49943 794e89c2
cd4ae8c0 1738809262 S Ii:2:002:6 -115:1 544 <
cd4ae8c0 1738851647 C Ii:2:002:6 -75:1 512 = 5cb92e43 9a6cf843 9d8f2042 00000000 dcc61644 b3483f44 4be20844 0ae25d44
cd4ae8c0 1738866266 S Ii:2:002:6 -115:1 544 <
cd4ae8c0 1738914156 C Ii:2:002:6 -75:1 512 = 954d8843 63b4cb43 da01f543 ab1ffc43 52d7a943 e5e48a43 f0e8c3c2 4a7c3a42
cd4ae8c0 1738926261 S Ii:2:002:6 -115:1 544 <
cd4ae8c0 1738968760 C Ii:2:002:6 -75:1 512 = 3fba0044 ea8e6542 00000000 56891144 42e43944 f98b0344 e15f5844 bda13744
cd4ae8c0 1738983458 S Ii:2:002:6 -115:1 544 <
cd4ae8c0 1739031279 C Ii:2:002:6 -75:1 512 = dcca0a44 557b1f44 7ecd2244 3d93f243 0afdd443 6c274342 b5784243 d2e89e43
cd4ae8c0 1739040747 S Ii:2:002:6 -115:1 544 <
cd4ae8c0 1739086016 C Ii:2:002:6 -75:1 512 = a2622a43 00000000 0d353544 28c05d44 b3102744 c43f7c44 5c415b44 4fa2d143
cd4ae8c0 1739095767 S Ii:2:002:6 -115:1 544 <
cd4ae8c0 1739148519 C Ii:2:002:6 -75:1 512 = 6f9c1b44 304e1f44 1ed2eb43 ddf2cd43 8f5e0b42 7b113443 60eb9743 78751c44
cd4ae8c0 1739166280 S Ii:2:002:6 -115:1 544 <
cd4ae8c0 1739203146 C Ii:2:002:6 -75:1 512 = 00000000 d5d22f44 57665844 1be52144 c40e7744 d0075644 b458c743 74520544
cd4ae8c0 1739210669 S Ii:2:002:6 -115:1 544 <
cd4ae8c0 1739265639 C Ii:2:002:6 -75:1 512 = 79130444 9f44b543 11859743 131495c2 9a3c8e42 ad874243 af1e0144 4aa76e42
cd4ae8c0 1739270681 S Ii:2:002:6 -115:1 544 <
cd4ae8c0 1739328139 C Ii:2:002:6 -75:1 512 = 95d11444 3c833d44 c6ed0644 20e95b44 05e53a44 a6519143 5cdfd443 914cfe43
cd4ae8c0 1739339307 S Ii:2:002:6 -115:1 544 <
cd4ae8c0 1739383239 C Ii:2:002:6 -75:1 512 = 29f3ae43 d2769043 8461aec2 03116842 8c703543 ccf7fb43 1c003942 00000000
cd4ae8c0 1739396046 S Ii:2:002:6 -115:1 544 <
cd4ae8c0 1739445377 C Ii:2:002:6 -75:1 512 = b4c13944 943e0344 67315844 92353744 6de08943 ca2ecd43 8df2f643 04c9fd43
cd4ae8c0 1739458215 S Ii:2:002:6 -115:1 544 <
cd4ae8c0 1739500068 C Ii:2:002:6 -75:1 512 = f758c243 eefb4641 42d31d43 0b3d8c43 5e7d1644 20391143 00000000 50b73044
cd4ae8c0 1739517289 S Ii:2:002:6 -115:1 544 <
cd4ae8c0 1739562528 C Ii:2:002:6 -75:1 512 = f54d2844 b89a7d44 f78a5c44 c3ead343 19fb0b44 f4b72044 46262444 4f5ef543
cd4ae8c0 1739574873 S Ii:2:002:6 -115:1 544 <
cd4ae8c0 1739617262 C Ii:2:002:6 -75:1 512 = f4c21142 7d273543 36969843 beb01c44 50e52943 00000000 c6d44944 dd8e7244
cd4ae8c0 1739630853 S Ii:2:002:6 -115:1 544 <
cd4ae8c0 1739679769 C Ii:2:002:6 -75:1 512 = 9dad7844 d35c5744 ab79c943 0ac90644 a4a91b44 23181f44 ac56eb43 ed66cd43
cd4ae8c0 1739693695 S Ii:2:002:6 -115:1 544 <
cd4ae8c0 1739734395 C Ii:2:002:6 -75:1 512 = 91594643 2f49a143 6c3c2144 59863b43 00000000 1e7c3044 bdff5844 5f482244
cd4ae8c0 1739749321 S Ii:2:002:6 -115:1 544 <
cd4ae8c0 1739796888 C Ii:2:002:6 -75:1 512 = 07d83b44 faa09243 034cd643 cc370044 624d0344 03dbb343 1ea09543 af5b9ac2
cd4ae8c0 1739809295 S Ii:2:002:6 -115:1 544 <
cd4ae8c0 1739851653 C Ii:2:002:6 -75:1 512 = d2be2943 2b3af643 87540942 00000000 24321644 b9943e44 66030844 f3655d44
cd4ae8c0 1739866212 S Ii:2:002:6 -115:1 544 <
cd4ae8c0 1739914144 C Ii:2:002:6 -75:1 512 = 639b8c43 760fd043 05d5f943 180e0044 235fad43 f0998f43 38ddb3c2 a92d5c42
cd4ae8c0 1739922226 S Ii:2:002:6 -115:1 544 <
cd4ae8c0 1739968767 C Ii:2:002:6 -75:1 512 = a828fe43 87f24942 00000000 48851244 6bc03a44 b37d0444 3b9b5944 78713844
cd4ae8c0 1739979315 S Ii:2:002:6 -115:1 544 <
cd4ae8c0 1740031264 C Ii:2:002:6 -75:1 512 = 5c0d0a44 ab411f44 ca562244 70c0f143 e2d7d343 e3a73842 84b54043 67109e43
cd4ae8c0 1740046956 S Ii:2:002:6 -115:1 544 <
cd4ae8c0 1740086009 C Ii:2:002:6 -75:1 512 = 02742b43 00000000 a67e3444 99de5c44 36292644 b9ad7b44 a8625a44 96a6cf43
cd4ae8c0 1740099316 S Ii:2:002:6 -115:1 544 <
cd4ae8c0 1740148578 C Ii:2:002:6 -75:1 512 = 3a5a1a44 3d801d44 19b4e843 6c54ca43 3b91e141 40cb2d43 2ed19443 15df1a44
cd4ae8c0 1740159263 S Ii:2:002:6 -115:1 544 <
cd4ae8c0 1740203153 C Ii:2:002:6 -75:1 512 = 00000000 ab8e3044 45975844 75122244 9d807744 e4315644 b778c743 68c00544
cd4ae8c0 1740219365 S Ii:2:002:6 -115:1 544 <
cd4ae8c0 1740265703 C Ii:2:002:6 -75:1 512 = 0c4a0344 ee2ab443 05f29543 6a8398c2 044c8a42 8e624143 74c50044 b45d6742
cd4ae8c0 1740282221 S Ii:2:002:6 -115:1 544 <
cd4ae8c0 1740328147 C Ii:2:002:6 -75:1 512 = 86951544 c27d3d44 98410744 2c875c44 01ea3a44 412c9143 b4fed443 59cefe43
cd4ae8c0 1740342620 S Ii:2:002:6 -115:1 544 <
cd4ae8c0 1740382883 C Ii:2:002:6 -75:1 512 = 1e80b043 431f9243 8143a7c2 920f7542 edfa3843 e898fd43 b8334842 00000000
cd4ae8c0 1740391947 S Ii:2:002:6 -115:1 544 <
cd4ae8c0 1740445389 C Ii:2:002:6 -75:1 512 = 664e3a44 33c90344 42295944 38cd3744 b2a98a43 daaace43 e52df843 c1b3fe43
cd4ae8c0 1740455773 S Ii:2:002:6 -115:1 544 <
cd4ae8c0 1740500004 C Ii:2:002:6 -75:1 512 = fd33bf43 e591ce40 e5861843 18ff8943 a8681544 96aa0c43 00000000 87363144
cd4ae8c0 1740518231 S Ii:2:002:6 -115:1 544 <
cd4ae8c0 1740562592 C Ii:2:002:6 -75:1 512 = 37da2644 e6337c44 61cf5a44 4f96d043 a3370a44 ee351f44 236a2244 9ecef143
cd4ae8c0 1740574399 S Ii:2:002:6 -115:1 544 <
cd4ae8c0 1740617303 C Ii:2:002:6 -75:1 512 = 75c83a42 e90f4043 3f179e43 16a71f44 c76b3443 00000000 3f3e4844 134e7044
cd4ae8c0 1740629302 S Ii:2:002:6 -115:1 544 <
cd4ae8c0 1740679756 C Ii:2:002:6 -75:1 512 = cd247b44 6b8d5944 9183ce43 d92f0944 32dd1d44 042e2144 109fef43 0b57d143
cd4ae8c0 1740693692 S Ii:2:002:6 -115:1 544 <
cd4ae8c0 1740734382 C Ii:2:002:6 -75:1 512 = 3d6d3b43 43df9b43 fc561e44 49813043 00000000 cbb73344 62ee5b44 057e2544
cd4ae8c0 1740750276 S Ii:2:002:6 -115:1 544 <
cd4ae8c0 1740796940 C Ii:2:002:6 -75:1 512 = 57b53b44 adb19243 ae59d643 6ce2ff43 47570344 91f4b343 81799543 a39997c2
cd4ae8c0 1740805423 S Ii:2:002:6 -115:1 544 <
cd4ae8c0 1740851644 C Ii:2:002:6 -75:1 512 = e5f43543 ce2dfc43 095c3b42 00000000 e4371544 b84f3d44 63d20644 d3365c44
cd4ae8c0 1740857457 S Ii:2:002:6 -115:1 544 <
cd4ae8c0 1740914134 C Ii:2:002:6 -75:1 512 = 4dcc8c43 df1ed043 c7d6f943 337a0044 940bae43 fb618f43 c2a9b0c2 15ce6442
cd4ae8c0 1740929310 S Ii:2:002:6 -115:1 544 <
cd4ae8c0 1740968758 C Ii:2:002:6 -75:1 512 = 7dbefb43 04be3642 00000000 1f1d1444 730f3c44 119e0544 9c2b5b44 b0643944
cd4ae8c0 1740983894 S Ii:2:002:6 -115:1 544 <
cd4ae8c0 1741031282 C Ii:2:002:6 -75:1 512 = b4bb0744 96771c44 8ba31f44 6f92ec43 fc3ace43 fe8a1542 88b53743 0e3d9a43
cd4ae8c0 1741054739 S Ii:2:002:6 -115:1 544 <
cd4ae8c0 1741086022 C Ii:2:002:6 -75:1 512 = f6db2f43 00000000 cfd53244 752a5b44 9ddd2444 3f137a44 efa95844 b686cc43
cd4ae8c0 1741099659 S Ii:2:002:6 -115:1 544 <
cd4ae8c0 1741148455 C Ii:2:002:6 -75:1 512 = 0b771c44 c5e81f44 fab6ec43 b998ce43 f15d1442 39223843 f7839943 d2a11d44
cd4ae8c0 1741170207 S Ii:2:002:6 -115:1 544 <
cd4ae8c0 1741203157 C Ii:2:002:6 -75:1 512 = 00000000 97da3144 5bfc5944 16aa2344 29bb7844 675c5744 203dca43 f81f0744
cd4ae8c0 1741208558 S Ii:2:002:6 -115:1 544 <
cd4ae8c0 1741265693 C Ii:2:002:6 -75:1 512 = 7fc3ff43 6cb4ac43 79ad8e43 de93b3c2 c5535d42 7a073343 744bfa43 260d3242
cd4ae8c0 1741279257 S Ii:2:002:6 -115:1 544 <
cd4ae8c0 1741328134 C Ii:2:002:6 -75:1 512 = b61a1244 eb9c3a44 8e150444 69365944 890c3844 5dec8a43 fdf5ce43 a65ff843
cd4ae8c0 1741338278 S Ii:2:002:6 -115:1 544 <
cd4ae8c0 1741382898 C Ii:2:002:6 -75:1 512 = 2e7eb043 02549243 b921a6c2 16ba8042 f5cb3a43 6917ff43 551a5142 00000000
cd4ae8c0 1741391861 S Ii:2:002:6 -115:1 544 <
cd4ae8c0 1741445395 C Ii:2:002:6 -75:1 512 = 8b663b44 68d90444 b8fd5944 86c83844 df928c43 86dad043 eedff943 7b670044
cd4ae8c0 1741464077 S Ii:2:002:6 -115:1 544 <
cd4ae8c0 1741500078 C Ii:2:002:6 -75:1 512 = c23abe43 87689140 e6dc1643 dc088943 99081544 359c0b43 00000000 48ad3144
cd4ae8c0 1741515246 S Ii:2:002:6 -115:1 544 <
cd4ae8c0 1741562532 C Ii:2:002:6 -75:1 512 = 16752644 b5967b44 87955a44 30a3cf43 ab070a44 79a21e44 4de22144 5d01f143
cd4ae8c0 1741578270 S Ii:2:002:6 -115:1 544 <
cd4ae8c0 1741617318 C Ii:2:002:6 -75:1 512 = f70e2842 abbf3b43 f4ef9b43 1d7c1e44 48153143 00000000 d9954644 18db6e44
cd4ae8c0 1741634215 S Ii:2:002:6 -115:1 544 <
cd4ae8c0 1741679757 C Ii:2:002:6 -75:1 512 = a23e7b44 800d5a44 4de6ce43 6cc00944 2b311e44 3fa02144 39e2ef43 a429d243
cd4ae8c0 1741692252 S Ii:2:002:6 -115:1 544 <
cd4ae8c0 1741734401 C Ii:2:002:6 -75:1 512 = d77b4243 80b99e43 e5122044 99dd3743 00000000 5f103344 0e665b44 21c22444
cd4ae8c0 1741753823 S Ii:2:002:6 -115:1 544 <
cd4ae8c0 1741796944 C Ii:2:002:6 -75:1 512 = 80903a44 7ee18f43 b11dd443 f6fefc43 04c90144 d575b043 70db9243 6a7ba5c2
cd4ae8c0 1741806829 S Ii:2:002:6 -115:1 544 <
cd4ae8c0 1741851578 C Ii:2:002:6 -75:1 512 = f6133043 4e54f943 54d42442 00000000 856f1444 b4b33c44 ee5b0644 5a905b44
cd4ae8c0 1741869232 S Ii:2:002:6 -115:1 544 <
cd4ae8c0 1741914079 C Ii:2:002:6 -75:1 512 = 95308d43 2d72d143 f65cfa43 60a40044 22f2ad43 a5489043 0269afc2 12b36442
cd4ae8c0 1741934966 S Ii:2:002:6 -115:1 544 <
cd4ae8c0 1741968828 C Ii:2:002:6 -75:1 512 = e31bfd43 8a454642 00000000 1d521344 11ac3b44 ab480544 767a5a44 21433944
cd4ae8c0 1741986241 S Ii:2:002:6 -115:1 544 <
cd4ae8c0 1742031268 C Ii:2:002:6 -75:1 512 = f65e0844 dcf21c44 5b482044 9b6ded43 8badcf43 47921b42 622d3943 9baa9a43
cd4ae8c0 1742059226 S Ii:2:002:6 -115:1 544 <
cd4ae8c0 1742086010 C Ii:2:002:6 -75:1 512 = e6462c43 00000000 f3cd3244 38245b44 ad6e2444 f3ec7944 23995844 9a84cc43
cd4ae8c0 1742094222 S Ii:2:002:6 -115:1 544 <
cd4ae8c0 1742148585 C Ii:2:002:6 -75:1 512 = 31311d44 cd882044 9128ee43 bbfecf43 79932442 b98c3943 eadc9a43 d5a01d44
cd4ae8c0 1742158245 S Ii:2:002:6 -115:1 544 <
cd4ae8c0 1742203155 C Ii:2:002:6 -75:1 512 = 00000000 370f3244 36a35a44 89342444 9e7b7944 70375844 a892cb43 42b10744
cd4ae8c0 1742214288 S Ii:2:002:6 -115:1 544 <
cd4ae8c0 1742265639 C Ii:2:002:6 -75:1 512 = d9570144 092cb043 688e9143 de71a6c2 b5ae7442 10ec3843 4e6bfd43 65314542
cd4ae8c0 1742278262 S Ii:2:002:6 -115:1 544 <
cd4ae8c0 1742328127 C Ii:2:002:6 -75:1 512 = 2ce21344 9f393c44 7fb30544 93bd5a44 9bf93944 44ce8e43 237cd243 7de8fb43
cd4ae8c0 1742346239 S Ii:2:002:6 -115:1 544 <
cd4ae8c0 1742382899 C Ii:2:002:6 -75:1 512 = 8627b143 1b0a9343 2ce6a2c2 cc507d42 a7df3a43 2a86fe43 a4114d42 00000000
cd4ae8c0 1742398705 S Ii:2:002:6 -115:1 544 <
cd4ae8c0 1742445268 C Ii:2:002:6 -75:1 512 = 18703c44 a5d00544 34f15a44 cdd03944 75228f43 56bed243 d657fc43 8d500144
cd4ae8c0 1742464889 S Ii:2:002:6 -115:1 544 <
cd4ae8c0 1742500010 C Ii:2:002:6 -75:1 512 = 3971be43 581c9e40 283f1743 39e98843 5c431544 ae5e0b43 00000000 46f03244
cd4ae8c0 1742511371 S Ii:2:002:6 -115:1 544 <
cd4ae8c0 1742562586 C Ii:2:002:6 -75:1 512 = c1242644 f5787b44 9c5b5a44 2ca5cf43 a4080a44 38a31e44 d1cf2144 b0d2f043
cd4ae8c0 1742581515 S Ii:2:002:6 -115:1 544 <
cd4ae8c0 1742617254 C Ii:2:002:6 -75:1 512 = 376c4f42 1bf14543 8409a143 60082144 7aac3943 00000000 f48d4644 79f26e44
cd4ae8c0 1742634273 S Ii:2:002:6 -115:1 544 <
cd4ae8c0 1742679837 C Ii:2:002:6 -75:1 512 = d8527b44 053d5a44 d145cf43 faa70944 b0761e44 6e932144 3f69f043 273ed243
cd4ae8c0 1742694273 S Ii:2:002:6 -115:1 544 <
cd4ae8c0 1742734446 C Ii:2:002:6 -75:1 512 = 21c93c43 c16c9c43 48c61e44 2ba83143 00000000 06203244 d54b5a44 81a92344
cd4ae8c0 1742753930 S Ii:2:002:6 -115:1 544 <
cd4ae8c0 1742796903 C Ii:2:002:6 -75:1 512 = c1a03a44 2f699043 280bd443 a3fcfd43 fe740244 be03b243 dc839343 6e13a0c2
cd4ae8c0 1742818205 S Ii:2:002:6 -115:1 544 <
cd4ae380 1742826326 S Co:2:002:0 s 40 cb 0000 0000 0007 7 = 030a0002 00ff07
cd4ae380 1742839771 C Co:2:002:0 0 7 >
cd4ae8c0 1742851647 C Ii:2:002:6 -75:1 512 = eda93343 f2c5fa43 d8362e42 00000000 31a71444 f0013d44 4e3e0644 60a35b44
cd4ae8c0 1742866249 S Ii:2:002:6 -115:1 544 <
cd4ae8c0 1742914132 C Ii:2:002:6 -75:1 512 = 82c88d43 78add143 441efb43 26e30044 7e25af43 ddf39043 04dbabc2 66e86f42
cd4ae8c0 1742934281 S Ii:2:002:6 -115:1 544 <
cd4ae8c0 1742968766 C Ii:2:002:6 -75:1 512 = 37798443 cee141c3 00000000 eb4f8f43 b62ee043 f6506643 a2860e44 2fe7da43
cd4ae8c0 1742978255 S Ii:2:002:6 -115:1 544 <
cd4ae8c0 1743031283 C Ii:2:002:6 -75:1 512 = b58b5a44 bc526f44 16497244 18ef4844 04fd3944 d49fb743 99480044 c7841f44
cd4ae8c0 1743042274 S Ii:2:002:6 -115:1 544 <
cd4ae8c0 1743085897 C Ii:2:002:6 -75:1 512 = a4129044 00000000 8551dc44 3983f044 e1f6d444 20290045 9852ef44 7cabb544
cd4ae8c0 1743102269 S Ii:2:002:6 -115:1 544 <
cd4ae8c0 1743148397 C Ii:2:002:6 -75:1 512 = bd96d544 3db0d644 1510c244 2690ba44 30668b44 66059e44 1481ad44 97b2d544
cd4ae8c0 1743160337 S Ii:2:002:6 -115:1 544 <
cd4ae8c0 1743203157 C Ii:2:002:6 -75:1 512 = 00000000 01389c44 0282b044 71289544 4012c044 6a5baf44 a4d06b44 d4538744
cd4ae8c0 1743209284 S Ii:2:002:6 -115:1 544 <
cd4ae8c0 1743265704 C Ii:2:002:6 -75:1 512 = 65ced743 e6678543 4a494e43 6fbe29c3 d27ec2c1 3cdec542 b34ed243 a88316c2
cd4ae8c0 1743278248 S Ii:2:002:6 -115:1 544 <
cd4ae8c0 1743328132 C Ii:2:002:6 -75:1 512 = c32eaec3 ce3c3cc3 2a46cac3 d94188c2 2df145c3 7a6923c4 ee8f02c4 ed4ddbc3
cd4ae8c0 1743341355 S Ii:2:002:6 -115:1 544 <
cd4ae8c0 1743382878 C Ii:2:002:6 -75:1 512 = 20bf3bc4 09fd4ac4 125294c4 557a82c4 497866c4 37a915c4 9ca384c4 00000000
cd4ae8c0 1743391937 S Ii:2:002:6 -115:1 544 <
cd4ae8c0 1743445378 C Ii:2:002:6 -75:1 512 = 67e605c2 1c037ac3 5513ae42 6cd42ac2 b809f9c3 d041b7c3 6f4d8dc3 d6c485c3
cd4ae8c0 1743461167 S Ii:2:002:6 -115:1 544 <
cd4ae8c0 1743499896 C Ii:2:002:6 -75:1 512 = 75bcbe43 1d7db140 49061743 d5018943 8d1c1544 e9c50a43 00000000 bbe03144
cd4ae8c0 1743512007 S Ii:2:002:6 -115:1 544 <
cd4ae8c0 1743562513 C Ii:2:002:6 -75:1 512 = e02db744 bf59e244 ad89d144 bb049844 0c85a944 bebcb344 f7e3b444 0c49a044
cd4ae8c0 1743572877 S Ii:2:002:6 -115:1 544 <
cd4ae8c0 1743617263 C Ii:2:002:6 -75:1 512 = 2c0b8c44 94a79e44 934fae44 4f73d644 bb9d9d44 00000000 929dea44 64dffe44
cd4ae8c0 1743632165 S Ii:2:002:6 -115:1 544 <
cd4ae8c0 1743679757 C Ii:2:002:6 -75:1 512 = 6c9fed44 6592dc44 f80ea344 05b9b444 23f7be44 e0edbf44 ea57ab44 74f4a344
cd4ae8c0 1743689241 S Ii:2:002:6 -115:1 544 <
cd4ae8c0 1743734383 C Ii:2:002:6 -75:1 512 = 5f5bb543 a79cf243 4cc44944 9160af43 00000000 56cf3d44 b73f6644 cb762f44
cd4ae8c0 1743750946 S Ii:2:002:6 -115:1 544 <
cd4ae8c0 1743796896 C Ii:2:002:6 -75:1 512 = efcf2443 873991c3 1da01dc3 90de97c2 76f172c2 827262c3 de8a8fc3 c4b325c4
cd4ae8c0 1743810298 S Ii:2:002:6 -115:1 544 <
cd4ae8c0 1743851520 C Ii:2:002:6 -75:1 512 = b68568c4 8da717c4 1b9b85c4 00000000 d20e00c4 f2a0afc3 92e70dc4 21b568c3
cd4ae8c0 1743859314 S Ii:2:002:6 -115:1 544 <
cd4ae8c0 1743914011 C Ii:2:002:6 -75:1 512 = 01de37c4 853f17c4 1a6802c4 ad58fcc3 72b427c4 e4e536c4 50518ac4 c3e070c4
cd4ae8c0 1743926213 S Ii:2:002:6 -115:1 544 <
cd4ae8c0 1743968764 C Ii:2:002:6 -75:1 512 = 7af1bd42 4479b6c3 00000000 afc29343 7567e443 0adf6d43 e7861044 935cdf43
cd4ae8c0 1743981685 S Ii:2:002:6 -115:1 544 <
cd4ae8c0 1744031138 C Ii:2:002:6 -75:1 512 = 0fbf5c44 f90e7144 53237444 d6c54a44 ffcc3b44 25beba43 524e0244 14642144
cd4ae8c0 1744046854 S Ii:2:002:6 -115:1 544 <
cd4ae8c0 1744086007 C Ii:2:002:6 -75:1 512 = 4a609044 00000000 c6a5db44 78edef44 cf48d444 bebbff44 a68eee44 e4f2b444
cd4ae8c0 1744099232 S Ii:2:002:6 -115:1 544 <
cd4ae8c0 1744148506 C Ii:2:002:6 -75:1 512 = 6928d544 6950d644 e1b1c144 0f2dba44 19f58a44 e8859d44 da2dad44 d650d544
cd4ae8c0 1744162212 S Ii:2:002:6 -115:1 544 <
cd4ae8c0 1744203150 C Ii:2:002:6 -75:1 512 = 00000000 7b229c44 e96cb044 d0c69444 40f1bf44 702baf44 77836b44 2f288744
cd4ae8c0 1744218284 S Ii:2:002:6 -115:1 544 <
cd4ae8c0 1744265644 C Ii:2:002:6 -75:1 512 = 62b4d743 ac0d8543 4b3b4d43 30e92ac3 85cad2c1 514ac342 0c9cd143 06b719c2
cd4ae8c0 1744282201 S Ii:2:002:6 -115:1 544 <
cd4ae8c0 1744328142 C Ii:2:002:6 -75:1 512 = c93cadc3 2a8839c3 9c9ac9c3 c64886c2 175a45c3 dee822c4 274202c4 2f2adbc3
cd4ae8c0 1744340361 S Ii:2:002:6 -115:1 544 <
cd4ae8c0 1744382761 C Ii:2:002:6 -75:1 512 = 06573dc4 dea94cc4 9d2f95c4 3c6b83c4 ed4368c4 ae9b17c4 d68285c4 00000000
cd4ae8c0 1744397641 S Ii:2:002:6 -115:1 544 <
cd4ae8c0 1744445282 C Ii:2:002:6 -75:1 512 = d15c08c2 88597cc3 e9b0a842 c0e634c2 305afac3 a356b8c3 93f08ec3 503186c3
cd4ae8c0 1744449310 S Ii:2:002:6 -115:1 544 <
cd4ae8c0 1744500018 C Ii:2:002:6 -75:1 512 = 17d7b843 3ee9ebc0 a09c0a43 be858343 32351244 03f8fd42 00000000 ceb43144
cd4ae8c0 1744519254 S Ii:2:002:6 -115:1 544 <
cd4ae8c0 1744562569 C Ii:2:002:6 -75:1 512 = 2b77b644 cbc3e144 3fc6d044 e2599744 3fe6a844 4e04b344 0e68b444 0bc39f44
cd4ae8c0 1744578277 S Ii:2:002:6 -115:1 544 <
cd4ae8c0 1744617256 C Ii:2:002:6 -75:1 512 = 87c78b44 17559e44 2ef8ad44 04f9d544 4c519d44 00000000 84a5ea44 f6e1fe44
cd4ae8c0 1744638276 S Ii:2:002:6 -115:1 544 <
cd4ae8c0 1744679631 C Ii:2:002:6 -75:1 512 = ffb8ed44 2896dc44 983ca344 b6b5b444 dee9be44 4c35c044 ea8eab44 5621a444
cd4ae8c0 1744691630 S Ii:2:002:6 -115:1 544 <
cd4ae8c0 1744734284 C Ii:2:002:6 -75:1 512 = 9895b643 9952f443 e6674a44 f0f7af43 00000000 28063e44 047a6644 fc4b2f44
cd4ae8c0 1744746279 S Ii:2:002:6 -115:1 544 <
cd4ae8c0 1744796819 C Ii:2:002:6 -75:1 512 = dbd62743 e5308fc3 27a319c3 9e608ec2 9eb859c2 87465dc3 a2da8cc3 e67124c4
cd4ae8c0 1744809138 S Ii:2:002:6 -115:1 544 <
cd4ae8c0 1744851644 C Ii:2:002:6 -75:1 512 = 301267c4 1b8116c4 64ec84c4 00000000 0710ffc3 f4afaec3 52d60dc4 945b67c3
cd4ae8c0 1744863542 S Ii:2:002:6 -115:1 544 <
cd4ae8c0 1744914012 C Ii:2:002:6 -75:1 512 = 0cfa38c4 624918c4 f86a03c4 aa44fdc3 6a0928c4 a85d37c4 cd978ac4 e27d71c4
cd4ae8c0 1744926771 S Ii:2:002:6 -115:1 544 <
cd4ae8c0 1744968650 C Ii:2:002:6 -75:1 512 = 28d5aa42 d232bbc3 00000000 fd6e9443 2aeae443 c58a6e43 23a21044 23d8de43
cd4ae8c0 1744979321 S Ii:2:002:6 -115:1 544 <
cd4ae8c0 1745031270 C Ii:2:002:6 -75:1 512 = 8df85a44 f1886f44 fce67244 95574944 e58b3a44 8d76b843 75030144 4be01f44
cd4ae8c0 1745037830 S Ii:2:002:6 -115:1 544 <
cd4ae8c0 1745085879 C Ii:2:002:6 -75:1 512 = db1f9044 00000000 390adc44 0b34f044 109bd444 72faff44 49dbee44 d341b544
cd4ae8c0 1745101120 S Ii:2:002:6 -115:1 544 <
cd4ae8c0 1745148405 C Ii:2:002:6 -75:1 512 = 74f4d544 e542d744 1eafc244 c22cbb44 22ec8b44 dc9c9e44 f428ae44 004bd644
cd4ae8c0 1745166274 S Ii:2:002:6 -115:1 544 <
cd4ae8c0 1745203137 C Ii:2:002:6 -75:1 512 = 00000000 11ec9b44 c21fb044 18779444 eea4bf44 3d82ae44 595d6a44 52998644
cd4ae8c0 1745219286 S Ii:2:002:6 -115:1 544 <
cd4ae8c0 1745265638 C Ii:2:002:6 -75:1 512 = 8e44d743 e0978443 3c854d43 3f6b2bc3 402dd4c1 6592c242 2724d143 1b011fc2
cd4ae8c0 1745278987 S Ii:2:002:6 -115:1 544 <
cd4ae8c0 1745328013 C Ii:2:002:6 -75:1 512 = 1a8baac3 564f34c3 17dac6c3 377274c2 b9b33fc3 75b321c4 7ca700c4 c6ecd7c3
cd4ae8c0 1745345004 S Ii:2:002:6 -115:1 544 <
cd4ae8c0 1745382775 C Ii:2:002:6 -75:1 512 = 77253dc4 0f654cc4 ca1a95c4 f67e83c4 677768c4 aeac17c4 0cc985c4 00000000
cd4ae8c0 1745393523 S Ii:2:002:6 -115:1 544 <
cd4ae8c0 1745445253 C Ii:2:002:6 -75:1 512 = bdfd1cc2 c0d680c3 182d9e42 1a614ec2 7723fdc3 bf4fbbc3 e84191c3 646689c3
cd4ae8c0 1745459278 S Ii:2:002:6 -115:1 544 <
cd4ae8c0 1745499878 C Ii:2:002:6 -75:1 512 = 194fbe43 8c178a40 8d911443 fe3d8843 48a71444 0b1b0843 00000000 26533044
cd4ae8c0 1745506152 S Ii:2:002:6 -115:1 544 <
cd4ae8c0 1745562443 C Ii:2:002:6 -75:1 512 = 2a89b744 85d7e244 37c8d144 25539844 89bfa944 36f5b344 3059b544 d7c6a044
cd4ae8c0 1745572846 S Ii:2:002:6 -115:1 544 <
cd4ae8c0 1745617157 C Ii:2:002:6 -75:1 512 = 164a8b44 62d79d44 3e7dad44 1299d544 d6c49c44 00000000 9bdeea44 7816ff44
cd4ae8c0 1745634276 S Ii:2:002:6 -115:1 544 <
cd4ae8c0 1745679696 C Ii:2:002:6 -75:1 512 = e7a6ed44 818cdc44 bb25a344 8498b444 9cddbe44 18ffbf44 9e7cab44 25ffa344
cd4ae8c0 1745690246 S Ii:2:002:6 -115:1 544 <
cd4ae8c0 1745734447 C Ii:2:002:6 -75:1 512 = 32bdb443 40e3f243 8edb4944 489bae43 00000000 c5273d44 cda86544 9ead2e44
cd4ae8c0 1745750975 S Ii:2:002:6 -115:1 544 <
cd4ae8c0 1745796898 C Ii:2:002:6 -75:1 512 = 53832643 8bcd90c3 1a371cc3 3d5190c2 301f66c2 84ab5ec3 5ec08dc3 f7b624c4
cd4ae8c0 1745812219 S Ii:2:002:6 -115:1 544 <
cd4ae8c0 1745851578 C Ii:2:002:6 -75:1 512 = ac1469c4 de6618c4 7e0186c4 00000000 3743fbc3 76cdaac3 bf750bc4 4cd05fc3
cd4ae8c0 1745878213 S Ii:2:002:6 -115:1 544 <
cd4ae8c0 1745914069 C Ii:2:002:6 -75:1 512 = 70f338c4 c04418c4 8f3403c4 e204fec3 686f28c4 b78b37c4 d4ac8ac4 131372c4
cd4ae8c0 1745919671 S Ii:2:002:6 -115:1 544 <
cd4ae8c0 1745968635 C Ii:2:002:6 -75:1 512 = 77d9bb42 c7f8b6c3 00000000 f2349143 8832e243 49516a43 1e330f44 e114dc43
cd4ae8c0 1745986217 S Ii:2:002:6 -115:1 544 <
cd4ae8c0 1746031128 C Ii:2:002:6 -75:1 512 = cafa5c44 75be7144 ec8d7444 165c4b44 06643c44 2858bc43 83730244 f69b2144
cd4ae8c0 1746039226 S Ii:2:002:6 -115:1 544 <
cd4ae8c0 1746086011 C Ii:2:002:6 -75:1 512 = 32e38e44 00000000 7fc9dd44 011df244 587ed644 0edf0045 b189f044 7602b744
cd4ae8c0 1746109603 S Ii:2:002:6 -115:1 544 <
cd4ae8c0 1746148399 C Ii:2:002:6 -75:1 512 = e7a3d444 7d8ad544 82f0c044 89a3b944 427b8a44 caec9c44 2382ac44 6b98d444
cd4ae8c0 1746162228 S Ii:2:002:6 -115:1 544 <
cd4ae8c0 1746203033 C Ii:2:002:6 -75:1 512 = 00000000 1c749b44 32c5af44 4b549444 bc35bf44 5d5bae44 060b6a44 d6798644
eeb31f00 1746219322 S Ii:2:002:6 -115:1 544 <
eeb31f00 1746265507 C Ii:2:002:6 -75:1 512 = eb93dc43 f9de8943 81755743 91dd20c3 aee286c1 1d03d442 9014d643 d90bf0c1
eeb31f00 1746275531 S Ii:2:002:6 -115:1 544 <
eeb31f00 1746328148 C Ii:2:002:6 -75:1 512 = e560a7c3 4dc02cc3 cde0c2c3 c0d25bc2 a60d39c3 a1d71fc4 281dfec3 6205d4c3
eeb31f00 1746339325 S Ii:2:002:6 -115:1 544 <
eeb31f00 1746382752 C Ii:2:002:6 -75:1 512 = 19603ec4 87d34dc4 02df95c4 021684c4 45de69c4 07e418c4 0f4286c4 00000000
eeb31f00 1746392307 S Ii:2:002:6 -115:1 544 <
eeb31f00 1746445280 C Ii:2:002:6 -75:1 512 = 171021c2 c29780c3 1fc49d42 b6a84fc2 d25afdc3 8449bbc3 2ca891c3 8a5d89c3
eeb31f00 1746451166 S Ii:2:002:6 -115:1 544 <
eeb31f00 1746499878 C Ii:2:002:6 -75:1 512 = 3653be43 e2156b40 ca841443 27a18743 ab911444 67ab0743 00000000 3f8d3044
eeb31f00 1746506489 S Ii:2:002:6 -115:1 544 <
eeb31f00 1746562454 C Ii:2:002:6 -75:1 512 = b29eb744 ccdfe244 d3afd144 174c9844 56dfa944 0335b444 9d4ab544 faada044
eeb31f00 1746579257 S Ii:2:002:6 -115:1 544 <
eeb31f00 1746617155 C Ii:2:002:6 -75:1 512 = d5438b44 21ab9d44 d350ad44 5d65d544 fdbc9c44 00000000 703feb44 b3a8ff44
eeb31f00 1746630312 S Ii:2:002:6 -115:1 544 <
eeb31f00 1746679655 C Ii:2:002:6 -75:1 512 = a6b3ec44 eb7cdb44 a61ba244 599fb344 1416be44 624dbf44 cf84aa44 8e18a344
eeb31f00 1746686742 S Ii:2:002:6 -115:1 544 <
eeb31f00 1746734278 C Ii:2:002:6 -75:1 512 = 2593b843 dd85f643 268c4b44 1fe7b243 00000000 73ea3b44 1ad46444 62e62d44
eeb31f00 1746754213 S Ii:2:002:6 -115:1 544 <
eeb31f00 1746796780 C Ii:2:002:6 -75:1 512 = 25352f43 34708bc3 777012c3 081078c2 b5b33cc2 5daf54c3 b0eb88c3 797322c4
eeb31f00 1746809312 S Ii:2:002:6 -115:1 544 <
eeb31f00 1746851588 C Ii:2:002:6 -75:1 512 = 2e5269c4 673918c4 89e485c4 00000000 2460f9c3 0beaa8c3 47540ac4 ab045bc3
eeb31f00 1746870279 S Ii:2:002:6 -115:1 544 <
eeb31f00 1746914080 C Ii:2:002:6 -75:1 512 = 4a1e3ac4 8f9819c4 607004c4 152e00c4 e39029c4 410f39c4 8e6d8bc4 085073c4
eeb31f00 1746930269 S Ii:2:002:6 -115:1 544 <
eeb31f00 1746968635 C Ii:2:002:6 -75:1 512 = 51a1c042 ac81b5c3 00000000 9e0f9043 cf44e143 01af6843 b7db0e44 b4eada43
eeb31f00 1746979773 S Ii:2:002:6 -115:1 544 <
eeb31f00 1747031149 C Ii:2:002:6 -75:1 512 = 99975d44 33667244 bfe27444 75984b44 c09c3c44 3befbc43 e4040344 85c02144
eeb31f00 1747034762 S Ii:2:002:6 -115:1 544 <
eeb31f00 1747085964 C Ii:2:002:6 -75:1 512 = 57988f44 00000000 5093dc44 d6e2f044 7662d544 32540045 3588ef44 d823b644
eeb31f00 1747115710 S Ii:2:002:6 -115:1 544 <
eeb31f00 1747148389 C Ii:2:002:6 -75:1 512 = b4ecd444 3eead544 5456c144 c0d4b944 f8a38a44 3f409d44 f9cdac44 3be9d444
eeb31f00 1747169315 S Ii:2:002:6 -115:1 544 <
eeb31f00 1747203022 C Ii:2:002:6 -75:1 512 = 00000000 e2ff9a44 1456af44 8ddd9344 92c2be44 85aead44 76dd6844 62da8544
eeb31f00 1747219238 S Ii:2:002:6 -115:1 544 <
eeb31f00 1747265587 C Ii:2:002:6 -75:1 512 = c6d0dc43 5b038a43 13e35743 54d820c3 40bf7cc1 58eed642 0206d743 04b6dac1
eeb31f00 1747278593 S Ii:2:002:6 -115:1 544 <
eeb31f00 1747328030 C Ii:2:002:6 -75:1 512 = 3188aac3 d46534c3 4a9cc6c3 e41676c2 aa3a40c3 3f9421c4 f7a600c4 992dd7c3
eeb31f00 1747338267 S Ii:2:002:6 -115:1 544 <
eeb31f00 1747382753 C Ii:2:002:6 -75:1 512 = 880540c4 da5e4fc4 509b96c4 2ca884c4 74ef6ac4 ca181ac4 7fb686c4 00000000
eeb31f00 1747394243 S Ii:2:002:6 -115:1 544 <
eeb31f00 1747445262 C Ii:2:002:6 -75:1 512 = 822f34c2 5ed782c3 eb359442 1d3d64c2 8aa2ffc3 9e92bdc3 259e93c3 9e958bc3
eeb31f00 1747450942 S Ii:2:002:6 -115:1 544 <
eeb31f00 1747499891 C Ii:2:002:6 -75:1 512 = e7ffbe43 a41bc340 cfc41743 4eb58943 91701544 ae910b43 00000000 0a4b3144
eeb31f00 1747513930 S Ii:2:002:6 -115:1 544 <
eeb31f00 1747562383 C Ii:2:002:6 -75:1 512 = e7e7b744 3a1ee344 2ce6d144 16849844 941eaa44 3588b444 659ab544 c8eea044
eeb31f00 1747574240 S Ii:2:002:6 -115:1 544 <
eeb31f00 1747617155 C Ii:2:002:6 -75:1 512 = 934c8b44 4ef19d44 5376ad44 ff9dd544 73f99c44 00000000 0e11eb44 175fff44
eeb31f00 1747630515 S Ii:2:002:6 -115:1 544 <
eeb31f00 1747679634 C Ii:2:002:6 -75:1 512 = bf1eed44 6fe3db44 5674a244 8d09b444 d767be44 a0a3bf44 fdfaaa44 7381a344
eeb31f00 1747690201 S Ii:2:002:6 -115:1 544 <
eeb31f00 1747734259 C Ii:2:002:6 -75:1 512 = 13ddb743 6f14f643 9bb64b44 c9b9b243 00000000 a12b3d44 36c56544 9b082f44
eeb31f00 1747749282 S Ii:2:002:6 -115:1 544 <
eeb31f00 1747796771 C Ii:2:002:6 -75:1 512 = 75502c43 3e0f8dc3 076715c3 498a81c2 221f48c2 3b7958c3 53d389c3 86ef22c4
eeb31f00 1747806224 S Ii:2:002:6 -115:1 544 <
eeb31f00 1747851524 C Ii:2:002:6 -75:1 512 = 91346bc4 e1a81ac4 a80887c4 00000000 1d36fcc3 a26eabc3 d3e80bc4 02df60c3
eeb31f00 1747868574 S Ii:2:002:6 -115:1 544 <
eeb31f00 1747914030 C Ii:2:002:6 -75:1 512 = a39938c4 b2fe17c4 42a902c4 89d5fcc3 d1fb27c4 b22637c4 ae708ac4 196671c4
eeb31f00 1747932890 S Ii:2:002:6 -115:1 544 <
eeb31f00 1747968649 C Ii:2:002:6 -75:1 512 = 52a9c342 82cbb4c3 00000000 db979243 afc9e343 41bb6c43 5d161044 fe6bdd43
eeb31f00 1747986552 S Ii:2:002:6 -115:1 544 <
eeb31f00 1748031151 C Ii:2:002:6 -75:1 512 = 5d175e44 37127344 c7af7544 e1404c44 d9313d44 6549be43 1a810344 1d802244
eeb31f00 1748059255 S Ii:2:002:6 -115:1 544 <
eeb31f00 1748085894 C Ii:2:002:6 -75:1 512 = adf28e44 00000000 434edc44 49d1f044 3e2ed544 0a370045 9d1def44 2bbeb544
eeb31f00 1748093335 S Ii:2:002:6 -115:1 544 <
eeb31f00 1748148398 C Ii:2:002:6 -75:1 512 = d5ecd444 f5ded544 312fc144 f6cdb944 54b58a44 c2199d44 75caac44 46f4d444
eeb31f00 1748166270 S Ii:2:002:6 -115:1 544 <
eeb31f00 1748203072 C Ii:2:002:6 -75:1 512 = 00000000 1f059c44 5c63b044 b3d79444 66c9bf44 f7b8ae44 97206b44 97e28644
eeb31f00 1748213102 S Ii:2:002:6 -115:1 544 <
eeb31f00 1748265523 C Ii:2:002:6 -75:1 512 = c482dc43 af548943 a8085643 ec7a20c3 e35d8fc1 29bbd342 fe69d643 5288f0c1
eeb31f00 1748279494 S Ii:2:002:6 -115:1 544 <
eeb31f00 1748328013 C Ii:2:002:6 -75:1 512 = 663cabc3 c14934c3 bd02c7c3 2b6a7bc2 eaed41c3 e4e221c4 900d01c4 27b2d7c3
eeb31f00 1748339282 S Ii:2:002:6 -115:1 544 <
eeb31f00 1748382753 C Ii:2:002:6 -75:1 512 = 22b73ec4 d94a4ec4 f9dc95c4 b93084c4 cfe269c4 39da18c4 b23886c4 00000000
eeb31f00 1748389764 S Ii:2:002:6 -115:1 544 <
eeb31f00 1748445264 C Ii:2:002:6 -75:1 512 = c44919c2 03bd7fc3 f52aa142 c1834dc2 f396fcc3 5ec6bac3 b86190c3 c3af88c3
eeb31f00 1748450263 S Ii:2:002:6 -115:1 544 <
eeb31f00 1748499901 C Ii:2:002:6 -75:1 512 = 27e2c143 56075541 d65a1c43 11d28b43 80961644 00831143 00000000 479c3044
eeb31f00 1748516248 S Ii:2:002:6 -115:1 544 <
eeb31f00 1748562385 C Ii:2:002:6 -75:1 512 = 0737b844 f34ee344 aafcd144 3fbc9844 7231aa44 dac4b444 35f8b544 ce1fa144
eeb31f00 1748582822 S Ii:2:002:6 -115:1 544 <
eeb31f00 1748617128 C Ii:2:002:6 -75:1 512 = cb6e8b44 63b99d44 f541ad44 d57ad544 efdc9c44 00000000 a6e2e944 2667fe44
eeb31f00 1748621692 S Ii:2:002:6 -115:1 544 <
eeb31f00 1748679633 C Ii:2:002:6 -75:1 512 = fbefec44 31a3db44 d754a244 71fdb344 188cbe44 4d59bf44 1fa2aa44 6715a344
eeb31f00 1748693742 S Ii:2:002:6 -115:1 544 <
eeb31f00 1748734254 C Ii:2:002:6 -75:1 512 = ae58b743 0adff443 dd114b44 1ef2b143 00000000 d6483d44 45016644 7d082f44
eeb31f00 1748742753 S Ii:2:002:6 -115:1 544 <
eeb31f00 1748796773 C Ii:2:002:6 -75:1 512 = 551e2c43 865d8dc3 a27e15c3 83ba7fc2 875348c2 9dda58c3 68908ac3 22e822c4
eeb31f00 1748802275 S Ii:2:002:6 -115:1 544 <
eeb31f00 1748851533 C Ii:2:002:6 -75:1 512 = 84d768c4 dfd317c4 36a085c4 00000000 3122fdc3 862dacc3 ca780cc4 368d62c3
eeb31f00 1748874026 S Ii:2:002:6 -115:1 544 <
eeb31f00 1748914012 C Ii:2:002:6 -75:1 512 = da5339c4 1da518c4 1b4b03c4 41d4fec3 794e29c4 ef6938c4 3af98ac4 a3a772c4
eeb31f00 1748922274 S Ii:2:002:6 -115:1 544 <
eeb31b40 1748955625 S Co:2:002:0 s 40 cb 0000 0000 0007 7 = 03d00702 00ff07
eeb31f00 1748968773 C Ii:2:002:6 -75:1 512 = dcb8c542 fedbb3c3 00000000 1a659543 014ce643 1a0b7243 db4d1144 4199df43
eeb31b40 1748969005 C Co:2:002:0 0 7 >
eeb31b40 1748974249 S Ii:2:002:6 -115:1 544 <
eeb31b40 1749031160 C Ii:2:002:6 -75:1 512 = efa25d44 9bcf7244 472c7544 ddac4b44 b3a73c44 465ebd43 d1ed0244 39d12144
eeb31b40 1749040215 S Ii:2:002:6 -115:1 544 <
eeb31b40 1749085955 C Ii:2:002:6 -75:1 512 = 88c38f44 00000000 675aa545 3d89aa45 f863a345 d5d1ae45 2e1aaa45 4b8d9b45
eeb31b40 1749102267 S Ii:2:002:6 -115:1 544 <
eeb31b40 1749148396 C Ii:2:002:6 -75:1 512 = daee6748 84f26648 cdeb6648 60036748 34736648 07216748 dc7b6748 bd976748
eeb31b40 1749161493 S Ii:2:002:6 -115:1 544 <
eeb31b40 1749203075 C Ii:2:002:6 -75:1 512 = 00000000 02c5f047 ec49f147 c460f047 e851f247 e356f147 bcbeef47 5f1cf147
eeb31b40 1749222280 S Ii:2:002:6 -115:1 544 <
eeb31b40 1749265582 C Ii:2:002:6 -75:1 512 = 95a217c7 975c18c7 04b418c7 7f011ac7 02d919c7 d58e19c7 162318c7 d4741ac7
eeb31b40 1749279249 S Ii:2:002:6 -115:1 544 <
eeb31b40 1749328037 C Ii:2:002:6 -75:1 512 = 241f41c8 c31241c8 a7f140c8 4b9f41c8 cd2441c8 0b1741c8 56d441c8 1da441c8
eeb31b40 1749342279 S Ii:2:002:6 -115:1 544 <
eeb31b40 1749382756 C Ii:2:002:6 -75:1 512 = 09a16dc8 59dc6dc8 57fb6dc8 67716ec8 1da26ec8 f8116ec8 76596fc8 00000000
eeb31b40 1749395161 S Ii:2:002:6 -115:1 544 <
eeb31b40 1749445281 C Ii:2:002:6 -75:1 512 = c83e1dc8 d32d1dc8 a9ab1dc8 e54d1dc8 f4561dc8 0cec1dc8 67c01dc8 fc151dc8
eeb31b40 1749454266 S Ii:2:002:6 -115:1 544 <
eeb31b40 1749499907 C Ii:2:002:6 -75:1 512 = f33dffc5 e65705c6 046903c6 59aa01c6 6201f9c5 4d1e04c6 00000000 ff3b7e46
eeb31b40 1749519262 S Ii:2:002:6 -115:1 544 <
eeb31b40 1749562389 C Ii:2:002:6 -75:1 512 = f8502348 a5942448 77e62348 edf32248 d9d72348 1de12348 622d2348 7b1f2348
eeb31b40 1749575821 S Ii:2:002:6 -115:1 544 <
eeb31b40 1749617160 C Ii:2:002:6 -75:1 512 = e1836c48 96356d48 dd926d48 8cac6d48 02036e48 00000000 a27a6f48 9edb6f48
eeb31b40 1749629320 S Ii:2:002:6 -115:1 544 <
eeb31b40 1749679637 C Ii:2:002:6 -75:1 512 = 9b7c3f48 6dba3e48 14b73d48 a8ba3e48 d2be3e48 4cee3d48 93e33d48 5bf33d48
eeb31b40 1749695610 S Ii:2:002:6 -115:1 544 <
eeb31b40 1749734262 C Ii:2:002:6 -75:1 512 = f3f45b47 ebba5c47 69c25d47 0ebc5c47 00000000 47340147 a1e90147 6fd40047
eeb31b40 1749746875 S Ii:2:002:6 -115:1 544 <
eeb31b40 1749796830 C Ii:2:002:6 -75:1 512 = 5438fac7 9376fac7 2b54fbc7 f407fbc7 eef5f9c7 7f68fac7 03b4fac7 9b2bfbc7
eeb31b40 1749815382 S Ii:2:002:6 -115:1 544 <
eeb31b40 1749851573 C Ii:2:002:6 -75:1 512 = f00a62c8 ba7f61c8 09bb62c8 00000000 6b7167c8 236b67c8 4a3867c8 411968c8
eeb31b40 1749862257 S Ii:2:002:6 -115:1 544 <
eeb31b40 1749914021 C Ii:2:002:6 -75:1 512 = fcc155c8 3d9756c8 b06456c8 0c7e55c8 c9c155c8 a8f855c8 c21c56c8 268456c8
eeb31b40 1749918223 S Ii:2:002:6 -115:1 544 <
eeb31b40 1749968641 C Ii:2:002:6 -75:1 512 = 449ac5c7 bb2fc7c7 00000000 9d7c99c7 594199c7 db6899c7 378d99c7 715499c7
eeb31b40 1749979297 S Ii:2:002:6 -115:1 544 <
eeb31b40 1750031146 C Ii:2:002:6 -75:1 512 = 3ce0a847 2ff1a847 f743a847 df06a847 8106a847 c21ca747 15d5a747 9c48a847
eeb31b40 1750044548 S Ii:2:002:6 -115:1 544 <
eeb31b40 1750085889 C Ii:2:002:6 -75:1 512 = 0b954f48 00000000 ef075a48 0f675a48 8fbb5948 14445b48 206c5a48 f5585948
eeb31b40 1750101536 S Ii:2:002:6 -115:1 544 <
eeb31b40 1750148386 C Ii:2:002:6 -75:1 512 = 0eef6748 4df46648 3ced6648 44056748 3e756648 61226748 2a7d6748 6a996748
eeb31b40 1750159256 S Ii:2:002:6 -115:1 544 <
eeb31b40 1750203018 C Ii:2:002:6 -75:1 512 = 00000000 74b8f047 e03df147 e654f047 7c45f247 0d4bf147 fcb2ef47 6311f147
eeb31b40 1750218271 S Ii:2:002:6 -115:1 544 <
eeb31b40 1750265585 C Ii:2:002:6 -75:1 512 = dc7d17c7 183918c7 db8f18c7 56dc19c7 a2b319c7 b66919c7 bbfe17c7 ad501ac7
eeb31b40 1750279032 S Ii:2:002:6 -115:1 544 <
eeb31b40 1750328021 C Ii:2:002:6 -75:1 512 = 071b41c8 b70e41c8 57ed40c8 5c9b41c8 b82041c8 ab1241c8 8fcf41c8 609f41c8
eeb31b40 1750341682 S Ii:2:002:6 -115:1 544 <
eeb31b40 1750382758 C Ii:2:002:6 -75:1 512 = e9a06dc8 95db6dc8 53fa6dc8 07716ec8 9ea16ec8 72126ec8 5c596fc8 00000000
eeb31b40 1750386600 S Ii:2:002:6 -115:1 544 <
eeb31b40 1750445327 C Ii:2:002:6 -75:1 512 = 90411dc8 e8301dc8 81ae1dc8 73511dc8 4f5a1dc8 c3ee1dc8 bcc31dc8 3d191dc8
eeb31b40 1750459239 S Ii:2:002:6 -115:1 544 <
eeb31b40 1750499888 C Ii:2:002:6 -75:1 512 = 6745fec5 37dc04c6 b9ea02c6 c22d01c6 820bf8c5 7aa003c6 00000000 63ce7e46
eeb31b40 1750519238 S Ii:2:002:6 -115:1 544 <
eeb31b40 1750562451 C Ii:2:002:6 -75:1 512 = b64a2348 2e8e2448 2fe02348 68ed2248 b2d12348 e0da2348 fe262348 f6182348
eeb31b40 1750575017 S Ii:2:002:6 -115:1 544 <
eeb31b40 1750617139 C Ii:2:002:6 -75:1 512 = 62806c48 3c326d48 978e6d48 00a96d48 67ff6d48 00000000 58796f48 37da6f48
eeb31b40 1750630571 S Ii:2:002:6 -115:1 544 <
eeb31b40 1750679641 C Ii:2:002:6 -75:1 512 = 57783f48 fab53e48 cfb23d48 e1b53e48 91b93e48 0aea3d48 f3de3d48 3aef3d48
eeb31b40 1750695058 S Ii:2:002:6 -115:1 544 <
eeb31b40 1750734281 C Ii:2:002:6 -75:1 512 = 7a055c47 7dc95c47 93d35d47 54cc5c47 00000000 c6db0047 f1910147 ac7c0047
eeb31b40 1750741701 S Ii:2:002:6 -115:1 544 <
eeb31b40 1750796758 C Ii:2:002:6 -75:1 512 = 0b14fac7 d251fac7 862ffbc7 ece3fac7 25d2f9c7 4244fac7 4a90fac7 3207fbc7
eeb31b40 1750810631 S Ii:2:002:6 -115:1 544 <
eeb31b40 1750851512 C Ii:2:002:6 -75:1 512 = e10c62c8 e98161c8 f1bc62c8 00000000 e86f67c8 366967c8 6b3667c8 a41768c8
eeb31b40 1750866230 S Ii:2:002:6 -115:1 544 <
eeb31b40 1750914009 C Ii:2:002:6 -75:1 512 = bac455c8 2c9a56c8 556856c8 738155c8 6fc455c8 d1fb55c8 751f56c8 dd8656c8
eeb31b40 1750926291 S Ii:2:002:6 -115:1 544 <
eeb31b40 1750968639 C Ii:2:002:6 -75:1 512 = c28bc5c7 4920c7c7 00000000 696b99c7 e52f99c7 f15799c7 837b99c7 fc4299c7
eeb31b40 1750979644 S Ii:2:002:6 -115:1 544 <
eeb31b40 1751031131 C Ii:2:002:6 -75:1 512 = 8ae9a847 52fba847 504ea847 e710a847 9a10a847 db26a747 35dfa747 d451a847
eeb31b40 1751042203 S Ii:2:002:6 -115:1 544 <
eeb31b40 1751085892 C Ii:2:002:6 -75:1 512 = fb904f48 00000000 af075a48 1d675a48 b6bb5948 3e445b48 246d5a48 7f595948
eeb31b40 1751099328 S Ii:2:002:6 -115:1 544 <
eeb31b40 1751148397 C Ii:2:002:6 -75:1 512 = 54f26748 faf56648 2eef6648 7a076748 1a776648 22246748 6b7e6748 549a6748
eeb31b40 1751156662 S Ii:2:002:6 -115:1 544 <
eeb31b40 1751203053 C Ii:2:002:6 -75:1 512 = 00000000 c4c4f047 724bf147 7c61f047 b352f247 b657f147 2cc0ef47 351ef147
eeb31b40 1751208810 S Ii:2:002:6 -115:1 544 <
eeb31b40 1751265521 C Ii:2:002:6 -75:1 512 = 989217c7 e84d18c7 eca418c7 41f119c7 11ca19c7 027f19c7 ff1418c7 ec651ac7
eeb31b40 1751277692 S Ii:2:002:6 -115:1 544 <
eeb31b40 1751328016 C Ii:2:002:6 -75:1 512 = 092041c8 161341c8 51f240c8 a99f41c8 ae2441c8 481641c8 7bd341c8 b0a441c8
eeb31b40 1751358270 S Ii:2:002:6 -115:1 544 <
eeb31b40 1751382760 C Ii:2:002:6 -75:1 512 = 18a16dc8 f1db6dc8 6afa6dc8 ba706ec8 fea16ec8 c0126ec8 02596fc8 00000000
eeb31b40 1751400137 S Ii:2:002:6 -115:1 544 <
eeb31b40 1751445272 C Ii:2:002:6 -75:1 512 = 133e1dc8 5d2d1dc8 faaa1dc8 5d4d1dc8 0b561dc8 e1ea1dc8 82bf1dc8 e0141dc8
eeb31b40 1751458201 S Ii:2:002:6 -115:1 544 <
eeb31b40 1751499883 C Ii:2:002:6 -75:1 512 = d87fffc5 4e7605c6 cb8803c6 d6cb01c6 8543f9c5 da3904c6 00000000 03047f46
eeb31b40 1751508377 S Ii:2:002:6 -115:1 544 <
eeb31b40 1751562458 C Ii:2:002:6 -75:1 512 = 6e4d2348 3d912448 30e32348 f6f02248 bfd42348 ffdd2348 482a2348 1c1c2348
eeb31b40 1751571195 S Ii:2:002:6 -115:1 544 <
eeb31b40 1751617162 C Ii:2:002:6 -75:1 512 = 4b806c48 c7306d48 2e8e6d48 19a86d48 78fe6d48 00000000 52796f48 e7da6f48
eeb31b40 1751646295 S Ii:2:002:6 -115:1 544 <
eeb31b40 1751679696 C Ii:2:002:6 -75:1 512 = 6c7a3f48 72b83e48 73b53d48 7bb83e48 83bc3e48 8dec3d48 c5e13d48 0ef23d48
eeb31b40 1751693650 S Ii:2:002:6 -115:1 544 <
eeb31b40 1751734261 C Ii:2:002:6 -75:1 512 = b3f55b47 f9bb5c47 3bc55d47 70bf5c47 00000000 fa2f0147 89e60147 d0cf0047
eeb31b40 1751741160 S Ii:2:002:6 -115:1 544 <
eeb31b40 1751796767 C Ii:2:002:6 -75:1 512 = 281ffac7 335cfac7 b13afbc7 74edfac7 d3dcf9c7 494ffac7 489bfac7 5d12fbc7
eeb31b40 1751822828 S Ii:2:002:6 -115:1 544 <
eeb31b40 1751851503 C Ii:2:002:6 -75:1 512 = e70862c8 607d61c8 bbb862c8 00000000 556f67c8 b76867c8 4b3667c8 031768c8
eeb31b40 1751863254 S Ii:2:002:6 -115:1 544 <
eeb31b40 1751914014 C Ii:2:002:6 -75:1 512 = 03c255c8 049756c8 746456c8 567e55c8 58c155c8 7af855c8 761c56c8 088456c8
eeb31b40 1751929286 S Ii:2:002:6 -115:1 544 <
eeb31b40 1751968647 C Ii:2:002:6 -75:1 512 = 2390c5c7 3825c7c7 00000000 f36199c7 d12599c7 a94e99c7 ca7199c7 483999c7
eeb31b40 1751974245 S Ii:2:002:6 -115:1 544 <
eeb31b40 1752031134 C Ii:2:002:6 -75:1 512 = 5be3a847 27f4a847 d747a847 490ba847 430aa847 e220a747 aad8a747 6f4ba847
eeb31b40 1752053807 S Ii:2:002:6 -115:1 544 <
eeb31b40 1752085880 C Ii:2:002:6 -75:1 512 = 3c944f48 00000000 21075a48 c0665a48 d1ba5948 d9435b48 526c5a48 60595948
eeb31b40 1752100285 S Ii:2:002:6 -115:1 544 <
eeb31b40 1752148405 C Ii:2:002:6 -75:1 512 = 5df26748 a1f66648 12f06648 4c086748 28786648 36256748 4d806748 009c6748
eeb31b40 1752166509 S Ii:2:002:6 -115:1 544 <
eeb31b40 1752203015 C Ii:2:002:6 -75:1 512 = 00000000 7ab8f047 473ef147 a654f047 0f46f247 b54bf147 93b4ef47 0312f147
eeb31b40 1752219285 S Ii:2:002:6 -115:1 544 <
eeb31b40 1752265510 C Ii:2:002:6 -75:1 512 = c88717c7 1d4118c7 da9718c7 a6e319c7 3abd19c7 dc7319c7 0c0918c7 fe581ac7
eeb31b40 1752273780 S Ii:2:002:6 -115:1 544 <
eeb31b40 1752328031 C Ii:2:002:6 -75:1 512 = 242141c8 c81441c8 b0f340c8 67a141c8 612641c8 141841c8 49d541c8 3fa541c8
eeb31b40 1752341351 S Ii:2:002:6 -115:1 544 <
eeb31b40 1752382756 C Ii:2:002:6 -75:1 512 = 8da16dc8 76dc6dc8 e7fa6dc8 15726ec8 6ea36ec8 10146ec8 785a6fc8 00000000
eeb31b40 1752392078 S Ii:2:002:6 -115:1 544 <
eeb31b40 1752445280 C Ii:2:002:6 -75:1 512 = b73e1dc8 3a2e1dc8 c5ab1dc8 4f4e1dc8 df561dc8 9beb1dc8 60c01dc8 d1151dc8
eeb31b40 1752455543 S Ii:2:002:6 -115:1 544 <
eeb31b40 1752499946 C Ii:2:002:6 -75:1 512 = be78fec5 e2f004c6 530703c6 d64e01c6 5e46f8c5 2abc03c6 00000000 1bc47e46
eeb31b40 1752510216 S Ii:2:002:6 -115:1 544 <
eeb31b40 1752562382 C Ii:2:002:6 -75:1 512 = 85462348 4b8a2448 76dc2348 f5e92248 c8cd2348 ebd62348 6e232348 c2152348
eeb31b40 1752572795 S Ii:2:002:6 -115:1 544 <
eeb31b40 1752617162 C Ii:2:002:6 -75:1 512 = d87f6c48 46306d48 748d6d48 6ca76d48 c2fd6d48 00000000 dc796f48 c4db6f48
eeb31b40 1752629993 S Ii:2:002:6 -115:1 544 <
eeb31b40 1752679642 C Ii:2:002:6 -75:1 512 = a6793f48 03b83e48 d4b43d48 03b83e48 4ebc3e48 e1eb3d48 d1e03d48 06f13d48
eeb31b40 1752689292 S Ii:2:002:6 -115:1 544 <
eeb31b40 1752734258 C Ii:2:002:6 -75:1 512 = 0a185c47 0edc5c47 c3e65d47 c9df5c47 00000000 8c070147 a9be0147 d9a80047
eeb31b40 1752738230 S Ii:2:002:6 -115:1 544 <
eeb31b40 1752796831 C Ii:2:002:6 -75:1 512 = 4211fac7 864efac7 a72cfbc7 9cdffac7 a8cff9c7 2e41fac7 6e8cfac7 d703fbc7
eeb31b40 1752810272 S Ii:2:002:6 -115:1 544 <
eeb31b40 1752851582 C Ii:2:002:6 -75:1 512 = f40e62c8 118361c8 11be62c8 00000000 367167c8 c16a67c8 bd3767c8 2b1968c8
eeb31b40 1752859709 S Ii:2:002:6 -115:1 544 <
eeb31b40 1752914091 C Ii:2:002:6 -75:1 512 = 35c455c8 539956c8 6a6756c8 ae8055c8 93c355c8 f7fa55c8 691e56c8 708556c8
eeb31b40 1752929263 S Ii:2:002:6 -115:1 544 <
eeb31b40 1752968705 C Ii:2:002:6 -75:1 512 = 90a6c5c7 733bc7c7 00000000 358b99c7 714f99c7 777799c7 9d9b99c7 356299c7
eeb31b40 1752981549 S Ii:2:002:6 -115:1 544 <
eeb31b40 1753031161 C Ii:2:002:6 -75:1 512 = 00f0a847 c700a947 3954a847 5017a847 ee16a847 712da747 7ae5a747 8e57a847
eeb31b40 1753040235 S Ii:2:002:6 -115:1 544 <
eeb31b40 1753085954 C Ii:2:002:6 -75:1 512 = ac934f48 00000000 d6075a48 78675a48 88bb5948 23445b48 6c6c5a48 35595948
